,Comment,Author,Created UTC,Cleaned_Comment,sentiment_score
903,"As an uninvested spectator, I'd normally be all for a school like FAU making it to the Sweet Sixteen

but naturally, a #16 seed making it that far has to take priority",DerpyDingus,2023-03-20 01:24:54,uninvested spectator normally school like fau making sweet sixteen naturally seed making far take priority,-0.1746871918439865
904,This FDU team may have the most heart of any team I've ever watched.,Llama_Leaping_Larry,2023-03-20 01:26:13,fdu team may heart team ever watched,-0.004229939077049494
905,Gooooo FDU!,Exact-Cucumber,2023-03-20 01:26:17,gooooo fdu,0.010642129927873611
906,FDU holding their own on the boards the past few games really is proof sometimes rebounding is about attitude,ddottay,2023-03-20 01:26:28,fdu holding board past game really proof sometimes rebounding attitude,-0.0766896903514862
907,Bro they fucking Monstars'd Purdue lmao,Kardinale,2023-03-20 01:26:30,bro fucking monstars purdue lmao,-0.3145185112953186
908, I think every single person in that arena is an **FDU** **fan** tonight,mruab,2023-03-20 01:26:34,think every single person arena fdu fan tonight,-0.11004500091075897
909,The deepest 16 seed in the country,[deleted],2023-03-20 01:26:36,deepest seed country,-0.012418247759342194
910,This is the end of computer metrics if FDU wins,RichardStuck757,2023-03-20 01:26:37,end computer metric fdu win,-0.07676015794277191
911,Fairleigh Dickinson is HAULING ASS around the court and it is awesome to watch. I love college basketball so much.,WhoopieKush,2023-03-20 01:27:01,fairleigh dickinson hauling as around court awesome watch love college basketball much,-0.00037725456058979034
912,The way FDU plays is either completely abysmal or fun as hell. There is absolutely no in between.,bcheneyatc,2023-03-20 01:27:25,way fdu play either completely abysmal fun hell absolutely,-0.7987446188926697
913,Holy fucking shit what an amazing game,AlexB_SSBM,2023-03-20 01:27:40,holy fucking shit amazing game,-0.00182383565697819
914,I'm sucking wind just watching this game.,PissLikeaRacehorse,2023-03-20 01:28:05,sucking wind watching game,-0.055929526686668396
915,THIS IS SUCH A GOOD GAME I LOVE MARCH MADNESS,LRXC,2023-03-20 01:28:08,good game love march madness,0.007208655588328838
916,THAT’S the foul they call?? BS,jzsszmzj,2023-03-20 01:28:09,foul call b,-0.3941919505596161
917,This is electric,taylor1288,2023-03-20 01:28:18,electric,0.009879790246486664
918,FDU,[deleted],2023-03-20 01:28:29,fdu,-0.036004990339279175
919,This game is fucking ridiculous.,NotABot1235,2023-03-20 01:28:32,game fucking ridiculous,-0.6170089840888977
920,The winner of this vs Tennessee might be the lowest scoring game in NCAA history.,Keyblade_Yoshi,2023-03-20 01:28:34,winner v tennessee might lowest scoring game ncaa history,-0.2806743085384369
921,#I LOVE COLLEGE BASKETBALL!,BRNDC10,2023-03-20 01:28:58,love college basketball,0.0003307955339550972
922,"This game has been amazing, definitely worth staying up for",PuckNorthern,2023-03-20 01:29:11,game amazing definitely worth staying,-0.00015226344112306833
923,This second half has been one of the most exciting live basketball games I’ve watched,freshbless,2023-03-20 01:29:34,second half one exciting live basketball game watched,0.04154357314109802
924,This is peak March madness,TaekDePlej,2023-03-20 01:29:51,peak march madness,0.012107215821743011
925,FDU's demise has been greatly exaggerated earlier in this thread,MeetLawrence,2023-03-20 01:30:06,fdu demise greatly exaggerated earlier thread,-0.025360792875289917
926,"What a fucking game, absolutely fun as hell.

Also, what would have actually happened have they kept playing beyond the 12min mark?  Two back to back media timeouts after the first two dead balls?",ieatplaydough,2023-03-20 01:30:17,fucking game absolutely fun hell also would actually happened kept playing beyond min mark two back back medium timeouts first two dead ball,-0.24561339616775513
927,Don’t fucking quit FDU,[deleted],2023-03-20 01:30:21,fucking quit fdu,-0.8090814352035522
928,FAU's gonna become America's villain if they win this one,StarvedRock314,2023-03-20 01:30:28,fau gon na become america villain win one,-0.06769109517335892
929,Either of these teams are capable of out coaching Rick Barnes,tclark8995,2023-03-20 01:30:58,either team capable coaching rick barnes,-0.017385859042406082
930,Both teams are shooting under 40%. Does not feel like it,loyalsons4evertrue,2023-03-20 01:31:32,team shooting feel like,0.11348199844360352
931,"Babe wake up, FDU is about to cover again",Degen4lyf,2023-03-20 01:31:51,babe wake fdu cover,-0.03994469344615936
932,This is like watching FGCU's kids fight,[deleted],2023-03-20 01:31:58,like watching fgcu kid fight,0.0713634043931961
933,What the fuck is happening,Chibears85,2023-03-20 01:32:34,fuck happening,-0.7940095663070679
934,I've never seen a team like FDU before. This is an incredible story. Truly America's team.,BJRACINE21,2023-03-20 01:33:01,never seen team like fdu incredible story truly america team,-0.0028857241850346327
935,Game is gonna end 102-100 at this pace,WhoopieKush,2023-03-20 01:33:04,game gon na end pace,0.023239783942699432
936,FDU plying like they think they’re at the level Kansas should be AND I AM HERE FOR IT.,adivineeternity,2023-03-20 01:33:09,fdu plying like think level kansa,0.0703200101852417
937,Wait when the fuck did Edey Jr get here,cory_bdp,2023-03-20 01:33:38,wait fuck edey jr get,-0.5385540127754211
938,This is an amazing game to watch so far! Legit worried about both these teams 😬,boyhitscar,2023-03-20 01:34:36,amazing game watch far legit worried team,-0.0004083900712430477
939,"Had Ole Miss waited a week, they could’ve had either of those coaches, instead of the abuser",tclark8995,2023-03-20 01:34:58,ole miss waited week could either coach instead abuser,-0.731975793838501
940,FAU is crazily athletic for a mid major team. I can see why they were in or near the top 25 for most of the year.,k614,2023-03-20 01:35:21,fau crazily athletic mid major team see near top year,0.006712853908538818
941,Sweet 16 is gonna be fun.,zorofan8878,2023-03-20 01:35:58,sweet gon na fun,0.004458940587937832
942,Need final four games to be like this,green_day_95,2023-03-20 01:36:35,need final four game like,0.057956576347351074
943,"Win or lose, FDU has made the most of their opportunity this week. What an incredible run so far.",Shiggys,2023-03-20 01:37:08,win lose fdu made opportunity week incredible run far,-0.014053599908947945
944,FAU casually bringing Yao Ming's larger son,cory_bdp,2023-03-20 01:37:27,fau casually bringing yao ming larger son,0.02210243046283722
945,"3 on 1, you gotta know when to pull it out my man",[deleted],2023-03-20 01:37:57,got ta know pull man,-0.007488843984901905
946,Refs are really not calling anything I guess,TheTB94,2023-03-20 01:38:12,ref really calling anything guess,-0.177986279129982
947,This FDU team has 0 quit,huttts999,2023-03-20 01:39:29,fdu team quit,-0.4555215835571289
948,How can literally the shortest team in D1 be so good at rebounding. It's amazing to watch.,boregon,2023-03-20 01:39:30,literally shortest team good rebounding amazing watch,-0.099907785654068
949,Chirp chirp,efkz,2023-03-20 01:39:42,chirp chirp,0.03367648273706436
950,FDU is getting allllll the rebounds,AlexB_SSBM,2023-03-20 01:39:46,fdu getting allllll rebound,0.01410764642059803
951,FDU the shortest d1 team in the country and they’re dominating rebounds! That’s some fuckin hustle baby,SlayerHdThe3rd,2023-03-20 01:40:15,fdu shortest team country dominating rebound fuckin hustle baby,-0.1715429723262787
952,Heart over height bout to be stolen for tinder dudes bios,SteadyHandsShake,2023-03-20 01:40:32,heart height bout stolen tinder dude bios,-0.3852478265762329
953,Heart over height 💀,leapbitch,2023-03-20 01:40:58,heart height,0.007740721106529236
954,Holy fuck,efkz,2023-03-20 01:41:03,holy fuck,-0.7441911101341248
955,Okay that was nasty,EveningLength8,2023-03-20 01:41:08,okay nasty,-0.751060962677002
956,WHAT THE FUCK WAS THAT MOVE? HOLY SHIT!,x20mike07x,2023-03-20 01:41:10,fuck move holy shit,-0.6968597769737244
957,WHAT A MOVE,TheTB94,2023-03-20 01:41:11,move,-0.11993280053138733
958,LOLOL OMFG THIS ROBERTS KID HOLY SHIT,Llama_Leaping_Larry,2023-03-20 01:41:11,lolol omfg robert kid holy shit,-0.02666807919740677
959,What a fucking move! Holy shit,LukarWarrior,2023-03-20 01:41:25,fucking move holy shit,-0.20232346653938293
960,Absolutely insane game,FutureRaifort,2023-03-20 01:41:30,absolutely insane game,-0.8014845848083496
961,FAU is answering every single time,huttts999,2023-03-20 01:41:40,fau answering every single time,-0.03526143729686737
962,These announcers need to embrace FDU more,ILkeSportzNIDCWhKnws,2023-03-20 01:41:44,announcer need embrace fdu,-0.013855665922164917
963,"Holy shit, this game is incredible.",Key_Spinach,2023-03-20 01:41:51,holy shit game incredible,-0.003037320449948311
964,My theory is FDU got space jammed which is why they are all short. But they are getting their powers back,Zlatarog,2023-03-20 01:42:16,theory fdu got space jammed short getting power back,0.05406320095062256
965,How was there no foul?????,Llama_Leaping_Larry,2023-03-20 01:42:25,foul,-0.6699149012565613
966,HOW IS THAT A FOUL HE LEGIT ALREADY HAD THE BALL,Kodyaufan2,2023-03-20 01:42:37,foul legit already ball,-0.009730681777000427
967,Fdu should call a time out they need to slow down,humorousmoose,2023-03-20 01:42:49,fdu call time need slow,0.07490816712379456
968,"WHOS THE FOUL ON!? Pretty important, looked like FAU if I had to guess",[deleted],2023-03-20 01:42:50,who foul pretty important looked like fau guess,-0.1095028817653656
969,Let’s go FDU,_sunsetdreams_1,2023-03-20 01:43:10,let go fdu,-0.7257781624794006
970,How many times does the press have to lead to an open shot until they abandon it? Jesus christ,iunrealx1995,2023-03-20 01:43:13,many time press lead open shot abandon jesus christ,-0.23679672181606293
971,How was that not a foul when the FAU defender was completely turned around and fell into him backwards?,The_Koopa_King,2023-03-20 01:43:16,foul fau defender completely turned around fell backwards,-0.6446098685264587
972,these refs belong in prison!,indreams159,2023-03-20 01:43:29,ref belong prison,-0.29436805844306946
973,Why do these commentars hate fun. They're hyping FAU too much,TastesLikeHoneyNut,2023-03-20 01:43:33,commentars hate fun hyping fau much,-0.15636155009269714
974,Dicky V might not be the best spokesman for Coors light,Dickfuckpoopypants,2023-03-20 01:43:49,dicky v might best spokesman coors light,-0.0319468230009079
975,"Get the ball in roberts hands

That ball should not be shot before he touches it. He’ll dish it if they’ve got a shot",[deleted],2023-03-20 01:43:56,get ball robert hand ball shot touch dish got shot,-0.004668779671192169
976,What an absolute ridiculous good game,buckeyefan1930,2023-03-20 01:44:27,absolute ridiculous good game,-0.0007420089095830917
977,7-0 FAU run. Finally starting to score in the paint. That was a big 3 from Nic Boyd to quiet the crowd when FDU was up 3. 7 made threes for both teams.,spierce64006,2023-03-20 01:44:41,fau run finally starting score paint big nic boyd quiet crowd fdu made three team,0.008429663255810738
978,trutv basically has this and that shitty prank show. It's amazing that they get to air the tournament.,x20mike07x,2023-03-20 01:45:31,trutv basically shitty prank show amazing get air tournament,-0.7302131652832031
979,"Critical time in this game for FDU, can't let this game get away from you",[deleted],2023-03-20 01:45:44,critical time game fdu let game get away,-0.24335874617099762
980,"Damn I turn the game on, see a sick move by FDU to go up 3, then fall victim to a 7-0 run. I might need to change the channel",Repraht,2023-03-20 01:45:56,damn turn game see sick move fdu go fall victim run might need change channel,-0.6684707403182983
981,I have FAU in the S16 ama,lightvl,2023-03-20 01:46:19,fau ama,0.007061727344989777
982,damnnnn that looked like it was going in,gravityyalwayyswins,2023-03-20 01:49:12,damnnnn looked like going,-0.07464385032653809
983,FAU let’s chill on the 3’s for abit,goodgooglyymoogly,2023-03-20 01:49:17,fau let chill abit,-0.07023565471172333
984,I’m so conflicted I need to watch my Frogs but I also need to watch this,IAmNotStephen,2023-03-20 01:49:53,conflicted need watch frog also need watch,0.06298914551734924
985,COME ON FDU HOLD IT TOGETHER,TheJURY15,2023-03-20 01:49:57,come fdu hold together,-0.04851561784744263
986,FD you better make that layup,atoastypancake,2023-03-20 01:50:20,fd better make layup,-0.03716394305229187
987,I still think FDUs head coach would rock a Krillan cosplay if he shaved his head,pm8k,2023-03-20 01:51:29,still think fdus head coach would rock krillan cosplay shaved head,0.0009809136390686035
988,Unfortunately if the shots keep falling like this then FDU is probably done. ☹️,slayerhk47,2023-03-20 01:52:00,unfortunately shot keep falling like fdu probably done,-0.4247896075248718
989,**THE SOunD TrACk of ChIPOt-LAY?!?!?!?!**,macncheeseface,2023-03-20 01:52:08,sound track chipot lay,0.031075306236743927
990,Really like the fdu coach trusting the team to score before calling timeout,BromidicAlzabo,2023-03-20 01:52:36,really like fdu coach trusting team score calling timeout,0.01548340916633606
991,AND ONE LETS FUCKING GO! Knock this shit down,[deleted],2023-03-20 01:53:24,one let fucking go knock shit,-0.4613730311393738
992,༼ つ ◕_◕ ༽つ FDU take my energy ༼ つ ◕_◕ ༽つ,Ginyu420,2023-03-20 01:53:26,つ _ つ fdu take energy つ _ つ,0.008869439363479614
993,We all know that FAU is the real winner here because they get to go home to Boca Raton tomorrow....while FDU gets to go to New Jersey,macncheeseface,2023-03-20 01:54:07,know fau real winner get go home boca raton tomorrow fdu get go new jersey,-0.007430012337863445
994,FDU def had it,IndycarFan64,2023-03-20 01:54:39,fdu def,-0.13020867109298706
995,Am I missing something or do the announcers mistakenly believe FDU is D2?,FatalTragedy,2023-03-20 01:55:12,missing something announcer mistakenly believe fdu,-0.2826653718948364
996,Jump balls are called too quickly.,TwizzlersSourz,2023-03-20 01:55:25,jump ball called quickly,-0.001882791519165039
997,That's not a jump even if he had all ball.  The FDU guy was just about to clear,WhizBangNeato,2023-03-20 01:55:33,jump even ball fdu guy clear,-0.022068586200475693
998,"Barely a tie up, but whatever",[deleted],2023-03-20 01:55:33,barely tie whatever,0.07383754849433899
999,Boooo,Ghost-of-Moravia,2023-03-20 01:55:33,boooo,-0.1105903834104538
1000,DOUBLE BULLSHIT CALLS,Mobile-Tangelo,2023-03-20 01:55:48,double bullshit call,-0.8003020882606506
1001,HOW THE FUCK IS THAT FAU BALL,jrluhn,2023-03-20 01:56:06,fuck fau ball,-0.6974982619285583
1002,Is that three tie-ups in three minutes? I feel like this crew is…quick on those.,crownebeach,2023-03-20 01:56:17,three tie ups three minute feel like crew quick,-0.029432326555252075
1003,I guess the arm is a part of the ball sometimes but not at other times,BobRoberts01,2023-03-20 01:56:52,guess arm part ball sometimes time,0.060009509325027466
1004,Refs have taken over,loyalsons4evertrue,2023-03-20 01:56:57,ref taken,-0.10517585277557373
1005,Refs remembered they had a whistle. First half was pretty much whistleless,YaBoiWhit,2023-03-20 01:57:32,ref remembered whistle first half pretty much whistleless,-0.005433529615402222
1006,This is Troy state vs devry if devry didn’t blow,No_Push4492,2023-03-20 01:57:55,troy state v devry devry blow,-0.14897403120994568
1007,That one guy looks exactly like Jae Crowder,gobirds18_,2023-03-20 01:57:57,one guy look exactly like jae crowder,-0.04550330340862274
1008,Huge possession for FDU here.,SockVonPuppet,2023-03-20 01:58:02,huge possession fdu,-0.03047236055135727
1009,FDU take my energy,[deleted],2023-03-20 01:58:52,fdu take energy,-0.012677162885665894
1010,After watching FDU I question Kenpom's defensive rankings because there's no way FDU is ranked 360 and much lower than Baylor who leaves 3 point shooters wide open and doesn't get back on transition.,[deleted],2023-03-20 01:59:29,watching fdu question kenpom defensive ranking way fdu ranked much lower baylor leaf point shooter wide open get back transition,0.030245795845985413
1011,༼ つ ◕_◕ ༽つ FDU take my energy ༼ つ ◕_◕ ༽つ,nubbythedeafbear,2023-03-20 01:59:32,つ _ つ fdu take energy つ _ つ,0.008869439363479614
1012,༼ つ ◕_◕ ༽つ FDU take my energy ༼ つ ◕_◕ ༽つ,Mukaido,2023-03-20 01:59:34,つ _ つ fdu take energy つ _ つ,0.008869439363479614
1013,༼ つ ◕_◕ ༽つ FDU take my energy ༼ つ ◕_◕ ༽つ,arrowfan624,2023-03-20 01:59:44,つ _ つ fdu take energy つ _ つ,0.008869439363479614
1014,༼ つ ◕_◕ ༽つ FDU take my energy ༼ つ ◕_◕ ༽つ,DefiantRazorback,2023-03-20 01:59:46,つ _ つ fdu take energy つ _ つ,0.008869439363479614
1015,༼ つ ◕\_◕ ༽つ FDU take my energy ༼ つ ◕\_◕ ༽つ,dontbuymacaws,2023-03-20 01:59:46,つ _ つ fdu take energy つ _ つ,0.008869439363479614
1016,༼ つ ◕_◕ ༽つ FDU take my energy ༼ つ ◕_◕ ༽つ,akulkarnii,2023-03-20 01:59:47,つ _ つ fdu take energy つ _ つ,0.008869439363479614
1017,༼ つ ◕_◕ ༽つ FDU take my energy ༼ つ ◕_◕ ༽つ,Equivalent-Impress96,2023-03-20 01:59:49,つ _ つ fdu take energy つ _ つ,0.008869439363479614
1018,༼ つ ◕_◕ ༽つ FDU take my energy ༼ つ ◕_◕ ༽つ,huttts999,2023-03-20 01:59:51,つ _ つ fdu take energy つ _ つ,0.008869439363479614
1019,༼ つ ◕_◕ ༽つ FDU take my energy ༼ つ ◕_◕ ༽つ,MightyEighth,2023-03-20 01:59:52,つ _ つ fdu take energy つ _ つ,0.008869439363479614
1020,Someone create a separate take my energy thread,dogtufts,2023-03-20 02:00:29,someone create separate take energy thread,-0.06972522288560867
1021,That dude is so quick,EyePlay,2023-03-20 02:01:39,dude quick,0.014329183846712112
1022,"Roberts and Nowell...the day of the 5' 8"" kings",scoot87,2023-03-20 02:02:05,robert nowell day king,-0.012304496020078659
1023,Refs cooking rn,Firm_Feedback_2095,2023-03-20 02:02:35,ref cooking rn,0.023251965641975403
1024,That feels like the kind of turnover that could be the game,dingiesaur,2023-03-20 02:02:35,feel like kind turnover could game,-0.1158159077167511
1025,That missed travel call just ended it again for FDU,IndycarFan64,2023-03-20 02:02:58,missed travel call ended fdu,-0.3586442768573761
1026,Stupid stupid shot. Feels like game rn,FutureRaifort,2023-03-20 02:03:20,stupid stupid shot feel like game rn,-0.744879424571991
1027,These fucking refs man. Ruining this game,Mike_Honcho_3,2023-03-20 02:03:26,fucking ref man ruining game,-0.7736740708351135
1028,FDU has had 0 luck,FutureRaifort,2023-03-20 02:03:30,fdu luck,-0.00011918693780899048
1029,hate to sound like sour grapes but both this game and last FAU has benefitted from some generous reffing,accordionzero,2023-03-20 02:03:49,hate sound like sour grape game last fau benefitted generous reffing,-0.6320266723632812
1030,Depressing af,FutureRaifort,2023-03-20 02:03:56,depressing af,-0.5359106063842773
1031,NOOOOOOOOO,Doctor_Peepance,2023-03-20 02:04:13,nooooooooo,-0.29032468795776367
1032,FAU is pretty fun to watch too,huttts999,2023-03-20 02:04:15,fau pretty fun watch,0.008403459563851357
1033,I fucking hate Florida Atlantic,Life_Act_6887,2023-03-20 02:04:16,fucking hate florida atlantic,-0.7753682732582092
1034,Bro did these commentators go to FAU or something? Fuck these guys,StarvedRock314,2023-03-20 02:04:19,bro commentator go fau something fuck guy,-0.49898797273635864
1035,Man... FAU is really coasting on refball this tournament,GovernmentDoingStuff,2023-03-20 02:04:35,man fau really coasting refball tournament,0.06293639540672302
1036,How many travels FAU gonna walk away with,cory_bdp,2023-03-20 02:04:36,many travel fau gon na walk away,0.005988016724586487
1037,How does it feel to be a Disney villain FAU?,BurnPhoenix,2023-03-20 02:04:38,feel disney villain fau,-0.10347718000411987
1038,I tell you what Columbus can host the shit outta some tournament games.,NeverDieKris,2023-03-20 02:04:43,tell columbus host shit outta tournament game,-0.6593208909034729
1039,A couple of missed travels :(,skywalker_44,2023-03-20 02:04:44,couple missed travel,0.2695913016796112
1040,FDU's lack of size really showed down the stretch.,redditjwh,2023-03-20 02:04:52,fdu lack size really showed stretch,0.3061230778694153
1041,Forget any kind of hidden skill that drives upsets. The secret ingredient to underdog victories is winning all the 50/50 bounces. All of a sudden every loose ball finds an Owl,crownebeach,2023-03-20 02:05:11,forget kind hidden skill drive upset secret ingredient underdog victory winning bounce sudden every loose ball find owl,-0.14291827380657196
1042,Show the travel,Sirrenderthe69th,2023-03-20 02:05:20,show travel,-0.030054554343223572
1043, ༼ つ ◕\_◕ ༽つ FDU take my energy ༼ つ ◕\_◕ ༽つ,Llama_Leaping_Larry,2023-03-20 02:05:47,つ _ つ fdu take energy つ _ つ,0.008869439363479614
1044,TV execs rn when a coach takes a TO: 🤑🤑🤑,dinozaurs,2023-03-20 02:06:14,tv exec rn coach take,-0.011450111865997314
1045,FDU turning into a real Purdue down the stretch here.,LukarWarrior,2023-03-20 02:06:36,fdu turning real purdue stretch,0.01935918629169464
1046,Take the glass slipper for yourself FAU!,Keyblade_Yoshi,2023-03-20 02:06:56,take glass slipper fau,-0.012347191572189331
1047,Tennessee gonna work either of these teams but at least FDU would be fun,[deleted],2023-03-20 02:06:58,tennessee gon na work either team least fdu would fun,0.011059857904911041
1048,Robert’s is going to be wearing a different uniform next year,taylor1288,2023-03-20 02:07:28,robert going wearing different uniform next year,-0.05222887545824051
1049,Good run though FDU. Well fought!,newaccount721,2023-03-20 02:07:48,good run though fdu well fought,0.1349601000547409
1050,March God is dead,[deleted],2023-03-20 02:08:09,march god dead,-0.8007445335388184
1051,Proud of the Fair Dicks.  They showed true heart.,scoot87,2023-03-20 02:08:10,proud fair dick showed true heart,-0.0008983972948044538
1052,"FDU, we still love you",loyalsons4evertrue,2023-03-20 02:08:20,fdu still love,0.0005624939221888781
1053,Can't let them go on a 7-0 run when you're down 3 points late in the game. That seals the deal,PlebBot69,2023-03-20 02:08:24,let go run point late game seal deal,-0.05991923809051514
1054,So goddamn close FUCK!,Johnnycc,2023-03-20 02:09:14,goddamn close fuck,-0.04936617985367775
1055,༼ つ ◕_◕ ༽つ FDU take my energy ༼ つ ◕_◕ ༽つ,immaculatebacon,2023-03-20 02:09:31,つ _ つ fdu take energy つ _ つ,0.008869439363479614
1056,"Well, at least we have a better tournament record than Iowa still",fancycheesus,2023-03-20 02:10:23,well least better tournament record iowa still,-0.6941379308700562
1057,Imagine if fdu hit those open lay ups in the first half.,[deleted],2023-03-20 02:10:58,imagine fdu hit open lay ups first half,0.01197165995836258
1058,Phone bad,Equivalent-Gap1956,2023-03-20 02:11:53,phone bad,-0.7504489421844482
1059,Noooooooooo,theopression,2023-03-20 02:12:03,noooooooooo,-0.31315183639526367
1060,Noooooo,loyalsons4evertrue,2023-03-20 02:12:04,noooooo,-0.35314035415649414
1061,Missed layups are the difference. Heartbreaking,Metamodernity1215,2023-03-20 02:12:23,missed layup difference heartbreaking,-0.09982019662857056
1062,THAT LOCKER ROOM WHITEBOARD DIED FOR THIS,DerpyDingus,2023-03-20 02:13:05,locker room whiteboard died,-0.11800414323806763
1063,Dude getting booed so much,ChaosMage175,2023-03-20 02:13:06,dude getting booed much,-0.32349899411201477
1064,What a story.,cincycusefan,2023-03-20 02:13:35,story,0.0075942352414131165
1065,Fuck FAU,[deleted],2023-03-20 02:13:42,fuck fau,-0.8087833523750305
1066,Get fucked,MuseDroness,2023-03-20 02:13:44,get fucked,-0.8661097884178162
1067,Fuck you refs,arrowfan624,2023-03-20 02:13:44,fuck ref,-0.5491142272949219
1068,Roberts just ran out of gas,YaBoiWhit,2023-03-20 02:13:47,robert ran gas,-4.022568464279175e-05
1069,DESERVED,That_One_Pancake,2023-03-20 02:13:49,deserved,-0.22305195033550262
1070,Lmao at the kid trying to 360 dunk at the end.,dcd13,2023-03-20 02:13:52,lmao kid trying dunk end,0.010312020778656006
1071,Ok that was a shit move by FAU,drowse,2023-03-20 02:13:53,ok shit move fau,-0.43087199330329895
1072,FAU public enemy number 1 now,jakurek,2023-03-20 02:13:53,fau public enemy number,-0.611096978187561
1073,LAME AS FUCK,919sFinest,2023-03-20 02:13:56,lame fuck,-0.7990840673446655
1074,BEAT HIS ASS FUCK THAT DUDE,GeicoFrogGaveMeHerp,2023-03-20 02:13:57,beat as fuck dude,-0.057266540825366974
1075,Lmao get fucked dickhead,Licit_x64,2023-03-20 02:14:01,lmao get fucked dickhead,-0.736832320690155
1076,BOOOOOO,LRXC,2023-03-20 02:14:16,boooooo,-0.07038001716136932
1077,FUCK YOU FAU WOW,Maleficent-Brush-406,2023-03-20 02:14:18,fuck fau wow,-0.670203447341919
1078,BOOOOOOOOoo,LRXC,2023-03-20 02:14:22,boooooooooo,-0.06877773255109787
1079,Go Tennessee.  FAU doesn't deserve the Elite 8 after that.,[deleted],2023-03-20 02:14:33,go tennessee fau deserve elite,-0.0011954153887927532
1080,What an asshole,gobirds18_,2023-03-20 02:14:40,asshole,-0.8036019206047058
1081,Haha what an assclown.,Statalyzer,2023-03-20 02:15:12,haha assclown,-0.011387377977371216
1082,Let’s go Tennessee,zach721,2023-03-20 02:15:23,let go tennessee,-0.652525007724762
1083,Loving Davis's interview lol,FutureRaifort,2023-03-20 02:16:08,loving davis interview lol,-0.00016718357801437378
