,Comment,Author,Created UTC,Cleaned_Comment,sentiment_score
3308,#HEAAAẢ̷̢̮̞̪̣̟̺̞̪͇͓̏̽̑̒͛́̆͐̂͑̈̿͗͠Ä̸̖̤̞͉̘͖̠́͌̀̚ͅͅA̸̢̭̗̙͊̊̊̉̈́̕Ą̴̧̠̠̳̰͙̜̰͎̦̈́́͑ͅA̵̪̘̿̊̈Ą̵̦̱̯͈͈̼͇͖̫̘̝̹̋̊̈́̀̍Ȁ̴̖̩͍̩̠̓̐͛͂̏͋͋͘̕Ą̶͔͖̻̾̊̃̊̏̓̓̑͆̅̅́̕͝Ă̸͇͍̙̏̇̂͝͝A̶̲̙̻̤͕̎͗̿̇̄͗̎͝A̶̢̡͉̮̤̘̩̖̥̫̙̽̄̋̂̌̊̊̚͝͝Ạ̶̛̛͖͈̠̫̮̦̑͂̿̈́̾̽͛͋̒͗̄Ą̴̧̨̡̛̼͖̬̩̟̗̑͊͑͆̓̔̾̀̀̉̋͘̚A̶͓̹̮͉̙͒́͊̀̅̍͘Ą̵͕̥̥̮̭͍̯̙̰̖̌͐́͌̿̎̀̍́͂̊̇͛̈́͜͠ͅA̵͇̖̐Ȃ̵̟͚̃͝A̵̰̞̙̻͓̮͈͊͗̊̍̓̓̑Ạ̸̠̠̖̝̗͍̊̉͑̍̌̂̊̆͑̈́̐́͘̕R̶͚͎͕̘̫̥̖̭͍̦͕̦̹̃̓̄̎͗̋̍̇͆͘͘͜͝R̶̡̛̝̻̖̣̼͖̜̈́̈́̎͊̓̑̈́̾R̴̡͔͚̝͈͙̞̰̜͋R̶̦͓͖͎͐̽̓̆͐͐̓̿̚͘R̴̟̭̅͒̐̀͒R̴̨̧͓̣͔͖̟̹̻͓͙̝͓̲͋͐̓̂̃͗͐̎̄̿̋̔͝͝R̴̛̪̖̱̭̬͙̠̟͖̲̝͐͐͊́̇̓͗̒̓̿͌R̶̡̮̝͉̥̙̥̳̾̾̓̏̑̾̓͗̚͘͠͠R̷̘̳͇͉̠͍͍̐̒͒͒͝R̵̙̪̪͕̾͋̕R̴̨̟̠̞̭͈̖̰̃̌̓̅͒̐̇͋̈́̚͝ͅT̵͚͓͎̰̤̙͇̹̘͇̺͍̥̰͊͗̀͑̅̓́͘͝ͅṬ̷̡̡̡̬̤̬̲̗̠͈̼͖̭̀̏̽̉͆̄͝,[deleted],2023-03-20 01:56:24,heaaaa r r r r r r r r r r r,0.021796107292175293
3309,They likely will both get bullied and blown out Tennessee will just do what they did to us and just be overly physical and they don’t have the size to rlly deal with,Milflover69cbb,2023-03-20 01:59:11,likely get bullied blown tennessee u overly physical size rlly deal,-0.33842816948890686
3310,Bold pick,KindlyJackfruit416,2023-03-20 01:59:07,bold pick,-0.00875784456729889
3311,same here,8pointfavorite,2023-03-20 02:00:08,,0.056165412068367004
3312,Or Peter Dinklage,fastbagboy,2023-03-20 01:59:13,peter dinklage,-0.0031343698501586914
3313,Bruh why is this so true lol,Mobile-Tangelo,2023-03-20 02:00:09,bruh true lol,0.00661445502191782
3314,Something similar done by KSU earlier today…,Interesting-Title717,2023-03-20 02:08:48,something similar done ksu earlier today,-0.0032541975378990173
3315,"I mean, Lane Kiffin did coach there a couple years",C_CityOfTheDF_Steady,2023-03-20 02:09:38,mean lane kiffin coach couple year,-0.05485725402832031
3316,It is in Jersey that's how a lot of them talk lol.,runevault,2023-03-20 02:11:32,jersey lot talk lol,0.019567180424928665
3317,"Well, now everyones rooting against them even more now",Littlegreenman42,2023-03-20 02:14:25,well everyones rooting even,-0.039344191551208496
3318,Still sorry for them after that dunk?,Banana_Joe_Joe,2023-03-20 02:15:36,still sorry dunk,-0.7023988962173462
3319,Let go FAU!,spierce64006,2023-03-20 02:19:40,let go fau,-0.7075738906860352
3320,Especially after a slow start,Powerful-Ride-3728,2023-03-20 02:35:36,especially slow start,0.022212833166122437
3321,Lmao yeah this hatred is going to evaporate once everyone realizes we play Tennessee next,RustyKarma076,2023-03-20 02:09:37,lmao yeah hatred going evaporate everyone realizes play tennessee next,-0.4006991684436798
3322,Who’s we?,[deleted],2023-03-20 02:09:24,,0.056165412068367004
3323,Nah man you can still root for us.,Funky_Dingo,2023-03-20 02:27:57,nah man still root u,-0.11622297763824463
3324,"I think we can all agree, Fuck Memphis",RustyKarma076,2023-03-20 01:49:35,think agree fuck memphis,-0.31434378027915955
3325,Yes,FriedFishFan,2023-03-20 01:50:15,yes,0.005425803363323212
3326,:(,accordionzero,2023-03-20 01:50:18,,0.056165412068367004
3327,They got that dawg in them,slayerhk47,2023-03-20 01:58:06,got dawg,0.03219195455312729
3328,Teams forget how to shoot against them,42dylan,2023-03-20 01:58:43,team forget shoot,-0.48336538672447205
3329,FAU isn’t good enough to do that currently,gottahavemyPOPPs,2023-03-20 01:59:01,fau good enough currently,0.01135999709367752
3330,They are telling everyone to stop underestimating them lol. Beating Purdue wasn't a fluke,Ginyu420,2023-03-20 01:59:18,telling everyone stop underestimating lol beating purdue fluke,-0.482763409614563
3331,Delete this,JUSTCALLmeY,2023-03-20 02:00:27,delete,-0.31448471546173096
3332,"We needed one thing to put us over and we got it haha 
*suddenly Vol fan*",TheDeepBlueZ,2023-03-20 02:17:53,needed one thing put u got haha suddenly vol fan,0.03082449734210968
3333,Yeah that was…something,Kodyaufan2,2023-03-20 02:11:34,yeah something,0.07889584451913834
3334,Stop it. That loss had nothing to do with them making shots. They shot a terrible percentage for an upset. 30% from 3? UMB shot 50%. We just fucking sucked. Own it. We scored less than 60 points against a team that is in the 350's for adjusted defense. We fucking S U C K.,ekimtk,2023-03-20 00:22:03,stop loss nothing making shot shot terrible percentage upset umb shot fucking sucked scored le point team adjusted defense fucking u c k,-0.5884823799133301
3335,don't tell desantis,TheRealHenryG,2023-03-20 01:52:41,tell desantis,-0.15600252151489258
3336,Facts,[deleted],2023-03-20 01:50:06,fact,-0.03249135613441467
3337,What an absolute fucking dickhead,MightyEighth,2023-03-20 02:14:55,absolute fucking dickhead,-0.9023293852806091
3338,"NEC 🤝 ACC  
  
Having one remaining team",SaintArkweather,2023-03-19 23:53:55,nec acc one remaining team,-0.12281115353107452
3339,I’m torn! I want to see FDU continue on but I also want FAU to continue their fantastic season. Still rooting for FDU,Achambres,2023-03-19 22:59:34,torn want see fdu continue also want fau continue fantastic season still rooting fdu,-0.048177361488342285
3340,"People that took FAU -15.5, alums, and that's about it",Xaxziminrax,2023-03-19 23:02:12,people took fau alum,0.013035677373409271
3341,Purdue fans if there’s any left,PancherosFood,2023-03-19 23:22:02,purdue fan left,-0.49579086899757385
3342,"I want them to win because I think they have a real shot at going full Loyola Chicago

Just don’t see that with FDU",rvadarocket,2023-03-19 23:17:25,want win think real shot going full loyola chicago see fdu,-0.2190174162387848
3343,UMBC fans maybe,danhoang1,2023-03-19 22:58:45,umbc fan maybe,0.0664554238319397
3344,Even if that leg of my bracket wasn’t already blown to shit I’d be cheering top unit.,Generalbuttnaked69,2023-03-19 22:59:53,even leg bracket already blown shit cheering top unit,-0.014534013345837593
3345,I'll root for FAU next round if they win.,AcrossTheNight,2023-03-19 23:48:01,root fau next round win,-0.02649936079978943
3346,Sup,thexraptor,2023-03-19 23:48:55,sup,-0.04607264697551727
3347,Meeeee!!!!,Jwhidde4,2023-03-19 23:42:52,meeeee,0.035193368792533875
3348,What about having Tobin cropped onto Luka and Pete cropping onto Booker,inshamblesx,2023-03-19 23:18:54,tobin cropped onto luka pete cropping onto booker,0.005642950534820557
3349,Don’t count yourself out. Even i’m still pessimistic about my owls even after the good start.,MinoKillz,2023-03-20 00:15:15,count even still pessimistic owl even good start,-0.6097550392150879
3350,Step 1: be Purdue,slayerhk47,2023-03-20 00:13:10,step purdue,-0.04082069545984268
3351,They'll settle down and fight to under 10 points I bet. Lots of adrenaline in that first 4 min segment.,[deleted],2023-03-20 00:16:04,settle fight point bet lot adrenaline first min segment,0.01905253529548645
3352,Oh it’s damn near guaranteed. How Purdue ended up with this weird voodoo around to always fall flat on our faces when we are at our most successful will puzzle historians and scientists until the end of time,makualla,2023-03-20 00:21:22,oh damn near guaranteed purdue ended weird voodoo around always fall flat face successful puzzle historian scientist end time,-0.2678290903568268
3353,Hey man,[deleted],2023-03-20 00:19:39,hey man,0.0019005462527275085
3354,not a huge selection lol,TheRealHenryG,2023-03-20 00:19:25,huge selection lol,0.006494143512099981
3355,Just crushing the recruiting boards,ItsPosey,2023-03-20 00:19:11,crushing recruiting board,-0.4829047918319702
3356,I love basketball too fr,jayden9271,2023-03-20 00:20:14,love basketball fr,0.001075939740985632
3357,And somehow they made all them against us.,etsuandpurdue3,2023-03-20 00:23:29,somehow made u,-0.004432655870914459
3358,"i want them to make it through for two big reasons 1) to make history and 2) because i wanna keep watching this team, they're fun as hell",gravityyalwayyswins,2023-03-20 00:28:40,want make two big reason make history wan na keep watching team fun hell,-0.23509296774864197
3359,Lost to a bunch of shit teams,GeicoFrogGaveMeHerp,2023-03-20 00:31:02,lost bunch shit team,-0.690565288066864
3360,"The NEC is the worst conference in the country, by a mile. Wins over those teams don't get credit in the metrics, losses get you knocked down.",ddottay,2023-03-20 00:31:54,nec worst conference country mile win team get credit metric loss get knocked,-0.825082004070282
3361,Here for it lol,snuffleupagus86,2023-03-20 00:33:08,lol,0.013738974928855896
3362,"feels like legitimately the MAJORITY of the top-seeds (1/2) have come out to play games like they were still half asleep.

this game finally has fire to it.",gravityyalwayyswins,2023-03-20 00:35:47,feel like legitimately majority top seed come play game like still half asleep game finally fire,-0.015038527548313141
3363,And then there’s Princeton who shoots 90%,Halvey15,2023-03-20 00:39:30,princeton shoot,0.011449649930000305
3364,17 seed,Rickydada,2023-03-20 00:39:11,seed,-0.03966549038887024
3365,Who is their best player?,ElectromagneticMango,2023-03-20 01:15:41,best player,-0.0006508035585284233
3366,Thank you for that play by play,FakeInternetDentity,2023-03-20 00:39:53,thank play play,-0.0006663240492343903
3367,That you Andrew Catalon?,PhoneAcc23,2023-03-20 00:40:47,andrew catalon,-0.014700502157211304
3368,He probably learned it from Bob Knight while he was at IU,PhoneAcc23,2023-03-20 00:45:50,probably learned bob knight iu,0.015453990548849106
3369,Fau timeout lol,FakeInternetDentity,2023-03-20 00:46:02,fau timeout lol,0.03213474899530411
3370,they'd literally be leading by 10. so frustrating.,gravityyalwayyswins,2023-03-20 00:54:18,literally leading frustrating,-0.47096505761146545
3371,I love this game,SteadyHandsShake,2023-03-20 00:54:56,love game,0.0004991707392036915
3372,I prefer the one where the guy coughs once then plays video games for 15 seconds,HornyAardvarks,2023-03-20 00:59:30,prefer one guy cough play video game second,-0.2781105041503906
3373,You know how I felt yesterday. Don't make me do this twice. FAU needs the vibes.,Updog_IS_funny,2023-03-20 01:07:30,know felt yesterday make twice fau need vibe,-0.339581161737442
3374,it has been high key fun IMO!,gravityyalwayyswins,2023-03-20 01:17:49,high key fun imo,0.008143621496856213
3375,Subscribe,a_banned_user,2023-03-20 01:21:00,subscribe,-0.22461295127868652
3376,Hell yeah they are,Powerful-Ride-3728,2023-03-20 01:21:53,hell yeah,-0.1346169114112854
3377,I'M HERE WHAT NOW,Seastep,2023-03-20 01:21:55,,0.056165412068367004
3378,bonk,sunnymushroom,2023-03-20 01:22:35,bonk,0.0192878395318985
3379,"What’s funny is if FAU wins this game, they’ll become Americas team alongside Princeton",Kodyaufan2,2023-03-20 01:23:08,funny fau win game become america team alongside princeton,0.00357902143150568
3380,"https://twitter.com/PardonMyTake/status/1636900417312378881

Look at their home gym, these kids are just happy they get to hear someone cheer for them",a_banned_user,2023-03-20 01:23:54,look home gym kid happy get hear someone cheer,-0.0010557398200035095
3381,Not sure a team like FAU would be used to having this size of a crowd be against them lol,thezander8,2023-03-20 01:25:25,sure team like fau would used size crowd lol,-0.08018697798252106
3382,Im in cusa and could care less lets go fdu,Powerful-Ride-3728,2023-03-20 01:24:08,im cusa could care le let go fdu,-0.42514467239379883
3383,:((((,Jwhidde4,2023-03-20 01:30:21,,0.056165412068367004
3384,🙌🏻,JustGresh,2023-03-20 01:26:39,,0.056165412068367004
3385,best 16 of all time lowkey,verdenvidia,2023-03-20 01:29:30,best time lowkey,-0.003459243569523096
3386,Literally every shot is pretty much either a make or an air ball,Kodyaufan2,2023-03-20 01:29:39,literally every shot pretty much either make air ball,-0.0008420944213867188
3387,THANK YOU. Martin was getting assaulted in the paint,Jwhidde4,2023-03-20 01:28:59,thank martin getting assaulted paint,-0.10678837448358536
3388,Incoming 27-26,tclark8995,2023-03-20 01:29:13,incoming,-0.03865514695644379
3389,There really is nothing else like it,inahotairballoon,2023-03-20 01:29:49,really nothing else like,-0.0053695738315582275
3390,This is our 3rd March Madness game in school history and everyone hates us mannnn,RustyKarma076,2023-03-20 01:31:29,rd march madness game school history everyone hate u mannnn,-0.21946069598197937
3391,They’re going so fast there’s been a ton of shots,That_One_Pancake,2023-03-20 01:31:56,going fast ton shot,0.030791908502578735
3392,Crazy part is I could see FAU covering still,RichardStuck757,2023-03-20 01:32:22,crazy part could see fau covering still,0.020821750164031982
3393,Unsubscribe,Updog_IS_funny,2023-03-20 01:36:36,unsubscribe,-0.38056397438049316
3394,"Pretty sure it’s just Edey in a mustache and glasses. He just wants to play, ya know?",treblkickd,2023-03-20 01:39:37,pretty sure edey mustache glass want play ya know,0.07992987334728241
3395,That’s good though. Not complacent,KindlyJackfruit416,2023-03-20 01:36:43,good though complacent,0.0769851803779602
3396,Refs too busy hee heeing,SteadyHandsShake,2023-03-20 01:39:23,ref busy hee heeing,0.006724357604980469
3397,Hops,ResidentRunner1,2023-03-20 01:39:58,hop,0.04640080779790878
3398,They said that for KSU’s Nowell too lmao,JustGresh,2023-03-20 01:41:29,said ksu nowell lmao,-0.11248253285884857
3399,Lol nice flair,isedmiston,2023-03-20 01:45:14,lol nice flair,0.004322660155594349
3400,Or a museum!,Jaerba,2023-03-20 01:46:42,museum,-0.0165213942527771
3401,Nah Impractical Jokers is funny stop clowning,Ghost-of-Moravia,2023-03-20 01:45:56,nah impractical joker funny stop clowning,-0.20285411179065704
3402,"I’m surprised they haven’t just changed their name to Impractical Jokers. I’m not complaining, it’s a great background show, but that is the only thing I ever see playing on the channel",Repraht,2023-03-20 01:47:28,surprised changed name impractical joker complaining great background show thing ever see playing channel,-0.11086809635162354
3403,your frogs can wait,gravityyalwayyswins,2023-03-20 01:50:16,frog wait,-0.08275392651557922
3404,You have to finish that game first. Also add TCU flair to your handle,[deleted],2023-03-20 01:51:00,finish game first also add tcu flair handle,0.012539714574813843
3405,Their coach and most of their players came from a d2 school last year,Kodyaufan2,2023-03-20 01:55:49,coach player came school last year,-0.05457594245672226
3406,Their starting backcourt came from Division 2.,mrwhitaker3,2023-03-20 01:56:08,starting backcourt came division,0.0650942400097847
3407,No. I think the coach and one of the FDU players came from D2. It's his first or second year at FDU,inevitablescape,2023-03-20 01:56:18,think coach one fdu player came first second year fdu,-0.1819322407245636
3408,They were talking about Tobin Anderson getting hired from a D2 school and Demetre Roberts transferring from the same school to FDU this year to follow him,verndom,2023-03-20 01:56:24,talking tobin anderson getting hired school demetre robert transferring school fdu year follow,-0.2506367564201355
3409,I actually want to know. I watch mostly NBA and that made zero sense to me.,JUSTCALLmeY,2023-03-20 01:56:50,actually want know watch mostly nba made zero sense,-0.5826879143714905
3410,They have 15 losses in the worst conference lmao,Milflover69cbb,2023-03-20 02:01:24,loss worst conference lmao,-0.8627234101295471
3411,"A lot of their defense is press/turnovers, I wonder if KenPom misses that somewhat",SaintArkweather,2023-03-20 02:02:28,lot defense press turnover wonder kenpom miss somewhat,0.25123485922813416
3412,if you like watching ref ball,BEzzzzG,2023-03-20 02:05:00,like watching ref ball,0.06696310639381409
3413,Don't slander FDU that way,mpshanny87,2023-03-20 02:08:56,slander fdu way,-0.7903470993041992
3414,"FDU, forever in my heart <3 RIP 2023 tourney",gravityyalwayyswins,2023-03-20 02:09:16,fdu forever heart rip tourney,-0.01666606403887272
3415,The whole state,immaculatebacon,2023-03-20 02:11:46,whole state,-0.011589497327804565
3416,pls dont remind me :( the pain is too much,gravityyalwayyswins,2023-03-20 02:12:00,pls dont remind pain much,-0.2057335078716278
3417,"i dont like the way the owl looks at me.

also, lets go FDU <3",gravityyalwayyswins,2023-03-20 01:47:21,dont like way owl look also let go fdu,-0.5323955416679382
3418,"It's scary, but not in a good way",fastbagboy,2023-03-20 01:47:38,scary good way,0.006197765469551086
3419,"My small DIII school switched from classic block letters to italic script font, a couple years after I graduated, it’s a fucking travesty.",theseyeahthese,2023-03-20 01:51:44,small diii school switched classic block letter italic script font couple year graduated fucking travesty,-0.37510570883750916
3420,Can we agree Rice owl is superior?,newaccount721,2023-03-20 01:48:27,agree rice owl superior,0.023842360824346542
3421,“Big Money” FAU knocks out Cinderella darling,Ok-Lack-5172,2023-03-20 01:52:41,big money fau knock cinderella darling,0.000321878120303154
3422,Yeah that was mind boggling,PlebBot69,2023-03-20 02:09:13,yeah mind boggling,-0.19870558381080627
3423,They did mention it right when it happened I thought? But never replayed it,Ok_Run_8184,2023-03-20 02:11:50,mention right happened thought never replayed,-0.5302176475524902
3424,Funnily enough FDU would play those Bulls quite well.,SaltyHawk95,2023-03-20 02:12:45,funnily enough fdu would play bull quite well,0.031436361372470856
3425,Keep hoping,JJcny92,2023-03-26 01:49:02,keep hoping,-0.11365686357021332
3426,At least AT&T and Capital One have a bit of variety. I'm so fucking tired of the Paxlovid commercial.,LukarWarrior,2023-03-20 01:46:02,least capital one bit variety fucking tired paxlovid commercial,-0.31509050726890564
3427,sorry are you anti-american? get out of here commie im gonna go watch b-ball with my friends again,Maleficent-Brush-406,2023-03-20 01:46:53,sorry anti american get commie im gon na go watch b ball friend,-0.72259521484375
3428,Les eat yah yah les eat yah yah,BurnPhoenix,2023-03-20 01:48:13,le eat yah yah le eat yah yah,0.032862573862075806
3429,Pfffft you’ll be rooting for them like the rest of us,PhoneAcc23,2023-03-20 02:08:43,pfffft rooting like rest u,0.02492663264274597
3430,Shut up. These are college kids. Relax.,spierce64006,2023-03-20 02:16:56,shut college kid relax,-0.425797700881958
3431,"No they aren't lmao

They are still a power conference school that has several advantages.",spierce64006,2023-03-20 02:30:47,lmao still power conference school several advantage,0.011159218847751617
3432,"I thought they were saying the fouls was on the FDU guy bodying him before that. 

The tackle was for sure a foul though not like that was clean.",a_banned_user,2023-03-20 00:32:56,thought saying foul fdu guy bodying tackle sure foul though like clean,-0.3243992030620575
3433,ngl from this thread some people are gonna hold a vendetta against y’all if FAU wins,That_One_Pancake,2023-03-20 01:51:49,ngl thread people gon na hold vendetta fau win,0.007118046283721924
3434,Princeton too,Milflover69cbb,2023-03-20 01:51:37,princeton,4.9091875553131104e-05
3435,Yeah okay pal. Whatever you want to tell yourself,Johnnycc,2023-03-20 01:51:24,yeah okay pal whatever want tell,0.01269976794719696
3436,"Nope, people are gonna fucking hate you guys if you beat FDU",boregon,2023-03-20 01:52:20,nope people gon na fucking hate guy beat fdu,-0.7488362789154053
3437,Who’s the blue blood?,Ill_Ad_5308,2023-03-20 02:06:47,blue blood,-0.03307048976421356
3438,They’re my public enemy #1,Kodyaufan2,2023-03-20 02:18:43,public enemy,-0.8351963758468628
3439,No they still are.,spierce64006,2023-03-20 02:23:06,still,0.0921829342842102
3440,Do you have the same order or switch it up?!,j_shelb,2023-03-19 23:40:47,order switch,-0.09127099812030792
3441,No judgement here. I had whataburger for lunch and dinner lol,paulteegoldman,2023-03-19 23:57:40,judgement whataburger lunch dinner lol,0.05152437463402748
3442,Underrated comment,Jwhidde4,2023-03-20 00:00:29,underrated comment,-0.2767994999885559
3443,If I get my hopes up again I’m holding you personally responsible,Kodyaufan2,2023-03-20 00:16:10,get hope holding personally responsible,-0.19726234674453735
3444,"Maybe , but their game against Memphis went down to like the last second .",Sirrenderthe69th,2023-03-20 00:17:32,maybe game memphis went like last second,0.09912389516830444
3445,100%,humorousmoose,2023-03-20 00:17:35,,0.056165412068367004
3446,I think the highest id give them is an 8,AugustIstheMonth,2023-03-20 00:20:22,think highest id give,-0.19525499641895294
3447,They have the 357th ranked defense on barttorvik lol,thisisfunnyright,2023-03-20 00:24:07,th ranked defense barttorvik lol,-0.0051748305559158325
3448,Who,RangersFan243,2023-03-20 00:21:56,,0.056165412068367004
3449,oNlY oNe WaY tO fInD oUt,dinozaurs,2023-03-20 00:22:22,one way find,-0.05272185802459717
3450,You guys get whatever sponsored the NIT. RC cola or some shit,ItsPosey,2023-03-20 00:22:47,guy get whatever sponsored nit rc cola shit,-0.02920011430978775
3451,I’m definitely rooting for the 16,Rickydada,2023-03-20 00:26:56,definitely rooting,0.02007872611284256
3452,I guess I hate America,Sirrenderthe69th,2023-03-20 00:27:13,guess hate america,-0.6168404221534729
3453,I’m rooting for the 9 because the 16 has no chance at beating the 4,PhoneAcc23,2023-03-20 00:27:14,rooting chance beating,-0.011087596416473389
3454,Short people advantage,[deleted],2023-03-20 00:28:04,short people advantage,0.021435365080833435
3455,FAU fans really have no right to complain after the way their game against Memphis went down lol,Firm_Feedback_2095,2023-03-20 00:28:51,fau fan really right complain way game memphis went lol,0.0023772120475769043
3456,When does Billy Joel make an album based on the streak of NJ basketball miracles,[deleted],2023-03-20 00:37:40,billy joel make album based streak nj basketball miracle,0.0008708396926522255
3457,his last name doesn't end in a vowel though,JiffKewneye-n,2023-03-20 00:39:14,last name end vowel though,0.06809377670288086
3458,Gotta come out this time-out hot,FakeInternetDentity,2023-03-20 00:40:21,got ta come time hot,0.0015266607515513897
3459,Which one lol,ElectromagneticMango,2023-03-20 01:10:26,one lol,-0.006130006164312363
3460,I think you guys match up well with FDU since they are not good at shooting.,Keyblade_Yoshi,2023-03-20 00:47:54,think guy match well fdu since good shooting,0.0780847892165184
3461,"well it didn’t really work for Purdue, and they had Edey",trex_189,2023-03-20 00:47:34,well really work purdue edey,0.0022120466455817223
3462,Purdue had that same issue. Edey barely shot at the end,FakeInternetDentity,2023-03-20 00:48:15,purdue issue edey barely shot end,-0.18476197123527527
3463,He’s going to get a fat contract somewhere,Bronco4life21,2023-03-20 00:47:57,going get fat contract somewhere,-0.16043514013290405
3464,I’m convinced he’ll revitalize college basketball in some way. Completely revolutionary concepts.,seahawksjoe,2023-03-20 00:48:31,convinced revitalize college basketball way completely revolutionary concept,-0.06422241032123566
3465,"Sign me up, that shit sucked",PhoneAcc23,2023-03-20 00:50:41,sign shit sucked,-0.8111008405685425
3466,He’s the team PR guy as well,Ghost-of-Moravia,2023-03-20 00:51:21,team pr guy well,-0.012059785425662994
3467,He is the head SID. As a student.,TwizzlersSourz,2023-03-20 00:52:28,head sid student,-0.1734779179096222
3468,FAU can score....This FDU team just plays really weird,solarplanet,2023-03-20 01:06:47,fau score fdu team play really weird,0.09721574187278748
3469,how many mg,LRXC,2023-03-20 01:11:34,many mg,0.03451329469680786
3470,They got that dawg in them though,LukarWarrior,2023-03-20 01:22:07,got dawg though,0.272560715675354
3471,Its march baby,Powerful-Ride-3728,2023-03-20 01:21:05,march baby,-0.018598586320877075
3472,Already there,Rickydada,2023-03-20 01:23:01,already,-0.005126975476741791
3473,"To be fair, they did play like a 16 seed against Purdue.",[deleted],2023-03-20 01:25:47,fair play like seed purdue,0.010443918406963348
3474,This crowd is biased as hell and I love it,ChaosMage175,2023-03-20 01:26:29,crowd biased hell love,-0.3786669373512268
3475,Me too!,zerovanillacodered,2023-03-20 01:28:07,,0.056165412068367004
3476,They’re not calling anything,That_One_Pancake,2023-03-20 01:27:42,calling anything,-0.19368058443069458
3477,Nah this is fucking awesome to watch,AlexB_SSBM,2023-03-20 01:28:16,nah fucking awesome watch,-0.0246554147452116
3478,Hush,Kodyaufan2,2023-03-20 01:29:01,hush,-0.04383058845996857
3479,Been a wild game basically from the word go (minus a brief stint early where FDU looked like they were gonna get run off the floor).,runevault,2023-03-20 01:28:23,wild game basically word go minus brief stint early fdu looked like gon na get run floor,0.060629598796367645
3480,this man THIS,LRXC,2023-03-20 01:28:33,man,-0.036358967423439026
3481,You got it florida bro,DEPORT_PULISIC,2023-03-20 01:31:05,got florida bro,0.008570702746510506
3482,"Sorry, Miami fans.",AcrossTheNight,2023-03-20 01:31:34,sorry miami fan,-0.772559404373169
