,Comment,Author,Created UTC,Cleaned_Comment,sentiment_score
344,"I'll bet you money that Are You Winning service is run by Caesars or some other book lol

The whole thing is a racket that runs deep",GreatestWhiteShark,2023-03-17 20:05:18,bet money winning service run caesar book lol whole thing racket run deep,-0.0619286447763443
345,Clearly pushed off,pdxaidan,2023-03-17 20:09:38,clearly pushed,-0.3117328882217407
346,"No intent at all but that had to be a flagrant, avoid undercutting other players at really all costs",Lionslions670,2023-03-17 20:21:41,intent flagrant avoid undercutting player really cost,-0.5037424564361572
347,Marquette has needed help from the refs to barely beat a 15 seed that hasn’t even played great.,JayMoney2424,2023-03-17 20:09:44,marquette needed help ref barely beat seed even played great,-0.23736461997032166
348,"Sad to see calls go against an underdog but that’s a foul, if you cut across a guy at full speed and make *any* contact it basically has to be called

Edit: he clearly caught him with his arm, good lord any calls going to a higher seed makes people lose their minds",byzantiums,2023-03-17 19:38:40,sad see call go underdog foul cut across guy full speed make contact basically called edit clearly caught arm good lord call going higher seed make people lose mind,-0.7860305309295654
349,Huge for us,DrDilatory,2023-03-17 18:56:17,huge u,0.0016439631581306458
350,marquette just a different tier than vermont is,friedmpa,2023-03-17 19:17:32,marquette different tier vermont,0.01242712140083313
351,That's big! Kolek picked up his 3rd foul.,spierce64006,2023-03-17 20:03:48,big kolek picked rd foul,-0.15247365832328796
352,Vermont hanging around. That should've of been a charge a moment ago. Robin Duncan had the position.,spierce64006,2023-03-17 20:10:10,vermont hanging around charge moment ago robin duncan position,-0.021700680255889893
353,Jumped like a man who knows how important that shot was for his career lol,[deleted],2023-03-17 20:13:19,jumped like man know important shot career lol,-0.01520691066980362
354,VCU NEVER SHOULD HAVE BEEN IN THE 2011 TOURNAMENT THEIR RUN WAS A PACK OF ***LIES***,Pollaski,2023-03-17 20:42:36,vcu never tournament run pack lie,-0.22455093264579773
355,[deleted],[deleted],2023-03-17 20:47:44,deleted,-0.47444185614585876
356,Pretty dangerous play there,JayMoney2424,2023-03-17 20:20:20,pretty dangerous play,0.1650577038526535
357,"First time seeing Marquette, Kam Jones has a little James Harden in him. Maybe it's just being a lefty?",somasomore,2023-03-17 20:30:20,first time seeing marquette kam jones little james harden maybe lefty,0.034964852035045624
358,what is wrong with these goddamn refs they literally picked marquette to win it all yes im salty vermont basketball has nothing,CoachKillerTrae,2023-03-17 20:11:04,wrong goddamn ref literally picked marquette win yes im salty vermont basketball nothing,-0.6037418246269226
359,"These Marquette fans have the most annoying chants I’ve ever heard. Is it a whole sorority chanting this or something?

I might have to watch Sunday’s game on mute",Rockerblocker,2023-03-17 20:33:54,marquette fan annoying chant ever heard whole sorority chanting something might watch sunday game mute,-0.21754670143127441
360,[deleted],[deleted],2023-03-17 20:31:18,deleted,-0.47444185614585876
361,I saw Marquette was in OT and got really excited. I then realized they were playing South Florida and it was the women’s bracket. Good game though!,feralihatr,2023-03-17 17:46:56,saw marquette ot got really excited realized playing south florida woman bracket good game though,0.13210301101207733
362,"If Vermont brings the same energy as last year, this game will be a good one. Marquette hasn’t been getting many offensive rebounds and the Cats have been cleaning boards on that end. If the first chance shots don’t fall for Marquette, they could be in trouble.",Wolf_of_Walmart,2023-03-17 18:22:14,vermont brings energy last year game good one marquette getting many offensive rebound cat cleaning board end first chance shot fall marquette could trouble,0.0063815489411354065
363,Staying up for a 2am tipoff local time. MU RAH RAH!,Spectre1919,2023-03-17 18:51:24,staying tipoff local time mu rah rah,0.021686822175979614
364,Are you fucking kidding me,WIN011,2023-03-17 18:55:57,fucking kidding,-0.6800307631492615
365,our tiny ass gym is throwing off our depth perception geez. we’re gonna need to not throw the ball away in the corner if we wanna win,CoachKillerTrae,2023-03-17 19:00:29,tiny as gym throwing depth perception geez gon na need throw ball away corner wan na win,0.11362005770206451
366,The Mario movie looks hella fun and I'm tired of pretending it doesn't,TheyCallMeStone,2023-03-17 19:00:44,mario movie look hella fun tired pretending,0.025928057730197906
367,Hopefully it was just blood. Weird that the ref stopped play on the defensive end for anything other than blood or a concussion,_Hank_Marducas_,2023-03-17 19:00:49,hopefully blood weird ref stopped play defensive end anything blood concussion,-0.2830289602279663
368,FUCK YEAH,coilmeup,2023-03-17 19:01:37,fuck yeah,-0.22234758734703064
369,ugh kolek’s baxk we may be fucked,CoachKillerTrae,2023-03-17 19:01:48,ugh kolek baxk may fucked,-0.6673036217689514
370,Oh yeah Chase,coilmeup,2023-03-17 19:02:14,oh yeah chase,-0.012615885585546494
371,Yes get Sean out here,coilmeup,2023-03-17 19:03:49,yes get sean,-0.07288423925638199
372,"Looks like Koleks right wrist. He’s a lefty, so that’s good…",MayIServeYouWell,2023-03-17 19:03:52,look like koleks right wrist lefty good,0.08017771691083908
373,SHABANG,coilmeup,2023-03-17 19:05:01,shabang,-0.020619511604309082
374,"I'm surprised no one's said it yet,

I'm favoring Vermont just because it's the green team on St. Patrick's day!",TooHotForDog,2023-03-17 19:08:04,surprised one said yet favoring vermont green team st patrick day,-0.056260913610458374
375,MAKE FREE THROWS PLEASE,coilmeup,2023-03-17 19:14:18,make free throw please,-0.024153202772140503
376,Kam not being good at 3s infuriates me.,ApprehensiveCorgi867,2023-03-17 19:14:46,kam good infuriates,0.06298506259918213
377,Boots on the ground here. JOP TRAIN HAS ARRIVED,CarrollPC,2023-03-17 19:15:03,boot ground jop train arrived,-0.005706101655960083
378,Early  foul trouble for the Catamounts. Finn Sullivan and Robin Duncan already with 2 each.,spierce64006,2023-03-17 19:15:03,early foul trouble catamount finn sullivan robin duncan already,-0.44146519899368286
379,Wonder if kam jones spends all his time just practicing 3s and never does any practice on free throws,beasty9000,2023-03-17 19:18:26,wonder kam jones spends time practicing never practice free throw,-0.46253475546836853
380,They're giving us chances and we just keep fucking blowing it,DrDilatory,2023-03-17 19:20:53,giving u chance keep fucking blowing,-0.7050546407699585
381,Great job Chase for dodging that ball,coilmeup,2023-03-17 19:23:10,great job chase dodging ball,0.001473097363486886
382,UMass-Dartmouth Corsairs mention by CBS!,spierce64006,2023-03-17 19:23:12,uma dartmouth corsair mention cbs,0.009666666388511658
383,Where Shaka get all that hair from?,arbitrator06,2023-03-17 19:23:15,shaka get hair,-0.017958246171474457
384,Can Vermont hold on to the ball?,laughoutloud102,2023-03-17 19:23:45,vermont hold ball,0.013695761561393738
385,Only 3 fouls is nice.,coilmeup,2023-03-17 19:23:52,foul nice,-0.33017390966415405
386,OMax!,Dekalbian,2023-03-17 19:23:58,omax,-0.06429293751716614
387,That’s a bad call,JayMoney2424,2023-03-17 19:25:17,bad call,-0.6978206634521484
388,Hard to believe Shaka hasn’t made a 2nd round in a decade,albeve,2023-03-17 19:26:32,hard believe shaka made nd round decade,-0.004763050004839897
389,How that wild possession turned into a three.,americanbaseball,2023-03-17 19:26:57,wild possession turned three,-0.01846255362033844
390,Vermont needs to step up on defense,inevitablescape,2023-03-17 19:27:34,vermont need step defense,0.051077425479888916
391,[deleted],[deleted],2023-03-17 19:28:45,deleted,-0.47444185614585876
392,Isn’t this a 30 second timeout?,beasty9000,2023-03-17 19:34:40,second timeout,-0.012316197156906128
393,Please give the ball to Oso more please,coilmeup,2023-03-17 19:37:22,please give ball oso please,-0.10420332103967667
394,?????,Brady331,2023-03-17 19:37:47,,0.056165412068367004
395,"That’s so bad, wow.",MookieSweats,2023-03-17 19:37:52,bad wow,-0.8845361471176147
396,David Joplin with 10 for Marquette. Matt Veretto leads the Vermont with 9.,spierce64006,2023-03-17 20:01:43,david joplin marquette matt veretto lead vermont,-0.00838693231344223
397,They can’t handle Oso.,millertime1419,2023-03-17 20:03:57,handle oso,-0.13736197352409363
398,Oso takeover,SnakeMilker,2023-03-17 20:04:30,oso takeover,-0.10725505650043488
399,Saw that spin coming from a mile away,humorousmoose,2023-03-17 20:04:42,saw spin coming mile away,-0.054352886974811554
400,God are Koleks nails all bloody?,coilmeup,2023-03-17 20:04:45,god koleks nail bloody,-0.21323803067207336
401,Mitchell should throw a Vermont jersey on. Gets to the tournament and thinks he's a star,rccola4422,2023-03-17 20:06:38,mitchell throw vermont jersey get tournament think star,-0.008878998458385468
402,Jesus christ Reddit is dying every other minute on me.,[deleted],2023-03-17 20:09:13,jesus christ reddit dying every minute,-0.11346802115440369
403,Why does this team stop moving the ball every time kolek goes out,P1kachu2_,2023-03-17 20:10:08,team stop moving ball every time kolek go,-0.2055322229862213
404,This red has a wagon,_Hank_Marducas_,2023-03-17 20:21:47,red wagon,-0.0010002553462982178
405,Dickie V drinking coors light? It all makes sense now,Jordanwolf98,2023-03-17 20:26:14,dickie v drinking coors light make sense,-0.02494432032108307
406,Hard being an Orange fan that year. My girlfriend (now wife) was giving me so much grief that year. I’m like there is no way they beat Syracuse. She ended up picking UVM in her bracket and won the whole pool that year.,Intelligent_Shirt_50,2023-03-17 20:39:26,hard orange fan year girlfriend wife giving much grief year like way beat syracuse ended picking uvm bracket whole pool year,-0.5812975168228149
407,Rip groovy UV,[deleted],2023-03-17 20:49:50,rip groovy uv,-0.05766827613115311
408,"Let’s goooo!!! 

WE ARE!",millertime1419,2023-03-17 20:49:52,let goooo,-0.048670023679733276
409,4:49 EST finish,[deleted],2023-03-17 20:49:55,est finish,-0.04868398606777191
410,LFG,coilmeup,2023-03-17 20:49:58,lfg,0.009960025548934937
411,K,confirmd_am_engineer,2023-03-17 21:00:12,k,-0.07461680471897125
412,"Cuz Vermont pulled so far ahead everyone stopped watching? 

Ya me too",DrDilatory,2023-03-17 18:32:13,cuz vermont pulled far ahead everyone stopped watching ya,-0.15123982727527618
413,That’s what I thought about the Arizona-Princeton thread,ddottay,2023-03-17 18:50:56,thought arizona princeton thread,0.019279420375823975
414,St John’s played Marquette tight in all 3 games too,_Hank_Marducas_,2023-03-17 20:32:21,st john played marquette tight game,0.03443669527769089
415,That comeback attempt in the last game of the season was brilliant.  Then I hear your coach is out?  Tough breaks...,the_greasy_one,2023-03-17 20:38:51,comeback attempt last game season brilliant hear coach tough break,0.002163659781217575
416,Big East undefeated so far,Doctor_Phist,2023-03-17 19:07:23,big east undefeated far,-0.0019907215610146523
417,"Iona's a popular upset pick, but I know better than to bet against you guys. 5 teams 5 wins! Hope X's game is the BE's worst look today lol",skyllian-five,2023-03-17 19:09:17,iona popular upset pick know better bet guy team win hope x game worst look today lol,-0.14066801965236664
418,Yeah not fair,footer9,2023-03-17 20:41:26,yeah fair,0.030938969925045967
419,Glad GE is having a good year.,Chucktownbadger,2023-03-17 19:54:44,glad ge good year,0.0028047000523656607
420,"""Its...uh ...yeah when you get late in the tournament it's fun to see where guards....are good and play well.... deep in the tournamen. Clark??""",Spectre1919,2023-03-17 19:56:32,uh yeah get late tournament fun see guard good play well deep tournamen clark,0.03886935114860535
421,"Yup, as is tradition.  He’s earned at least 1, but not many if any more than that.",Chucktownbadger,2023-03-17 20:25:36,yup tradition earned least many,0.06862339377403259
422,I was shocked he didn’t take that one haha,WIN011,2023-03-17 20:25:49,shocked take one haha,-0.5112432241439819
423,"Absolutely, I'd be there if I was in driving distance",SnakeMilker,2023-03-17 20:44:42,absolutely driving distance,-0.023634523153305054
424,"Nah, Id prefer spartan fans there. Thanks.",somasomore,2023-03-17 20:44:24,nah id prefer spartan fan thanks,0.03014957904815674
425,We need all the help (in the stands) we can get,footer9,2023-03-17 20:45:07,need help stand get,-0.1541968286037445
426,the answer is yes.,ApprehensiveCorgi867,2023-03-17 20:53:58,answer yes,-0.08550108969211578
427,Debating the same. Any idea when our game might be?,millertime1419,2023-03-17 20:46:21,debating idea game might,0.10270970314741135
428,"We hired the wrong guy 9 years ago, now we have the right guy.",millertime1419,2023-03-17 20:45:11,hired wrong guy year ago right guy,-0.7129518389701843
429,The Wojo years… we don’t like to talk about it…,ArchaicWarden,2023-03-17 20:44:30,wojo year like talk,-0.022669553756713867
430,Wojo,Dekalbian,2023-03-17 20:43:54,wojo,-0.06316465139389038
431,It's been a dark decade,footer9,2023-03-17 20:45:49,dark decade,0.04958045482635498
432,Steve Wojo,SnakeMilker,2023-03-17 20:44:09,steve wojo,-0.03211192041635513
433,"Every year in recent memory that we've made it to the tournament that seems true, but I'm not sure this year",DrDilatory,2023-03-17 19:32:32,every year recent memory made tournament seems true sure year,-0.04271700978279114
434,An honorable death.,millertime1419,2023-03-17 20:33:40,honorable death,-0.11706699430942535
435,Agreed.,Chucktownbadger,2023-03-17 19:16:06,agreed,-0.04147566854953766
436,Maybe not after that shot tho,SnakeMilker,2023-03-17 19:16:26,maybe shot tho,0.0783795416355133
437,Didn’t lead to a big swing,Dekalbian,2023-03-17 19:39:55,lead big swing,0.01250157505273819
438,#MARQUETTE,Dekalbian,2023-03-17 20:31:16,marquette,-0.03462183475494385
439,This is the analysis I’m looking for!,brownlab319,2023-03-17 19:33:26,analysis looking,-0.01650245487689972
440,The one game I'm watching this year. My eyes are bleeding.,Ar0n,2023-03-17 19:40:58,one game watching year eye bleeding,-0.5821226835250854
441,Killa who?,eclectic_tastes,2023-03-17 20:16:16,killa,0.0016059204936027527
442,Bam,chuncken,2023-03-17 20:26:15,bam,-0.16708962619304657
443,He’s got sauce,_Hank_Marducas_,2023-03-17 20:27:30,got sauce,0.03264964744448662
444,Okay.,millertime1419,2023-03-17 20:42:52,okay,0.09463077783584595
445,You mean the X-ray vision ref. Can see through anyones body.,nosnack,2023-03-17 19:39:07,mean x ray vision ref see anyones body,-0.008623937144875526
446,"The refs didn’t make Kennesaw State miss all of their shots for like 8 minutes. 

And this call is way worse than that one.",SeekerSpock32,2023-03-17 19:40:33,ref make kennesaw state miss shot like minute call way worse one,-0.7242209911346436
447,Had a very good chance of it last year with Ryan Davis and Ben Shungu but this year is a tough one to do it.,spierce64006,2023-03-17 19:42:21,good chance last year ryan davis ben shungu year tough one,0.09954820573329926
448,"Dont tell me the mid 2000s was that long ago.

Edit: I forgot the year but you guys damn naer made the sweet 16",Stang1776,2023-03-17 19:41:41,dont tell mid long ago edit forgot year guy damn naer made sweet,-0.1034623235464096
449,Ya this is a Ross > Stevie game,WIN011,2023-03-17 20:14:16,ya ross stevie game,0.021616846323013306
450,All that running up and down court 🥵,TheyCallMeStone,2023-03-17 20:21:57,running court,0.018766164779663086
451,"I feel the same way on some targeting calls in football… play happens so fast, you cant predict what the other guy is going to do. But the refs look at this in super slo-mo, and spend minutes analyzing it… it looks totally different like that",MayIServeYouWell,2023-03-17 20:27:52,feel way targeting call football play happens fast cant predict guy going ref look super slo mo spend minute analyzing look totally different like,-0.20556949079036713
452,"Holy fuck, your flairs… rip on Sunday",millertime1419,2023-03-17 20:32:18,holy fuck flair rip sunday,-0.20415806770324707
453,Hiring Tom Crean after Shaka leaves?,Pollaski,2023-03-17 20:46:01,hiring tom crean shaka leaf,-0.07684502005577087
454,Hearing them in tiny-ass Patrick Gym when they're right on top of the game is an electric experience. They are great at hockey games at the Gut too.,scrapsbypap,2023-03-17 19:11:36,hearing tiny as patrick gym right top game electric experience great hockey game gut,0.0019210572354495525
455,Honestly never thought our band was very good in my time as a student so this is probably accurate,SnakeMilker,2023-03-17 19:14:44,honestly never thought band good time student probably accurate,-0.516504168510437
456,vermont kids are music nerds lol,CoachKillerTrae,2023-03-17 19:18:19,vermont kid music nerd lol,0.015587501227855682
457,Any way to make a buck...,inevitablescape,2023-03-17 19:11:59,way make buck,-0.060386620461940765
458,if no one else got us veretto got us,CoachKillerTrae,2023-03-17 19:29:44,one else got u veretto got u,-0.07492215931415558
459,Should’ve just taken the layup,WIN011,2023-03-17 19:40:55,taken layup,-0.13845403492450714
460,And the ball tho at the end,Glass3QuartersFull,2023-03-17 19:51:55,ball tho end,0.01218615472316742
461,I hate the Jimmy V one where Great Clips exploits his win and struggle just to advertise their stores.,Doctor_Phist,2023-03-17 20:00:32,hate jimmy v one great clip exploit win struggle advertise store,-0.4275011718273163
462,New Mexico lost at the Pit on Wednesday night.,spierce64006,2023-03-17 20:11:10,new mexico lost pit wednesday night,-0.23536209762096405
463,shhhhh,CoachKillerTrae,2023-03-17 20:47:47,shhhhh,-0.06404517590999603
464,"Same way anyone becomes a fan of any sports team really, you live in or have a connection to the area

Probably every single catamount fan is a Vermont alumni or a native Vermonter",DrDilatory,2023-03-17 20:34:53,way anyone becomes fan sport team really live connection area probably every single catamount fan vermont alumnus native vermonter,-0.002389889908954501
465,"Figuring they're one of two D1 schools in a state with 650k people (and the other one is freakin Dartmouth), the fanbase can be considerable.",Pollaski,2023-03-17 20:36:13,figuring one two school state k people one freakin dartmouth fanbase considerable,0.05009308457374573
466,How do you become a St Peter’s fan?,Rockerblocker,2023-03-17 20:35:52,become st peter fan,-0.00174817256629467
467,Haha I went to school there but Burlington loves VT basketball. We don't got many sports so people come from all over the state to watch them. When I was into basketball as a kid that's where my dad would take me,Glass3QuartersFull,2023-03-17 20:35:53,haha went school burlington love vt basketball got many sport people come state watch basketball kid dad would take,0.00048350426368415356
468,lifelong basketball fans who grew up in rural Vermont like myself 🤙 we had a good run this season but i always kinda knew this wasn’t gonna be the season we were gonna finally pull of a run,CoachKillerTrae,2023-03-17 20:46:06,lifelong basketball fan grew rural vermont like good run season always kinda knew gon na season gon na finally pull run,0.0017402293160557747
469,Fucking pathetic officiating.,flipz4444,2023-03-17 19:38:58,fucking pathetic officiating,-0.862419068813324
470,"Wild flair, we are enemies but brothers",scrapsbypap,2023-03-17 19:08:05,wild flair enemy brother,-0.03447776287794113
471,Confusing that the city is in Michigan but the school is in Milwaukee.,Meanteenbirder,2023-03-17 18:22:32,confusing city michigan school milwaukee,0.13478273153305054
472,Milwaukee.,ApprehensiveCorgi867,2023-03-17 18:21:44,milwaukee,-0.27289915084838867
473,They haven't played against Tyler Kolek yet,TheyCallMeStone,2023-03-17 18:32:23,played tyler kolek yet,0.010454364120960236
474,We love him,_Hank_Marducas_,2023-03-17 19:08:56,love,-8.834060281515121e-06
475,"I think they’re playing at nationwide arena, which is where the Blue Jackets nhl team plays. Could be a condensation issue.",confirmd_am_engineer,2023-03-17 19:14:17,think playing nationwide arena blue jacket nhl team play could condensation issue,-0.07985579967498779
476,This is uninspired at best.,Chucktownbadger,2023-03-17 19:21:53,uninspired best,-0.1613229215145111
477,"Yeah, but I'm not worried. I could easily see MU turn it on next game",gandaalf,2023-03-17 19:23:30,yeah worried could easily see mu turn next game,0.006697501987218857
478,How's Serbia this time of year?,butts6891,2023-03-17 19:26:34,serbia time year,-0.046272799372673035
479,They aren't winning unless they make a bunch of outside shots.,spierce64006,2023-03-17 19:34:45,winning unless make bunch outside shot,-0.04931570589542389
480,One of these years they’ll actually pull off the 1st round upset and then actually end up making a deep run,Kodyaufan2,2023-03-17 19:39:06,one year actually pull st round upset actually end making deep run,-0.09432058036327362
481,They want Vermont to win because they’re scared of Tyler “fuck em” Kolek.,millertime1419,2023-03-17 19:43:16,want vermont win scared tyler fuck em kolek,-0.3852826952934265
482,green 4 st pattys day!,ilovefacebook,2023-03-17 19:42:09,green st patty day,0.02023591846227646
483,Looks like it almost went in too,humorousmoose,2023-03-17 20:06:04,look like almost went,0.0025441348552703857
484,Didn’t you just beat Xavier and make them cry?,FedGoat13,2023-03-17 20:10:47,beat xavier make cry,-0.02224179357290268
485,It's a catholic school but it has public school energy,TheyCallMeStone,2023-03-17 20:17:45,catholic school public school energy,-0.007540024816989899
486,It’s not a public school it’s jesuit,cixzejy,2023-03-17 20:18:22,public school jesuit,-0.000346355140209198
487,"All the new Big East schools are private, minus Uconn",DrGeraldBaskums,2023-03-17 20:23:48,new big east school private minus uconn,0.0033898502588272095
488,Kam does not know who Cam is,WIN011,2023-03-17 20:29:55,kam know cam,-0.013300307095050812
489,Kam*,_Hank_Marducas_,2023-03-17 20:30:13,kam,0.0030237138271331787
490,Put some respect on Kam's name,SnakeMilker,2023-03-17 20:30:15,put respect kam name,-0.03726029396057129
491,Who is this Cam you speak of,Dekalbian,2023-03-17 20:30:58,cam speak,-0.019089475274086
492,Me too…,Chucktownbadger,2023-03-17 19:22:29,,0.056165412068367004
493,There should be a buzzer on one of the refs hips so that a ref in the booth can have them review shit like that,Augustus13,2023-03-17 19:41:08,buzzer one ref hip ref booth review shit like,-0.045593321323394775
494,[deleted],[deleted],2023-03-17 20:10:02,deleted,-0.47444185614585876
495,Ur kidding right?,pdxaidan,2023-03-17 20:09:53,ur kidding right,-0.20479078590869904
496,6th fella,LocksTheFox,2023-03-17 19:04:11,th fella,0.02506311982870102
497,Got off to a bad start thanks to a very new lineup and some weird ass scheduling,LocksTheFox,2023-03-17 19:04:46,got bad start thanks new lineup weird as scheduling,-0.23546463251113892
498,"Yeah... There are a lot of years where I don't think I'm being a total homer to think that we are a decent upset pick, but I don't think it's in the cards for us this year",DrDilatory,2023-03-17 19:05:11,yeah lot year think total homer think decent upset pick think card u year,0.0683036744594574
499,[deleted],[deleted],2023-03-17 19:04:20,deleted,-0.47444185614585876
500,get our Kam cooking ;),LocksTheFox,2023-03-17 19:10:02,get kam cooking,-0.001019766554236412
501,Hurting it seems but not hurt.,Chucktownbadger,2023-03-17 19:10:46,hurting seems hurt,-0.11705538630485535
502,Got his thumb a little jammed or hyper extended. Seems fine,Augustus13,2023-03-17 19:10:36,got thumb little jammed hyper extended seems fine,0.16695404052734375
503,"Don’t give up just yet, got a loooooot of game left.",confirmd_am_engineer,2023-03-17 19:15:01,give yet got loooooot game left,-0.026687026023864746
504,It's the first half lmao,Common-Community-550,2023-03-17 19:17:13,first half lmao,0.05221980810165405
505,Hope he comes back for his senior year.,spierce64006,2023-03-17 19:18:50,hope come back senior year,0.00048372335731983185
506,ik cmon john let’s run a play as well,CoachKillerTrae,2023-03-17 19:16:27,ik cmon john let run play well,0.005672017112374306
507,Interesting flair combo. You a big Houser fan?,confirmd_am_engineer,2023-03-17 19:19:16,interesting flair combo big houser fan,0.009257480502128601
508,I went there for the NHL draft years ago. It's a pretty nice arena,LocksTheFox,2023-03-17 19:19:12,went nhl draft year ago pretty nice arena,0.03565160557627678
509,"Anytime your normal mail or package is en route, it could be in the same mail bags as a Colorguard sample on its way back to the Exact Science labs. And think about all the people who don’t wash their hands packing that sample up…

;-)",brownlab319,2023-03-17 19:21:47,anytime normal mail package en route could mail bag colorguard sample way back exact science lab think people wash hand packing sample,-0.06465350836515427
510,"Good skiing too, if that’s your thing.",confirmd_am_engineer,2023-03-17 19:24:27,good skiing thing,0.013796809129416943
511,Marquettes defense is killing you,MayIServeYouWell,2023-03-17 19:22:27,marquette defense killing,-0.033517271280288696
