,Comment,Author,Created UTC,Cleaned_Comment,sentiment_score
176,"Well, at least if this one's over early it won't be like most other years where I think we might actually pull a huge upset before we get blown out in the last 5 minutes lol",DrDilatory,2023-03-17 19:02:41,well least one early like year think might actually pull huge upset get blown last minute lol,-0.1735703945159912
177,Kol3k,footer9,2023-03-17 19:05:36,kol k,-0.0267142653465271
178,Come on boys,scrapsbypap,2023-03-17 19:06:15,come boy,-0.02238275483250618
179,Kolek is so good,Doctor_Phist,2023-03-17 19:07:03,kolek good,0.03297816962003708
180,"Come on Jop,  Close out",Chucktownbadger,2023-03-17 19:07:11,come jop close,0.0026190634816884995
181,This court seems slick.,Chucktownbadger,2023-03-17 19:13:05,court seems slick,0.23995228111743927
182,"I knew it was long, but legit a decade since our last tourney win. Goddamn. I was a junior in college",gandaalf,2023-03-17 19:15:05,knew long legit decade since last tourney win goddamn junior college,-0.002606266178190708
183,If we play like this for the rest of the tourney we’re screwed,coilmeup,2023-03-17 19:21:37,play like rest tourney screwed,-0.3801325261592865
184,"If Marquette knows that they can just keep all five guys at the three-point line, it's going to be impossible to get anyone open for a shot

Can we even attempt to play where we drive towards the rim and then pass it back out for a quick three?",DrDilatory,2023-03-17 19:22:17,marquette know keep five guy three point line going impossible get anyone open shot even attempt play drive towards rim pas back quick three,-0.11306801438331604
185,"Can’t watch the Iowa State v Pitt game I wanted while I am overseas. Only feed that this bar has is a Serbian one that has this Vermont Marquette game. 

The beauty of the commercials though is they do a live wide cam of the whole arena. It’s low key awesome 

https://i.imgur.com/70VGQq8.jpg",ToxicSteve13,2023-03-17 19:24:36,watch iowa state v pitt game wanted overseas feed bar serbian one vermont marquette game beauty commercial though live wide cam whole arena low key awesome,0.024467919021844864
186,CALL HIM,coilmeup,2023-03-17 19:26:22,call,-0.253581166267395
187,Joplin is BALLIN,gandaalf,2023-03-17 19:26:43,joplin ballin,0.018624313175678253
188,Ugh,coilmeup,2023-03-17 19:32:19,ugh,-0.2602250874042511
189,Vermont is playing like they are allergic to the paint,Wolf_of_Walmart,2023-03-17 19:32:38,vermont playing like allergic paint,-0.36792081594467163
190,Kolek clearly bothered by that thumb or whatever. Think they can take this without his A game but he needs to wake up,gandaalf,2023-03-17 19:32:54,kolek clearly bothered thumb whatever think take without game need wake,-0.031742602586746216
191,The yearly competitive Vermont tourney game only to lose by double digits is right on schedule so far,rvadarocket,2023-03-17 19:34:48,yearly competitive vermont tourney game lose double digit right schedule far,0.007951401174068451
192,REFBALL,DrDilatory,2023-03-17 19:36:44,refball,0.021697551012039185
193,What a horrible call. Wasn’t even touched!,Wolf_of_Walmart,2023-03-17 19:37:11,horrible call even touched,-0.9189772605895996
194,One of the worst calls I’ve ever seen,thugmuffin22,2023-03-17 19:37:15,one worst call ever seen,-0.9417979717254639
195,Holy moly WHAT,afantasticbastard,2023-03-17 19:37:48,holy moly,-0.000450722174718976
196,"just, wow.",ilovefacebook,2023-03-17 19:38:01,wow,-0.005741604603827
197,"Ooof, bad call",Spectre1919,2023-03-17 19:38:09,ooof bad call,-0.732911229133606
198,FUCK YEAH STEVIE,coilmeup,2023-03-17 19:38:26,fuck yeah stevie,-0.19136610627174377
199,Just a disastrous end to the half for Vermont. John Becker is not happy on a terrible missed foul call that went against him.,spierce64006,2023-03-17 19:39:30,disastrous end half vermont john becker happy terrible missed foul call went,-0.7780129909515381
200,"“Tyler’s only made three field goals, is he okay?” Lmao",MookieSweats,2023-03-17 19:40:39,tyler made three field goal okay lmao,0.030282037332654
201,How come so many Michigan state fans have Vermont shirts on? Coaching ties or something?,theopression,2023-03-17 19:40:59,come many michigan state fan vermont shirt coaching tie something,0.029676534235477448
202,That would have been a huge 3,Stang1776,2023-03-17 20:05:43,would huge,0.015323802828788757
203,I have Marquette in Final Four. Apologies to all their fans in advance.,FedGoat13,2023-03-17 20:06:27,marquette final four apology fan advance,-0.20188111066818237
204,why can't this team play a game that isn't FUCKING stressful,ApprehensiveCorgi867,2023-03-17 20:09:08,team play game fucking stressful,-0.5427777767181396
205,This Vermont team has some really good perimeter defense,No-Lab7758,2023-03-17 20:09:27,vermont team really good perimeter defense,0.007765217684209347
206,Such poor ball movement now,footer9,2023-03-17 20:09:38,poor ball movement,-0.4252445697784424
207,Hesitating and passing up an open 3 leading to a Marquette mini-run. Not great!,LocksTheFox,2023-03-17 20:14:08,hesitating passing open leading marquette mini run great,0.01248353160917759
208,Vermont had their chance right there great look to cut it to 2,JayMoney2424,2023-03-17 20:14:21,vermont chance right great look cut,0.0007693935185670853
209,I always have to look up if Marquette is private because I can never remember if it's one of those weird public schools like Purdue or Auburn that are public schools without a stately name,airbornetoxic,2023-03-17 20:16:38,always look marquette private never remember one weird public school like purdue auburn public school without stately name,-0.17087827622890472
210,Fuck that looked awful. Hope he’s alright,Jordanwolf98,2023-03-17 20:20:16,fuck looked awful hope alright,-0.6405571103096008
211,What in the world is this smash mouth remix🤮🤮,Waterpalolegend,2023-03-17 20:20:44,world smash mouth remix,-0.03090958297252655
212,Kinda seems like he was just backing up... odd.,hiswayout,2023-03-17 20:21:44,kinda seems like backing odd,0.24749764800071716
213,Is adding the F1 to that the makeup call? We all even now?,Spectre1919,2023-03-17 20:22:53,adding f makeup call even,-0.09856614470481873
214,We’re even for that call in the first half now.,millertime1419,2023-03-17 20:23:05,even call first half,-0.3359263837337494
215,"He's lucky he landed on the guy who undercut him, otherwise that would have hurt a lot worse.",Pollaski,2023-03-17 20:23:17,lucky landed guy undercut otherwise would hurt lot worse,-0.536945104598999
216,KAMERON JONES,millertime1419,2023-03-17 20:23:39,kameron jones,-0.01236327737569809
217,the kam jones show,jconley4297,2023-03-17 20:24:06,kam jones show,-0.01675558090209961
218,Oh Kam…,Chucktownbadger,2023-03-17 20:29:05,oh kam,-0.03769626468420029
219,dudes a BUCKET,jconley4297,2023-03-17 20:29:17,dude bucket,-0.3682703673839569
220,What a performance from Cam Jones!,jaowerpower,2023-03-17 20:29:28,performance cam jones,0.03296736627817154
221,Kam Jones really took over,[deleted],2023-03-17 20:29:35,kam jones really took,0.017094198614358902
222,THE KAM SHOW,Dekalbian,2023-03-17 20:29:37,kam show,-0.009594529867172241
223,Simply unstoppable Mr. Jones,sarcasmrules18,2023-03-17 20:29:47,simply unstoppable mr jones,-0.08141543716192245
224,"This game is over, Marquette (Jones) is just too good",LordStarkgaryen,2023-03-17 20:29:49,game marquette jones good,0.03519502282142639
225,Kam Jones hates Vermont/St. Patricks Day,SeattleMatt123,2023-03-17 20:29:52,kam jones hate vermont st patrick day,-0.04062826931476593
226,KAM CAM,kylepierce722,2023-03-17 20:30:14,kam cam,0.018692821264266968
227,Kam Jones has sauce,_Hank_Marducas_,2023-03-17 20:30:24,kam jones sauce,0.034651979804039
228,"Hi Dylan Schaefler, your team held its own today!",millertime1419,2023-03-17 20:41:29,hi dylan schaefler team held today,-0.04795778542757034
229,Dylan Penn's hair is almost as impressive as Tyger Campbell's,the_greasy_one,2023-03-17 20:41:47,dylan penn hair almost impressive tyger campbell,0.003870232030749321
230,Robin Duncan deep banked in 3 lol. Still perfect from the field on 5/5 shooting. Marquette flexed their muscles in that 6-7 minute period and put the game away. Tough final game in a Catamounts jersey for America East POTY Finn Sullivan but he's been outstanding over his time and career in Burlington.,spierce64006,2023-03-17 20:45:44,robin duncan deep banked lol still perfect field shooting marquette flexed muscle minute period put game away tough final game catamount jersey america east poty finn sullivan outstanding time career burlington,0.00029082223773002625
231,gordon’s milkshakes are very good,hatnohat,2023-03-17 20:46:39,gordon milkshake good,-0.0008388757705688477
232,Certainly will bring all the boys to the hotel yard…,Zloggt,2023-03-17 20:53:19,certainly bring boy hotel yard,0.0034106592647731304
233,I stopped working just to come here and say that was one of the worst calls I've seen in my 39 years on this planet.  Holy fuck.,Where0Meets15,2023-03-17 19:39:23,stopped working come say one worst call seen year planet holy fuck,-0.8541117906570435
234,Another great day of college basketball officiating right here!,DetroitSparty,2023-03-17 19:39:41,another great day college basketball officiating right,0.0007258590776473284
235,I apologize for that call but will also take the point it gave us,irreleventnothing,2023-03-17 19:41:56,apologize call also take point gave u,-0.29650312662124634
236,Gotta be one of the worst calls in the history of calls,Blitqz21l,2023-03-17 19:44:13,got ta one worst call history call,-0.8958175182342529
237,New Ben & Jerry's Flavor: No Upset For You Vanilla (with extra salt),Pollaski,2023-03-17 20:32:04,new ben jerry flavor upset vanilla extra salt,0.029042869806289673
238,"Vermont looks like a 15 seed, but underwhelmed by Marquette so far",thugmuffin22,2023-03-17 19:21:53,vermont look like seed underwhelmed marquette far,-0.00353926420211792
239,That was the worst foul call I’ve ever witnessed in my life,buckyballboy,2023-03-17 19:39:39,worst foul call ever witnessed life,-0.9418627023696899
240,"So dumb there is no way to remedy just an atrocious, garbage call",LunchboxDDS,2023-03-17 19:39:56,dumb way remedy atrocious garbage call,-0.844071090221405
241,Block and a flop,SnakeMilker,2023-03-17 20:09:29,block flop,-0.2133975625038147
242,Good luck Shaka!,mbh223,2023-03-17 17:47:22,good luck shaka,-0.009571028873324394
243,"Demonstrate that Jesuit superiority, Marquette.",AchtungKessel,2023-03-17 18:22:55,demonstrate jesuit superiority marquette,-0.09772780537605286
244,I want Joey,SnakeMilker,2023-03-17 18:47:45,want joey,-0.1723729968070984
245,LFG,coilmeup,2023-03-17 18:48:18,lfg,0.009960025548934937
246,Yeah Oso!,coilmeup,2023-03-17 18:54:02,yeah oso,0.029160551726818085
247,Oso please please please stay out of foul trouble,footer9,2023-03-17 18:54:39,oso please please please stay foul trouble,-0.8005101084709167
248,Fuck,coilmeup,2023-03-17 18:56:22,fuck,-0.7464621067047119
249,"Kolek favoring that hand/wrist started before the 3, I didn't clock when it happened but it was early. Hopefully it's nothing serious.",skyllian-five,2023-03-17 18:56:41,kolek favoring hand wrist started clock happened early hopefully nothing serious,0.11332529783248901
250,FUCK ME,coilmeup,2023-03-17 18:57:04,fuck,-0.7464621067047119
251,"Good lord we look sloppy, rushing shots, holy fuck",DrDilatory,2023-03-17 18:57:28,good lord look sloppy rushing shot holy fuck,-0.6008741855621338
252,What is it with high-seeded teams who haven't won before (or not in a long time) and their best player getting injured? It's like the injury gods hate parity.,karmew32,2023-03-17 19:00:26,high seeded team long time best player getting injured like injury god hate parity,-0.3525238037109375
253,Nobody makes Kolek bleed his own blood.,TheyCallMeStone,2023-03-17 19:02:00,nobody make kolek bleed blood,-0.5672681331634521
254,"Kolek, my King, welcome back",Dekalbian,2023-03-17 19:02:08,kolek king welcome back,0.0007621948607265949
255,Did that just sau 6th “Person” of the year?,coilmeup,2023-03-17 19:03:16,sau th person year,-0.013146042823791504
256,Vermont has a great program but seems this version isn't as strong as the past couple,[deleted],2023-03-17 19:03:53,vermont great program seems version strong past couple,0.002749469131231308
257,GOOD BLOCK MATT,CoachKillerTrae,2023-03-17 19:04:24,good block matt,0.04885008931159973
258,"Well, TKO seems fine.",Chucktownbadger,2023-03-17 19:05:07,well tko seems fine,0.15067757666110992
259,PENN 3,CoachKillerTrae,2023-03-17 19:07:40,penn,-0.05292133986949921
260,"The not so secret, secret now is that March Madness commercials blow Super Bowl commercials outta the water",Jordanwolf98,2023-03-17 19:08:34,secret secret march madness commercial blow super bowl commercial outta water,-0.020883623510599136
261,We need to get Kam and Oso cooking.,Chucktownbadger,2023-03-17 19:09:35,need get kam oso cooking,-0.013300672173500061
262,"Lets go Catamounts! How about Dylan Penn hitting a three ball early on. Matt Veretto who had a career high in the America East tournament final against UMass-Lowell also has hit from the outside early on. Finn Sullivan needs a huge game for Vermont to pull this off. 

Tyler Kolek looks good in the first 10 minutes here for Shaka Smart's charges.",spierce64006,2023-03-17 19:09:46,let go catamount dylan penn hitting three ball early matt veretto career high america east tournament final uma lowell also hit outside early finn sullivan need huge game vermont pull tyler kolek look good first minute shaka smart charge,-0.03552400320768356
263,is Kolek hurt?,BigBoutros,2023-03-17 19:09:54,kolek hurt,-0.18307900428771973
264,Jopppp,theerealobs,2023-03-17 19:11:00,jopppp,0.02453628182411194
265,"Welp...same as every year, maybe next year",DrDilatory,2023-03-17 19:11:50,welp every year maybe next year,-0.03969292715191841
266,stop losing your assignments on the perimeter pls :/,[deleted],2023-03-17 19:12:52,stop losing assignment perimeter pls,-0.35124915838241577
267,AD heating up from 3?,scrapsbypap,2023-03-17 19:13:34,ad heating,-0.0235385000705719
268,Vermont is in big trouble if they keep up the fouling like this,gandaalf,2023-03-17 19:14:01,vermont big trouble keep fouling like,-0.5999222993850708
269,"It almost looks like Vermont is coached to not even try to go for offensive rebounds lmao

Either the ball goes in, or all five Marquette players are closer than any single UVM player on the rebound",DrDilatory,2023-03-17 19:15:35,almost look like vermont coached even try go offensive rebound lmao either ball go five marquette player closer single uvm player rebound,-0.05971646308898926
270,Ben. Cmon,coilmeup,2023-03-17 19:15:40,ben cmon,-0.0422392338514328
271,john becker run a play for a shooter challenege,CoachKillerTrae,2023-03-17 19:16:39,john becker run play shooter challenege,0.009871795773506165
272,Thats actually a pretty cool arena,coilmeup,2023-03-17 19:18:33,thats actually pretty cool arena,0.0104092201218009
273,[deleted],[deleted],2023-03-17 19:18:34,deleted,-0.47444185614585876
274,"I like Vermont.

It has good beer, quiet life and Ben & Jerry's ice cream.",Pesci_Avocado,2023-03-17 19:19:24,like vermont good beer quiet life ben jerry ice cream,0.01600106805562973
275,It seems like Vermont has more that one turnover to me,coilmeup,2023-03-17 19:19:42,seems like vermont one turnover,-0.06065237522125244
276,Offensive boards and fouls killing us,LocksTheFox,2023-03-17 19:21:39,offensive board foul killing u,-0.385381281375885
277,By slip I think you mean push off announcer dude.,Chucktownbadger,2023-03-17 19:24:59,slip think mean push announcer dude,-0.014454394578933716
278,That was a strange foul call,ToeSuckingFiend,2023-03-17 19:25:15,strange foul call,-0.7021550536155701
279,LFG JOP!,Chucktownbadger,2023-03-17 19:27:06,lfg jop,0.03499259054660797
280,"Who remembers when Darius ""Expecto Patronum"" Johnson-Odom played for Marquette?",itwasnewtome,2023-03-17 19:28:23,remembers darius expecto patronum johnson odom played marquette,0.002573242411017418
281,The threes in this game worry me if we can’t defense these 3’s how do we except to defend MSU’s 3’s,cixzejy,2023-03-17 19:28:40,three game worry defense except defend msu,-0.24265870451927185
282,Matt Veretto seems to be going for another career high. Picking up right where he left on in the America East final against UMass-Lowell. 3 triples in the opening half for him thus far.,spierce64006,2023-03-17 19:29:15,matt veretto seems going another career high picking right left america east final uma lowell triple opening half thus far,0.008042281493544579
283,Would enjoy if Kam picked it up,SnakeMilker,2023-03-17 19:30:17,would enjoy kam picked,0.007830132730305195
284,Vermont has some goooood looking jerseys,humorousmoose,2023-03-17 19:33:04,vermont goooood looking jersey,0.04990766569972038
285,"I can’t imagine a more frightening sight for a top 3-4 seed than seeing your first round opponent is the American East champion.

It feels like every year the winner of this conference pulls off an upset or comes very close to doing it.

The American East, Big West, Ivy, and Missouri Valley. Every year",Kodyaufan2,2023-03-17 19:35:27,imagine frightening sight top seed seeing first round opponent american east champion feel like every year winner conference pull upset come close american east big west ivy missouri valley every year,-0.33122435212135315
286,Watching this on the John at work. The future is now.,ITHETRUESTREPAIRMAN,2023-03-17 19:36:33,watching john work future,-1.8594786524772644e-05
287,Horseshit,JerryGoDeep,2023-03-17 19:37:05,horseshit,-0.14723849296569824
288,Wow that’s terrible.,andy-022,2023-03-17 19:37:32,wow terrible,-0.9362905621528625
289,What is that call lmao,coilmeup,2023-03-17 19:37:32,call lmao,-0.22343629598617554
290,What a horseshit call,flipz4444,2023-03-17 19:37:34,horseshit call,-0.2472878396511078
291,That’s a bad call,_Hank_Marducas_,2023-03-17 19:37:35,bad call,-0.6978206634521484
292,wheres the foul,-motts-,2023-03-17 19:37:38,wheres foul,-0.36081206798553467
293,Yeah that’s bad,SeekerSpock32,2023-03-17 19:37:42,yeah bad,-0.7818916440010071
294,Bad bad bad,coastalneer,2023-03-17 19:38:11,bad bad bad,-0.9216311573982239
295,First the Kennesaw st game now this reffing is making these games unwatchable,No-Lab7758,2023-03-17 19:38:35,first kennesaw st game reffing making game unwatchable,0.02397918701171875
296,FUCK YEAH STEVIE,coilmeup,2023-03-17 19:38:35,fuck yeah stevie,-0.19136610627174377
297,Anybody got a replay link of the call before half?,itwasnewtome,2023-03-17 19:59:59,anybody got replay link call half,-0.08273256570100784
298,Iowa State WTH?,coilmeup,2023-03-17 20:01:22,iowa state wth,-0.06970049440860748
299,Kolek! Why!?!,millertime1419,2023-03-17 20:02:55,kolek,-0.009237512946128845
300,Vermont would be beating half of the tournament teams rn,AeroStatikk,2023-03-17 20:03:02,vermont would beating half tournament team rn,-0.021133795380592346
301,Dumb foul Kolek,Dekalbian,2023-03-17 20:03:13,dumb foul kolek,-0.8230518698692322
302,Shaka going way out into the court has always bothered me,ttuurrppiinn,2023-03-17 20:05:43,shaka going way court always bothered,-0.03876662254333496
303,These boys hanging around !!,AFC-Wimbledon-Stan,2023-03-17 20:05:47,boy hanging around,0.012977875769138336
304,Vermont is getting some decent looks from 3. Just not making any.,mrwboilers,2023-03-17 20:05:59,vermont getting decent look making,0.030354714021086693
305,"Two Indiana folk on Vermont?

Sign me up!!!!",Stang1776,2023-03-17 20:08:01,two indiana folk vermont sign,0.03204839676618576
306,Literally just give the ball to Oso,WIN011,2023-03-17 20:08:09,literally give ball oso,-0.0927896723151207
307,Come on that’s perfect defense!,0pticle,2023-03-17 20:08:34,come perfect defense,1.045397948473692e-05
308,Kam? Could you… idk… do something?,millertime1419,2023-03-17 20:10:06,kam could idk something,0.02345014363527298
309,aaaand just like that game over,CoachKillerTrae,2023-03-17 20:13:39,aaaand like game,0.025706607848405838
310,"Death

Taxes

Sketchy charge/blocking calls in close games",mjr2p3,2023-03-17 20:14:19,death tax sketchy charge blocking call close game,-0.5401825308799744
311,Why is Brutus in a March Madness commercial?,eclectic_tastes,2023-03-17 20:15:35,brutus march madness commercial,0.006606966257095337
312,All right take 15 everyone,FedGoat13,2023-03-17 20:20:21,right take everyone,-0.032043736428022385
313,Game over,humorousmoose,2023-03-17 20:24:46,game,-0.007730305194854736
314,These guys really cannot shoot all of a sudden lol,humorousmoose,2023-03-17 20:31:59,guy really shoot sudden lol,0.014015745371580124
315,Ill take a milkshake too Jamie,sarcasmrules18,2023-03-17 20:47:54,ill take milkshake jamie,-0.4817894697189331
316,Jesus christ why the fuck are you calling off the dogs Vermont? You're losing!,MichaelSquare,2023-03-17 20:50:11,jesus christ fuck calling dog vermont losing,-0.7616038918495178
317,RING OUT,Spectre1919,2023-03-17 20:51:24,ring,-0.03808087110519409
318,Starting to wonder if Marquette is getting a bit uneasy seeing what’s happening to the #2 team in the Big East right now…,Meanteenbirder,2023-03-17 18:03:50,starting wonder marquette getting bit uneasy seeing happening team big east right,0.11821677535772324
319,Fuckin BS calls for the Big East all day,IAMnotMcKaylaMaroney,2023-03-17 19:37:57,fuckin b call big east day,-0.6210012435913086
320,Did Shaka get hair plugs? He went from bald for years to a head full.,Windshieldpoop,2023-03-17 19:41:18,shaka get hair plug went bald year head full,-0.29701322317123413
321,"I miss when it was 45-40, Marquette just too hot",IAMnotMcKaylaMaroney,2023-03-17 20:31:13,miss marquette hot,0.015172168612480164
322,"Refs definitely see a bit one-sided in this....

Our defenders feet were planted and he just jumped into our guy as he was shooting...",DrDilatory,2023-03-17 19:24:51,ref definitely see bit one sided defender foot planted jumped guy shooting,-0.288368821144104
323,Marquette looks pretty vulnerable. Veront hasn’t really played that well.,JayMoney2424,2023-03-17 19:34:49,marquette look pretty vulnerable veront really played well,0.023002425208687782
324,"If Vermont has 1 million fans, I am one of them. If Vermont only has one fan, I am that one. If Vermont has no fans... then I am dead.",slayerhk47,2023-03-17 19:01:55,vermont million fan one vermont one fan one vermont fan dead,-0.4184744358062744
325,Why would they tell us that Kolek’s dad is abusive and frame it as a good thing,fluffyglof,2023-03-17 19:20:39,would tell u kolek dad abusive frame good thing,-0.6026330590248108
326,Wait what?? He didn’t touch him?,ToeSuckingFiend,2023-03-17 19:37:29,wait touch,-0.10413965582847595
327,That ref was so close to t’ing up the Vermont coach too after getting called out for that phantom call lmao,theopression,2023-03-17 19:39:37,ref close ing vermont coach getting called phantom call lmao,-0.29423922300338745
328,The refs dicking us omg 💔,utocmc2020,2023-03-17 19:40:37,ref dicking u omg,-0.09372000396251678
329,"Same as every fucking year, they play just well enough for me to have some hope that they'll upset a much stronger team and then blow it at the end, I hate watching this team lmao",DrDilatory,2023-03-17 20:24:07,every fucking year play well enough hope upset much stronger team blow end hate watching team lmao,-0.19897159934043884
330,[Every single year...](https://i.ibb.co/M8G6Spb/Screenshot-20230317-163219-Samsung-Internet.jpg),DrDilatory,2023-03-17 20:33:11,every single year,-0.009102015756070614
331,Vermont getting hosed,mrwboilers,2023-03-17 19:39:23,vermont getting hosed,-0.04562600702047348
332,Marquette is slapping the floor up 24 pts. Wtf,Digital_Dutch,2023-03-17 20:40:58,marquette slapping floor pt wtf,-0.06358125805854797
333,That’s not good hopefully Kolek alright,GingerMan313,2023-03-17 18:56:31,good hopefully kolek alright,0.02393340691924095
334,No upsets this afternoon I guess,[deleted],2023-03-17 19:48:11,upset afternoon guess,-0.12247884273529053
335,2 seed needing absurd help by the refs to only barely keep a lead,DrDilatory,2023-03-17 20:08:56,seed needing absurd help ref barely keep lead,-0.5294703245162964
336,Bad call. I'll take it tho,gandaalf,2023-03-17 19:37:53,bad call take tho,-0.45980125665664673
337,"Patiently waiting for a makeup call, any day now please...",DrDilatory,2023-03-17 20:01:41,patiently waiting makeup call day please,-0.26131802797317505
338,Let's go Vermont!,inevitablescape,2023-03-17 19:02:44,let go vermont,-0.5642558336257935
339,Where's the foul????,DrDilatory,2023-03-17 19:04:27,foul,-0.6699149012565613
340,yeah we just don’t have it this year man we need more athletism to make a run,CoachKillerTrae,2023-03-17 19:15:58,yeah year man need athletism make run,-0.2016361951828003
341,How many fouls is it to foul out in NCAA?,DrDilatory,2023-03-17 20:02:34,many foul foul ncaa,-0.6313702464103699
342,"We never were all that likely to win in the first place, but now if we lose I'm going to spend the entire year pretending the only reason we lost was because of that call, thanks refs",DrDilatory,2023-03-17 19:54:13,never likely win first place lose going spend entire year pretending reason lost call thanks ref,-0.6035538911819458
343,One thing I've noticed about Marquette is that they struggle without their starting PG. Few teams have the luxury that MSU does with Tyson Walker being able to run the show if Hoggard is out,brownblackmamba,2023-03-17 20:16:14,one thing noticed marquette struggle without starting pg team luxury msu tyson walker able run show hoggard,-0.15319515764713287
