,Comment,Author,Created UTC,Cleaned_Comment,sentiment_score
1972,What a bad pass,That_One_Pancake,2023-03-20 00:44:42,bad pas,-0.6505635380744934
1973,What a shot,bcocfbhp,2023-03-20 00:44:57,shot,-0.004813238978385925
1974,I hope this doesn’t get ugly,IAmNotStephen,2023-03-20 00:45:14,hope get ugly,-0.5426180362701416
1975,Why not,TreatyToke,2023-03-20 00:45:15,,0.056165412068367004
1976,BELIEVE,Life_Act_6887,2023-03-20 00:45:26,believe,-0.02038348838686943
1977,There ya go,MrPopps,2023-03-20 00:45:27,ya go,-0.0022139661014080048
1978,Aight THAT was straight Curry-esque,Mobile-Tangelo,2023-03-20 00:45:46,aight straight curry esque,0.02547353319823742
1979,Banger,sarcasmrules18,2023-03-20 00:45:47,banger,0.04044189304113388
1980,Damn young Rick Moranis is going places,ehs4290,2023-03-20 00:48:33,damn young rick moranis going place,-0.0010006497614085674
1981,Good for that fella,RichardStuck757,2023-03-20 00:48:58,good fella,0.021156413480639458
1982,I want free gum,Spencelia,2023-03-20 00:49:02,want free gum,-0.14397577941417694
1983,Ive missed watching teams that can make midrange jumpers 🥹,Licit_x64,2023-03-20 00:51:47,ive missed watching team make midrange jumper,-0.07825785875320435
1984,Fairleigh Dickinson’s SID is a student who went to Ian Eagle’s Sports Broadcasting Camp,mruab,2023-03-20 00:53:12,fairleigh dickinson sid student went ian eagle sport broadcasting camp,-0.054309092462062836
1985,nooooooo,gravityyalwayyswins,2023-03-20 00:55:19,nooooooo,-0.32956749200820923
1986,I put 6 dollars to win 90 so I just sealed a FDU loss. Sorry boys,ActualLibertarian,2023-03-20 00:57:32,put dollar win sealed fdu loss sorry boy,-0.4963773488998413
1987,"Roberts needs to get scorching hot from deep early in the second half and undo all of his team’s missed layups, and FDU is moving on",Mr_426,2023-03-20 00:58:39,robert need get scorching hot deep early second half undo team missed layup fdu moving,0.04169058799743652
1988,Why are they crossing teams out like that? Just because they lost doesn't mean you x them out of the round they lost in. You still got that pick right.,LukarWarrior,2023-03-20 01:10:34,crossing team like lost mean x round lost still got pick right,-0.050212562084198
1989,"alright Knights, time to take out your swords and do this thing",gravityyalwayyswins,2023-03-20 01:16:33,alright knight time take sword thing,0.047735147178173065
1990,"he should not have made that shot hahaha what an angle, amazing",gravityyalwayyswins,2023-03-20 01:17:22,made shot hahaha angle amazing,-0.00017288047820329666
1991,Let’s fucking go,ehs4290,2023-03-20 01:18:23,let fucking go,-0.7417362332344055
1992,Holy fuck,PhoneAcc23,2023-03-20 01:18:31,holy fuck,-0.7441911101341248
1993,The tide is turning 😏,Mobile-Tangelo,2023-03-20 01:18:35,tide turning,0.047284916043281555
1994,FDU!!!!,ChaosMage175,2023-03-20 01:18:41,fdu,-0.036004990339279175
1995,FDU DROPPING BOMBS!,runevault,2023-03-20 01:18:53,fdu dropping bomb,-0.00639931857585907
1996,LETSSSSSSSSS FUCKING GOOOOOO,[deleted],2023-03-20 01:18:56,let fucking goooooo,-0.3731691837310791
1997,They can do this,IPutMyHandOnA_Stove,2023-03-20 01:19:10,,0.056165412068367004
1998,they are ahead holy shit you can feeeeeel the energy in that stadium,gravityyalwayyswins,2023-03-20 01:19:21,ahead holy shit feeeeeel energy stadium,-0.036520183086395264
1999,FDU WIN IT ALL CMON,Zyleo,2023-03-20 01:19:31,fdu win cmon,-0.034650757908821106
2000,God damn this is what march madness is all about,cory_bdp,2023-03-20 01:19:35,god damn march madness,-0.02031307853758335
2001,FDU,MrPopps,2023-03-20 01:19:35,fdu,-0.036004990339279175
2002,LETS GO WAY TO COME OUT OF THE LOCKER ROOM,TheJURY15,2023-03-20 01:19:36,let go way come locker room,-0.13951456546783447
2003,FDU out here exemplifying March.,americanbaseball,2023-03-20 01:19:48,fdu exemplifying march,0.002294626086950302
2004,Here we go again,belmontbreak,2023-03-20 01:19:50,go,-0.03891566023230553
2005,Something’s happening!!,bcheneyatc,2023-03-20 01:19:52,something happening,-0.07158640027046204
2006,This thread gonna be poppin soon,c_dubby,2023-03-20 01:20:05,thread gon na poppin soon,0.014265470206737518
2007,This is much preferable to getting dunked on all over again because FAU’s up 25.,TheBoilerCat,2023-03-20 01:20:13,much preferable getting dunked fau,0.005357097834348679
2008,d's get ~~degrees~~ sweet sixteens,Triscuitador,2023-03-20 01:20:15,get degree sweet sixteen,-0.00017570750787854195
2009,"holy shit, how did the tides turn that quickly and sharply",LindberghBar,2023-03-20 01:20:21,holy shit tide turn quickly sharply,-0.2860914468765259
2010,Fuck I love March madness,TastesLikeHoneyNut,2023-03-20 01:20:33,fuck love march madness,-0.008406111039221287
2011,What is going on,John_E_Depth,2023-03-20 01:20:43,going,-0.04268844425678253
2012,ALERT ALERT THEY MADE A LAYUP,gravityyalwayyswins,2023-03-20 01:20:45,alert alert made layup,-0.07978235185146332
2013,FDU FDU FDU,Hotstuffmama1027,2023-03-20 01:20:55,fdu fdu fdu,-0.060161665081977844
2014,FAU is assss rn,That_One_Pancake,2023-03-20 01:21:18,fau ass rn,0.011996276676654816
2015,All the momentum! This must feel better than a home game right now for them,TheTB94,2023-03-20 01:21:25,momentum must feel better home game right,-0.011342201381921768
2016,FDU changed their whole strat at halftime. Drive and kick baybeee,Mobile-Tangelo,2023-03-20 01:21:27,fdu changed whole strat halftime drive kick baybeee,0.04711170494556427
2017,Holy fuck they look poised,blb242,2023-03-20 01:21:41,holy fuck look poised,-0.43312111496925354
2018,FDU FDU,taylor1288,2023-03-20 01:22:02,fdu fdu,-0.0489269495010376
2019,Heat check,ActualLibertarian,2023-03-20 01:22:05,heat check,0.046068549156188965
2020,GET THAT SHIT OUTTA HERE,[deleted],2023-03-20 01:22:15,get shit outta,-0.5906181931495667
2021,NO WAY,SteadyHandsShake,2023-03-20 01:22:30,way,-0.05886805057525635
2022,OH SHIIIIIIITTTTTTTTTT,Llama_Leaping_Larry,2023-03-20 01:22:34,oh shiiiiiiitttttttttt,-0.031904108822345734
2023,That was great,bcocfbhp,2023-03-20 01:22:36,great,0.000329368282109499
2024,Fdu playing some magical basketball man,AtmosphereVarious440,2023-03-20 01:22:37,fdu playing magical basketball man,0.0014360733330249786
2025,MO MEN TUM!!!,CrackerJackKittyCat,2023-03-20 01:22:44,mo men tum,0.027874238789081573
2026,"Thanks for not showing the jawing, truTV",[deleted],2023-03-20 01:22:46,thanks showing jawing trutv,-0.011647483333945274
2027,let’s go!!!!! FDU FDU,Whitehawk1313,2023-03-20 01:22:48,let go fdu fdu,-0.6889538764953613
2028,"I SEE YOU FDU, I SEE YOU",LukarWarrior,2023-03-20 01:22:49,see fdu see,-0.1549791693687439
2029,Joe Munden is an absolute DAWG,IPutMyHandOnA_Stove,2023-03-20 01:22:55,joe munden absolute dawg,-0.024210993200540543
2030,TALK YO SHIT KNIGHTS,huttts999,2023-03-20 01:23:01,talk yo shit knight,-0.18899522721767426
2031,CMON FDU,PossiblyYourDad,2023-03-20 01:23:12,cmon fdu,-0.05315008759498596
2032,The energy in this stadium must be insane,ILkeSportzNIDCWhKnws,2023-03-20 01:23:19,energy stadium must insane,-0.0032142270356416702
2033,Let them hang around and they get some momentum,sarcasmrules18,2023-03-20 01:23:21,let hang around get momentum,0.009589046239852905
2034,The owl doesn't look like he's wearing his bling today.,k614,2023-03-20 01:23:42,owl look like wearing bling today,-0.021105453372001648
2035,Seriously? Shoving the FDU player for showing good sportsmanship and trying to help you up? I'm all for conference support but that's some BS. Go FDU!,VerySeriousBanana,2023-03-20 01:24:21,seriously shoving fdu player showing good sportsmanship trying help conference support b go fdu,-0.8403097987174988
2036,Crowd going nuts for FDU,adumb99,2023-03-20 01:24:23,crowd going nut fdu,0.0762217566370964
2037,We will not be beaten by owls.,theseyeahthese,2023-03-20 01:24:27,beaten owl,-0.0708625465631485
2038,FDU FDU FDU FDU,lrllrrlrllrrlrllrrl,2023-03-20 01:24:34,fdu fdu fdu fdu,-0.054763078689575195
2039,I want to hear what the FDU coach said at halftime. Pumped these guys UPPPP!,Mobile-Tangelo,2023-03-20 01:24:45,want hear fdu coach said halftime pumped guy upppp,-0.27622926235198975
2040,"If Roberts is feelin himsf, idk man.",[deleted],2023-03-20 01:24:49,robert feelin himsf idk man,-0.02094312012195587
2041,FDU fun to watch,goodgooglyymoogly,2023-03-20 01:24:54,fdu fun watch,0.01351382490247488
2042,BEAUTIFUL,humorousmoose,2023-03-20 01:24:58,beautiful,-0.00019299937412142754
2043,HE SHOT THAT SHIT OVER THAT BIG MFs HEAD,OfficialHavik,2023-03-20 01:24:58,shot shit big mf head,-0.21731944382190704
2044,Just popped in here. Is FAU getting as much hate as we did when we played UMBC?,TeaEsKSU,2023-03-20 01:25:20,popped fau getting much hate played umbc,-0.15755967795848846
2045,Full court on full court crime gets me mad hard ngl,Tommy_Wisseau_burner,2023-03-20 01:25:37,full court full court crime get mad hard ngl,-0.26776161789894104
2046,WHAT DO I DO WITH MY HANDS??!?!?!?,logosss,2023-03-20 01:25:39,hand,-0.07482869923114777
2047,THERE IS NO SCRAPPIER TEAM holy shit FDU,gravityyalwayyswins,2023-03-20 01:25:46,scrappier team holy shit fdu,-0.5864401459693909
2048,Just coming from my game 👀,EasyBreecy,2023-03-20 01:25:47,coming game,0.0026001259684562683
2049,You are witnessing the strength of street knowledge,[deleted],2023-03-20 01:25:50,witnessing strength street knowledge,-0.004483399912714958
2050,Shoutout to the real ones who watched the Texas southern game lol,edleranalytics,2023-03-20 01:25:56,shoutout real one watched texas southern game lol,-0.020244188606739044
2051,It took a bit. But it’s in,SteadyHandsShake,2023-03-20 01:25:57,took bit,0.2217034101486206
2052,Hell yeah what an effort on that board!!,Hooper1054,2023-03-20 01:26:09,hell yeah effort board,-0.046411775052547455
2053,I don’t understand how they’re getting these boards,That_One_Pancake,2023-03-20 01:26:11,understand getting board,-0.16217313706874847
2054,Sean Moore is playing like 2022 NCAA tournament Caleb Love,skocats,2023-03-20 01:26:14,sean moore playing like ncaa tournament caleb love,-0.00017883535474538803
2055,All tournament we have been so inconsistent from range. We’ve lived on 3’s all year,RustyKarma076,2023-03-20 01:26:24,tournament inconsistent range lived year,-0.02376943826675415
2056,classic gaffney,Triscuitador,2023-03-20 01:26:42,classic gaffney,0.0015157524030655622
2057,Should be an and 1 there,jzsszmzj,2023-03-20 01:27:06,,0.056165412068367004
2058,FAU is not mentally prepared for this,That_One_Pancake,2023-03-20 01:27:08,fau mentally prepared,-0.007336050271987915
2059,MAKE YOUR LAYUPS,TwizzlersSourz,2023-03-20 01:27:18,make layup,-0.010296434164047241
2060,Midrange Jesus!,bcocfbhp,2023-03-20 01:27:24,midrange jesus,0.03744623064994812
2061,What a fun game,FutureRaifort,2023-03-20 01:27:28,fun game,0.01196699496358633
2062,"#KNIGHTS OF COLUMBUS, THAT HURT!

--FAU, probably",dicks_out_for,2023-03-20 01:27:30,knight columbus hurt fau probably,-0.2688937485218048
2063,FDU looks so much more settled in and composed,Ghost-of-Moravia,2023-03-20 01:27:30,fdu look much settled composed,0.06585445255041122
2064,Has the under 16 timeout not happened yet?,PhoneAcc23,2023-03-20 01:27:37,timeout happened yet,0.0579666942358017
2065,Roberts is so good. Damn,mtmodi,2023-03-20 01:27:39,robert good damn,-0.016682688146829605
2066,this back n forth is wild sdfhskjhfjs,gravityyalwayyswins,2023-03-20 01:27:47,back n forth wild sdfhskjhfjs,0.005490977317094803
2067,Electric!,sarcasmrules18,2023-03-20 01:27:57,electric,0.009879790246486664
2068,This game is so good,Insane_Pigmask,2023-03-20 01:28:01,game good,0.008182499557733536
2069,This is just fantastic basketball to watch. So damn fun.,bcheneyatc,2023-03-20 01:28:31,fantastic basketball watch damn fun,0.00026886328123509884
2070,Fucking awesome,ehs4290,2023-03-20 01:28:35,fucking awesome,-0.0012262179516255856
2071,Insane pace of play.,ChonkyWumpus,2023-03-20 01:28:35,insane pace play,-0.12376831471920013
2072,Robert’s legit looks like Kyrie. Dude is so explosive.,rhinocodon_typus,2023-03-20 01:28:35,robert legit look like kyrie dude explosive,0.0008850139565765858
2073,God I fucking love March,MrPopps,2023-03-20 01:28:38,god fucking love march,-0.0011052596382796764
2074,Great game here,Man0nTheMoon915,2023-03-20 01:29:17,great game,0.0005672449478879571
2075,"Everybody needs a breather, including the crowd. Going to get U16 and U12 TOs back to back though, might kill momentum",VinceValenceFL,2023-03-20 01:29:21,everybody need breather including crowd going get u u tos back back though might kill momentum,0.1440267711877823
2076,Now this.. is EPIC,Littledawg24,2023-03-20 01:29:34,epic,-0.00218973308801651
2077,well maybe there won’t be a whistle until the under 8; let’s hope,trex_189,2023-03-20 01:29:48,well maybe whistle let hope,-0.06889572739601135
2078,"Perry Clark did it out of respect for the guys who rebuilt his program, but the FDU sub situation really reminds me of the Tulane Posse from like 1991 or 1992.",nypr13,2023-03-20 01:30:02,perry clark respect guy rebuilt program fdu sub situation really reminds tulane posse like,-0.0451192632317543
2079,What a way to end the week. FDU FDU FDU!,naimsayin,2023-03-20 01:30:24,way end week fdu fdu fdu,-0.17583602666854858
2080,TruTv has had all the barn burners. What a game so far.,[deleted],2023-03-20 01:30:38,trutv barn burner game far,0.05467364192008972
2081,I can’t believe I predicted FDU to beat Purdue (trust me bro),huttts999,2023-03-20 01:31:31,believe predicted fdu beat purdue trust bro,-0.07652410864830017
2082,Really glad I’m in a hotel tonight that gets every channel known to man EXCEPT TruTV.,do_you_know_doug,2023-03-20 01:31:33,really glad hotel tonight get every channel known man except trutv,-0.0003177877515554428
2083,Roberts is a certified bucket,IMKudaimi123,2023-03-20 01:32:20,robert certified bucket,-0.02171788364648819
2084,*GAINED THE LEAD*,OfficialHavik,2023-03-20 01:32:31,gained lead,-0.030468031764030457
2085,feeling like destiny at this point!,Farplaner,2023-03-20 01:32:39,feeling like destiny point,0.006016969680786133
2086,What the actual fuck am I watching?,SaltyHawk95,2023-03-20 01:32:43,actual fuck watching,-0.5196825861930847
2087,LOL THIS FDU TEAM. Roberts is AMAZING to watch,Llama_Leaping_Larry,2023-03-20 01:32:46,lol fdu team robert amazing watch,-0.0003900750307366252
2088,FDU is gonna have the biggest possible home court advantage in the next round,joebos617,2023-03-20 01:32:47,fdu gon na biggest possible home court advantage next round,-0.021536480635404587
2089,"COME THROUGH, FDU!",SockVonPuppet,2023-03-20 01:32:49,come fdu,-0.03680624067783356
2090,Andrew Catalon and Steve Lappas have grown into a surprisingly enjoyable announcer pairing,macncheeseface,2023-03-20 01:32:49,andrew catalon steve lappas grown surprisingly enjoyable announcer pairing,0.0010170007590204477
2091,My YTTV is delayed so sorry for my late reactions,loyalsons4evertrue,2023-03-20 01:32:59,yttv delayed sorry late reaction,-0.2576204538345337
2092,NKU could never hit these 3s,idontcare111,2023-03-20 01:33:00,nku could never hit,-0.11348247528076172
2093,Robert’s is ungodly,rhinocodon_typus,2023-03-20 01:33:02,robert ungodly,-0.8192835450172424
2094,"alright fdu you can shoot, but you gotta play defense too",QuarantineTaratino,2023-03-20 01:33:11,alright fdu shoot got ta play defense,0.055565495043992996
2095,FDU has missed so many layups,WhizBangNeato,2023-03-20 01:34:20,fdu missed many layup,0.029159188270568848
2096,"These guys work the glass so very well.  If other 16 seeds learn how to play this kind of defense, we could get more 16 seed upsets.",[deleted],2023-03-20 01:34:25,guy work glass well seed learn play kind defense could get seed upset,0.0019056256860494614
2097,I believe in miracles,fancycheesus,2023-03-20 01:34:28,believe miracle,-0.0074628135189414024
2098,roberts is reincarnation of edert,Emotion-Timely,2023-03-20 01:34:39,robert reincarnation edert,-0.039453186094760895
2099,An SEC commercial?,Mav_Rixx,2023-03-20 01:35:29,sec commercial,-0.018369406461715698
2100,AND ONEEEEEEEEEE,[deleted],2023-03-20 01:39:05,oneeeeeeeeee,0.009305834770202637
2101,FDU dude needs to get out of the key lmao,RichardStuck757,2023-03-20 01:39:26,fdu dude need get key lmao,0.006114453077316284
2102,AND ONEEEEEE,c_dubby,2023-03-20 01:39:27,oneeeeee,-0.007630631327629089
2103,"IN AND ONE, LESSSSGO",gravityyalwayyswins,2023-03-20 01:39:28,one lessssgo,-0.11609700322151184
2104,"Lmao ""chirp chirp""",FatalTragedy,2023-03-20 01:39:38,lmao chirp chirp,0.013096176087856293
2105,WHAT AN AND 1 WOW,LRXC,2023-03-20 01:39:38,wow,-0.005741604603827
2106,FDU just wants it more. I agree with Lappas.,mrwhitaker3,2023-03-20 01:39:41,fdu want agree lappas,0.05435773730278015
2107,They just want it more!,[deleted],2023-03-20 01:39:43,want,-0.05539262294769287
2108,"always love the guy ""holding people back"" when no one is is moving haha",PralineAggravating89,2023-03-20 01:39:44,always love guy holding people back one moving haha,-0.0006622993387281895
2109,Tweet tweet!,JUSTCALLmeY,2023-03-20 01:39:56,tweet tweet,-0.07744058966636658
2110,Hype man on FDU bench looking like a 10th year senior lol,HerkulezRokkafeller,2023-03-20 01:40:19,hype man fdu bench looking like th year senior lol,0.07229144871234894
2111,Yo I’m scared for the next round. Yeah we’re physical and taller but there’s no way in hell we can punk either of these teams like we did against Duke,Tommy_Wisseau_burner,2023-03-20 01:40:20,yo scared next round yeah physical taller way hell punk either team like duke,-0.5120465755462646
2112,This is the best Coke ever! - Tobin Anderson,Bronco4life21,2023-03-20 01:40:21,best coke ever tobin anderson,-0.00034612626768648624
2113,What a move!!!,ChaosMage175,2023-03-20 01:40:23,move,-0.11993280053138733
2114,Did you guys hear that the average height of FDU’s teams is 3 foot 7,dizZzy5,2023-03-20 01:40:25,guy hear average height fdu team foot,0.15523365139961243
2115,"So the trick to making a low-major tournament run is to just be the best height-adjusted offensive rebounding team in the nation, got it",thezander8,2023-03-20 01:40:45,trick making low major tournament run best height adjusted offensive rebounding team nation got,-0.011388860642910004
2116,Siiiiiick!,CFO_David_Wallace,2023-03-20 01:40:47,siiiiiick,-0.01238510012626648
2117,SOOOOO SAYCY!!!,Tommy_Wisseau_burner,2023-03-20 01:40:49,sooooo saycy,-0.001305075827986002
2118,This has been an extremely entertaining game,huttts999,2023-03-20 01:40:52,extremely entertaining game,0.0038324911147356033
2119,#THE SAUCE,ledhotzepper,2023-03-20 01:41:00,sauce,0.036932602524757385
2120,FAKER WHAT WAS THAT,logosss,2023-03-20 01:41:00,faker,-0.3732859194278717
2121,the fdu defense is choking,Emotion-Timely,2023-03-20 01:41:11,fdu defense choking,0.014185771346092224
2122,Wtf was that,100DaysOfSodom,2023-03-20 01:41:12,wtf,-0.12699513137340546
2123,I’m so stressed dude,jzsszmzj,2023-03-20 01:41:21,stressed dude,-0.11484509706497192
2124,12 points this half for Roberts damnnnn,gravityyalwayyswins,2023-03-20 01:41:22,point half robert damnnnn,0.010120756924152374
2125,This is INSANE,meamarie,2023-03-20 01:41:25,insane,-0.5580716729164124
2126,Did em dirty,[deleted],2023-03-20 01:41:25,em dirty,-0.6653950810432434
2127,HOLY SHIT,Xaxziminrax,2023-03-20 01:41:25,holy shit,-0.42152541875839233
2128,DAVIS IS GETTING A STATUE IF WE WIN TONIGHT,RustyKarma076,2023-03-20 01:41:37,davis getting statue win tonight,0.0003154221922159195
2129,This game is going off,JustGresh,2023-03-20 01:41:38,game going,-0.039395421743392944
2130,That was a really nice coast to coast,bcocfbhp,2023-03-20 01:41:38,really nice coast coast,0.0035999983083456755
2131,This isn’t funny anymore fau do your thing 😭 😭 😭,[deleted],2023-03-20 01:41:49,funny anymore fau thing,-0.09302234649658203
2132,That was disgusting,EvChaosBlaze,2023-03-20 01:41:51,disgusting,-0.8485124707221985
2133,Fuck the elite,PhoneAcc23,2023-03-20 01:45:31,fuck elite,-0.04944811761379242
2134,"Hmm, I wonder why all these betting apps keep pushing multi-leg parlays with 15% house edge. Truly mystifying.",[deleted],2023-03-20 01:45:56,hmm wonder betting apps keep pushing multi leg parlay house edge truly mystifying,0.022295374423265457
2135,13 for FDU does absolutely nothing on the court,[deleted],2023-03-20 01:47:21,fdu absolutely nothing court,-0.3944591283798218
2136,I love how it looks like Tobin Anderson never knows what to do with his arms,verndom,2023-03-20 01:47:41,love look like tobin anderson never know arm,-0.025455284863710403
2137,FAUCK.,whole_lot_of_velcro,2023-03-20 01:47:46,fauck,0.0027442574501037598
2138,I like how fdu can’t even afford a logo,Milflover69cbb,2023-03-20 01:48:15,like fdu even afford logo,-0.15133142471313477
2139,Tobin Anderson had two timeouts left at the end of the purdue game. It's so interesting.,edleranalytics,2023-03-20 01:48:19,tobin anderson two timeouts left end purdue game interesting,0.13163155317306519
2140,No offense FAU but I will burn down your campus,cory_bdp,2023-03-20 01:48:21,offense fau burn campus,-0.08129662275314331
2141,Real talk: we cashing out FDU money line for guaranteed profit or diamond hands it?,sitnkick20,2023-03-20 01:48:27,real talk cashing fdu money line guaranteed profit diamond hand,-0.09063713997602463
2142,who was he trying to throw to?! take that white boy out the game pls,gravityyalwayyswins,2023-03-20 01:48:31,trying throw take white boy game pls,0.026990830898284912
2143,Tobin call a timeout!,bcocfbhp,2023-03-20 01:48:31,tobin call timeout,-0.046195581555366516
2144,welp there goes my amusement for the day,Chibears85,2023-03-20 01:48:33,welp go amusement day,0.0019456353038549423
2145,Getting into dangerous territory now. Come on FDU!!,GuyFaulks77,2023-03-20 01:48:54,getting dangerous territory come fdu,0.017524346709251404
2146,Charge?,huttts999,2023-03-20 01:48:54,charge,-0.6329319477081299
2147,TAKE A TIMEOUT FFS,ImJeeezus,2023-03-20 01:48:56,take timeout ffs,-0.08382146060466766
2148,"Refs are selling, no offensive foul?",TheTB94,2023-03-20 01:48:56,ref selling offensive foul,-0.6061514616012573
2149,Call. A. Timeout.,That_One_Pancake,2023-03-20 01:48:58,call timeout,-0.07250063121318817
2150,FDU almost got the unlucky roll again,IndycarFan64,2023-03-20 01:49:48,fdu almost got unlucky roll,-0.03569227457046509
2151,Let’s geaux FDU,nubbythedeafbear,2023-03-20 01:51:06,let geaux fdu,-0.08880884945392609
2152,If you could play a round of golf with Chuck and Bill Walton who would you have as your 4th?,HerkulezRokkafeller,2023-03-20 01:51:23,could play round golf chuck bill walton would th,0.035243190824985504
2153,FDU please,[deleted],2023-03-20 01:52:24,fdu please,-0.18173256516456604
2154,Wouldn’t mind if either team loses but damn I want a close game. Looks like FDU is going dry now,IndycarFan64,2023-03-20 01:52:28,mind either team loses damn want close game look like fdu going dry,-0.6953344345092773
2155,༼ つ ◕_◕ ༽つ FDU take my energy ༼ つ ◕_◕ ༽つ,ChaosMage175,2023-03-20 01:53:49,つ _ つ fdu take energy つ _ つ,0.008869439363479614
2156,we found the next kyrie,Emotion-Timely,2023-03-20 01:53:49,found next kyrie,-0.0016963174566626549
2157,Did he say Cancer State,BurmecianSoldierDan,2023-03-20 01:53:56,say cancer state,-0.6632661819458008
2158,somebody draft Roberts plz,goodfortunecoffee,2023-03-20 01:54:00,somebody draft robert plz,-0.1824456751346588
2159,"Wowwwww & they got the ball back, they need to score here so badly. You need to capitalize here",[deleted],2023-03-20 01:54:04,wo got ball back need score badly need capitalize,-0.0189267098903656
2160,\#2 got that dawg in him fr fr,LukarWarrior,2023-03-20 01:54:15,got dawg fr fr,0.053087249398231506
2161,Just yell and these refs will give you a call lol,big_mustache_dad,2023-03-20 01:54:17,yell ref give call lol,-0.0870307981967926
2162,That was a foul,Ghost-of-Moravia,2023-03-20 01:55:10,foul,-0.6699149012565613
2163,"IT WAS A FOWL.

Nah?",theseyeahthese,2023-03-20 01:55:17,fowl nah,-0.028595522046089172
2164,They're so quick on jump balls,AHSfav,2023-03-20 01:55:47,quick jump ball,0.022752080112695694
2165,That was more of a jump ball than the first one wtf,huttts999,2023-03-20 01:55:49,jump ball first one wtf,0.012439645826816559
2166,"How on earth, he had that completely",CoolVinnie,2023-03-20 01:55:51,earth completely,-0.023770105093717575
2167,Not gonna show the actual foul of course,Ok_Run_8184,2023-03-20 01:55:59,gon na show actual foul course,-0.6464898586273193
2168,Is it just me or do like half the teams in D1 have a guy named Davis,SaintArkweather,2023-03-20 01:56:04,like half team guy named davis,-0.052357032895088196
2169,Fucking refs I swear to Christ…,Johnnycc,2023-03-20 01:56:05,fucking ref swear christ,-0.7509389519691467
2170,And now the ref show starts,IAmNotStephen,2023-03-20 01:56:09,ref show start,-0.07850275933742523
2171,How was that a foul when the other one wasn’t??,IndycarFan64,2023-03-20 01:56:11,foul one,-0.5901426076889038
2172,HERE'S SOME FREE POINTS FAU,cory_bdp,2023-03-20 01:56:13,free point fau,0.022961020469665527
2173,Stop shooting threes.  Stop calling tie ups,[deleted],2023-03-20 01:56:23,stop shooting three stop calling tie ups,-0.34881484508514404
2174,IDK,k614,2023-03-20 01:57:34,idk,-0.05731643736362457
2175,Finally they stopped Davis,at_least_u_tried,2023-03-20 01:57:34,finally stopped davis,-0.07124287635087967
2176,Cmon FDU 😭,[deleted],2023-03-20 01:58:20,cmon fdu,-0.05315008759498596
2177,Thank god YouTube tv finally figured out multiview,IAmNotStephen,2023-03-20 01:59:14,thank god youtube tv finally figured multiview,-0.014027789235115051
