,Comment,Author,Created UTC,Cleaned_Comment,sentiment_score
512,DJOOOOOOOOO!,Spectre1919,2023-03-17 19:30:50,djooooooooo,0.00047322362661361694
513,We are guarding it now they are just hot,coilmeup,2023-03-17 19:29:10,guarding hot,0.013175718486309052
514,I like our matchup there lol Hauser and our shooters will get some good looks.,JayMoney2424,2023-03-17 19:32:54,like matchup lol hauser shooter get good look,0.05385487154126167
515,Hes in foul trouble so not much he can do,coilmeup,2023-03-17 19:30:39,he foul trouble much,-0.5337684154510498
516,You should see the new hockey jerseys we had this year. The greens were fucking *orgasmic*.,LocksTheFox,2023-03-17 19:33:55,see new hockey jersey year green fucking orgasmic,-0.07628441601991653
517,I’m sure twitter will have it shortly.,Chucktownbadger,2023-03-17 20:01:24,sure twitter shortly,-0.08358307927846909
518,Always a brutal seed and draw,scrapsbypap,2023-03-17 20:07:48,always brutal seed draw,-0.20166847109794617
519,"They were 50 % in the first half, aren't doing bad at all",IAMnotMcKaylaMaroney,2023-03-17 20:09:53,first half bad,-0.6424160599708557
520,Hoosiers represent!,Where0Meets15,2023-03-17 20:09:33,hoosier represent,-0.040789082646369934
521,He listened to you,Augustus13,2023-03-17 20:15:01,listened,-0.01854132115840912
522,Ayyyyyy,Spectre1919,2023-03-17 20:14:46,ayyyyyy,0.3076874017715454
523,No but an inopportune couple of possession there. All the looks from 3 in the 2nd half for UVM have been good looks.,spierce64006,2023-03-17 20:15:18,inopportune couple possession look nd half uvm good look,-0.05110299587249756
524,Eh Xavier has been prone to these types of games all year. I’m just plain nervous in general.,WIN011,2023-03-17 18:17:24,eh xavier prone type game year plain nervous general,0.0868101716041565
525,"No game is a given. But you have to focus on your own game, not what’s happening elsewhere. I did like Shaka’s healthy respect for Vermont, so that’s encouraging. I guess we’ll see!",MayIServeYouWell,2023-03-17 18:24:57,game given focus game happening elsewhere like shaka healthy respect vermont encouraging guess see,0.094268798828125
526,Turns out razors exist.,millertime1419,2023-03-17 19:42:38,turn razor exist,-0.08773193508386612
527,"A lot of these fouls have been fouls, but that was not one of them",LocksTheFox,2023-03-17 19:25:41,lot foul foul one,-0.7297328114509583
528,I think that was the only truly bad call. Everything else seems fine to me,gandaalf,2023-03-17 19:28:27,think truly bad call everything else seems fine,-0.5893166065216064
529,"That was a bad call, but Vermont is pushing off almost every possession.",owmyfreakingeyes,2023-03-17 19:36:17,bad call vermont pushing almost every possession,-0.7188116312026978
530,I think Mich. St will match up very well against either team,Wolf_of_Walmart,2023-03-17 19:36:05,think mich st match well either team,0.03257959336042404
531,"In the second round when the refs stop sucking the dicks of the higher seed, yeah I think Michigan State is going to win their next game regardless of whether or not it's Marquette or if we somehow pull off the upset and it's us",DrDilatory,2023-03-17 19:40:52,second round ref stop sucking dick higher seed yeah think michigan state going win next game regardless whether marquette somehow pull upset u,-0.12809616327285767
532,Shaka Smart will do that do a team. I think y’all clown them on Sunday,jrluhn,2023-03-17 19:38:09,shaka smart team think clown sunday,-0.003014553338289261
533,EGB’s,millertime1419,2023-03-17 20:42:36,egb,-0.00875730812549591
534,"Wrong. Well, I hope you'll be wrong by this evening 😅",framingXjake,2023-03-17 19:52:19,wrong well hope wrong evening,-0.27871033549308777
535,See the Pitt game?,cixzejy,2023-03-17 19:55:40,see pitt game,-0.07562039792537689
536,"The one 2 seed i had winning it all lost.

I can handle another 2 seed i had going to final four losing again.",Stang1776,2023-03-17 20:10:34,one seed winning lost handle another seed going final four losing,-0.42535287141799927
537,There ya go,WIN011,2023-03-17 20:02:31,ya go,-0.0022139661014080048
538,All of your guys are defensively sound in their assignments though.  It’s been really impressive thus far.,Chucktownbadger,2023-03-17 19:16:41,guy defensively sound assignment though really impressive thus far,0.08758211135864258
539,"Yeah the previous teams from 2021 and 2022 seasons were definitely stronger. UVM need to hit a lot of 3's if they are going to win this and need big games from Deloney, Penn and Sullivan.",spierce64006,2023-03-17 19:18:02,yeah previous team season definitely stronger uvm need hit lot going win need big game deloney penn sullivan,0.09840726852416992
540,1 red card or 2 yellows,Stang1776,2023-03-17 20:06:25,red card yellow,-0.05286629498004913
541,5,LocksTheFox,2023-03-17 20:02:52,,0.056165412068367004
542,Okay.,millertime1419,2023-03-17 20:17:09,okay,0.09463077783584595
543,Okay.,millertime1419,2023-03-17 20:10:29,okay,0.09463077783584595
544,literally. if we were playing peak basketball rn we’d be the ones up by 5,CoachKillerTrae,2023-03-17 20:11:26,literally playing peak basketball rn one,-0.027025610208511353
545,I'm going to enjoy watching you whoop their asses next game,DrDilatory,2023-03-17 20:13:35,going enjoy watching whoop ass next game,0.0018896569963544607
546,"Except, he didn’t make contact, so no.",Exact-Cucumber,2023-03-17 19:40:06,except make contact,-0.14327841997146606
547,Good thing he didn’t make any contact,[deleted],2023-03-17 19:40:08,good thing make contact,0.04631451889872551
548,But he didn’t make any contact???,coastalneer,2023-03-17 19:39:22,make contact,-0.06645699590444565
549,Wrong,MookieSweats,2023-03-17 19:39:08,wrong,-0.4525466561317444
550,So no defense?,Stang1776,2023-03-17 19:39:30,defense,-0.030809342861175537
551,If he made the dunk that would of never been called and you call that full speed?,JerryGoDeep,2023-03-17 19:40:26,made dunk would never called call full speed,-0.47012531757354736
552,Literally did not touch the guy. Plenty of space between them. Could slip a phone book through that gap with ease,framingXjake,2023-03-17 19:43:45,literally touch guy plenty space could slip phone book gap ease,0.007017927244305611
553,feet weren't set,LocksTheFox,2023-03-17 20:10:47,foot set,0.035253264009952545
554,"For his career? We’re double Big East champs, he was BE coach of the year and is in running for national coach of the year. His career is solid.",millertime1419,2023-03-17 20:16:13,career double big east champ coach year running national coach year career solid,-0.00014126359019428492
555,This season did enough already for Shaka to be at Marquette as long as he wants tbh,SnakeMilker,2023-03-17 20:14:49,season enough already shaka marquette long want tbh,-0.23728275299072266
556,Lmao Shaka has done more for this program than the past 3 coaches did combined. He's good.,TheyCallMeStone,2023-03-17 20:19:13,lmao shaka done program past coach combined good,0.020144479349255562
557,Why wouldn’t you want the team that beat you to make a run?,millertime1419,2023-03-17 20:52:31,want team beat make run,-0.36157143115997314
558,He’s like a lefty Jordan Clarkson,WIN011,2023-03-17 20:31:36,like lefty jordan clarkson,0.012086525559425354
559,What charge?,RockChalkJewHawk,2023-03-17 20:12:03,charge,-0.6329319477081299
560,"It's just common game cheers from the cheerleaders, sounds like they've got the mics amped up for them too",Spectre1919,2023-03-17 20:36:41,common game cheer cheerleader sound like got mics amped,0.11359184980392456
561,Okay.,millertime1419,2023-03-17 20:34:50,okay,0.09463077783584595
562,Yep MU is just one big sorority,footer9,2023-03-17 20:36:25,yep mu one big sorority,-0.0002116728574037552
563,What happened last year to Kentucky?,coilmeup,2023-03-17 20:31:46,happened last year kentucky,-0.09868146479129791
564,It’s March homie. Maybe it Kentucky would’ve gotten a little more hyped last year they wouldn’t have choked,rockies20,2023-03-17 20:33:23,march homie maybe kentucky would gotten little hyped last year choked,0.06351856887340546
565,It's the NCAA tournament and they're on a big run,somasomore,2023-03-17 20:33:25,ncaa tournament big run,0.008419536054134369
566,"It’s March Madness, don’t need to be the fun police.",Dekalbian,2023-03-17 20:32:11,march madness need fun police,-0.09829945862293243
567,Why was Kentucky so hyped against St Peters last year…oh wait,WIN011,2023-03-17 20:32:13,kentucky hyped st peter last year oh wait,-0.04446667432785034
568,no clap only silence,touristBiscuits,2023-03-17 20:32:22,clap silence,-0.08632960915565491
569,Oh no. God forbid a team has fun playing basketball and showing emotion!,ArchaicWarden,2023-03-17 20:34:20,oh god forbid team fun playing basketball showing emotion,-0.8391544222831726
570,Wtf? It’s the NCAA tournament… how boring of a fan are you?,millertime1419,2023-03-17 20:36:35,wtf ncaa tournament boring fan,-0.1106235682964325
571,"If they do what they’ve been doing in good games, early second half is gonna be awesome.

Also of note is UVM isn’t great with offensive rebounds either, tho has improved through the season. Looks like this will be an old-school game.",Meanteenbirder,2023-03-17 18:23:49,good game early second half gon na awesome also note uvm great offensive rebound either tho improved season look like old school game,0.009808240458369255
572,God I'm still annoyed about that Arkansas game last year,DrDilatory,2023-03-17 18:28:16,god still annoyed arkansas game last year,-0.6218146681785583
573,Cats are a good defensive rebounding team.  Which is only good if they can get stops and Marquette cools off.,Captain_T,2023-03-17 19:08:13,cat good defensive rebounding team good get stop marquette cool,0.011053051799535751
574,You mean FTs?,Chucktownbadger,2023-03-17 19:15:44,mean ft,0.0058366358280181885
575,Jop wagon*,millertime1419,2023-03-17 19:17:49,jop wagon,0.0225360170006752
576,Hair follicles I think,SnakeMilker,2023-03-17 19:23:49,hair follicle think,0.042304545640945435
577,Well now 4,coilmeup,2023-03-17 19:24:17,well,0.004197046160697937
578,You try guarding this offense…,millertime1419,2023-03-17 19:30:42,try guarding offense,0.012240111827850342
579,Why not Esperanto?,spierce64006,2023-03-17 19:30:02,esperanto,0.00020028650760650635
580,I wish I had studied Latin.,brownlab319,2023-03-17 19:32:39,wish studied latin,-0.18859325349330902
581,He's a star in my eyes,SnakeMilker,2023-03-17 20:07:13,star eye,0.03017786145210266
582,Idk how this sub was when UMBC won but if a 13-16 seed had a double digit lead at any point the thread would be on fire 😂,inshamblesx,2023-03-17 18:46:15,idk sub umbc seed double digit lead point thread would fire,-0.05188991129398346
583,"Always liked Greg, great teammate.",Dekalbian,2023-03-17 19:55:31,always liked greg great teammate,0.00028213957557454705
584,1 heat check everybody knows the rules,footer9,2023-03-17 20:26:12,heat check everybody know rule,-0.03189898282289505
585,Respectable opinion,Dekalbian,2023-03-17 20:45:23,respectable opinion,0.016401225700974464
586,"I’d assume early afternoon, the Sunday 2:30 EST slot?",Dekalbian,2023-03-17 20:48:34,assume early afternoon sunday est slot,-0.09080663323402405
587,Don’t forget the state of the program that Buzz left him. 7 scholarship players,Augustus13,2023-03-17 20:45:40,forget state program buzz left scholarship player,-0.5005770921707153
588,"Great recruiter, but arguably the worst in-game coach I've ever seen",gandaalf,2023-03-17 20:44:40,great recruiter arguably worst game coach ever seen,-0.9055120944976807
589,That's why he's not coming for it til next season lol,skyllian-five,2023-03-17 19:17:37,coming til next season lol,0.007738273590803146
590,It shreds any momentum Vermont had. How are they supposed to play D if they get called for fouls where they don't even *touch* their guy? Like that's confusing as shit and hurts your ability to defend because you don't fucking know what's gonna get the whistle blown,framingXjake,2023-03-17 19:42:28,shred momentum vermont supposed play get called foul even touch guy like confusing shit hurt ability defend fucking know gon na get whistle blown,-0.6558772921562195
591,Strange that an SEC commercial plays for a game where there aren’t any SEC teams,SeekerSpock32,2023-03-17 19:37:24,strange sec commercial play game sec team,-0.43079936504364014
592,Doesn’t change the fact that the last two possessions could’ve had an entirely different outcome if there hadn’t been utter bs calls on them,No-Lab7758,2023-03-17 19:42:40,change fact last two possession could entirely different outcome utter b call,-0.17342832684516907
593,Also I would argue the kennesaw state one was worse because it was on a much more crucial time of the game,No-Lab7758,2023-03-17 19:43:23,also would argue kennesaw state one worse much crucial time game,-0.5637842416763306
594,i was born in 2005 brotha i missed our relevancy 😿,CoachKillerTrae,2023-03-17 19:42:37,born brotha missed relevancy,-0.24831384420394897
595,"Exactly.

There are plenty of clear cases where it’s a target or an danger box out, but there are a ton where it’s not really avoidable on the part of the defender (or person boxing out).",______W______,2023-03-17 20:31:21,exactly plenty clear case target danger box ton really avoidable part defender person boxing,-0.10423198342323303
596,Shaka isn’t going anywhere. Marquette has the bag to keep him for the long haul.,millertime1419,2023-03-17 20:48:31,shaka going anywhere marquette bag keep long haul,-0.06293860822916031
597,"Not only is Shaka Smart the perfect fit for Marquette, it's his dream job.  I expect him to retire there.",the_greasy_one,2023-03-17 21:00:09,shaka smart perfect fit marquette dream job expect retire,-0.0020947172306478024
598,"That one's awful too.

Yeah there's some bad ones this year",thenewTeamDINGUS,2023-03-17 20:09:09,one awful yeah bad one year,-0.89068603515625
599,"I’ve been to Vermont multiple occasions to snowboard as I’m not far from them. I love it there, just a crazy combination of things. Vermont and basketball. Wild.",PancherosFood,2023-03-17 20:35:49,vermont multiple occasion snowboard far love crazy combination thing vermont basketball wild,0.001171274809166789
600,worcester vt right here smallest town fuckin ever,CoachKillerTrae,2023-03-17 20:47:27,worcester vt right smallest town fuckin ever,-0.256433367729187
601,dartmouth is just barely in NH my guy,CoachKillerTrae,2023-03-17 20:46:57,dartmouth barely nh guy,-0.10849535465240479
602,Fuckin Doug,PancherosFood,2023-03-17 20:37:19,fuckin doug,-0.6706268787384033
603,"My brotha in Christ all over Vermont is rural essentially

Even Burlington is like a suburb",PancherosFood,2023-03-17 20:47:11,brotha christ vermont rural essentially even burlington like suburb,-0.003383796662092209
604,haha enemies for today alone!,irreleventnothing,2023-03-17 19:09:01,haha enemy today alone,-0.10913269221782684
605,"And Marquette, Michigan has a DI national champion in ice hockey (Northern Michigan)",LocksTheFox,2023-03-17 19:00:32,marquette michigan di national champion ice hockey northern michigan,-0.007527213543653488
606,Bruh you jinxed us,b_ollhoff,2023-03-17 18:59:52,bruh jinxed u,-0.003954246640205383
607,Naming my first newborn Tyler and his middle name Fuck’Em,Dekalbian,2023-03-17 19:09:56,naming first newborn tyler middle name fuck em,-0.1627071499824524
608,"Ahhhhh, that would make sense.",Chucktownbadger,2023-03-17 19:15:29,ahhhhh would make sense,0.05298452079296112
609,That’s the thing. I’m not in Serbia. But that’s the only feed that shows this lmaoo,ToxicSteve13,2023-03-17 19:27:29,thing serbia feed show lmaoo,-0.05438810586929321
610,"Last year we should have been higher than a 13 seed for sure, if they ranked us like 10 or 11 like we should have been I think we would have won a game or two

Arkansas was just really good last year, unfortunate first round match up and the game was still really close",DrDilatory,2023-03-17 19:41:57,last year higher seed sure ranked u like like think would game two arkansas really good last year unfortunate first round match game still really close,-0.047204554080963135
611,We all got blackout drunk after and forgot,SnakeMilker,2023-03-17 20:16:02,got blackout drunk forgot,-0.11048749089241028
612,"yeah i think this is why i get confused, it definitely has public school energy",airbornetoxic,2023-03-17 20:56:32,yeah think get confused definitely public school energy,0.0016366392374038696
613,Oh shoot my bad lol,jaowerpower,2023-03-17 20:30:39,oh shoot bad lol,-0.6906781196594238
614,They should wear a shock collar to be punished for their misdeeds,queef-latina-69,2023-03-17 19:49:55,wear shock collar punished misdeed,-0.4815348982810974
615,I’m glad we could have your unbiased take as well,WIN011,2023-03-17 20:10:52,glad could unbiased take well,0.0023269839584827423
616,Bros feet were moving for sure,SnakeMilker,2023-03-17 20:10:41,bros foot moving sure,0.007615126669406891
617,wrong green mid-major,Boom_Confetti,2023-03-17 19:07:50,wrong green mid major,-0.04288405179977417
618,I guess I would say so. I live like 10 minutes away from Stevens Point so thats cool,coilmeup,2023-03-17 19:20:39,guess would say live like minute away stevens point thats cool,0.006617426872253418
619,"Im on my third beer already.  I hope i can make it to our game.  These Guinness are going down so damn smooth.  Ill move to Busch Light after this.  Can only donso many draughts before i get cotton mouth.

Might be a 15 beer night.",Stang1776,2023-03-17 20:12:54,im third beer already hope make game guinness going damn smooth ill move busch light donso many draught get cotton mouth might beer night,0.004273861646652222
620,Ayyyyyyyyyyy,millertime1419,2023-03-17 20:30:27,ayyyyyyyyyyy,0.29836854338645935
621,"Thing is Shaka’s in a situation Vermont has been in before. A meh school most years is excelling this season and the coach is getting a lot of respect, similar to Vermont last year.",Meanteenbirder,2023-03-17 18:26:20,thing shaka situation vermont meh school year excelling season coach getting lot respect similar vermont last year,0.09735265374183655
622,"Username checks out, I think something is wrong with yours",DrDilatory,2023-03-17 19:39:05,username check think something wrong,-0.27585935592651367
623,"yup, but 11-6 involving two high majors is the boringest of upsets, lol",[deleted],2023-03-17 20:04:01,yup involving two high major boringest upset lol,0.1573811173439026
624,"Was a perfectly good call...

Was pretty much the same play as the time where your guy got three free throws on his three-point attempt",DrDilatory,2023-03-17 20:03:23,perfectly good call pretty much play time guy got three free throw three point attempt,0.005142221227288246
625,And if Marquette were playing peak ball it’d be a 20 point game. Goes both ways.,Dekalbian,2023-03-17 20:12:37,marquette playing peak ball point game go way,0.006357446312904358
626,Yes it is but tournament runs are what make or break careers imo.,[deleted],2023-03-17 20:19:19,yes tournament run make break career imo,-0.0022712917998433113
627,"Cuz fuck y'all after today, that's why?

Why would I want to see the fans dancing on our season's grave be even happier? The hypothetical of you guys winning the championship and us going ""well, we drew the national champion in the first round, of course it makes sense we lost, maybe if we drew a different team we would have won"" isn't worth anything. It's a pointless hypothetical that may or may not be true. What is true is that you guys are reveling in our loss, and I look forward to doing the same if you lose against Michigan next week lol",DrDilatory,2023-03-17 20:55:32,cuz fuck today would want see fan dancing season grave even happier hypothetical guy winning championship u going well drew national champion first round course make sense lost maybe drew different team would worth anything pointless hypothetical may may true true guy reveling loss look forward lose michigan next week lol,-0.5507780313491821
628,My man just learned about cheerleaders,CaptainBecket,2023-03-17 20:36:49,man learned cheerleader,-0.003985250368714333
629,And yesterday with Arizona,SnakeMilker,2023-03-17 20:32:27,yesterday arizona,-0.0569591149687767
630,[deleted],[deleted],2023-03-17 20:33:05,deleted,-0.47444185614585876
631,Sorry was referring to UVM getting defensive rebounds though the verbiage was kind of confusing,Wolf_of_Walmart,2023-03-17 18:26:23,sorry referring uvm getting defensive rebound though verbiage kind confusing,0.034361332654953
632,"ugh yes FTs, I very much mean FTs.",ApprehensiveCorgi867,2023-03-17 19:16:22,ugh yes ft much mean ft,-0.1120271384716034
633,I’m partial to trains,CarrollPC,2023-03-17 19:18:20,partial train,-0.18398621678352356
634,[deleted],[deleted],2023-03-17 19:30:58,deleted,-0.47444185614585876
635,"I still want a Greg and JaJaun sitcom. They were hilarious together.

Edit: meant Jamal Cain, not JaJuan.",millertime1419,2023-03-17 19:58:45,still want greg jajaun sitcom hilarious together edit meant jamal cain jajuan,0.006586208939552307
636,I was hoping he'd transfer his 3 point shooting to Stevie,footer9,2023-03-17 19:59:07,hoping transfer point shooting stevie,0.03522747755050659
637,Buzz fucked us HARD. Our best player was Juan Anderson who somehow stumbled into the NBA. He was awful at MU,gandaalf,2023-03-17 20:53:05,buzz fucked u hard best player juan anderson somehow stumbled nba awful mu,-0.7591175436973572
638,Let Markus do whatever he wants and make the Hauser's upset enough to leave,SnakeMilker,2023-03-17 20:46:14,let markus whatever want make hauser upset enough leave,-0.7437422871589661
639,"Bad team coach honestly, he put everything on Howard.",cixzejy,2023-03-17 20:46:13,bad team coach honestly put everything howard,-0.8401477932929993
640,Man couldn't make an adjustment to save his life,ApprehensiveCorgi867,2023-03-17 20:53:19,man make adjustment save life,-0.013182399794459343
641,Let’s wait for the second half when the makeup calls start flying.  I just find it bullshit that refs can’t call an objective or even game.,Chucktownbadger,2023-03-17 19:43:08,let wait second half makeup call start flying find bullshit ref call objective even game,-0.5077948570251465
642,"Sure, but it’s not a “big swing” anyway you put it",Dekalbian,2023-03-17 19:43:40,sure big swing anyway put,0.040762607008218765
643,It really is!,brownlab319,2023-03-17 19:49:37,really,0.08026288449764252
644,"Holy shit, my brain can't handle y'alls generation already being adults.",framingXjake,2023-03-17 19:50:21,holy shit brain handle alls generation already adult,-0.19667215645313263
645,"Jesus christ.

Here i am remembering IUs last championship",Stang1776,2023-03-17 19:46:18,jesus christ remembering ius last championship,-0.06513209640979767
646,"Yeah you'd expect us to be one of the better hockey teams in the country, surprised the basketball team is as good as it is, and we don't even have a football team",DrDilatory,2023-03-17 20:37:10,yeah expect u one better hockey team country surprised basketball team good even football team,-0.05705970525741577
647,I legit spent two decades thinking Dartmouth was in Vermont.  LMFAO.,Pollaski,2023-03-17 20:52:02,legit spent two decade thinking dartmouth vermont lmfao,-0.0017888080328702927
648,ik lol i grew up in a town with less than 250 people close to montpelier. we got some good ass co-ops tho 🥵🥵,CoachKillerTrae,2023-03-17 20:48:50,ik lol grew town le people close montpelier got good as co ops tho,0.03017239458858967
649,Cheers!,scrapsbypap,2023-03-17 19:09:36,cheer,0.010567903518676758
650,then that's...bizarre,butts6891,2023-03-17 19:28:17,bizarre,-0.7372488379478455
651,Where are you?,chuncken,2023-03-17 19:28:53,,0.056165412068367004
652,All good lol just like to poke fun when people call him Cam,WIN011,2023-03-17 20:36:14,good lol like poke fun people call cam,0.01659313403069973
653,"I haven't officially signed off work yet, another 7 minutes and the Beanblossom hard cider from Oliver down in Bloomington comes out.",Where0Meets15,2023-03-17 20:25:07,officially signed work yet another minute beanblossom hard cider oliver bloomington come,-0.045186202973127365
654,Looks like he heard ya,Spectre1919,2023-03-17 20:32:39,look like heard ya,-0.0419907420873642
655,"Sure thing homer 😂. If you can't see the forearms to the chest, you must have started St Patty's early.",owmyfreakingeyes,2023-03-17 19:40:46,sure thing homer see forearm chest must started st patty early,-0.02765651047229767
656,Everyone knows you shoot your off hand completely to the right after you shoot,WIN011,2023-03-17 20:04:20,everyone know shoot hand completely right shoot,-0.0030215366277843714
657,yeah no shit we playin like a middle school team from new hampshire with this playcalling rn,CoachKillerTrae,2023-03-17 20:15:04,yeah shit playin like middle school team new hampshire playcalling rn,-0.05070912837982178
658,"Maybe at some schools, but I think his got a long leash at a school like Marquette",somasomore,2023-03-17 20:31:42,maybe school think got long leash school like marquette,0.028338536620140076
659,Or maybe like getting the highest seed in school history,TheyCallMeStone,2023-03-17 20:24:39,maybe like getting highest seed school history,0.04254738241434097
660,We haven’t won a tourney game in 10 years. Y’all player well and it was a competitive game for a lot of it. We’re just very glad to have finally won one.,millertime1419,2023-03-17 20:59:16,tourney game year player well competitive game lot glad finally one,0.005999119020998478
