,Comment,Author,Created UTC,Cleaned_Comment,sentiment_score
0,Let's get Gene on to tell us how it was a perfect call,very_humble,2023-03-17 19:39:04,let get gene tell u perfect call,-0.11274972558021545
1,Fuck Joey Hauser!,millertime1419,2023-03-17 20:50:26,fuck joey hauser,-0.7930044531822205
2,Here's to hoping this is the quietest game thread of the day,footer9,2023-03-17 18:24:47,hoping quietest game thread day,0.07127757370471954
3,Lmao that’s one of the worst calls I’ve ever seen.,Boilermaker24,2023-03-17 19:38:25,lmao one worst call ever seen,-0.9217841625213623
4,You’ve gotta be kidding me how is this a flagrant lol,big_mustache_dad,2023-03-17 20:21:13,got ta kidding flagrant lol,-0.0009419247508049011
5,This play happens 3 times every game and is never called a flagrant,Shot_Juggernaut2113,2023-03-17 20:21:26,play happens time every game never called flagrant,-0.07369661331176758
6,"Marquette really tough as nails and it’s gonna take a really strong, complete 40 minute game from a team to take them out. 

- signed a fan of a team that lost to them 3 times",TheVirtual_Boy,2023-03-17 20:31:02,marquette really tough nail gon na take really strong complete minute game team take signed fan team lost time,-0.246025949716568
7,"Hi Marquette! I have you guys winning the whole thing! So please win!

Nothing personal UVM!

[Also all 5 BE tourney teams play today!](https://youtu.be/oBqqI6NMeaM)",huskyferretguy1,2023-03-17 19:05:57,hi marquette guy winning whole thing please win nothing personal uvm also tourney team play today,-0.19765174388885498
8,The Kam Jones show in Columbus in the 2nd half. He has 18 of Marquette's last 21 point.,spierce64006,2023-03-17 20:32:43,kam jones show columbus nd half marquette last point,-0.06444967538118362
9,Couldn’t they have showed that kid BEFORE they were down 20?,coilmeup,2023-03-17 20:41:00,showed kid,-0.043799325823783875
10,Shout out GE3 let's go Pitt,SnakeMilker,2023-03-17 19:53:59,shout ge let go pitt,-0.4389709234237671
11,"Bro, I am straight up having a good time",TheyCallMeStone,2023-03-17 20:30:56,bro straight good time,0.000739914714358747
12,"From a strict rule fidelity standpoint, that is undoubtedly one of the worst calls I've ever seen",upstatewilly,2023-03-17 19:41:42,strict rule fidelity standpoint undoubtedly one worst call ever seen,-0.749384343624115
13,Hilarious you can tell at halftime that Kenny isn’t even watching this game.,Chucktownbadger,2023-03-17 19:46:18,hilarious tell halftime kenny even watching game,-0.18391405045986176
14,Kam Jones would be better off taking his free throws from about 8 feet further back,_Hank_Marducas_,2023-03-17 20:17:57,kam jones would better taking free throw foot back,-0.04275715351104736
15,They’re boxing out before he jumps,_Hank_Marducas_,2023-03-17 20:20:53,boxing jump,0.027149632573127747
16,Kam gonna start chucking dumb 3s,SnakeMilker,2023-03-17 20:25:07,kam gon na start chucking dumb,-0.24929296970367432
17,**Poll:**  Do I drive to Columbus tomorrow?,Dekalbian,2023-03-17 20:43:09,poll drive columbus tomorrow,-0.06309667229652405
18,How in the world has it been 10 years since Marquette won a game in the tournament?,Intelligent_Shirt_50,2023-03-17 20:43:31,world year since marquette game tournament,-0.015285404399037361
19,"Marquette is my pick to win it all

Vermont spoiled UMass Lowells chances of going to the dance (sister school of mine) 

Go Golden Eagles",Pesci_Avocado,2023-03-17 19:05:42,marquette pick win vermont spoiled uma lowell chance going dance sister school mine go golden eagle,0.013750717043876648
20,"Vermont is the ultimate spoiler team, every since the great Sorrentine from the parking lot",JalenBrunsonBurner,2023-03-17 19:27:43,vermont ultimate spoiler team every since great sorrentine parking lot,-0.002023646142333746
21,That was brutal. Ref had a blow locked and loaded on that foul call,Stang1776,2023-03-17 19:38:44,brutal ref blow locked loaded foul call,-0.7069354057312012
22,That might have been the worst call of the tournament,Glass3QuartersFull,2023-03-17 19:38:44,might worst call tournament,-0.7205899357795715
23,what the hell was that call man,CoachKillerTrae,2023-03-17 19:39:00,hell call man,-0.7185961008071899
24,He literally jumped while being blocked out and put himself in a vulnerable state. Steratore is such a hack,zachwilson23,2023-03-17 20:21:43,literally jumped blocked put vulnerable state steratore hack,-0.5126447677612305
25,Bullshit. He was boxing out before he jumped,teamgreat455,2023-03-17 20:22:27,bullshit boxing jumped,-0.4215875267982483
26,Jesus Kam is FEELING it.,ApprehensiveCorgi867,2023-03-17 20:25:18,jesus kam feeling,-0.0066145360469818115
27,"we had a chance with the flagrant and we blew it. that’s game for ya, good luck marquette i’ll be cheering for u guys against michigan st and prolly throughout the tourney, cool to see marquette back on top it’s pretty nostalgic at least even if my team is shit",CoachKillerTrae,2023-03-17 20:28:12,chance flagrant blew game ya good luck marquette cheering u guy michigan st prolly throughout tourney cool see marquette back top pretty nostalgic least even team shit,0.008246585726737976
28,cause of death: kam jones,LocksTheFox,2023-03-17 20:29:42,cause death kam jones,-0.7014706134796143
29,Shaka gonna get the NCAA monkey off his back finally. Marquette got some dudes.,mrwhitaker3,2023-03-17 20:30:46,shaka gon na get ncaa monkey back finally marquette got dude,-0.0005859509110450745
30,Gold coming for most improved player next season. Book it,SnakeMilker,2023-03-17 19:15:47,gold coming improved player next season book,0.0001450306735932827
31,"Definitely feels like the refs are biased in favor of the higher seed a lot of years, last year against Arkansas it felt like bullshit, and this year it feels like bullshit",DrDilatory,2023-03-17 19:37:15,definitely feel like ref biased favor higher seed lot year last year arkansas felt like bullshit year feel like bullshit,-0.765084445476532
32,"I’m not someone who’s quick to cry refball, but that was bullshit",SeekerSpock32,2023-03-17 19:38:48,someone quick cry refball bullshit,-0.270931601524353
33,"Wow, that horrendous call is gonna be a big swing here",ieatplaydough,2023-03-17 19:38:57,wow horrendous call gon na big swing,-0.6013928055763245
34,"Thank god that only resulted in one point, that was a **terrible** call",Dekalbian,2023-03-17 19:41:17,thank god resulted one point terrible call,-0.7787049412727356
35,"Hello, let me introduce you to Kameron Jones.",millertime1419,2023-03-17 20:13:48,hello let introduce kameron jones,-0.07253431528806686
36,I like how they put up Gene’s NCAAB ref credentials this time since people got so mad at his last appearance during the Xavier game,TheJURY15,2023-03-17 20:21:44,like put gene ncaab ref credential time since people got mad last appearance xavier game,-0.04399880766868591
37,How tf is that a flagrant?!?,Any_Mud442,2023-03-17 20:21:46,tf flagrant,-0.034041449427604675
38,"I hate that. He's boxing out before the guy jumps, wtf is he supposed to do?",SocksandSmocks,2023-03-17 20:22:09,hate boxing guy jump wtf supposed,-0.5278894901275635
39,Who needs a point guard when you have point Oso,_Hank_Marducas_,2023-03-17 20:23:57,need point guard point oso,0.006638914346694946
40,WE ARE,gandaalf,2023-03-17 20:30:20,,0.056165412068367004
41,kam jones in the second half is the greatest college basketball player i have ever seen. dude is hotter than a pizza oven,kylepierce722,2023-03-17 20:30:52,kam jones second half greatest college basketball player ever seen dude hotter pizza oven,-0.0008643025066703558
42,Cooking with gas now,footer9,2023-03-17 20:30:53,cooking gas,0.03441520035266876
43,Not looking good now. Good luck rest of the way Marquette!,Intelligent_Shirt_50,2023-03-17 20:34:00,looking good good luck rest way marquette,-0.0010191798210144043
44,Announcers acting like Vermont won’t go on an 18-0 scoring run to win the game,Wolf_of_Walmart,2023-03-17 20:43:02,announcer acting like vermont go scoring run win game,-0.019368931651115417
45,"Uh, there aren’t any SEC teams in this game.",SeekerSpock32,2023-03-17 19:29:30,uh sec team game,-0.0347023606300354
46,Dumb foul,WIN011,2023-03-17 19:31:53,dumb foul,-0.8597857356071472
47,That was a terrible call… sorry Vermont fans,millertime1419,2023-03-17 19:37:40,terrible call sorry vermont fan,-0.8687940835952759
48,Man FUCK this game,DrDilatory,2023-03-17 19:38:00,man fuck game,-0.7752639055252075
49,Lmao that was one of the worst phantom fouls I’ve seen.,Boilermaker24,2023-03-17 19:38:49,lmao one worst phantom foul seen,-0.8723180294036865
50,KILLA KAM!,coilmeup,2023-03-17 20:13:39,killa kam,0.007876858115196228
51,Holy fuck make free throws,coilmeup,2023-03-17 20:18:05,holy fuck make free throw,-0.19800524413585663
52, he lost his footing is this really something that needs relooked at?,cixzejy,2023-03-17 20:20:18,lost footing really something need relooked,0.09867864847183228
53,How is that a flagrant what,coilmeup,2023-03-17 20:21:32,flagrant,-0.04180554300546646
54,"As much as a BS flagrant that is, we've gotten some good calls too.",CJL13,2023-03-17 20:21:47,much b flagrant gotten good call,0.043675437569618225
55,"Shaka Smart has Marquette on a string defensively. 

Awesome rotations.",PhillyPhan95,2023-03-17 20:23:34,shaka smart marquette string defensively awesome rotation,0.000590078067034483
56,Kam,_Hank_Marducas_,2023-03-17 20:24:33,kam,0.0030237138271331787
57,Kam Jones decided he wanted to play basketball lmao,Any_Mud442,2023-03-17 20:24:51,kam jones decided wanted play basketball lmao,-0.01737271249294281
58,Kam Jones is a DUDE,KJones77,2023-03-17 20:24:52,kam jones dude,-0.0016038715839385986
59,"A truly great ""ball don't lie"" stretch right there",SocksandSmocks,2023-03-17 20:25:28,truly great ball lie stretch right,0.0005221993196755648
60,by my count 13 straight points for jones,jconley4297,2023-03-17 20:27:28,count straight point jones,-0.08324219286441803
61,The Marquette Golden Jones',americanbaseball,2023-03-17 20:27:46,marquette golden jones,0.001792004331946373
62,STEVIE GETTING SOME OF THAT SWEET SWEET 3 TOO,Dekalbian,2023-03-17 20:33:42,stevie getting sweet sweet,0.0040069203823804855
63,Marquette looks good. Always have loved their color scheme too.,GeneralTaos,2023-03-17 20:39:11,marquette look good always loved color scheme,0.0011194059625267982
64,Nice to hear CBS Championship after an NCAA tourney game. Shout MU Pep Band!,Spectre1919,2023-03-17 20:53:00,nice hear cbs championship ncaa tourney game shout mu pep band,0.01159166730940342
65,"#DARRYL MORSELL DIFFERENCE, BABY 😤


#

#I GOT THE GOLDEN EAGLES WINNING IT ALL",PinkSaldo,2023-03-17 18:21:41,darryl morsell difference baby got golden eagle winning,-0.003939282149076462
66,🤠🔫,footer9,2023-03-17 18:57:31,,0.056165412068367004
67,Worst call I have seen this year,Augustus13,2023-03-17 19:37:22,worst call seen year,-0.9226533770561218
68,God I hate when the ref with the worse view of the play makes the call.,ddottay,2023-03-17 19:37:26,god hate ref worse view play make call,-0.8784000277519226
69,Bad call for sure,WIN011,2023-03-17 19:37:26,bad call sure,-0.6904544234275818
70,Horrible call lmao,JayMoney2424,2023-03-17 19:37:38,horrible call lmao,-0.8258695006370544
71,"God, the officiating is awful.",mrwhitaker3,2023-03-17 19:37:52,god officiating awful,-0.8766601085662842
72,God awful call wow,framingXjake,2023-03-17 19:37:59,god awful call wow,-0.9107072949409485
73,First the Kennesaw st game now this reffing is making these games unwatchable,No-Lab7758,2023-03-17 19:38:42,first kennesaw st game reffing making game unwatchable,0.02397918701171875
74,Absolute horseshit,ScubaSteveEL,2023-03-17 19:39:12,absolute horseshit,-0.7380463480949402
75,Who the fuck invited ACC refs to the party,framingXjake,2023-03-17 19:39:16,fuck invited acc ref party,-0.5739802718162537
76,bro we can never be the sleeper upset team 🥲,CoachKillerTrae,2023-03-17 19:39:46,bro never sleeper upset team,-0.25503912568092346
77,"Feet were moving side-to-side, good call.",Dekalbian,2023-03-17 20:09:58,foot moving side side good call,0.060805629938840866
78,Take stevie Mitchell out and give the ball to Oso every fucking possession. How hard is this game?,packersRus,2023-03-17 20:10:16,take stevie mitchell give ball oso every fucking possession hard game,-0.20305396616458893
79,FINALLY KAM!!!,millertime1419,2023-03-17 20:13:05,finally kam,-0.009193181991577148
80,Why was that ref cheeked up?,ChiTownFan4,2023-03-17 20:21:02,ref cheeked,0.019956156611442566
81,A lot of man fell on that play,LocksTheFox,2023-03-17 20:21:07,lot man fell play,0.03972162678837776
82,that’s a common foul all day,jconley4297,2023-03-17 20:21:35,common foul day,-0.6145049333572388
83,Ridiculous,Augustus13,2023-03-17 20:21:55,ridiculous,-0.5458971858024597
84,Nothing in that.,spierce64006,2023-03-17 20:21:58,nothing,0.17524036765098572
85,BALL DON’T LIE,FedGoat13,2023-03-17 20:22:42,ball lie,-0.18533986806869507
86,Oh yeah well I had zero offers too.,Warhawk137,2023-03-17 20:23:03,oh yeah well zero offer,-0.8259595632553101
87,"I always struggle on those calls.

I get the intention behind calling those and can see that it’s certainly a valid safety concern, but often times it seems like they expect players to have eyes in the back of their head in order to avoid such a call.",______W______,2023-03-17 20:24:04,always struggle call get intention behind calling see certainly valid safety concern often time seems like expect player eye back head order avoid call,-0.5483261346817017
88,Good things happen when Kam drives,WIN011,2023-03-17 20:24:43,good thing happen kam drive,0.03816448524594307
89,KAM. JONES.,millertime1419,2023-03-17 20:25:00,kam jones,-0.01052023470401764
90,That soft flagrant call gave us an opportunity and we threw it away. That's momentum for ya.,LocksTheFox,2023-03-17 20:25:44,soft flagrant call gave u opportunity threw away momentum ya,-0.1821567565202713
91,"Kam Jones, good lord.",millertime1419,2023-03-17 20:29:18,kam jones good lord,-0.014784876257181168
92,OMFG IM CREAMING RN,coilmeup,2023-03-17 20:30:20,omfg im creaming rn,-0.011494293808937073
93,[Kam](https://streamable.com/d7f2xh),CaptainBecket,2023-03-17 20:33:03,kam,0.0030237138271331787
94,K A M,MurDoct,2023-03-17 20:36:59,k,-0.07461680471897125
95,"HE HIT THAT ONE FROM THE PARKING LOT 

God, that was a great upset.  Vermont never should have been near a 13 that year.",Pollaski,2023-03-17 20:37:08,hit one parking lot god great upset vermont never near year,-0.014442872256040573
96,Oh come on we’re out of the tournament and still catching strays,dangermouse29,2023-03-17 20:37:19,oh come tournament still catching stray,-0.0677848756313324
97,Alright biggest fear averted now onto second biggest fear.,cixzejy,2023-03-17 20:43:31,alright biggest fear averted onto second biggest fear,-0.3489985466003418
98,This is amazing. Keep it up boys! Onto Sparty,gandaalf,2023-03-17 20:44:14,amazing keep boy onto sparty,-0.0007765623740851879
99,I had a feeling that this was gonna be the hardest game for Marquette but this was a blowout. LETS GO EAGLES 🦅,moella0407,2023-03-17 21:05:14,feeling gon na hardest game marquette blowout let go eagle,-0.18059781193733215
100,"Pro tip, just jump on the back of the guy boxing you out and get a flagrant.",millertime1419,2023-03-17 20:21:46,pro tip jump back guy boxing get flagrant,0.007388059049844742
101,"So if you're being blocked out, you can just jump and fall so they'll call it a flagrant",zachwilson23,2023-03-17 20:23:14,blocked jump fall call flagrant,-0.0848047286272049
102,ummm going to the locker room? we so fucked,ApprehensiveCorgi867,2023-03-17 18:58:34,ummm going locker room fucked,-0.6262998580932617
103,Jesus Christ this would be terrible if Kolek is badly hurt. Thankfully seems like he just jammed it..,gandaalf,2023-03-17 18:58:46,jesus christ would terrible kolek badly hurt thankfully seems like jammed,-0.8076440691947937
104,Put a hand up Jop,WIN011,2023-03-17 19:07:22,put hand jop,-0.016425319015979767
105,They may not win the game but Vermont’s pep band washes Marquette’s,ddottay,2023-03-17 19:09:44,may win game vermont pep band wash marquette,-0.0014443639665842056
106,Bothers the shit outta me that the NCAA can make money by dancing on Jim Valvano’s grave.,confirmd_am_engineer,2023-03-17 19:10:05,bother shit outta ncaa make money dancing jim valvano grave,-0.5114262104034424
107,JOPWAGON,coilmeup,2023-03-17 19:11:20,jopwagon,0.03196697682142258
108,Guard the three maybe?,coilmeup,2023-03-17 19:12:49,guard three maybe,0.07468285411596298
109,"The dad in that Allstate commercial puts a tiny amount of extinguisher onto the house, then sees his home is still on fire and then tries to put out the tiny candles in the yard.

My man, your fucking home is on fire.",Common-Community-550,2023-03-17 19:18:17,dad allstate commercial put tiny amount extinguisher onto house see home still fire try put tiny candle yard man fucking home fire,-0.051007241010665894
110,I still think it’s ridiculous they interview coaches during the game. Grab something small at half otherwise leave them alone.,WIN011,2023-03-17 19:18:50,still think ridiculous interview coach game grab something small half otherwise leave alone,-0.4703417420387268
111,LET OSO COOK,coilmeup,2023-03-17 19:21:47,let oso cook,-0.050682514905929565
112,"Let's go boys, open this shit up",SnakeMilker,2023-03-17 19:24:13,let go boy open shit,-0.3323615789413452
113,Vermont gotta summon the spirits of coppenrath and sorrentine,brownblackmamba,2023-03-17 19:27:53,vermont got ta summon spirit coppenrath sorrentine,0.00471189059317112
114,Veretto playing his heart out,scrapsbypap,2023-03-17 19:28:49,veretto playing heart,0.0021598711609840393
115,Come on Tyler…,millertime1419,2023-03-17 19:32:29,come tyler,-0.021128226071596146
116,"Yo how is that a foul he just stood there…

Wow and even then he didn’t even hit him anyway",Kodyaufan2,2023-03-17 19:37:28,yo foul stood wow even even hit anyway,-0.6681360006332397
117,TERRIBLE CALL,humorousmoose,2023-03-17 19:37:40,terrible call,-0.8502798676490784
118,Horrible call,Dekalbian,2023-03-17 19:37:52,horrible call,-0.8616003394126892
119,Wow that is a terrible call,TheyCallMeStone,2023-03-17 19:37:55,wow terrible call,-0.914330780506134
120,Bad call wow,inevitablescape,2023-03-17 19:38:01,bad call wow,-0.7669844627380371
121,Absolute phantom call,VentureQuotes,2023-03-17 19:38:09,absolute phantom call,-0.2843361496925354
122,Wow terrible call,SnakeMilker,2023-03-17 19:38:39,wow terrible call,-0.914330780506134
123,Atrocious call,CXDXOXP,2023-03-17 19:38:44,atrocious call,-0.7406995892524719
124,Absolute horseshit,ScubaSteveEL,2023-03-17 19:38:49,absolute horseshit,-0.7380463480949402
125,"Seans gotta take a dribble there before making that pass, huge bailout there for us",P1kachu2_,2023-03-17 19:38:51,seans got ta take dribble making pas huge bailout u,0.010344434529542923
126,At least that BS only cost them 1 point,CageyTurtlez,2023-03-17 19:40:22,least b cost point,-0.4133225083351135
127,Between that Uberone commercial and this awful Taco Bell commercial it's enough to make me shut these games off.,thenewTeamDINGUS,2023-03-17 19:51:11,uberone commercial awful taco bell commercial enough make shut game,-0.8057003021240234
128,Kolek come the fuck on,coilmeup,2023-03-17 20:02:58,kolek come fuck,-0.40458834171295166
129,21-2 Pitt lead 🤯,inevitablescape,2023-03-17 20:07:13,pitt lead,-0.02038733661174774
130,"Don't do it....

Don't give me hope...",DrDilatory,2023-03-17 20:07:53,give hope,-0.08815496414899826
131,Finally Kam,WIN011,2023-03-17 20:12:47,finally kam,-0.009193181991577148
132,THERE WE GO,coilmeup,2023-03-17 20:13:07,go,-0.03891566023230553
133,I love Shaka’s enthusiasm,The_Champ_Son,2023-03-17 20:13:48,love shaka enthusiasm,0.000434347428381443
134,WTF is wrong with Kolek?  He body language has been trash since the game started.  I know about the injury and everything.,Chucktownbadger,2023-03-17 20:16:54,wtf wrong kolek body language trash since game started know injury everything,-0.7977866530418396
135,Just guys falling over.,millertime1419,2023-03-17 20:20:32,guy falling,-0.16301216185092926
136,This ref has a certified dump truck,TheyCallMeStone,2023-03-17 20:20:53,ref certified dump truck,-0.05321868136525154
137,The ref is thicc,[deleted],2023-03-17 20:21:05,ref thicc,-0.12695641815662384
138,"They’re playing All Star pretty loudly in there, aren’t they?

![gif](giphy|PgJwMLahrGc3IcteOt|downsized)",Zloggt,2023-03-17 20:21:50,playing star pretty loudly gif giphy pgjwmlahrgc icteot downsized,0.1687862128019333
139,Oooooh I'm not sure I agreee with that,LocksTheFox,2023-03-17 20:22:11,oooooh sure agreee,-0.014597643166780472
140,Not a good call,inevitablescape,2023-03-17 20:22:41,good call,0.06592296063899994
141,The man can’t miss,Prison__er,2023-03-17 20:24:28,man miss,-0.06906336545944214
142,Kam Jones show.,mrwhitaker3,2023-03-17 20:25:00,kam jones show,-0.01675558090209961
143,Jones can't be stopped right now,TaliZorah14,2023-03-17 20:25:08,jones stopped right,-0.04837411642074585
144,Vermont getting some trash calls,zachwilson23,2023-03-17 20:25:19,vermont getting trash call,-0.46776068210601807
145,Kam jones is a cheat code,humorousmoose,2023-03-17 20:25:41,kam jones cheat code,-0.5748245120048523
146,A seven point scoring spurt from Kam Jones and Marquette's lead is 14 just like that.,spierce64006,2023-03-17 20:26:24,seven point scoring spurt kam jones marquette lead like,0.022771134972572327
147,Vermont had a legit chane to get the deficit down to 3 if they made both technicals and then hit a 3-pointer. Huge missed opportunity and Marquette pounced.,nysom1227,2023-03-17 20:27:01,vermont legit chane get deficit made technical hit pointer huge missed opportunity marquette pounced,-0.0026497431099414825
148,wow kam jones is unstoppable right now,wwgd,2023-03-17 20:29:26,wow kam jones unstoppable right,-0.003368749748915434
149,Killa cam destroys everything I love,[deleted],2023-03-17 20:29:57,killa cam destroys everything love,-0.002077181590721011
150,Kam Jones legacy game,Any_Mud442,2023-03-17 20:30:07,kam jones legacy game,0.004351627081632614
151,Absolutely loving this.,MayIServeYouWell,2023-03-17 20:30:11,absolutely loving,-0.0005450330208986998
152,Sadly…Vermont cannot keep up with the Jones…,Zloggt,2023-03-17 20:30:23,sadly vermont keep jones,-0.38429099321365356
153,Jones is now president of Vermont,gopher33j,2023-03-17 20:30:38,jones president vermont,-0.07134345173835754
154,This is literally the Texas-Colgate game except not as close,coilmeup,2023-03-17 20:30:48,literally texas colgate game except close,-0.16623729467391968
155,Big credit to Vermont for shutting Tyler Kolek down.,the_greasy_one,2023-03-17 20:32:21,big credit vermont shutting tyler kolek,-0.09610103070735931
156,"Just gotta ask.. how does one find themselves a fan of Vermont Basketball? That’s gonna be as niche as it gets.

One thing was for sure, I don’t care what my brackets say, I was a big fan of the CATAMOUNTS today.",PancherosFood,2023-03-17 20:33:53,got ta ask one find fan vermont basketball gon na niche get one thing sure care bracket say big fan catamount today,-0.02462492138147354
157,PUT IN MICHAEL KENNEDY,packersRus,2023-03-17 20:36:15,put michael kennedy,-0.008676029741764069
158,Now I want a milkshake.,jaowerpower,2023-03-17 20:46:23,want milkshake,0.023825407028198242
159,No finish line!!,skyllian-five,2023-03-17 20:51:02,finish line,-0.0459955632686615
160,Big East 🤝refs,John_E_Depth,2023-03-17 19:39:59,big east ref,-0.01488824188709259
161,"Vermont has been a trendy upset pick the last 3 times they got in and lost each time.

Would be funny if they got their win when nobody is expecting it",sebsasour,2023-03-17 19:44:08,vermont trendy upset pick last time got lost time would funny got win nobody expecting,-0.15751489996910095
162,Floor slap= automatic bucket,cynicallyoptimistic1,2023-03-17 20:40:38,floor slap automatic bucket,-0.3904244899749756
163,So I guess if you’re getting boxed out just jump and fall over. Profit,Bucks2020,2023-03-17 20:22:06,guess getting boxed jump fall profit,-0.06698444485664368
164,These motherfuckers are going to get like four points off of a foul that didn't happen,DrDilatory,2023-03-17 19:38:19,motherfucker going get like four point foul happen,-0.6219490766525269
165,Nervous energy,irreleventnothing,2023-03-17 17:51:21,nervous energy,0.013642918318510056
166,I DON'T EVEN KNOW WHERE MARQUETTE IS BUT FUCK WHEREVER THAT IS GO CATS!,DrDilatory,2023-03-17 18:14:51,even know marquette fuck wherever go cat,-0.8121222853660583
167,Marquette isn't safe. 14 and 15 seed upsets are becoming a trend this year.,shawn131871,2023-03-17 18:24:20,marquette safe seed upset becoming trend year,0.003335479646921158
168,"Seeing all these 13, 14, and 15 seeds doing well so far 👀",DrDilatory,2023-03-17 18:33:01,seeing seed well far,0.010227147489786148
169,I really hope we aren’t asleep at tip-off,cixzejy,2023-03-17 18:38:22,really hope asleep tip,0.01971074938774109
170,Needs to be an Oso game,WIN011,2023-03-17 18:52:55,need oso game,0.02258133888244629
171,"Oso 7'1"" if you count his hair",SnakeMilker,2023-03-17 18:54:46,oso count hair,-0.032101236283779144
172,Fuck me,SnakeMilker,2023-03-17 18:56:57,fuck,-0.7464621067047119
173,Fuuuu,Spectre1919,2023-03-17 18:56:58,fuuuu,-0.016547948122024536
174,Kolek take my arms I don't need them,TheyCallMeStone,2023-03-17 18:57:19,kolek take arm need,-0.018845051527023315
175,CMON CATS,CoachKillerTrae,2023-03-17 19:01:37,cmon cat,-0.03557048738002777
