,Comment,Author,Created UTC,Cleaned_Comment,sentiment_score
0,I want the winner of this game to go up against Princeton in the Final Four. True Mid Major Madness.,Primary_Psychology95,2023-03-19 23:03:20,want winner game go princeton final four true mid major madness,-0.011929139494895935
1,Some pregnant lady in Utah right now is like “OMG I love the name Fairleigh 😍”,sunnymushroom,2023-03-20 01:29:49,pregnant lady utah right like omg love name fairleigh,-0.0453096404671669
2,"[Cool tidbit from the Columbus regional: Since Fairleigh Dickinson doesn't have a band, Dayton's band has stepped up. The UD band learned  FDU's fight song minutes before tip Fri. Today, they're waving around plastic swords they got from Party City as they root for the Knights](https://twitter.com/jake_trotter/status/1637624666226401281?s=46&t=BdzQuEzhUNBu90xEOGRUtg)",WhoopieKush,2023-03-20 01:43:45,cool tidbit columbus regional since fairleigh dickinson band dayton band stepped ud band learned fdu fight song minute tip fri today waving around plastic sword got party city root knight,0.004139489494264126
3,"Yamming it on a 16 seed that you barely beat is definitely a vibe

I hope we run it up on these clowns",GoatPaco,2023-03-20 02:15:34,yamming seed barely beat definitely vibe hope run clown,-0.027136072516441345
4,"FDU probably loses by 20, but it would be sick if they won",huttts999,2023-03-19 23:13:19,fdu probably loses would sick,-0.38739097118377686
5,"I kinda feel bad for FAU. Any other year, they'd be the underdog getting all the neutral fan support. Instead, they've got pretty much everyone in the building rooting against them.",ttuurrppiinn,2023-03-20 00:29:45,kinda feel bad fau year underdog getting neutral fan support instead got pretty much everyone building rooting,-0.43090492486953735
6,Quit making your fucking shots FAU read the room,cory_bdp,2023-03-20 01:28:08,quit making fucking shot fau read room,-0.5737974643707275
7,"Imagine telling FAU fans in the beginning of this year that they'd somehow end up being the big bad favorite in a tournament game everyone was rooting against.  
  
I mean they literally never won a tourney game before this year, or gotten better than 15 seed",SaintArkweather,2023-03-20 01:59:30,imagine telling fau fan beginning year somehow end big bad favorite tournament game everyone rooting mean literally never tourney game year gotten better seed,-0.8069198727607727
8,FAU did the impossible. They got me to root for Tennessee athletics.,sparside223,2023-03-20 02:15:49,fau impossible got root tennessee athletics,-0.35664594173431396
9,That dunk attempt just turned everyone against them. They beat the 16 Cinderella. We can forgive that. But now? Nah.,Littledawg24,2023-03-20 02:16:24,dunk attempt turned everyone beat cinderella forgive nah,-0.014735441654920578
10,"As a fan of FDU since 48 hours ago, I've been waiting for this day my whole life.",dinozaurs,2023-03-19 22:50:10,fan fdu since hour ago waiting day whole life,0.014236196875572205
11,AMERICA'S TEAM VS SOME FLORIDA TEAM. WE ALL KNOW WHO WE ARE ROOTING FOR LETS GO FDU! SLAUGHTER THEM,RetlocPeck,2023-03-19 22:45:54,america team v florida team know rooting let go fdu slaughter,-0.37754422426223755
12,"FDU won 4 games last year, hired a D2 coach, didn’t win the conference tourney, and played in the first four. It’s insane that they are here",uturnorbit,2023-03-20 01:33:42,fdu game last year hired coach win conference tourney played first four insane,-0.16730691492557526
13,"Sorry FAU, in most situations people would be rooting for you.",soxfan1313,2023-03-20 01:42:26,sorry fau situation people would rooting,-0.6878770589828491
14,Dayton loaning their band to FDU's unexpected tournament run is such a wholesome march madness story,macncheeseface,2023-03-20 01:46:59,dayton loaning band fdu unexpected tournament run wholesome march madness story,-0.01735439896583557
15,FDU is the only school that could make FAU look like a  villain lmao,jjh2004,2023-03-20 01:50:55,fdu school could make fau look like villain lmao,-0.07592098414897919
16,Oh that dude is gonna get REAMED by his coach for that,That_One_Pancake,2023-03-20 02:14:21,oh dude gon na get reamed coach,-0.05978383868932724
17,"We will kill FAU

This transgression will not stand",[deleted],2023-03-20 02:14:26,kill fau transgression stand,-0.39537540078163147
18,"Showboating at the end of a victory over a 16 seed is awful karma, guess I’m rooting for Tennessee now next weekend",cov2445,2023-03-20 02:16:20,showboating end victory seed awful karma guess rooting tennessee next weekend,-0.32579827308654785
19,"FAU was just excited that they knocked off the powerhouse program, Fairleigh Dickinson",Immediate-Recipe-642,2023-03-20 02:22:43,fau excited knocked powerhouse program fairleigh dickinson,-0.05017321556806564
20,Game of the day,ddottay,2023-03-19 23:34:33,game day,0.02100525051355362
21,So you're telling me a 16 seed has only ever lost once in the men's second round? I like those odds...,RPBTinesIII,2023-03-20 00:29:55,telling seed ever lost men second round like odds,-0.44445765018463135
22,We are all living in Tobin Anderson’s NCAA Basketball 2010 Dynasty Mode. Don’t worry he’s stopping the sim and joining the game very soon,ledhotzepper,2023-03-20 01:49:21,living tobin anderson ncaa basketball dynasty mode worry stopping sim joining game soon,-0.11856941878795624
23,I love how we all hate FAU tonight but will be their biggest fans next week- March is undefeated,Ahambone,2023-03-20 02:05:48,love hate fau tonight biggest fan next week march undefeated,-0.013362646102905273
24,Why am I so invested in FDU lol I’m about to rage cry,ErickBachman,2023-03-20 02:09:00,invested fdu lol rage cry,-0.0406593382358551
25,"If you're going to showboat like that, you better not miss...",trekologer,2023-03-20 02:13:32,going showboat like better miss,-0.017606794834136963
26,And now I'm cheering against FAU for that.,EyePlay,2023-03-20 02:13:39,cheering fau,0.002796916291117668
27,FUCK that. End the game with some goddamn sportsmanship. I'm glad he duffed that dunk in front of EVERYBODY.,cincycusefan,2023-03-20 02:14:04,fuck end game goddamn sportsmanship glad duffed dunk front everybody,-0.3746536672115326
28,Dude trying to show up a 16 seed. What a loser.,radicalgator87,2023-03-20 02:14:08,dude trying show seed loser,-0.4566044807434082
29,That asshole dunk being rejected by the rim made me laugh.,CybeastID,2023-03-20 02:14:11,asshole dunk rejected rim made laugh,-0.6737110614776611
30,Bro why you gotta do that 🤦🏻‍♂️,blenkows,2023-03-20 02:14:18,bro got ta,0.01004122942686081
31,Doing that after barely beating a 16th seed? Bush league,PurpSamsquanch,2023-03-20 02:14:25,barely beating th seed bush league,0.02059677243232727
32,And that kid waving like they just beat a 1 seed... gtfo,I_Love_You_Sometimes,2023-03-20 02:15:20,kid waving like beat seed gtfo,-0.07955101132392883
33,Absolutely classless move by Martin there…I get that we had to play villains all game but there’s no need for that,FriedFishFan,2023-03-20 02:16:32,absolutely classless move martin get play villain game need,-0.5696298480033875
34,"Give him some credit guys, his team just beat THE farleigh dickinson university",Equivalent-Impress96,2023-03-20 02:16:59,give credit guy team beat farleigh dickinson university,-0.08599613606929779
35,"That guy on FAU should’ve gotten his shit rocked

What horrible sportsmanship. TENNESSEE beat this team by fucking 90.",Ryry77,2023-03-20 02:16:59,guy fau gotten shit rocked horrible sportsmanship tennessee beat team fucking,-0.7644269466400146
36,I hope a clip of that missed 360 dunk by FAU is in the 'one shining moment' montage after the championship,mruab,2023-03-20 02:17:34,hope clip missed dunk fau one shining moment montage championship,-0.06102500855922699
37,That missed windmill dunk when they should have held and then taunting in the tunnel is real peaked at  college shit.,TheTownTeaJunky,2023-03-20 02:18:00,missed windmill dunk held taunting tunnel real peaked college shit,-0.1276026964187622
38,I have tears in my eyes from laughing at that dumbfuck missing the dunk 🤣,PhoneAcc23,2023-03-20 02:18:40,tear eye laughing dumbfuck missing dunk,-0.4730806052684784
39,The dunk was classless. He should’ve waiting until time ran out or not done it at all. I was actually relieved that it didn’t go in.,[deleted],2023-03-20 02:22:01,dunk classless waiting time ran done actually relieved go,-0.006185770034790039
40,Cannot say enough how much I hated that dick move at the end…Martin apparently learned nothing after having an entire arena turn on the team,FriedFishFan,2023-03-20 02:24:52,say enough much hated dick move end martin apparently learned nothing entire arena turn team,-0.8642847537994385
41,"damn now I have to root for  multi-billionaire princeton as the underdog, wanted to see the 16 seed go deep",oarabbus,2023-03-20 02:25:20,damn root multi billionaire princeton underdog wanted see seed go deep,-0.3684985339641571
42,"I don’t wanna pretend like FDU was some sleeper team, but at the very least they have not looked like a bottom of D1 team defensively this tournament like Ken Pom said",McNutt4prez,2023-03-20 00:32:15,wan na pretend like fdu sleeper team least looked like bottom team defensively tournament like ken pom said,-0.07065662741661072
43,"Fau, yall are literally ruining everything",fancycheesus,2023-03-20 01:42:08,fau yall literally ruining everything,-0.8176777958869934
44,FDU coach is the epitome of 'let them cook'. Never calls timeout lol,ekimtk,2023-03-20 01:49:06,fdu coach epitome let cook never call timeout lol,-0.39424949884414673
45,FDU has another run in them. I can feel it.,Life_Act_6887,2023-03-20 01:50:36,fdu another run feel,0.016860362142324448
46,FDU is America’s Team tonight,Chardoggy1,2023-03-19 23:23:41,fdu america team tonight,-0.047524817287921906
47,"#WE ARE...

#FAIRLY

#DECENT

#UNIVERSITY!",indreams159,2023-03-20 00:24:26,fairly decent university,0.0309844221919775
48,Maybe FDU can afford a full mascot after this run,lawrence_uber_alles,2023-03-20 00:29:00,maybe fdu afford full mascot run,0.007435888051986694
49,"“They’re missing shots, and they need to make those”

They’re paying these guys HOW MUCH to say that? Lol",Mobile-Tangelo,2023-03-20 01:01:00,missing shot need make paying guy much say lol,-0.23137587308883667
50,"Useless fact: Creighton's win over Baylor means  there is at least one bird team in the Sweet Sixteen

Do we *really need* a second bird team in the Sweet Sixteen?",DerpyDingus,2023-03-20 01:33:18,useless fact creighton win baylor mean least one bird team sweet sixteen really need second bird team sweet sixteen,-0.6298173666000366
51,"When FDU wins im boofing 1000mg of Adderall, loading up my crackpipe (again) and hiking the Appalachian Trial to Madison Square Garden.",Maleficent-Brush-406,2023-03-20 01:38:20,fdu win im boofing mg adderall loading crackpipe hiking appalachian trial madison square garden,0.0017456002533435822
52,The weirdest alternate timeline where FAU is a big school villain. March madness is fucking wild,stevenaccc,2023-03-20 01:52:42,weirdest alternate timeline fau big school villain march madness fucking wild,-0.09365599602460861
53,Bad juju there from FAU. Tennessee gonna smoke them,SurpriseFrenchFries,2023-03-20 02:13:34,bad juju fau tennessee gon na smoke,-0.7211770415306091
54,Now I hope Tennessee absolutely runs over FAU fuck that shit,Titans55,2023-03-20 02:14:35,hope tennessee absolutely run fau fuck shit,-0.3996660113334656
55,I vow to hate FAU for the rest of my life,cory_bdp,2023-03-20 02:14:44,vow hate fau rest life,-0.767612636089325
56,"""It's ok we're on trutv""",jlt6666,2023-03-20 02:17:26,ok trutv,0.11449179798364639
57,"As a neutral fan, this is quite possibly the most exciting game of the tournament.",SANTAAAA__I_know_him,2023-03-20 01:34:52,neutral fan quite possibly exciting game tournament,0.13052117824554443
58,"Having believed for most of my life that I wasn’t good at basketball because I was short, I can’t say that after FDU. I’m just not good at basketball",MrPopps,2023-03-20 01:41:52,believed life good basketball short say fdu good basketball,0.009945616126060486
59,FAU is like the generic enemy team in the Disney movie who doesn't have any memorable highlights compared to the hero team's insane antics but the game is somehow always close,[deleted],2023-03-20 01:42:44,fau like generic enemy team disney movie memorable highlight compared hero team insane antic game somehow always close,-0.03748181462287903
60,cringe from fau,allnewluke,2023-03-20 02:13:29,cringe fau,-0.6151792407035828
61,Bruh that was just wrong…*and* he missed it lmao,canadianbroncos,2023-03-20 02:14:05,bruh wrong missed lmao,0.0045548975467681885
62,That was bitch made and I’m glad he bricked that,EveningLength8,2023-03-20 02:14:07,bitch made glad bricked,-0.5653553009033203
63,Actually kind of hilarious that he missed it lol,slim353,2023-03-20 02:14:20,actually kind hilarious missed lol,0.02150164544582367
64,"Welp FAU trying to rub it in the 16 seed's face isn't going to buy them much underdog love

(Do I have to root for UT now?)",NewbMastah69,2023-03-20 02:14:22,welp fau trying rub seed face going buy much underdog love root ut,-0.05311089754104614
65,And just like that cinderella is now public enemy #1. What a doofus lol,tsblank97,2023-03-20 02:14:46,like cinderella public enemy doofus lol,-0.06102907657623291
66,Lmao “I been trying to prove this shit since..”,ehs4290,2023-03-20 02:16:35,lmao trying prove shit since,-0.07273785769939423
67,Well. I guess we have a few more neutrals on our side now lmfao,[deleted],2023-03-20 02:16:17,well guess neutral side lmfao,-0.004085272550582886
68,A random midmajor 9 seed has me pulling for Tennessee lol,[deleted],2023-03-20 02:16:28,random midmajor seed pulling tennessee lol,0.038742661476135254
69,[removed],[deleted],2023-03-20 02:19:42,removed,-0.36443963646888733
70,This is some insanely biased reffing in favor of FDU but I’m here for it,HornyAardvarks,2023-03-20 00:32:22,insanely biased reffing favor fdu,-0.5220820903778076
71,"My girlfriend walked in during the Purdue-FDU game and asked “What does FDU stand for? Fuck Daddy University?”

And so they are forever known in my world.",whole_lot_of_velcro,2023-03-20 01:00:05,girlfriend walked purdue fdu game asked fdu stand fuck daddy university forever known world,-0.6762933135032654
72,"I thought FDU would get the doors blown off of them, if nothing else props to them for making this an exciting game so far",cov2445,2023-03-20 01:42:10,thought fdu would get door blown nothing else prop making exciting game far,-0.19125136733055115
73,"That missed travel really lead to this, un fucking real.",[deleted],2023-03-20 02:04:08,missed travel really lead un fucking real,-0.4072643518447876
74,Cant imagine being told a month ago that I would become this invested in Fairleigh-Dickinson basketball.,Raticus9,2023-03-20 02:06:57,cant imagine told month ago would become invested fairleigh dickinson basketball,-0.3199692964553833
75,"FDU got killed by their turnovers. Shame they're going out after a tough fight, but they'll always be remembered fondly. So proud of their coach and these guys. They'll always remember this",mrmcspicy,2023-03-20 02:09:24,fdu got killed turnover shame going tough fight always remembered fondly proud coach guy always remember,-0.1930983066558838
76,#OH THATS BAD KARMA,ledhotzepper,2023-03-20 02:13:32,oh thats bad karma,-0.8734616041183472
77,What a tool hahah fuck that guy,hans_guuber,2023-03-20 02:13:44,tool hahah fuck guy,-0.690831184387207
78,"WHAT A FUCKING ASSHOLE MOVE HOLY SHIT

DO NOT TRY TO 360 SLAM DUNK WHEN YOU WIN AGAINST THE UNDER DOG BY 8

FUCK YOU. YOU ARE A PIECE OF SHIT FOR DOING THAT",AlexB_SSBM,2023-03-20 02:13:49,fucking asshole move holy shit try slam dunk win dog fuck piece shit,-0.8872403502464294
79,"Cool, hope Tennessee executes them. Trash ass move, what a bum",PresWhale-iamHTaft,2023-03-20 02:14:06,cool hope tennessee executes trash as move bum,-0.14229285717010498
80,"I hope they get ass fucked by Tennessee just for that, fuck them and that guy",BL00DEE,2023-03-20 02:14:43,hope get as fucked tennessee fuck guy,-0.8089841604232788
81,FAU just earned that villain status…,MamawRex,2023-03-20 02:15:16,fau earned villain status,-0.07416751980781555
82,I'm really fucking tired of all these Paxlovid ads.,runevault,2023-03-20 00:47:32,really fucking tired paxlovid ad,-0.24108386039733887
83,Who wants an A in the middle of their FU when putting the D in FU so much better.,a_banned_user,2023-03-20 01:28:47,want middle fu putting fu much better,0.033136963844299316
84,"I keep having to double take on the time left. It feels like we're in the waning minutes, but still so much time left. This pace and intensity is amazing!",parzatx,2023-03-20 01:42:03,keep double take time left feel like waning minute still much time left pace intensity amazing,-0.11586913466453552
85,FDU>UMBC no matter what. At least their second game (actually third) is still exciting & they showed up to go to war.,crowd79,2023-03-20 01:44:08,fdu umbc matter least second game actually third still exciting showed go war,0.016900479793548584
86,We need an FDU bandwagon flair,PNW_Jeff,2023-03-20 01:44:27,need fdu bandwagon flair,0.08819591999053955
87,You know a group captures your heart when you have FAU in a $5k+ survivor pool and still kinda want to root for Fairleigh Dickinson,8686tjd,2023-03-20 02:08:46,know group capture heart fau k survivor pool still kinda want root fairleigh dickinson,0.020383261144161224
88,Now they’re the villains,Sirrenderthe69th,2023-03-20 02:13:41,villain,-0.4638170003890991
89,Classless shit there,Rockerblocker,2023-03-20 02:14:11,classless shit,-0.8088167309761047
90,"Man, fuck FAU after that.",Madscientist1683,2023-03-20 02:14:45,man fuck fau,-0.7506433129310608
91,ITS FUCK FAU NOW,gobirds18_,2023-03-20 02:14:48,fuck fau,-0.8087833523750305
92,Now they are the villains for the Tennessee matchup… yikes. Probably shouldn’t show boat after barely beating a 16 seed,CanadianHockeySyrup,2023-03-20 02:15:16,villain tennessee matchup yikes probably show boat barely beating seed,-0.11202222108840942
93,jesus christ what a fucking asshole man!,indreams159,2023-03-20 02:16:58,jesus christ fucking asshole man,-0.9189218878746033
94,"This feels, based on the announcing, like an FDU game featuring Florida Atlantic lol",mhgiantsfan,2023-03-20 00:10:43,feel based announcing like fdu game featuring florida atlantic lol,0.03738805651664734
95,"Feels like FDU played pretty poorly and yet, FAU didn’t put them away.",ddottay,2023-03-20 00:55:06,feel like fdu played pretty poorly yet fau put away,-0.17123949527740479
96,FAU obviously would’ve been the crowd favorite had Purdue won lol. So crazy how things change,loyalsons4evertrue,2023-03-20 01:20:55,fau obviously would crowd favorite purdue lol crazy thing change,0.008553802967071533
97,lol there's a guy here with a St. Peter's jersey too! hahaha,indreams159,2023-03-20 01:31:12,lol guy st peter jersey hahaha,0.023909227922558784
98,It must be so cool for these FDU guys to be playing in the round of 32 and hear the entire stadium chanting their name. It kind of brings a tear to my eye :'),ILkeSportzNIDCWhKnws,2023-03-20 01:34:54,must cool fdu guy playing round hear entire stadium chanting name kind brings tear eye,-0.0008757512550801039
99,If you don't love seeing a NEC and a CUSA school face each other for a sweet sixteen spot can you really say you love college basketball?,dsota2,2023-03-20 01:43:01,love seeing nec cusa school face sweet sixteen spot really say love college basketball,-4.1222432628273964e-05
100,"If FAU wins, it’s because they are playing their best, and not because FDU was an easy opponent. FDU is playing even better than they were last game.",ChargeisKill,2023-03-20 01:44:39,fau win playing best fdu easy opponent fdu playing even better last game,-0.001548971515148878
101,How good is Merrimack is the question,belmontbreak,2023-03-20 01:49:11,good merrimack question,0.09967044740915298
102,"This being FDU's 3rd game in 5 days, I'm really impressed by how energetically they're playing.",kanshawk15,2023-03-20 01:57:48,fdu rd game day really impressed energetically playing,0.0015091050881892443
103,"Every time there’s a walk, I turn into the DiCaprio meme the second before they call it lmao",coltsmetsfan614,2023-03-20 01:58:23,every time walk turn dicaprio meme second call lmao,-0.23340405523777008
104,It’s kinda hilarious that the villains of the night have also never been to the sweet 16 and are only the villains out of circumstance,SeekerSpock32,2023-03-20 01:58:47,kinda hilarious villain night also never sweet villain circumstance,-0.3122553527355194
105,"FDU hung in there, made some bad plays down the stretch 

They had a legit chance to get to the sweet 16",Free_Joty,2023-03-20 02:09:07,fdu hung made bad play stretch legit chance get sweet,-0.11998090147972107
106,Classless,tvchase,2023-03-20 02:13:33,classless,-0.6237756609916687
107,Wow fuck that guy,C_CityOfTheDF_Steady,2023-03-20 02:13:38,wow fuck guy,-0.9137017726898193
108,That was uncalled for and deserved the boos.,k614,2023-03-20 02:13:43,uncalled deserved boo,-0.5557255148887634
109,Good thing the bitch ass fucker missed it,HerkulezRokkafeller,2023-03-20 02:13:44,good thing bitch as fucker missed,-0.1629084348678589
110,"They're right to boo him on that, and he missed it!",VinceValenceFL,2023-03-20 02:14:16,right boo missed,-0.35067930817604065
111,Boy I was ready to get behind FAU. Now I have to root for Tennessee,immaculatebacon,2023-03-20 02:14:35,boy ready get behind fau root tennessee,-0.002269648015499115
112,If you’re gonna do that at least make the dunk  lmao what a loser,[deleted],2023-03-20 02:16:13,gon na least make dunk lmao loser,-0.3942493796348572
113,Lol “we’re on tru tv” they don’t care,theopression,2023-03-20 02:17:11,lol tru tv care,0.01535603404045105
114,That guy at the end for FAU was a dick.,ItsPosey,2023-03-20 02:30:19,guy end fau dick,-0.15295414626598358
115,"Potential seedigami here if 16 beats 9.

https://preview.redd.it/he34kh9zntoa1.png?width=1203&format=pjpg&auto=webp&s=6c2943315584adc2b60336c28c9f55626da04ee1

Actually wouldn't mind seeing Florida Atlantic win though as I think they'd have a real chance of making the final four which would be absolutely insane for a team with only one previous appearance in the tournament (a 15 seed in 2002)",SaintArkweather,2023-03-19 23:31:29,potential seedigami beat actually mind seeing florida atlantic win though think real chance making final four would absolutely insane team one previous appearance tournament seed,-0.045303672552108765
116,This fuckin coach talks as fast as these teams push the ball,[deleted],2023-03-20 00:35:30,fuckin coach talk fast team push ball,-0.4130471348762512
117,This doesnt make sense. Like FDU is *not good*. Theyre 300+ in kenpom. This isnt some underrated mid major that the committee scorned,Ok-Flounder3002,2023-03-20 01:23:35,doesnt make sense like fdu good theyre kenpom isnt underrated mid major committee scorned,-0.28009703755378723
118,This arena is pretty lit considering a team from New Jersey is playing a team from Florida in central Ohio,macncheeseface,2023-03-20 01:28:19,arena pretty lit considering team new jersey playing team florida central ohio,0.08968484401702881
119,It cracks me up that FDU doesn’t even have a logo,mbh223,2023-03-20 01:29:52,crack fdu even logo,-0.09757155179977417
120,Fact of the matter is that if Florida Atlantic wins this it means they hate fun and happiness and probably puppies,dizZzy5,2023-03-20 01:30:55,fact matter florida atlantic win mean hate fun happiness probably puppy,-0.037279874086380005
121,My only hope is that FDU wins the tournament so our R1 loss doesnt look as bad,jakurek,2023-03-20 01:34:32,hope fdu win tournament r loss doesnt look bad,-0.00017689168453216553
122,Imagine telling FAU after winning the CUSA that everyone would be rooting against them as the heavy favorites against a much more likeable team,[deleted],2023-03-20 01:34:41,imagine telling fau winning cusa everyone would rooting heavy favorite much likeable team,-0.02427254244685173
123,FDU has went from like 1000 fans to 1mil in the past few days. Love it! They are the ultimate underdog that most of us have ended up pulling for. Can't beat March Madness.,PralineAggravating89,2023-03-20 01:34:56,fdu went like fan mil past day love ultimate underdog u ended pulling beat march madness,-0.11161229759454727
124,Pure fucking hustle by FDU but FAU just not shaken by the pressure at all.,ieatplaydough,2023-03-20 01:42:06,pure fucking hustle fdu fau shaken pressure,-0.281452476978302
125,The gap between 16 seed and the one seed has definitely tightened by a lot in recent years. Used to be a guarantee that a 1 seed would win by a ton over a 16 seed. That's not so much the case anymore. I'd love to see FDU make history again with the first 16 seed to ever make the sweet 16. Of course I wouldn't mind fau make the sweet 16 either.,shawn131871,2023-03-20 01:42:55,gap seed one seed definitely tightened lot recent year used guarantee seed would win ton seed much case anymore love see fdu make history first seed ever make sweet course mind fau make sweet either,-0.15306483209133148
126,"These teams looks so much more competent than the MSU, Marquette game.",majikjohnson,2023-03-20 01:49:35,team look much competent msu marquette game,0.014534033834934235
