Comment,Author,Created UTC
What a horseshit call,flipz4444,2023-03-17 19:37:34
That’s a bad call,_Hank_Marducas_,2023-03-17 19:37:35
wheres the foul,-motts-,2023-03-17 19:37:38
Yeah that’s bad,SeekerSpock32,2023-03-17 19:37:42
Bad bad bad,coastalneer,2023-03-17 19:38:11
First the Kennesaw st game now this reffing is making these games unwatchable,No-Lab7758,2023-03-17 19:38:35
FUCK YEAH STEVIE,coilmeup,2023-03-17 19:38:35
Anybody got a replay link of the call before half?,itwasnewtome,2023-03-17 19:59:59
Iowa State WTH?,coilmeup,2023-03-17 20:01:22
Kolek! Why!?!,millertime1419,2023-03-17 20:02:55
Vermont would be beating half of the tournament teams rn,AeroStatikk,2023-03-17 20:03:02
Dumb foul Kolek,Dekalbian,2023-03-17 20:03:13
Shaka going way out into the court has always bothered me,ttuurrppiinn,2023-03-17 20:05:43
These boys hanging around !!,AFC-Wimbledon-Stan,2023-03-17 20:05:47
Vermont is getting some decent looks from 3. Just not making any.,mrwboilers,2023-03-17 20:05:59
"Two Indiana folk on Vermont?

Sign me up!!!!",Stang1776,2023-03-17 20:08:01
Literally just give the ball to Oso,WIN011,2023-03-17 20:08:09
Come on that’s perfect defense!,0pticle,2023-03-17 20:08:34
Kam? Could you… idk… do something?,millertime1419,2023-03-17 20:10:06
aaaand just like that game over,CoachKillerTrae,2023-03-17 20:13:39
"Death

Taxes

Sketchy charge/blocking calls in close games",mjr2p3,2023-03-17 20:14:19
Why is Brutus in a March Madness commercial?,eclectic_tastes,2023-03-17 20:15:35
All right take 15 everyone,FedGoat13,2023-03-17 20:20:21
Game over,humorousmoose,2023-03-17 20:24:46
These guys really cannot shoot all of a sudden lol,humorousmoose,2023-03-17 20:31:59
Ill take a milkshake too Jamie,sarcasmrules18,2023-03-17 20:47:54
Jesus christ why the fuck are you calling off the dogs Vermont? You're losing!,MichaelSquare,2023-03-17 20:50:11
RING OUT,Spectre1919,2023-03-17 20:51:24
Starting to wonder if Marquette is getting a bit uneasy seeing what’s happening to the #2 team in the Big East right now…,Meanteenbirder,2023-03-17 18:03:50
Fuckin BS calls for the Big East all day,IAMnotMcKaylaMaroney,2023-03-17 19:37:57
Did Shaka get hair plugs? He went from bald for years to a head full.,Windshieldpoop,2023-03-17 19:41:18
"I miss when it was 45-40, Marquette just too hot",IAMnotMcKaylaMaroney,2023-03-17 20:31:13
"Refs definitely see a bit one-sided in this....

Our defenders feet were planted and he just jumped into our guy as he was shooting...",DrDilatory,2023-03-17 19:24:51
Marquette looks pretty vulnerable. Veront hasn’t really played that well.,JayMoney2424,2023-03-17 19:34:49
"If Vermont has 1 million fans, I am one of them. If Vermont only has one fan, I am that one. If Vermont has no fans... then I am dead.",slayerhk47,2023-03-17 19:01:55
Why would they tell us that Kolek’s dad is abusive and frame it as a good thing,fluffyglof,2023-03-17 19:20:39
Wait what?? He didn’t touch him?,ToeSuckingFiend,2023-03-17 19:37:29
That ref was so close to t’ing up the Vermont coach too after getting called out for that phantom call lmao,theopression,2023-03-17 19:39:37
The refs dicking us omg 💔,utocmc2020,2023-03-17 19:40:37
"Same as every fucking year, they play just well enough for me to have some hope that they'll upset a much stronger team and then blow it at the end, I hate watching this team lmao",DrDilatory,2023-03-17 20:24:07
[Every single year...](https://i.ibb.co/M8G6Spb/Screenshot-20230317-163219-Samsung-Internet.jpg),DrDilatory,2023-03-17 20:33:11
Vermont getting hosed,mrwboilers,2023-03-17 19:39:23
Marquette is slapping the floor up 24 pts. Wtf,Digital_Dutch,2023-03-17 20:40:58
That’s not good hopefully Kolek alright,GingerMan313,2023-03-17 18:56:31
No upsets this afternoon I guess,[deleted],2023-03-17 19:48:11
2 seed needing absurd help by the refs to only barely keep a lead,DrDilatory,2023-03-17 20:08:56
Bad call. I'll take it tho,gandaalf,2023-03-17 19:37:53
"Patiently waiting for a makeup call, any day now please...",DrDilatory,2023-03-17 20:01:41
Let's go Vermont!,inevitablescape,2023-03-17 19:02:44
Where's the foul????,DrDilatory,2023-03-17 19:04:27
yeah we just don’t have it this year man we need more athletism to make a run,CoachKillerTrae,2023-03-17 19:15:58
How many fouls is it to foul out in NCAA?,DrDilatory,2023-03-17 20:02:34
"We never were all that likely to win in the first place, but now if we lose I'm going to spend the entire year pretending the only reason we lost was because of that call, thanks refs",DrDilatory,2023-03-17 19:54:13
One thing I've noticed about Marquette is that they struggle without their starting PG. Few teams have the luxury that MSU does with Tyson Walker being able to run the show if Hoggard is out,brownblackmamba,2023-03-17 20:16:14
"I'll bet you money that Are You Winning service is run by Caesars or some other book lol

The whole thing is a racket that runs deep",GreatestWhiteShark,2023-03-17 20:05:18
Clearly pushed off,pdxaidan,2023-03-17 20:09:38
"No intent at all but that had to be a flagrant, avoid undercutting other players at really all costs",Lionslions670,2023-03-17 20:21:41
Marquette has needed help from the refs to barely beat a 15 seed that hasn’t even played great.,JayMoney2424,2023-03-17 20:09:44
"Sad to see calls go against an underdog but that’s a foul, if you cut across a guy at full speed and make *any* contact it basically has to be called

Edit: he clearly caught him with his arm, good lord any calls going to a higher seed makes people lose their minds",byzantiums,2023-03-17 19:38:40
Huge for us,DrDilatory,2023-03-17 18:56:17
marquette just a different tier than vermont is,friedmpa,2023-03-17 19:17:32
That's big! Kolek picked up his 3rd foul.,spierce64006,2023-03-17 20:03:48
Vermont hanging around. That should've of been a charge a moment ago. Robin Duncan had the position.,spierce64006,2023-03-17 20:10:10
Jumped like a man who knows how important that shot was for his career lol,[deleted],2023-03-17 20:13:19
VCU NEVER SHOULD HAVE BEEN IN THE 2011 TOURNAMENT THEIR RUN WAS A PACK OF ***LIES***,Pollaski,2023-03-17 20:42:36
[deleted],[deleted],2023-03-17 20:47:44
Pretty dangerous play there,JayMoney2424,2023-03-17 20:20:20
"First time seeing Marquette, Kam Jones has a little James Harden in him. Maybe it's just being a lefty?",somasomore,2023-03-17 20:30:20
what is wrong with these goddamn refs they literally picked marquette to win it all yes im salty vermont basketball has nothing,CoachKillerTrae,2023-03-17 20:11:04
"These Marquette fans have the most annoying chants I’ve ever heard. Is it a whole sorority chanting this or something?

I might have to watch Sunday’s game on mute",Rockerblocker,2023-03-17 20:33:54
[deleted],[deleted],2023-03-17 20:31:18
I saw Marquette was in OT and got really excited. I then realized they were playing South Florida and it was the women’s bracket. Good game though!,feralihatr,2023-03-17 17:46:56
"If Vermont brings the same energy as last year, this game will be a good one. Marquette hasn’t been getting many offensive rebounds and the Cats have been cleaning boards on that end. If the first chance shots don’t fall for Marquette, they could be in trouble.",Wolf_of_Walmart,2023-03-17 18:22:14
Staying up for a 2am tipoff local time. MU RAH RAH!,Spectre1919,2023-03-17 18:51:24
Are you fucking kidding me,WIN011,2023-03-17 18:55:57
our tiny ass gym is throwing off our depth perception geez. we’re gonna need to not throw the ball away in the corner if we wanna win,CoachKillerTrae,2023-03-17 19:00:29
The Mario movie looks hella fun and I'm tired of pretending it doesn't,TheyCallMeStone,2023-03-17 19:00:44
Hopefully it was just blood. Weird that the ref stopped play on the defensive end for anything other than blood or a concussion,_Hank_Marducas_,2023-03-17 19:00:49
FUCK YEAH,coilmeup,2023-03-17 19:01:37
ugh kolek’s baxk we may be fucked,CoachKillerTrae,2023-03-17 19:01:48
Oh yeah Chase,coilmeup,2023-03-17 19:02:14
Yes get Sean out here,coilmeup,2023-03-17 19:03:49
"Looks like Koleks right wrist. He’s a lefty, so that’s good…",MayIServeYouWell,2023-03-17 19:03:52
SHABANG,coilmeup,2023-03-17 19:05:01
"I'm surprised no one's said it yet,

I'm favoring Vermont just because it's the green team on St. Patrick's day!",TooHotForDog,2023-03-17 19:08:04
MAKE FREE THROWS PLEASE,coilmeup,2023-03-17 19:14:18
Kam not being good at 3s infuriates me.,ApprehensiveCorgi867,2023-03-17 19:14:46
Boots on the ground here. JOP TRAIN HAS ARRIVED,CarrollPC,2023-03-17 19:15:03
Early  foul trouble for the Catamounts. Finn Sullivan and Robin Duncan already with 2 each.,spierce64006,2023-03-17 19:15:03
Wonder if kam jones spends all his time just practicing 3s and never does any practice on free throws,beasty9000,2023-03-17 19:18:26
They're giving us chances and we just keep fucking blowing it,DrDilatory,2023-03-17 19:20:53
Great job Chase for dodging that ball,coilmeup,2023-03-17 19:23:10
UMass-Dartmouth Corsairs mention by CBS!,spierce64006,2023-03-17 19:23:12
Where Shaka get all that hair from?,arbitrator06,2023-03-17 19:23:15
Can Vermont hold on to the ball?,laughoutloud102,2023-03-17 19:23:45
Only 3 fouls is nice.,coilmeup,2023-03-17 19:23:52
OMax!,Dekalbian,2023-03-17 19:23:58
That’s a bad call,JayMoney2424,2023-03-17 19:25:17
Hard to believe Shaka hasn’t made a 2nd round in a decade,albeve,2023-03-17 19:26:32
How that wild possession turned into a three.,americanbaseball,2023-03-17 19:26:57
Vermont needs to step up on defense,inevitablescape,2023-03-17 19:27:34
[deleted],[deleted],2023-03-17 19:28:45
Isn’t this a 30 second timeout?,beasty9000,2023-03-17 19:34:40
Please give the ball to Oso more please,coilmeup,2023-03-17 19:37:22
?????,Brady331,2023-03-17 19:37:47
"That’s so bad, wow.",MookieSweats,2023-03-17 19:37:52
David Joplin with 10 for Marquette. Matt Veretto leads the Vermont with 9.,spierce64006,2023-03-17 20:01:43
They can’t handle Oso.,millertime1419,2023-03-17 20:03:57
Oso takeover,SnakeMilker,2023-03-17 20:04:30
Saw that spin coming from a mile away,humorousmoose,2023-03-17 20:04:42
God are Koleks nails all bloody?,coilmeup,2023-03-17 20:04:45
Mitchell should throw a Vermont jersey on. Gets to the tournament and thinks he's a star,rccola4422,2023-03-17 20:06:38
Jesus christ Reddit is dying every other minute on me.,[deleted],2023-03-17 20:09:13
Why does this team stop moving the ball every time kolek goes out,P1kachu2_,2023-03-17 20:10:08
This red has a wagon,_Hank_Marducas_,2023-03-17 20:21:47
Dickie V drinking coors light? It all makes sense now,Jordanwolf98,2023-03-17 20:26:14
Hard being an Orange fan that year. My girlfriend (now wife) was giving me so much grief that year. I’m like there is no way they beat Syracuse. She ended up picking UVM in her bracket and won the whole pool that year.,Intelligent_Shirt_50,2023-03-17 20:39:26
Rip groovy UV,[deleted],2023-03-17 20:49:50
"Let’s goooo!!! 

WE ARE!",millertime1419,2023-03-17 20:49:52
4:49 EST finish,[deleted],2023-03-17 20:49:55
LFG,coilmeup,2023-03-17 20:49:58
K,confirmd_am_engineer,2023-03-17 21:00:12
"Cuz Vermont pulled so far ahead everyone stopped watching? 

Ya me too",DrDilatory,2023-03-17 18:32:13
That’s what I thought about the Arizona-Princeton thread,ddottay,2023-03-17 18:50:56
St John’s played Marquette tight in all 3 games too,_Hank_Marducas_,2023-03-17 20:32:21
That comeback attempt in the last game of the season was brilliant.  Then I hear your coach is out?  Tough breaks...,the_greasy_one,2023-03-17 20:38:51
Big East undefeated so far,Doctor_Phist,2023-03-17 19:07:23
"Iona's a popular upset pick, but I know better than to bet against you guys. 5 teams 5 wins! Hope X's game is the BE's worst look today lol",skyllian-five,2023-03-17 19:09:17
Yeah not fair,footer9,2023-03-17 20:41:26
Glad GE is having a good year.,Chucktownbadger,2023-03-17 19:54:44
"""Its...uh ...yeah when you get late in the tournament it's fun to see where guards....are good and play well.... deep in the tournamen. Clark??""",Spectre1919,2023-03-17 19:56:32
"Yup, as is tradition.  He’s earned at least 1, but not many if any more than that.",Chucktownbadger,2023-03-17 20:25:36
I was shocked he didn’t take that one haha,WIN011,2023-03-17 20:25:49
"Absolutely, I'd be there if I was in driving distance",SnakeMilker,2023-03-17 20:44:42
"Nah, Id prefer spartan fans there. Thanks.",somasomore,2023-03-17 20:44:24
We need all the help (in the stands) we can get,footer9,2023-03-17 20:45:07
the answer is yes.,ApprehensiveCorgi867,2023-03-17 20:53:58
Debating the same. Any idea when our game might be?,millertime1419,2023-03-17 20:46:21
"We hired the wrong guy 9 years ago, now we have the right guy.",millertime1419,2023-03-17 20:45:11
The Wojo years… we don’t like to talk about it…,ArchaicWarden,2023-03-17 20:44:30
Wojo,Dekalbian,2023-03-17 20:43:54
It's been a dark decade,footer9,2023-03-17 20:45:49
Steve Wojo,SnakeMilker,2023-03-17 20:44:09
"Every year in recent memory that we've made it to the tournament that seems true, but I'm not sure this year",DrDilatory,2023-03-17 19:32:32
An honorable death.,millertime1419,2023-03-17 20:33:40
Agreed.,Chucktownbadger,2023-03-17 19:16:06
Maybe not after that shot tho,SnakeMilker,2023-03-17 19:16:26
Didn’t lead to a big swing,Dekalbian,2023-03-17 19:39:55
#MARQUETTE,Dekalbian,2023-03-17 20:31:16
This is the analysis I’m looking for!,brownlab319,2023-03-17 19:33:26
The one game I'm watching this year. My eyes are bleeding.,Ar0n,2023-03-17 19:40:58
Killa who?,eclectic_tastes,2023-03-17 20:16:16
Bam,chuncken,2023-03-17 20:26:15
He’s got sauce,_Hank_Marducas_,2023-03-17 20:27:30
Okay.,millertime1419,2023-03-17 20:42:52
You mean the X-ray vision ref. Can see through anyones body.,nosnack,2023-03-17 19:39:07
"The refs didn’t make Kennesaw State miss all of their shots for like 8 minutes. 

And this call is way worse than that one.",SeekerSpock32,2023-03-17 19:40:33
Had a very good chance of it last year with Ryan Davis and Ben Shungu but this year is a tough one to do it.,spierce64006,2023-03-17 19:42:21
"Dont tell me the mid 2000s was that long ago.

Edit: I forgot the year but you guys damn naer made the sweet 16",Stang1776,2023-03-17 19:41:41
Ya this is a Ross > Stevie game,WIN011,2023-03-17 20:14:16
All that running up and down court 🥵,TheyCallMeStone,2023-03-17 20:21:57
"I feel the same way on some targeting calls in football… play happens so fast, you cant predict what the other guy is going to do. But the refs look at this in super slo-mo, and spend minutes analyzing it… it looks totally different like that",MayIServeYouWell,2023-03-17 20:27:52
"Holy fuck, your flairs… rip on Sunday",millertime1419,2023-03-17 20:32:18
Hiring Tom Crean after Shaka leaves?,Pollaski,2023-03-17 20:46:01
Hearing them in tiny-ass Patrick Gym when they're right on top of the game is an electric experience. They are great at hockey games at the Gut too.,scrapsbypap,2023-03-17 19:11:36
Honestly never thought our band was very good in my time as a student so this is probably accurate,SnakeMilker,2023-03-17 19:14:44
vermont kids are music nerds lol,CoachKillerTrae,2023-03-17 19:18:19
Any way to make a buck...,inevitablescape,2023-03-17 19:11:59
if no one else got us veretto got us,CoachKillerTrae,2023-03-17 19:29:44
Should’ve just taken the layup,WIN011,2023-03-17 19:40:55
And the ball tho at the end,Glass3QuartersFull,2023-03-17 19:51:55
I hate the Jimmy V one where Great Clips exploits his win and struggle just to advertise their stores.,Doctor_Phist,2023-03-17 20:00:32
New Mexico lost at the Pit on Wednesday night.,spierce64006,2023-03-17 20:11:10
shhhhh,CoachKillerTrae,2023-03-17 20:47:47
"Same way anyone becomes a fan of any sports team really, you live in or have a connection to the area

Probably every single catamount fan is a Vermont alumni or a native Vermonter",DrDilatory,2023-03-17 20:34:53
"Figuring they're one of two D1 schools in a state with 650k people (and the other one is freakin Dartmouth), the fanbase can be considerable.",Pollaski,2023-03-17 20:36:13
How do you become a St Peter’s fan?,Rockerblocker,2023-03-17 20:35:52
Haha I went to school there but Burlington loves VT basketball. We don't got many sports so people come from all over the state to watch them. When I was into basketball as a kid that's where my dad would take me,Glass3QuartersFull,2023-03-17 20:35:53
lifelong basketball fans who grew up in rural Vermont like myself 🤙 we had a good run this season but i always kinda knew this wasn’t gonna be the season we were gonna finally pull of a run,CoachKillerTrae,2023-03-17 20:46:06
Fucking pathetic officiating.,flipz4444,2023-03-17 19:38:58
"Wild flair, we are enemies but brothers",scrapsbypap,2023-03-17 19:08:05
Confusing that the city is in Michigan but the school is in Milwaukee.,Meanteenbirder,2023-03-17 18:22:32
Milwaukee.,ApprehensiveCorgi867,2023-03-17 18:21:44
They haven't played against Tyler Kolek yet,TheyCallMeStone,2023-03-17 18:32:23
We love him,_Hank_Marducas_,2023-03-17 19:08:56
"I think they’re playing at nationwide arena, which is where the Blue Jackets nhl team plays. Could be a condensation issue.",confirmd_am_engineer,2023-03-17 19:14:17
This is uninspired at best.,Chucktownbadger,2023-03-17 19:21:53
"Yeah, but I'm not worried. I could easily see MU turn it on next game",gandaalf,2023-03-17 19:23:30
How's Serbia this time of year?,butts6891,2023-03-17 19:26:34
They aren't winning unless they make a bunch of outside shots.,spierce64006,2023-03-17 19:34:45
One of these years they’ll actually pull off the 1st round upset and then actually end up making a deep run,Kodyaufan2,2023-03-17 19:39:06
They want Vermont to win because they’re scared of Tyler “fuck em” Kolek.,millertime1419,2023-03-17 19:43:16
green 4 st pattys day!,ilovefacebook,2023-03-17 19:42:09
Looks like it almost went in too,humorousmoose,2023-03-17 20:06:04
Didn’t you just beat Xavier and make them cry?,FedGoat13,2023-03-17 20:10:47
It's a catholic school but it has public school energy,TheyCallMeStone,2023-03-17 20:17:45
It’s not a public school it’s jesuit,cixzejy,2023-03-17 20:18:22
"All the new Big East schools are private, minus Uconn",DrGeraldBaskums,2023-03-17 20:23:48
Kam does not know who Cam is,WIN011,2023-03-17 20:29:55
Kam*,_Hank_Marducas_,2023-03-17 20:30:13
Put some respect on Kam's name,SnakeMilker,2023-03-17 20:30:15
Who is this Cam you speak of,Dekalbian,2023-03-17 20:30:58
Me too…,Chucktownbadger,2023-03-17 19:22:29
There should be a buzzer on one of the refs hips so that a ref in the booth can have them review shit like that,Augustus13,2023-03-17 19:41:08
[deleted],[deleted],2023-03-17 20:10:02
Ur kidding right?,pdxaidan,2023-03-17 20:09:53
6th fella,LocksTheFox,2023-03-17 19:04:11
Got off to a bad start thanks to a very new lineup and some weird ass scheduling,LocksTheFox,2023-03-17 19:04:46
"Yeah... There are a lot of years where I don't think I'm being a total homer to think that we are a decent upset pick, but I don't think it's in the cards for us this year",DrDilatory,2023-03-17 19:05:11
[deleted],[deleted],2023-03-17 19:04:20
get our Kam cooking ;),LocksTheFox,2023-03-17 19:10:02
Hurting it seems but not hurt.,Chucktownbadger,2023-03-17 19:10:46
Got his thumb a little jammed or hyper extended. Seems fine,Augustus13,2023-03-17 19:10:36
"Don’t give up just yet, got a loooooot of game left.",confirmd_am_engineer,2023-03-17 19:15:01
It's the first half lmao,Common-Community-550,2023-03-17 19:17:13
Hope he comes back for his senior year.,spierce64006,2023-03-17 19:18:50
ik cmon john let’s run a play as well,CoachKillerTrae,2023-03-17 19:16:27
Interesting flair combo. You a big Houser fan?,confirmd_am_engineer,2023-03-17 19:19:16
I went there for the NHL draft years ago. It's a pretty nice arena,LocksTheFox,2023-03-17 19:19:12
"Anytime your normal mail or package is en route, it could be in the same mail bags as a Colorguard sample on its way back to the Exact Science labs. And think about all the people who don’t wash their hands packing that sample up…

;-)",brownlab319,2023-03-17 19:21:47
"Good skiing too, if that’s your thing.",confirmd_am_engineer,2023-03-17 19:24:27
Marquettes defense is killing you,MayIServeYouWell,2023-03-17 19:22:27
DJOOOOOOOOO!,Spectre1919,2023-03-17 19:30:50
We are guarding it now they are just hot,coilmeup,2023-03-17 19:29:10
I like our matchup there lol Hauser and our shooters will get some good looks.,JayMoney2424,2023-03-17 19:32:54
Hes in foul trouble so not much he can do,coilmeup,2023-03-17 19:30:39
You should see the new hockey jerseys we had this year. The greens were fucking *orgasmic*.,LocksTheFox,2023-03-17 19:33:55
I’m sure twitter will have it shortly.,Chucktownbadger,2023-03-17 20:01:24
Always a brutal seed and draw,scrapsbypap,2023-03-17 20:07:48
"They were 50 % in the first half, aren't doing bad at all",IAMnotMcKaylaMaroney,2023-03-17 20:09:53
Hoosiers represent!,Where0Meets15,2023-03-17 20:09:33
He listened to you,Augustus13,2023-03-17 20:15:01
Ayyyyyy,Spectre1919,2023-03-17 20:14:46
No but an inopportune couple of possession there. All the looks from 3 in the 2nd half for UVM have been good looks.,spierce64006,2023-03-17 20:15:18
Eh Xavier has been prone to these types of games all year. I’m just plain nervous in general.,WIN011,2023-03-17 18:17:24
"No game is a given. But you have to focus on your own game, not what’s happening elsewhere. I did like Shaka’s healthy respect for Vermont, so that’s encouraging. I guess we’ll see!",MayIServeYouWell,2023-03-17 18:24:57
Turns out razors exist.,millertime1419,2023-03-17 19:42:38
"A lot of these fouls have been fouls, but that was not one of them",LocksTheFox,2023-03-17 19:25:41
I think that was the only truly bad call. Everything else seems fine to me,gandaalf,2023-03-17 19:28:27
"That was a bad call, but Vermont is pushing off almost every possession.",owmyfreakingeyes,2023-03-17 19:36:17
I think Mich. St will match up very well against either team,Wolf_of_Walmart,2023-03-17 19:36:05
"In the second round when the refs stop sucking the dicks of the higher seed, yeah I think Michigan State is going to win their next game regardless of whether or not it's Marquette or if we somehow pull off the upset and it's us",DrDilatory,2023-03-17 19:40:52
Shaka Smart will do that do a team. I think y’all clown them on Sunday,jrluhn,2023-03-17 19:38:09
EGB’s,millertime1419,2023-03-17 20:42:36
"Wrong. Well, I hope you'll be wrong by this evening 😅",framingXjake,2023-03-17 19:52:19
See the Pitt game?,cixzejy,2023-03-17 19:55:40
"The one 2 seed i had winning it all lost.

I can handle another 2 seed i had going to final four losing again.",Stang1776,2023-03-17 20:10:34
There ya go,WIN011,2023-03-17 20:02:31
All of your guys are defensively sound in their assignments though.  It’s been really impressive thus far.,Chucktownbadger,2023-03-17 19:16:41
"Yeah the previous teams from 2021 and 2022 seasons were definitely stronger. UVM need to hit a lot of 3's if they are going to win this and need big games from Deloney, Penn and Sullivan.",spierce64006,2023-03-17 19:18:02
1 red card or 2 yellows,Stang1776,2023-03-17 20:06:25
5,LocksTheFox,2023-03-17 20:02:52
Okay.,millertime1419,2023-03-17 20:17:09
Okay.,millertime1419,2023-03-17 20:10:29
literally. if we were playing peak basketball rn we’d be the ones up by 5,CoachKillerTrae,2023-03-17 20:11:26
I'm going to enjoy watching you whoop their asses next game,DrDilatory,2023-03-17 20:13:35
"Except, he didn’t make contact, so no.",Exact-Cucumber,2023-03-17 19:40:06
Good thing he didn’t make any contact,[deleted],2023-03-17 19:40:08
But he didn’t make any contact???,coastalneer,2023-03-17 19:39:22
Wrong,MookieSweats,2023-03-17 19:39:08
So no defense?,Stang1776,2023-03-17 19:39:30
If he made the dunk that would of never been called and you call that full speed?,JerryGoDeep,2023-03-17 19:40:26
Literally did not touch the guy. Plenty of space between them. Could slip a phone book through that gap with ease,framingXjake,2023-03-17 19:43:45
feet weren't set,LocksTheFox,2023-03-17 20:10:47
"For his career? We’re double Big East champs, he was BE coach of the year and is in running for national coach of the year. His career is solid.",millertime1419,2023-03-17 20:16:13
This season did enough already for Shaka to be at Marquette as long as he wants tbh,SnakeMilker,2023-03-17 20:14:49
Lmao Shaka has done more for this program than the past 3 coaches did combined. He's good.,TheyCallMeStone,2023-03-17 20:19:13
Why wouldn’t you want the team that beat you to make a run?,millertime1419,2023-03-17 20:52:31
He’s like a lefty Jordan Clarkson,WIN011,2023-03-17 20:31:36
What charge?,RockChalkJewHawk,2023-03-17 20:12:03
"It's just common game cheers from the cheerleaders, sounds like they've got the mics amped up for them too",Spectre1919,2023-03-17 20:36:41
Okay.,millertime1419,2023-03-17 20:34:50
Yep MU is just one big sorority,footer9,2023-03-17 20:36:25
What happened last year to Kentucky?,coilmeup,2023-03-17 20:31:46
It’s March homie. Maybe it Kentucky would’ve gotten a little more hyped last year they wouldn’t have choked,rockies20,2023-03-17 20:33:23
It's the NCAA tournament and they're on a big run,somasomore,2023-03-17 20:33:25
"It’s March Madness, don’t need to be the fun police.",Dekalbian,2023-03-17 20:32:11
Why was Kentucky so hyped against St Peters last year…oh wait,WIN011,2023-03-17 20:32:13
no clap only silence,touristBiscuits,2023-03-17 20:32:22
Oh no. God forbid a team has fun playing basketball and showing emotion!,ArchaicWarden,2023-03-17 20:34:20
Wtf? It’s the NCAA tournament… how boring of a fan are you?,millertime1419,2023-03-17 20:36:35
