Comment,Author,Created UTC
https://youtu.be/3OMmxKiG4LE,slitheringsidew,2023-03-16 01:52:33
Damn ASU is cooking in this first half,bentj101,2023-03-16 01:53:23
"Ouch Nevada, very ouch.",More-Combination9488,2023-03-16 01:53:36
"“Wait what, how did we get here?”-Steve Alford",No_Push4492,2023-03-16 01:53:50
"I feel like if you told a team to go out and only shoot 2 feet from the hoop and it doesn’t matter how many times you do it because we’re going to lose no matter what…

that team would still have more points than Nevada",ImmoralModerator,2023-03-16 01:55:15
😬,submanr,2023-03-16 01:55:48
It’s days like these I dream of me and my friends and enemies at the edge of the Limpopo wilderness. Together in harmony with guns are the ready waiting for the perfect chance to strike. Oh lord please deliver me to the Limpopo wilderness where all my dreams will come true.,slitheringsidew,2023-03-16 01:55:50
Are you kidding me?,mrwhitaker3,2023-03-16 01:56:17
Block party,[deleted],2023-03-16 01:56:18
Where has this Alonzo Gaffney been?,IamCaboose,2023-03-16 01:56:31
Can’t even get a fucking dunk to go down.,ScotTheDuck,2023-03-16 01:56:33
Tough game for the wolf pack,Historical_Score5251,2023-03-16 01:56:35
"If ASU even tried to offensively rebound, we'd be down by 80.",Pura112,2023-03-16 01:56:45
"Maybe Alford can pray his team back into this

Didn’t work when he told that student to pray her rape away while he simultaneous swept it under the rug, but hey it’s worth a shot",cory_bdp,2023-03-16 01:57:19
MERCY RULE,grantp13,2023-03-16 01:57:41
Change up the defense please,coilmeup,2023-03-16 01:57:45
They’re almost on 120 pace.,ScotTheDuck,2023-03-16 01:57:49
PASS THE STICKS,_kingfelix,2023-03-16 01:58:22
"Oh my god…. 

ASU has outscored UVA’s output for the entire game against Duke in the ACC championship. And the first half isn’t even over",cavahoos,2023-03-16 01:58:26
First four to final four?,fancycheesus,2023-03-16 02:00:17
Points!,1nf1niteCS,2023-03-16 02:01:57
I'm having a lot of fun. Such a great game.,lol_smart,2023-03-16 02:04:16
TFW Arizona has food: :(,slitheringsidew,2023-03-16 02:13:58
ASU in this form is a nightmare team for our poor defense. Picking them to make the S16 isn't a total stretch.,LondonIsBoss,2023-03-16 02:15:47
Why tf they showing the Weeknd lmao,[deleted],2023-03-16 02:23:05
I sure hope we don't hang a banner for this appearance,Flycat777,2023-03-16 02:24:54
Feel like this could be a game of right rim left rim. 67% is a wild number,[deleted],2023-03-16 02:26:13
Arizona State is letting that thing fly tonight,mruab,2023-03-16 02:29:37
Just redo the paint in big yellow letters. GuardU is back boys.,Kinesys11,2023-03-16 02:30:51
"Apparently we’re announcing the Devilpalooza artist tonight 

So we could have an epic win and then an epic fail because last year was Chase Atlantic",[deleted],2023-03-16 02:31:43
Respek the Pac,thugmuffin22,2023-03-16 02:33:49
Comeback incoming,lady_wildcat,2023-03-16 02:38:14
NO DON'T FOUL ON A 3 ATTEMPT,Joelsaurus,2023-03-16 02:38:53
An ejection could stir things up,ImmoralModerator,2023-03-16 02:42:51
Nevada doing everything they can to not help themselves.,Joelsaurus,2023-03-16 02:49:20
"Just tuned in, is ASU killing it or is NEV choking?",BugLyfe0228,2023-03-16 02:51:38
I don’t understand how Nevada misses shots by further than they’re even shot from,ImmoralModerator,2023-03-16 02:56:58
"**Me**

**4:20**",kGibbs,2023-03-16 03:14:47
Are they going to put a hundo on them?,mrwhitaker3,2023-03-16 03:16:12
"I mean, I wouldn't want to be compared to John Stockton...",JohnDavidsBooty,2023-03-16 03:18:32
Wow.... The MWC did not deserve 4 teams in the tourney.  The MAC deserved 2 over the MWC having 4.... Yuck.,astro7900,2023-03-16 18:06:01
"I mean it’s a good question, is this basketball",ErickBachman,2023-03-16 01:50:57
Congrats on marrying a babe.,NotABot1235,2023-03-16 01:52:24
Lmao this is amazing and I’d expect nothing less from asu alum,pp21,2023-03-16 01:52:56
Fuck yeah we going all the way!,wcooper97,2023-03-16 01:50:49
They shouldn't have made it after losing to San Jose in the mw tournament,sfr18,2023-03-16 01:22:45
Are you trying to say nobody watches our games?! Heresy,theopression,2023-03-16 01:22:15
Justice for Bill!,Thel3lues,2023-03-16 01:23:03
Hofstra should shut them up just a bit,bh6891,2023-03-16 00:20:25
Aren't we all.,NotABot1235,2023-03-16 01:12:53
Tempe (and really Phoenix metro as a whole) is severely underrated for how hot the women are.,PhirebirdSunSon,2023-03-16 02:30:14
Scouting the next Courtney Simpson,GrouchyTrousers,2023-03-16 01:21:00
Number 1 seed?,RoosterIcy,2023-03-16 01:48:08
Subscribe,Willsears94,2023-03-16 01:48:38
subscribed for more fun facts,ImmoralModerator,2023-03-16 03:10:09
"Woah I didn't know you could put flairs in comments like that, very cool. The facts are also good",CaptainScuttlebottom,2023-03-16 03:10:31
"Subscribe

Very cool information about Nevada!",romanapplesauce,2023-03-16 03:14:24
Thanks Harvard,Joelsaurus,2023-03-16 03:12:07
I think you do.,KingOfThePenguins,2023-03-16 01:50:25
"I mean, ASU is in a much nicer part of town than GCU, can you blame her?",PhirebirdSunSon,2023-03-16 02:31:05
"Leave her and never look back. Also, get checked.",SwizzyDangles,2023-03-16 01:49:20
Agreed,jabronius89,2023-03-16 02:15:35
"Surely it would be the club he has his jersey hung in, no?",TheFinalKiwi,2023-03-16 02:00:31
What's even crazier is Northern Arizona was 1 game away from being in. All 4 AZ universities in the tourney would have been cool.,Shamoofles,2023-03-16 02:17:52
That would be hilarious,EnwardGamerz,2023-03-16 02:20:39
I'm all for it.,KingOfThePenguins,2023-03-16 02:17:48
[deleted],[deleted],2023-03-16 02:18:08
Literally loled at this,dinoian,2023-03-16 02:45:59
"In my totally unbiased opinion, yes",theopression,2023-03-16 03:21:54
I'm partial to Nevada's,_FTP_,2023-03-16 03:23:24
It’s always USC.,_Pill-Cosby_,2023-03-16 10:17:32
You understand this team like a true fan. How much Sun Devil basketball did you accidentally ingest this season?,Muh_Nado,2023-03-16 02:10:01
I mean that’s probably a smart bet regardless.,cpnfantastic,2023-03-16 02:21:19
ASU is hitting its 3s. Simple as that.,Cut-OutWitch,2023-03-16 02:04:06
ASU simply chose not to miss.,TheLadyMagician,2023-03-16 02:05:38
"Every year of the First Four, except 2019, saw one team advance to the Round of 32. They could definitely be that team",SaintArkweather,2023-03-16 02:07:24
Coach is responsible for attitude and energy in the locker room. Alford fucking sucks man. I feel hella bad for our players :/,throwaway4tankies,2023-03-16 02:20:45
Will Baker has done absolutely since 1st half vs USU and Blackshear (who isn't really a PG) is in constant foul trouble and is missing a ton,1nf1niteCS,2023-03-16 02:20:15
You shut your damn mouth,azwildcat11,2023-03-16 03:21:09
"They have spoken, Bobby Jr was in!",Hybridkg87,2023-03-16 03:22:14
The basketball gods have granted your wish,cantpossiblywin,2023-03-16 22:22:55
Also: *points to everything since 1999*,bfinleyui,2023-03-16 02:00:25
BOOM,Shamoofles,2023-03-16 02:01:56
TCU is the best transition team in the country too. Should be a fun game.,mrwhitaker3,2023-03-16 02:08:33
Not even an exaggeration.,marietta1200,2023-03-16 02:07:16
Washington State did just lose at home vs Eastern Washington,Muffinnnnnnn,2023-03-16 02:27:10
Underrated take,fancycheesus,2023-03-16 02:14:16
Or u could thank nevada for sucking ass,koogee4,2023-03-16 02:15:46
o7,wcooper97,2023-03-16 02:16:32
"Let me sleep forever, tonight.",slitheringsidew,2023-03-16 02:16:48
"[Hot.](https://www.biblegateway.com/passage/?search=Ezekiel%2023%3A18-21&version=ESV)

![gif](giphy|YRDyiMrY9EkhbSaQrB|downsized)",warrenjt,2023-03-16 03:21:34
[deleted],[deleted],2023-03-16 01:25:40
Impractical Jokers and March Madness are the only good things to watch on truTv,coilmeup,2023-03-16 01:26:47
 #1 amongst hotel lobbies,TheRealHenryG,2023-03-16 01:27:15
You mean do people watch Impractical Jokers and World's Dumbest?,Specialist-Fee2414,2023-03-16 01:26:55
Isn’t impractical jokers on there?,SwizzyDangles,2023-03-16 01:27:01
My dad does,brokentr0jan,2023-03-16 01:26:56
Jokers all day baby,_kingfelix,2023-03-16 01:27:08
Impractical Jokers,Joel146,2023-03-16 01:27:23
Gotta support the homies,SirCromwell,2023-03-16 01:29:48
I get irrationally angry when they try to get creative with camera angles during a live ball. I hate it so damn much.,mrwboilers,2023-03-16 01:37:49
🤢,TheGeoninja,2023-03-16 01:37:23
Especially considering the B12 is 6-0 vs the P12 this season,kirkismyhinrich,2023-03-16 01:47:17
Big East was in the same boat and then Villanova went and won a couple of national championships. Go find yourselves a Jay Wright.,JerseyDvl,2023-03-16 01:51:09
Don’t lump the rest of us with that shit brick Alford.,AndABananaCognac,2023-03-16 01:57:28
If they keep shooting like this...,jabronius89,2023-03-16 01:53:30
[deleted],[deleted],2023-03-16 02:01:27
UAB or UNT should have made it in over Nevada lol,inshamblesx,2023-03-16 02:02:17
Just wait 'til Oregon state plays 😳,Jhwelsh,2023-03-16 02:10:38
It’s true. Nuts,FostetlerLFC,2023-03-16 02:42:50
Upvoted for spelling Colombia correctly,SaintArkweather,2023-03-16 03:01:39
"USA winning so far.. ASU winning so far.. coincidence, I think not.",Willsears94,2023-03-16 03:02:10
"Ok I gotta ask, I know what Alford did to Iowa but what’s the story with you guys",theopression,2023-03-16 03:14:23
and tech bros wondered why everyone kind of was gleeful at SVB going under,stoppedcaring0,2023-03-16 01:32:59
"Beat U of A, lose to Texas Southern. Wildcard!",Ur_wrong2121,2023-03-16 02:09:06
"Yeah they have a crazy inconsistent team. When they're hot, they're unreal. When they're cold, they can lose to anyone. That's the blessing & curse of the 'no such thing as a bad shot' philosophy on offense. They have athletes and no structure",halldaylong,2023-03-16 02:10:07
What does this even mean?,YoooCakess,2023-03-16 02:09:09
Except the Pac has the nicest most prestigious truck stops. Can guarantee the truckers there do great research on the product they haul,SwizzyDangles,2023-03-16 01:23:20
UCLA ASU sweet 16 would feed families,RyanIsHungryToo,2023-03-16 01:36:19
Subscribe.,Joelsaurus,2023-03-16 01:38:18
Lol this is my fave comment so far,pp21,2023-03-16 02:00:59
"Idk how you guys got in. Your last 3 games of the season were Quad 3 losses. Idk why they picked you guys over OSU. OSU got punished for playing a stronger schedule, yet Nevada couldn't win down the stretch against much easier teams.",ekimtk,2023-03-16 01:59:53
Can confirm,bfinleyui,2023-03-16 01:59:40
It's been apparent he doesn't really have a plan outside of freethrows,hoyeeah,2023-03-16 02:11:08
Not me,BonerForBenz,2023-03-16 02:05:49
I’m all for competitive rivalry but… yeah. I do too.,marietta1200,2023-03-16 02:06:22
Same here. UCLA Wonder Years,xCTRLxALTxDELx,2023-03-16 02:08:21
I don't,Colonel_Toast3,2023-03-16 02:11:00
😂,guest1969,2023-03-16 03:04:51
It tricks us with the Big Ten and the MWC every year lol,enjoytheshow,2023-03-16 02:07:27
It astounds me how many people have bootlicked it. There is a clear problem with a system that says Utah state is similar to duke and that Ohio state at 5-15 on conference is better that a 14-6 ACC tea,dementedturnip26,2023-03-16 02:09:24
At least you executed the joke correctly,carnagebot_55,2023-03-16 02:08:49
Yeah this is not normal for ASU,thewhalehunters,2023-03-16 02:11:12
"The score is eye popping so I went and checked the box score since I’m not watching

57% from 3 pointers, take out Cambridge’s shots and it’s 77% at 7 for 9

Total shooting of 67.7%, yeah that’s rough",PM_ME_YOUR_CATS_PAWS,2023-03-16 02:11:34
"this is the wrong community for nuance, like r/nba but for toddlers",throwaway4tankies,2023-03-16 02:11:21
Anyone with a single flair or peoples secondary flairs are being faded,inshamblesx,2023-03-16 02:15:05
Tape all 4 remote controls together and label them,fancycheesus,2023-03-16 02:36:30
"I could hardly see the kitchen behind all those screens 😂

Looks good though! I might do the same thing with my monitors + TV to have 3 displays.",wcooper97,2023-03-16 02:37:01
"Yeah, add another chair for me",ImmoralModerator,2023-03-16 02:38:00
Looks good to me. What time should I come over tomorrow?,Only499,2023-03-16 02:38:16
Bleached teeth look terrible,ballgazer3,2023-03-16 02:57:05
But what color are Frog Horns?,romanapplesauce,2023-03-16 02:57:14
They already are given that Tennessee is 4,LongMaybe1010,2023-03-16 03:04:07
Or a 70-7 victory…,LukasGynecomastia,2023-03-16 03:26:02
no,brokentr0jan,2023-03-16 03:30:03
I never realized this.,romanapplesauce,2023-03-16 03:31:02
Antelopes are the natural enemy of hypnotoads,Jcoch27,2023-03-16 06:06:22
ME TOO,GrouchyTrousers,2023-03-16 01:18:48
"I wish that every morning from now to eternity he wakes up and steps on a Lego when he least expects it.  Maybe when about to sit down for breakfast causing him to spill his coffee and have to make a new cup, maybe while walking and writing causing him to get ink all over his new suit.  There is no minor inconvenience frustrating enough that he wouldn’t deserve it.",dinoian,2023-03-16 01:24:48
"I didn't realize he wound up at Nevada.

Just another reason to root for the Devils.",NotABot1235,2023-03-16 01:17:04
"THATS MY COACH

That was a wild game to be at lol.",theopression,2023-03-16 01:29:27
That’s how you shewt the basketbahwuhl,therealbigted,2023-03-16 01:31:39
Nice.,TheLadyMagician,2023-03-16 01:45:34
"Rarely do you see a dagger 12 minutes into a game, but you may be right.",NotABot1235,2023-03-16 01:46:43
That s kinda our play style tho tbf,theopression,2023-03-16 01:47:16
That's what they do. Trust me.,TheLadyMagician,2023-03-16 01:49:53
Or MW criminally overrated as always,libsoutherner,2023-03-16 01:48:01
I'm just glad I can get drunk for these.  Way more fun,bfinleyui,2023-03-16 01:58:58
"Oh, I think there's a few more that could be added to his resume that could be categorized as ""cringeworthy.""",GrouchyTrousers,2023-03-16 02:15:31
His eyes...,Colonel_Toast3,2023-03-16 02:20:05
I’m ootl. Why does everyone hate Alford? He was pretty good at UCLA during his tenure,Advanced_Meringue_53,2023-03-16 01:59:01
His night is indeed going fucking horribly lol,Shamoofles,2023-03-16 02:00:00
Fuck Steve Alford!!!,cory_bdp,2023-03-16 02:00:26
MW doesn't take many bad non conf losses,1nf1niteCS,2023-03-16 02:03:15
They're not a truck stop conference.,romanapplesauce,2023-03-16 02:04:29
Fuck Alford,wooooooo1776,2023-03-16 02:06:35
"As someone who was on his fair share of bad sports teams as a kid, I feel for the Nevada players. At some point, you get numb when losing so badly, and you just want the game to end.

I wish there was a way that ASU could score buckets on Alford's head, instead of continuing to embarrass these players that Alford failed to prepare.",stoppedcaring0,2023-03-16 02:07:11
and you don’t have to worry about regressing to the mean because you guys don’t even have to shoot this half to win,ImmoralModerator,2023-03-16 02:10:29
"Yeah, they also lost to Hofstra… so I’d say Hofstra died for this.",bobsaget824,2023-03-16 02:24:14
So many foul calls,[deleted],2023-03-16 02:47:55
They already in the bonus too,[deleted],2023-03-16 02:52:48
It’s glorious,3EEBZ,2023-03-16 03:18:28
all this tells me is Farleigh Dickinson would be winning this game by 50 points rn,Boom_Confetti,2023-03-16 02:03:19
lmao,No_Pollution_4286,2023-03-16 02:02:50
Most of those wins were when Musselman and Steve Fisher were the coaches. I'm with you.,mrwhitaker3,2023-03-16 02:13:54
We just like to get the first round banner and go home. They make us play,Flycat777,2023-03-16 02:24:13
Heh,Colonel_Toast3,2023-03-16 02:30:22
A tradition unlike any other,c_dubby,2023-03-16 01:05:02
"They are in Dayton, Ohio. The Flat East cancels their conference out",TheGeoninja,2023-03-16 01:25:41
Because the teams just aren’t good lol,canesfan2005,2023-03-16 01:26:01
Wish I could have seen the 2020 team in the tournament as it was probably our best overall team. Fucking COVID,sfr18,2023-03-16 03:28:03
WATCH YOUR DAMN LANGUAGE SIR,DontTakeOurCampbell,2023-03-16 01:25:32
Fairleigh Dickinson should be an 11 seed confirmed,Mangotheory97,2023-03-16 01:30:54
We schedule on the road games,theopression,2023-03-16 01:30:13
You…I like your thinking!,Zloggt,2023-03-16 01:47:41
Hope ASU’s plane doesn’t show up and they have to wait 2 additional hours to travel out. What happened to IU last year.,[deleted],2023-03-16 01:50:39
Do it. I dare you,Surfer5153,2023-03-16 01:51:10
Did I miss something? Why are people talking about Utah state,Cjtow113,2023-03-16 01:54:33
"If they hit 3s, you're good",Backupplan4,2023-03-16 01:54:45
u should...Arizona should beat them,scoot87,2023-03-16 01:57:49
Just be sure to avoid Alford Jeep in the near future.,ScotTheDuck,2023-03-16 01:56:48
"the Nevada coach is doing this to himself at this point, horrible shot selection and offense",ImmoralModerator,2023-03-16 01:56:53
Over the Donner Pass. Better bring a friend!,GrouchyTrousers,2023-03-16 02:01:53
Fuck Alford.,AndABananaCognac,2023-03-16 01:58:47
"Haha, me too. I have nothing against Nevada...except that they gave Alford his next job.",GrouchyTrousers,2023-03-16 01:59:34
I bet Dana White and Steve Alford would be friends,bfinleyui,2023-03-16 02:00:05
Get me out bro lmfao,1nf1niteCS,2023-03-16 01:59:38
True!,Colonel_Toast3,2023-03-16 02:16:48
Lmfaoooo,SpartansATTACK,2023-03-16 02:04:39
Genuine question what do people have agaisnt him other than him Being a choke artist? I’ve seen him get death threats,RJD-ghost,2023-03-16 02:03:34
what witnessing tourney Mountain West does to a mf,Boom_Confetti,2023-03-16 02:05:02
He was right.,Colonel_Toast3,2023-03-16 02:09:21
I had ASU winning the next round. I may need to rethink then losing to Gonzaga though.,grrgrrtigergrr,2023-03-16 02:09:20
Seeing a lot of hate for him. What did he do?,go_berds,2023-03-16 02:17:39
Hang the banner!,1nf1niteCS,2023-03-16 02:29:11
"refball is my favorite sport, can they pull off a 27 point comeback? Let’s find out!",ImmoralModerator,2023-03-16 02:35:16
I mean ASU is almost in the bonus now too,[deleted],2023-03-16 02:49:34
I really don't think we're gonna blow a 22 point lead with 12:52 left. Just milk the clock and play great defense.,romanapplesauce,2023-03-16 02:49:56
Lol please.,slitheringsidew,2023-03-16 02:49:14
Incidentally the CAA and MWC champs are playing each other so we could get more confirmation of this....,SaintArkweather,2023-03-16 02:52:39
Muhammad/Gaffney is the OSU special,COLU_BUS,2023-03-16 02:54:13
I mean Ok State almost lost to Youngstown State so idk how much confidence I'd have in them to play much better,Muffinnnnnnn,2023-03-16 03:01:45
"If they win one more game and finish with a .500 conference record, they'd be in.",Joelsaurus,2023-03-16 03:00:57
"As an older ASU/Phoenix sports fan, I'm tempted to spill even more tales of woe. *Mario Elie and the Kiss of Death! Danny Manning's knee! Germaine to Boston!*

But to really get the point across, I should be rattling chains.",Cut-OutWitch,2023-03-16 03:06:45
"Listen to your radio crew, probably better anyways",listinglight778,2023-03-16 03:05:18
Do you want her to break up with you? Because this is how you get her to break up with you.,Joelsaurus,2023-03-16 03:08:24
You just did it. Show her your phone and all the nephews responses.  She's gotta understand!,IvankasFutureHusband,2023-03-16 03:04:53
Get a DVR,KingdomsEdge,2023-03-16 03:04:54
Eat Taco Bell and get the shits and call her an Uber when you’re sick,ObjectiveDev,2023-03-16 03:05:02
"""Uh... I'll pay for it?""",PinkSaldo,2023-03-16 03:04:41
RL Stine's DJ alter-ego,CasualMetaphor,2023-03-16 03:05:01
EDM producer who blew up in early 2010's,ivanezzz,2023-03-16 03:14:21
:(,Firmy4DaddyHermy,2023-03-16 01:11:35
Awww come on mang… even i back Zona in the tourney. Back the PAC! =(,TheBrettitor,2023-03-16 01:12:11
"\#1 Yes

\#2 Nope. Here for the Alford loss.",GrouchyTrousers,2023-03-16 01:22:14
That thought had crossed my mind too,MathewSK81,2023-03-16 02:02:06
Hate you too! Don't worry we'll probably forget how to score against TCU again. Fall Down!,romanapplesauce,2023-03-16 03:25:34
Nah bro.. the pac12 needs this more than anything hahaha,skarkle_coney,2023-03-16 03:21:27
Noble library the 🐐study area,theopression,2023-03-16 00:58:12
RIP. No professor should give exams during the first round of March Madness.,TheNSAAgent777,2023-03-16 00:54:25
"Washed alumnus here, noble was my go to",cr0asu,2023-03-16 01:11:29
"Ohh and, go devils!",TooHotForDog,2023-03-16 01:09:56
[deleted],[deleted],2023-03-16 01:23:20
For like $5 bro lol,TheRealHenryG,2023-03-16 01:29:05
They bore me now. Might never be the same.,coilmeup,2023-03-16 01:33:54
Batman was cool but yeah definitely getting boring now. MCU has been awful and DC is restarting from scratch.,SwizzyDangles,2023-03-16 01:35:44
"save for hancock, that’s the best one ever",illcentrifugal,2023-03-16 01:35:51
"I'm happy to say I never bought in to it. Never thought MCU was interesting after Iron Man. None of the movies were particularly well done or thought provoking. Entertaining, maybe, but not *good* movies.

either that or i've just been antisocial the last like 12 years",stoppedcaring0,2023-03-16 01:35:52
Only superhero thing I've enjoyed since Spiderman is season 3 of The Boys,abrutalstrudel,2023-03-16 01:36:48
Please. Abolish all MW sports. Be brave. Be best.,slitheringsidew,2023-03-16 01:37:13
Oooooo,canesfan2005,2023-03-16 01:40:44
I miss the era of Nike uniforms where every Nike school had a unique design on their back. I want to say like 2014-ish?,3EEBZ,2023-03-16 01:45:25
Nevada's offense is doing a decent amount of self-stifling,elgenie,2023-03-16 01:46:20
I quickly changed my TCU pick but watch ASU shoot 20% on Friday (assuming they win),Duck_man_,2023-03-16 01:48:29
I have sdsu winning 2 games hopefully nothing lol,IvankasFutureHusband,2023-03-16 01:53:15
Nothing. ASU is playing out of their minds.,Duck_man_,2023-03-16 01:52:10
Well don’t be too scared cuz it looks like Nevada just took a bunch of quaaludes before the game,Not_a-bot-i_swear,2023-03-16 01:55:56
Don’t worry,[deleted],2023-03-16 01:55:34
I wish he was calling this game,Colonel_Toast3,2023-03-16 02:17:57
This isn’t really on Nevada. ASU can’t miss,Duck_man_,2023-03-16 01:58:02
[deleted],[deleted],2023-03-16 01:58:52
I don't think I saw that anywhere lol,bh6891,2023-03-16 02:02:00
Really? We were mostly damned surprised we made it in,hoyeeah,2023-03-16 02:02:09
Did anyone in the Mountain West actually think Nevada was good?,steveoriley,2023-03-16 02:02:15
Maybe the metrics are broken?,dementedturnip26,2023-03-16 02:10:11
Madness,scoot87,2023-03-16 02:06:32
"ASU typically shoots 31.4% from 3.

Insane",Duck_man_,2023-03-16 02:06:40
"You'd be surprised how often ASU shoots well. Maybe not this well, but will enough to win.",Colonel_Toast3,2023-03-16 02:08:20
"Honestly, I think the MWC teams are not that good and just flat out overvalued by the metrics",dementedturnip26,2023-03-16 02:07:58
"Sweet 16 only, lost to Loyola-Chicago :(",Mattaholic,2023-03-16 02:13:41
"that was over 5 years ago, older than the average user on this sub",throwaway4tankies,2023-03-16 02:14:11
They did it to us at the Big 12 tourney too.,Im_DJayy,2023-03-16 02:14:23
"That game might have been the second most confusing result of the entire D1 season.

Number one, of course, was OU destroying Alabama.

TCU can be beaten, but man is their peak something to behold.",stoppedcaring0,2023-03-16 02:15:21
Thank you friend.,Joelsaurus,2023-03-16 02:20:36
You are playing Steve Alford. Y'all should be good lol.,Binx33,2023-03-16 02:40:17
You might need to disband your program if you manage to give up a 30+ point second half lead,Muffinnnnnnn,2023-03-16 02:42:59
Glad to see him playing well for ASU. We've missed him this season.,Only499,2023-03-16 02:50:23
They only made two 2 pointers in the first half,Impossible-Mud-597,2023-03-16 02:54:01
So cringe,doublething1,2023-03-16 02:59:38
Yes,1nf1niteCS,2023-03-16 03:12:48
Looked legit in the first half. Not bad per say but I thought it’d be a bigger blowout in the 2nd tbh,DayandKnight13,2023-03-16 03:13:26
They goin learn today..,skarkle_coney,2023-03-16 03:13:38
Seriously what the fuck.,Begle1,2023-03-16 05:06:00
"You know, i’ve always been a bit of a wolfpack myself",SirCromwell,2023-03-16 00:25:35
"Understandable, but unlikely.",Willsears94,2023-03-16 01:54:28
SDSU and Boise are gonna win. USU and Nevada shouldn’t have got in,Surfer5153,2023-03-16 01:52:02
Yeah that’s about right,Get_Pancaked,2023-03-16 02:01:49
I got downvoted to hell for suggesting limiting them to 2 bids in 2023 after last season lmao,inshamblesx,2023-03-16 01:53:38
"For shit like that, absolutely",[deleted],2023-03-16 02:44:46
I believe they can if a flagrant foul is being looked at.,Only499,2023-03-16 02:48:26
That *is* a very large guy he was tangled up with. Looked upcourt the whole time.,Muh_Nado,2023-03-16 02:45:42
Emotional guy,[deleted],2023-03-16 01:23:56
"He’s only had a couple this year, he’s just firey",Thel3lues,2023-03-16 01:24:14
"Once a Jersey Catholic boy with a chip on the shoulder, always a Jersey Catholic boy with a chip on the shoulder.",ivanezzz,2023-03-16 01:27:15
Bryce gave me chet hanks vibes,SwizzyDangles,2023-03-16 01:32:49
Time to fade them all. Except you guys are legit,LongMaybe1010,2023-03-16 01:35:32
