Comment,Author,Created UTC
Would love to play yall in the Final four! That’s all I want.,Fastbird33,2023-03-24 01:10:35
Volumes?,tmt22459,2023-03-24 01:24:18
This game is about to be 54-51,sickmemes48,2023-03-24 01:03:32
"If he just drops that in, easy points",Updog_IS_funny,2023-03-24 01:46:56
I need to join a witness protection program now,[deleted],2023-03-24 01:47:11
Much better now that my asshole has unclenched and my blood pressures returned to normal,EMAWChuckleFunks,2023-03-24 01:47:11
"Well I certainly don't wanna Tennessee again, although a neutral site matchup might not be as bad as getting whipped in Knoxville.",texas2089,2023-03-24 01:51:25
"Seriously 

Let the damn out of bounds line be your trap partner bud",[deleted],2023-03-24 01:55:18
Yeah I think he’s overthinking the “stay physical” plan.,TotesMcGotes13,2023-03-24 01:55:01
he’s too hyped up. gotta calm down,[deleted],2023-03-24 01:54:36
"Long shot, long rebound",MakesYourMise,2023-03-24 01:57:41
100%. Bring us Awaka.,HerpaderpObes,2023-03-24 01:57:53
Yeah these point blank misses need to stop. Too worried about drawing fouls instead of finishing,Hooper1054,2023-03-24 02:08:43
you’re probably hearing me in upstate new york,[deleted],2023-03-24 02:14:16
Same. I never wanted a stranger I never met to get stabbed in the throat…..or kicked out of the arena.,KalElMeatOfSteel,2023-03-24 02:22:41
yeah,flyindinosuars,2023-03-24 02:17:51
Typical tennessee,fragger404,2023-03-24 02:25:34
Key needs to shave the stache and see if he can shake that bad juju.,TotesMcGotes13,2023-03-24 02:26:38
I’m assuming pretty much the same one that went in to it,Rickydada,2023-03-24 02:34:53
I don’t know what’s up with that either. Usually Ut owns the glass but tonight they’ve been horseshit,Hooper1054,2023-03-24 02:54:18
its the law!,DangerIsMyUsername,2023-03-24 02:58:24
"If you’ve watched FAU at all this season, it should be no surprise they’re in this game. 33-3 record for a reason.",skyman501,2023-03-24 03:02:28
Same,dontbelievejustwatch,2023-03-24 03:07:34
At some point? It been said for years now,RazzleDazzle3469,2023-03-24 03:09:45
It's a miracle,inevitablescape,2023-03-24 03:11:16
This sub is gonna have a meltdown if FAU wins after Sundays bitchfest 😭,inshamblesx,2023-03-24 03:11:25
CUSA got robbed this year. UNT and UAB are running the NIT too,elbenji,2023-03-24 03:12:38
They shouldn’t have been. They went undefeated in their conference and won it. They’re only a 9 due to lack of name recognition/tournament history.,Marsha-the-moose,2023-03-24 03:13:07
The snowbirds went to bed hours ago,bagood1,2023-03-24 03:12:27
Dude just lost the game… wtf does he think he gets to take them into next season?,cryptoheh,2023-03-24 03:12:42
Honestly a lot of comments here about the refs making up their mind on this game and I kind of agree.,RVOSU50,2023-03-24 03:13:33
I feel like I watch this every year and he’s still employed.,RVOSU50,2023-03-24 03:12:48
I’m completely mystified as to why he let the team flounder for 5 minutes without calling a TO,Hooper1054,2023-03-24 03:13:25
The Barnes special,GBO_COYS,2023-03-24 03:14:54
That’s Rick Barnes basketball for you,Rickydada,2023-03-24 03:15:40
Back… and to the left,JediArchitect,2023-03-24 03:17:32
I think you’re right,thisisfunnyright,2023-03-24 03:17:51
The flagrant happened on the other end after the three. No idea how they didn't see it live.,Le_Jerk_My_Circle,2023-03-24 03:18:47
They dirty!,sjmahoney,2023-03-24 03:22:55
They dirty!,tallredrob,2023-03-24 03:24:14
48 hours,MapleHeel,2023-03-24 03:29:31
He can't leave if we never lose.,Updog_IS_funny,2023-03-24 03:30:29
"Hours, which is why we need to win.",FriedFishFan,2023-03-24 03:29:55
Penn State written all over it.,RVOSU50,2023-03-24 03:30:04
Question is who's calling. I'd argue a day,elbenji,2023-03-24 03:30:48
He already is in negotiations,wooooooo1776,2023-03-24 03:32:34
Barnes doesn't recruit guys like that. He recruits system guys. That's why we don't have anyone who can single-handedly create a shot. Tyreek Key was supposed to fill that hole as a transfer but the man is a walking brick.,EWall100,2023-03-24 03:38:10
"Is what it is , not even that mad about it . The duke game was fun . Exited to watch Joe Milton now 😂",Sirrenderthe69th,2023-03-24 03:36:03
I fully expected it.. and I'm still disappointed :(,Beermealex,2023-03-24 03:37:13
Let's check the scoreboard and see Tenn behind,llamawhittlings,2023-03-24 03:40:34
"No point guard, and we weren’t allowed to play the paint without 50 putting together his Oscar nomination tape.",[deleted],2023-03-24 03:43:35
4 points in a 6:30 minutes span. And honestly just really bad basketball during that run,sandy-eggo-padres,2023-03-24 03:43:10
Tell that to Reggie Miller,natigin,2023-03-24 03:43:10
Might as well have lol,O_J_Shrimpson,2023-03-24 03:45:27
They’re 2k game tips at 2 am tonight,Jed566,2023-03-24 02:15:41
I see what you did there. Lol,Ok-Till-8905,2023-03-24 02:16:30
Nice,murder-farts,2023-03-24 02:16:14
Arm extended,whatisahikikomori,2023-03-24 02:04:10
I just want a 6'0 point guard to do it to him,Equal-Razzmatazz1806,2023-03-24 03:00:23
I mean that guy was literally too small lol,Sirrenderthe69th,2023-03-24 03:00:35
"I don't think it's so much they aren't fouls from Tennessee, it's that it's not being called both ways.",Facebookqt,2023-03-24 03:14:50
Refs saw a narrative brewing after FAU hit a few shots and jumped on it.,cryptoheh,2023-03-24 03:19:33
I’m scared we’ll get the same treatment tomorrow. We’re a huge physical team and all it takes is the wrong ref crew.,Redline-7k,2023-03-24 03:19:55
Last guy that could hit them for us.. lol,Beermealex,2023-03-24 03:28:54
🤢,Sirrenderthe69th,2023-03-24 03:28:39
They’re brutal offensively but 100% getting absolutely hosed. Got to buckle down and overcome,sdotmills,2023-03-24 03:20:31
Not even questionable live. I didn’t need the replay. Refs trippin,VolsPE,2023-03-24 03:13:16
Yeah i agree it should’ve been off FAU there.,Redline-7k,2023-03-24 03:12:46
"He was talking about going for the steal. If he gets it, that’s an easy layup to go up 10. Instead it ended up as a UT 3 to cut it to 5",MapleHeel,2023-03-24 03:30:35
"Quite honestly, y’all are too good to be a Cinderella. At least those of that have watched you all before the tourney. FAU was criminally underseeded, but it hasn’t stopped them.",Wings4514,2023-03-24 03:47:09
"That wasn’t a travel, the defender stripped the ball and he lost possession.",[deleted],2023-03-24 01:47:58
They are a very physical team. No suprise.,spierce64006,2023-03-24 01:47:18
"Seems to match how the Duke/Tenn game started. Seems like they use that to ""set the tone""",YouAreMyDensity,2023-03-24 01:48:31
"They're a bunch of fucking bowling balls that think they're playing rugby.

FAU is going to physically beat up and Tennessee won't get called for obvious technicals, just like in our game.",NotABot1235,2023-03-24 01:51:47
Correct. It doesn't exist,Immediate-Recipe-642,2023-03-24 03:00:27
Because over the back isn't a foul. It's on the back and being taller with a longer reach isn't a foul,yousmelllikebiscuits,2023-03-24 03:00:05
"but still, fuck pat adams🧡",[deleted],2023-03-24 00:34:35
"This is bullshit. The later it gets, the stronger FAU gets. They’re owls and they’re much more active at night.",the_cajun88,2023-03-24 00:42:25
i got an 8am tomorrow morning😭 i can’t do this shit,[deleted],2023-03-24 00:39:47
Not a shot our game has 191 points lmao,zorofan8878,2023-03-24 01:11:29
"Between Uros and the field, I’m taking Uros",Zahfier,2023-03-24 01:28:14
[deleted],[deleted],2023-03-24 01:17:32
Overtime in the michigan state ksu game pushed it back.,initialgold,2023-03-24 01:16:54
9:36 tip,Ok-Till-8905,2023-03-24 01:15:24
"Seriously. 

Go big or go home.",the_cajun88,2023-03-24 01:35:52
"One ref did one of our most physical games of the year, the other did the duke, and the other guy we’ve not seen this year",mattdingus2002,2023-03-24 01:28:48
"Definitely possible , we really struggle to score sometimes .",Sirrenderthe69th,2023-03-24 01:30:24
"It’s March, anyone can win. 

*Prepare the popcorn.*",the_cajun88,2023-03-24 01:34:11
Don’t really care who wins. Low key hope Martin misses like 6 more dunks.,Tigercat01,2023-03-24 01:47:31
You can say the same for every offense,thewill450,2023-03-24 01:51:13
Mainly bc one of their players tried a show off 360 dunk as time expired when FDU stopped playing defense and let the clock run. FAU also had some benchwarmer waving goodbye as they closed out FAU. So really just bc they were dicks with how they finished out FDU,TotesMcGotes13,2023-03-24 01:59:12
"The dunk at the end was straight up punk ass shit, and their coach sort of started immediately working the refs and saying they’d be playing rugby against Tennessee immediately after the game.

I haven’t really liked FAU much this tourney, and am borderline rooting against them even against the damn Vols, but it was really just the one guy and the dunk that rubbed people the wrong way.",Tigercat01,2023-03-24 01:59:15
No they were perfectly fine until the last few seconds when one guy dunked the ball right before the buzzer rang. Thats literally it lol. Also they just happened to beat the Cinderella team of the tourney,blenkows,2023-03-24 01:59:26
Tried to dunk at the buzzer and said something to the bench,HalfBear-HalfCat,2023-03-24 01:57:58
"People didn’t like a bs last second highlight dunk attempt after fdu conceded the end

Plus the fact they were doing it to a 16 seed that took them to the wire",[deleted],2023-03-24 01:58:18
They dunked on FDU after the game was over to rub in the win,sickmemes48,2023-03-24 01:58:39
The latter. They just were expressing themselves. The Martin dunk at the end though was very stupid.,spierce64006,2023-03-24 01:58:58
"One of the FAU guys tried to do like a 360 dunk as time expired when the result was basically already decided and the FDU guys had all given up, and a lotta people got mad about that",Gr8_M8_,2023-03-24 01:59:22
as naismith intended,[deleted],2023-03-24 01:59:42
"Yeah they’re getting good looks, just gotta hit them",Cool_cid_club,2023-03-24 02:21:13
Imagine sitting near them at the game...fuuuck,JamJiggy,2023-03-24 02:22:16
"it’s march, we’re not used to this",the_cajun88,2023-03-24 02:41:49
"& If you don’t like that, you don’t like Tennessee basketball! (We don’t either)",FeverOG,2023-03-24 02:32:51
Nice,mister_fister_420,2023-03-24 02:38:15
First time watching us play offense? Lol,GBO_COYS,2023-03-24 02:54:23
ClassicTennessee. Play to their opponents level. Stagnant offense. Great defense.,TotesMcGotes13,2023-03-24 02:59:07
We’ve missed countless point blank shots,GBO_COYS,2023-03-24 02:59:09
As a neutral….Tennessee reminds me of some of the WVU teams that no one could score on….but couldn’t score themselves.,WVUREDS001,2023-03-24 02:58:36
HOOSIERS!!!,quasithomas,2023-03-24 03:12:38
reads this awkwardly in *first natty hopes riding on womens bball long shot*,Gavangus,2023-03-24 03:21:11
I’d take it after the decade we’ve had,TheStuffisLegal,2023-03-24 03:24:36
The epitaph of the 2022 Vols season,PM_ME_YOUR_CHURROS,2023-03-24 03:24:16
Wheels have fallen off. Less quit and more “don’t know what to do”,Tfsz0719,2023-03-24 03:26:42
It's a hootenanny,sjmahoney,2023-03-24 03:26:25
"Tennessee shook, they looked like the better team for most of the game but never could pull away, then FAU started shooting. Also FAU way out-rebounding.",natigin,2023-03-24 03:28:12
Probably Alabama,elbenji,2023-03-24 03:28:21
Tennessee fans convincing me its them rn,Ok-Lack-5172,2023-03-24 03:30:00
Looks like a garbage truck worker convention,sjmahoney,2023-03-24 03:29:34
🦉❗️,sjmahoney,2023-03-24 03:31:33
Boca Raton don't fuckin play,Jaakylma,2023-03-24 03:33:09
"Unless Tennessee turns into a totally different team right now, yep",CheckItWhileIWreckIt,2023-03-24 03:34:34
Maybe for like a month,symptomatc_adherence,2023-03-24 03:35:31
Northern Iowa,SaintArkweather,2023-03-24 03:37:33
last year was their best chance. it was a miracle they even made the s16 without their pg this year,inshamblesx,2023-03-24 03:37:23
Every team gets up for duke,thatmanzuko,2023-03-24 03:37:38
Let’s see if you’re saying that on Saturday lol,O_J_Shrimpson,2023-03-24 03:39:59
Would be amazing if Rodney Terry gets further than Barnes in year 1!,SaintArkweather,2023-03-24 03:38:53
"Especially when the inevitable meltdown happens….because not only did the wheels fall off that wagon, they somehow managed to drive it over a cliff afterward.",Tfsz0719,2023-03-24 03:39:06
Well now that you've said that K-state is probably winning the natty.,Dewot423,2023-03-24 03:40:17
Tennessee basketball,Tfsz0719,2023-03-24 03:42:27
My bracket is killing it right now.,[deleted],2023-03-24 03:47:35
Mine sure did,skyman501,2023-03-24 03:43:01
"I did! Woo

But I had them losing to Marquette",elbenji,2023-03-24 03:43:02
Facts,___VIBEZ___,2023-03-24 03:43:32
They 'sposed to be SEC.,mrwhitaker3,2023-03-24 03:45:13
GG. Congrats to you as well!!,[deleted],2023-03-24 15:07:21
Apparently,RazzleDazzle3469,2023-03-24 03:19:57
[removed],[deleted],2023-03-24 03:27:01
they throw elbows so much might as well call em Tshiebwennessee,verdenvidia,2023-03-24 03:28:41
"KSU is good. But they haven’t played a team
Who will D them up like UT. Still gotta beat FAU right now and hit open shots",Hooper1054,2023-03-24 02:06:10
"If we shoot 45% we win, if we go cold we could get run out of the building",[deleted],2023-03-24 02:06:43
K state is good. I’m worried about them if we can get through this game.,Jed566,2023-03-24 02:07:10
Easily,O_J_Shrimpson,2023-03-24 03:11:30
They were not showing the right play. He earned that foul hard with 7:32 left. Straight drops an elbow on a guy,timh123,2023-03-24 03:20:31
How about the station get the correct replay the first time? It was a fair reaction to what was first shown,RazzleDazzle3469,2023-03-24 03:23:51
">	without ref interference 

Sure dude",ItsZizk,2023-03-24 03:24:28
Welcome to the gulag,wking15,2023-03-24 01:35:04
"I feel obligated to pull for UT because they beat Duke, but people still mad about a late dunk from a team that’s never made the second weekend are ridiculous",MapleHeel,2023-03-24 01:36:36
you mean physical? since when is being tough on defense a bad thing (besides a week ago when this talking point started)?,[deleted],2023-03-24 01:34:56
"Last week was funny when other SEC fans, even ones cheering against Duke, were like “yeah those elbows get annoying”",ddottay,2023-03-24 01:39:14
There’s been a clear difference in how the game is being called in the second half vs the first.,TotesMcGotes13,2023-03-24 03:14:14
[removed],[deleted],2023-03-24 03:11:26
welcome to vols basketball,DangerIsMyUsername,2023-03-24 02:24:38
That was the UConn Arkansas game,[deleted],2023-03-24 02:24:10
CUSA showing that FAU should have been a high seed and UNT/UAB should have been in the tourney,elbenji,2023-03-24 03:13:39
"Yeah, I have them at a 5.",[deleted],2023-03-24 03:14:28
"Talent wise this is a fact. Resume wise they are right where they should be unfortunately.

More unfortunate for teams playing them as they are playing a team way better than their seed",a_banned_user,2023-03-24 03:14:07
"The 8seed path isn’t so bad, so long as you beat the 1 seed… which they didn’t even have to do",No_Push4492,2023-03-24 03:16:03
Well it helps when the broadcast shows the correct play,SoupBowl69,2023-03-24 03:24:21
"I think people are realizing how much of an overreaction that was, this FAU team rocks",MetaKoopa99,2023-03-24 03:24:09
a silly thing to still be mad about,bsEEmsCE,2023-03-24 03:24:34
I can’t believe people actually care that much to hate a team for something so unimportant like that lol,big_mustache_dad,2023-03-24 03:23:54
Not the teams fault that one guy was a dumbass IMO,LongFatButtBassett,2023-03-24 03:24:40
Coaches lining up like a train of hermit crabs swapping shells,Putrid_Debt5224,2023-03-24 03:28:03
"love barnes, but i need me a kirby",[deleted],2023-03-24 03:27:21
Maybe you'll get your Kirby Smart next,Teh_cliff,2023-03-24 03:27:50
It still hurts.,jmac3560,2023-03-24 03:30:01
They beat themselves just like Ut is doing. Memphis was fighting themselves during timeouts,Hooper1054,2023-03-24 03:30:11
Should’ve picked FAU to win it all with me,Pseudoneum,2023-03-24 03:39:54
Dude that is impressive you got this far at 99.9. I'm at 9.9 or something,newaccount721,2023-03-24 03:40:32
Refs need a breather,thewill450,2023-03-24 03:04:59
Beautiful,arrowfan624,2023-03-24 03:41:30
Them not making it to Omaha last year boggles the mind.,OleRockTheGoodAg,2023-03-24 03:41:32
"W 

HATING

LETS

GO",XAfricaSaltX,2023-03-24 03:41:37
That's what happens when your athletics programs are still relevant,yousmelllikebiscuits,2023-03-24 03:41:38
Enroute for alcohol already. Never too late to start,cscowboy01,2023-03-24 00:19:30
can’t drink all game if you don’t start before,carter_00,2023-03-24 00:18:22
What kind of question is this? Take a double shot to start with for even asking it.,[deleted],2023-03-24 01:19:06
9:36 est,initialgold,2023-03-24 01:16:27
It's in the description,MakesYourMise,2023-03-24 01:16:17
There's some Owls loose in MSG,sickmemes48,2023-03-24 01:22:40
Its gonna be an alijah martin revenge tour kinda night,solarplanet,2023-03-24 01:22:42
"So you're rooting for KSU because we knocked out MSU, right?",circa285,2023-03-24 01:42:32
Paxlovid,unidennedinu,2023-03-24 01:46:28
He’s no Tobin Anderson,constructss,2023-03-24 02:01:29
killed even,DangerIsMyUsername,2023-03-24 02:03:36
from your lips to the ears of God (if it’s the Vols you’re referring to),[deleted],2023-03-24 02:15:47
"It’s okay, it’s not changing fast",JonTheCatMan11,2023-03-24 02:20:22
We are the opposite of analytical,mattdingus2002,2023-03-24 02:21:10
Goldin taught him his secret move,Updog_IS_funny,2023-03-24 02:21:21
Thing is they are actually getting open looks… they aren’t contested. Just not going in.,blenkows,2023-03-24 02:25:32
They're getting open looks.,run_nyg,2023-03-24 02:26:10
"Honestly if y’all hit even half y’all’s wide open shots you’d be up pretty decent. It’s not like y’all are getting killed on the boards either, which is frightening as a vols fan… you guys can score. We can’t lol",Tommy_Wisseau_burner,2023-03-24 02:26:16
How to be Purdue without being Purdue....,Rysilk,2023-03-24 02:32:27
Getting beaten down inside the arc and harassed sometimes makes you miss open shots.,yousmelllikebiscuits,2023-03-24 02:33:02
Also score. That’s important too.,TotesMcGotes13,2023-03-24 02:34:06
Don't let the close score fool you into thinking this is a good game,oddfuture671,2023-03-24 02:48:21
So… bet the house?,Sad_Entertainment_54,2023-03-24 02:51:03
Key is tanking this game like he’s on the rockets,Icy_Increase3376,2023-03-24 03:08:03
He refuses.,zorofan8878,2023-03-24 03:08:16
Wake!,Tfsz0719,2023-03-24 03:08:44
RIP my plumbing,CatataFishSticks,2023-03-24 03:15:26
The committee did some trolling,bh6891,2023-03-24 03:20:10
"Michigan State over Marquette was the easiest upset call of all time for me






I thought Duke would beat the Vols, and if I wasn't a petty mf I'd be nauseated at the performance Purdue put out last week",inshamblesx,2023-03-24 03:19:32
They dirty,tallredrob,2023-03-24 03:23:26
It happened directly before the 3 and the timeout.,E51838,2023-03-24 03:23:20
Murder.,DpressedLionsFan,2023-03-24 03:28:53
You are assuming we will score more than 6 points,PersianVol,2023-03-24 03:30:06
"Just have 7 very athletic guards who are also good shooters with a true 7 footer as well

Easy",rvadarocket,2023-03-24 03:35:26
Their main bruiser is on the bench.,Mpm_277,2023-03-24 03:35:57
Tennessee schools fear C-USA,Jaakylma,2023-03-24 03:39:00
and its the fau guards making the differencr,Gavangus,2023-03-24 03:38:30
Tennessee bringing Plavsic back in for a 360 windmill elbow to someone’s head,byzantiums,2023-03-24 03:38:15
:(,BrettKernStanAccount,2023-03-24 03:38:42
"Them doing it on purpose every win now would be hilarious, just own it at this point",Hackasizlak,2023-03-24 03:39:53
"Rocky Flop, you’ll always be, at very best the Sweet Sixteen. Good ole Rocky Flop, Rocky Flop Tennessee.",Tfsz0719,2023-03-24 03:40:43
Not if the ball hit the rim first,strongscience62,2023-03-24 03:42:00
Kennesaw State to the AAC confirmed?,bh6891,2023-03-24 03:51:11
Yo that last sentence took me out 😂,Tommy_Wisseau_burner,2023-03-24 02:52:11
UNC fans don't like him because he once yelled at Dean Smith.,mrwhitaker3,2023-03-24 02:52:48
He’s taught to do that my friend.,[deleted],2023-03-24 03:23:56
He’s constantly “clearing space” like that.,Mpm_277,2023-03-24 03:27:21
Hahaha lets hope we get to that point,Fastbird33,2023-03-24 01:20:13
Yes,PalsRocksMyWorld,2023-03-24 02:38:31
Does anyone not?,oddfuture671,2023-03-24 02:43:16
Yes,fragger404,2023-03-24 02:44:10
No,LloydBraun19,2023-03-24 02:38:01
How is it their fault the announcers literally said that’s what it was lmao,cappy412,2023-03-24 03:23:38
Thanks jay bilas.,fragger404,2023-03-24 01:47:33
"If they didn’t do that bullshit at the end of last game, 100%. But seems like the majority want Tennessee in this because of if",blenkows,2023-03-24 01:51:45
[deleted],[deleted],2023-03-24 01:53:02
"Gator flair, FAU advertising. I'm confused haha.",Beermealex,2023-03-24 01:54:25
don’t worry i am too my friend,[deleted],2023-03-24 02:06:48
Impossible,EWall100,2023-03-24 02:23:13
"I ain't gonna never stop lovin you, biiiiiiiiitch",Simba_Swish,2023-03-24 02:23:22
"They're gonna get their lunch eaten inside. Even when Martin gets one in the air, there's 2 more giants waiting for him.",Updog_IS_funny,2023-03-24 02:27:27
It’s what K state would do,fragger404,2023-03-24 02:26:13
Shhhhhhh,chrt,2023-03-24 02:37:08
Nor did you,BreadKiller0688,2023-03-24 03:11:56
Also that was Tennessee ball but ¯\_(ツ)_/¯,FriedFishFan,2023-03-24 03:11:40
Why? They’ve not called many fouls? If anything they should be whistling both teams a lot more.,FlushTheTurd,2023-03-24 03:15:53
It comes down to the gambling angle imho,RicardoMouseIII,2023-03-24 03:16:05
Painter and Shaka approve of this message,Hackasizlak,2023-03-24 03:37:37
Remember him at Texas with Kevin Durant?,Emily_Postal,2023-03-24 03:37:49
Alright calm down. Losing Houston and Cincy and adding FAU is not an upgrade lmao,MapleHeel,2023-03-24 03:41:01
22-0 under 60 and 3-11 above 60,yousmelllikebiscuits,2023-03-24 03:45:05
It’s okay bro we hear you,Licit_x64,2023-03-24 03:39:39
That’s been the media blitz,fragger404,2023-03-24 03:03:17
SAME AMOUNT AS FAU,FriedFishFan,2023-03-24 03:50:15
"FAU is a similar level program, so true",Muffinnnnnnn,2023-03-24 03:46:45
FAU also!,BigGoopy,2023-03-24 03:47:08
So just as many as FAU.,Knightmare25,2023-03-24 03:50:36
Yikes,gohuskies15,2023-03-24 03:48:06
We had a deeper run than y’all. I’ll take it. Meanwhile Calipari and Kentucky doing less with more. Name a more dynamic duo.,grey_pilgrim_,2023-03-24 03:57:57
It's pretty awesome. Just another great thing about march.,daNish_brUin,2023-03-24 03:11:01
What did we do to you?,Fastbird33,2023-03-24 01:12:22
Yeah these refs have been biased so far.,spierce64006,2023-03-24 02:09:37
UT is not boxing out. They’ve done a surprisingly bad rebounding job tonight,Hooper1054,2023-03-24 02:53:36
Basketball is soft now.,wooooooo1776,2023-03-24 03:10:08
Awww,BigballerBrett,2023-03-24 03:14:05
At least he isn't decking a guy like Plavsic did when he came up the floor.,spierce64006,2023-03-24 03:03:41
They’re so small,fragger404,2023-03-24 02:05:00
For some reason I get Neil Patrick Harris vibes,chuncken,2023-03-24 02:10:13
legit just said this to my friends,[deleted],2023-03-24 02:09:10
“Team would be in the lead if they had more points”,ItsZizk,2023-03-24 02:21:51
"Fau needs to calm down, they should be up by alot despite TN suffocating D. FAU is still getting open shots",JamJiggy,2023-03-24 02:24:09
"Yeah, about that",Rickydada,2023-03-24 02:33:45
They love Alijah Martin at MSG,spierce64006,2023-03-24 03:14:28
How’d your postseason go?,[deleted],2023-03-24 03:28:24
My madman’s dream is an all-double digit seed final four one year but that’s probably not gonna happen.,ChonkyWumpus,2023-03-24 03:36:33
Rick has wasted far more talent imo.,8686tjd,2023-03-24 03:41:34
Keep crying,fragger404,2023-03-24 03:18:00
[deleted],[deleted],2023-03-24 02:52:04
That wasn’t a flop,catptain-kdar,2023-03-24 03:09:39
I disagree whole heartedly,gohuskies15,2023-03-24 03:19:12
lol never gonna happen. Everything's a fix or a grand conspiracy.,PM_ME_YOUR_CHURROS,2023-03-24 03:19:17
That would eliminate 90% of all comments tho,Ok-Lack-5172,2023-03-24 03:20:27
Steve Alford and choking in March?,wooooooo1776,2023-03-24 03:26:16
The B1G and choking in March?,DBLHelix,2023-03-24 03:26:34
Tennessee and choking in November. Easiest path to the playoffs and they lose to USC,Nov26-2011,2023-03-24 03:26:38
Rick Barnes and choking in March.,SithOverlord101,2023-03-24 03:26:40
We have one good shooting game every 5 games or so.. you just got unlucky honestly.,Beermealex,2023-03-24 03:02:56
"Hell tonight they can’t hit layups. I bet they’ve missed 15 shots inside 10 feet, and not contested shots either",Hooper1054,2023-03-24 03:03:44
You didn’t play any D.  Open 3s go down depending on the shooter,fragger404,2023-03-24 03:05:03
FAU looking floppier than a spaghetti noodle,Southern_Planner,2023-03-24 03:09:31
UT can’t hit shit. That’s not the refs fault,Hooper1054,2023-03-24 03:09:29
And Charlotte won the cbi,thisisfunnyright,2023-03-24 03:25:44
"Yep, refs clearly have a Tennessee bias in this game.",[deleted],2023-03-24 03:35:20
😂😂😂😂😂😂😂😂,Writal,2023-03-24 03:36:03
