Comment,Author,Created UTC
There's no reason for two eastern time zone teams to tip at 9:00 eastern,[deleted],2023-03-24 00:19:23
"[This was the play they really called the Flagrant on, I think](https://twitter.com/bferg999/status/1639103700366147584?s=46&t=daqEl6IRuNEKGvbHj-4bCg)",ddottay,2023-03-24 03:19:27
people saying FAU isn't good lol. They are 33-3 for christs sake.,asaber1003,2023-03-24 03:15:05
"My favorite graphic is the one that says “During Team A’s 12-0 run, Team B has made 0 shots”",TheJURY15,2023-03-24 03:24:51
"“Seven point lead but it feels closer than that”

Maybe because it’s actually a four point lead?",stripes361,2023-03-24 02:52:33
"If I watch another 6' 4"" guard rebound over three UT players, I will lose it.",HerpaderpObes,2023-03-24 03:01:50
I literally think they showed the wrong replay.,Nodarg,2023-03-24 03:19:38
"Weird, guess the refs didn’t have an agenda and it was clearly just a dirty play",Johnnymac98,2023-03-24 03:22:50
Pretty sure I’m dreaming but idgaf either way,blenkows,2023-03-24 03:46:45
That was the coldest shit I’ve heard. Allie asked him what he thought when his coach gets emotional talking about him and Davis didn’t stutter to say “it means I’m great” 😂,Tommy_Wisseau_burner,2023-03-24 03:46:46
"How was that FAU’s ball, respectfully?",GreenKeel,2023-03-24 03:11:31
What a travel lmao,MightyEighth,2023-03-24 01:42:30
"After how much Vol fans told us to quit whining about refs in both football and basketball this year, this is tasty as hell.",djowen68,2023-03-24 03:38:16
FAU vs K State in the elite 8 lmfao,XAfricaSaltX,2023-03-24 03:43:55
ITS GREAT TO BE AN FAU OWL,Funky_Dingo,2023-03-24 03:46:13
I honestly think we’re looking at the wrong play there.,ddottay,2023-03-24 03:17:11
Can we just not let Key shoot anymore. Dear lord.,TotesMcGotes13,2023-03-24 03:02:13
This is pitiful. Rick let’s them go on a damn 5 minute run with no timeout. Yeah it’s real useful now that we are down 7,zorofan8878,2023-03-24 03:13:09
Ok I take everything back that should be a flagrant 2 LOL,ICaseyHearMeRoar,2023-03-24 03:22:34
"I could hear the collective ""OHHH yeah, that's bad"" in this thread lmao",Alexlsonflre,2023-03-24 03:22:55
Keep crying about the refs. FAU outplayed Tennessee that entire second half,SaltyPickle1495,2023-03-24 03:37:33
"One step closer to the FAU v Creighton Final Four. Armageddon for my alma matters is nearing, I’m fully prepared.",BluejayLaw,2023-03-24 06:51:06
How do you watch that play several times and come up with this conclusion?,8686tjd,2023-03-24 03:17:39
I'm all good with the upset but that's some weak ass bull shit,RiverShenismydad,2023-03-24 03:18:25
"Rewound the game, flagrant foul was on a different play and completely called for.

No idea what the director at CBS is smoking",atlbluedevil,2023-03-24 03:20:11
Why is this thread buried,PFGcallaway,2023-03-24 01:46:10
[deleted],[deleted],2023-03-24 02:16:17
"They reviewed and still called that a flagrant? Lmao

Edit: it was, in fact, a flagrant",one_lucky_duck,2023-03-24 03:16:34
Inexplicable series of phantom calls,FederallyReserved,2023-03-24 03:18:40
Okay so the play it was called on was closer to an F2 than an F1 lmao,byzantiums,2023-03-24 03:22:50
"Adtime Funtime: So...another crazy game at the Garden! But ads again? Bleh...may as take some time to read these fun facts!

* [](#f/fau) Florida Atlantic - The *specific* type of Owl that the ""FAU Owls"" name refers to is that of the burrowing owl, a species that is native to the Boca Raton era. To add on, these owls were commonly found in the area where the campus is located on - and still remained in good numbers even *after* FAU's construction! Eventually, an arraignment was made to make the campus an owl sanctuary - and was the eventual namesake of the university's athletic teams 

* [](#f/tennessee) Tennessee - The Vols' all-too famous mascot is Smokey the Bluetick Coonhound - but what are his origins? Well, back in 1953, there was a competition held by the university to select a live coonhound to be their mascot - and a certain Rev. W. C. ""Bill"" Brooks entered his prize-winning ""Brook's Blue Smokey"" in this competition. At halftime of a later football game, the judging was held - and even though Smokey was the last dog introduced, the way he reacted to the crowd saying his name (barking, then howling) managed to make him the winner - and thus, the start of a long mascot dynasty!

>!There is no war in Ba Sing Se. There was no earlier similar comment I made that was missing an entire fun fact. You are just seeing things...!<",Zloggt,2023-03-24 03:30:15
"O

![gif](giphy|xRFNlhRqoP2PS)",Zloggt,2023-03-24 03:43:43
Candace is a great analyst. Great presence. Hope she becomes a mainstay,[deleted],2023-03-24 02:31:15
That’s a terrible call. WTF lol.,[deleted],2023-03-24 03:16:28
What flagrant lol bad call,Redline-7k,2023-03-24 03:17:58
I think the TV broadcast was showing the wrong play for the flagrant. The flagrant was on the other end of the floor after FAU made the three. The Tennessee center threw an actual elbow in the box out after the shot.,FrugalTycoon,2023-03-24 03:20:12
Lol yeah that’s 100% a flagrant foul,[deleted],2023-03-24 03:22:12
Okay yeah that was definitely a flagrant lmao,keymargot,2023-03-24 03:22:37
Alright that was definitely flagrant lol,TheStuffisLegal,2023-03-24 03:22:57
That’s a flagrant lmao,MapleHeel,2023-03-24 03:23:01
"Tell your kids about Tennessee fans talking shit, and then getting humbled by a 9 seed.",Gandalfthegold25,2023-03-24 03:42:34
"Watching FAU games in Boca Raton 12 years ago I never would have imagined this day would exist. Back then, my best friend would play as FAU in franchise mode of the old college basketball games and it seemed so unrealistic and goofy when he won a championship with them. Yet 12 years later FAU is halfway towards that unimaginable goal. Hoot Hoot Baby!!!",BtownBrelooms,2023-03-24 03:50:03
Barnes has now ended 15 of his 27 NCAA tournament appearances by losing to a team with a worse seed. Anti-clutch to the max.,turribledood,2023-03-24 04:07:58
Lets go Owls! Theres dozens of us!,Fastbird33,2023-03-24 01:11:46
I feel like the general March Madness viewing public doesn’t know that Olivier isn’t anything remotely close to a volume scorer and him taking two shots a half is pretty normal,LloydBraun19,2023-03-24 02:35:57
Unreal that we’re getting outrebounded,Sherpav,2023-03-24 03:01:14
7 points might as well be 70 with this offense,TotesMcGotes13,2023-03-24 03:13:01
I really think they called this on something that happened underneath the other basket. It looked like he elbowed him right when the 3 went in before the timeout.,E51838,2023-03-24 03:17:53
Didn’t Tennessee have the ball? So Tennessee calls timeout only to lose the ball on a bullshit call and give them two free throws. Fuck that,lawrence_uber_alles,2023-03-24 03:18:51
The feed is showing the wrong play. Tennessee big elbowed FAU’s big at 7:30 on the clock. Leveled him. He deserved that flagrant,MT_Whaaat,2023-03-24 03:19:18
They showed the wrong play. Not sure if the other one warranted a flagrant but it was definitely closer than the play they showed,LwLewis22,2023-03-24 03:19:33
"https://twitter.com/bferg999/status/1639103700366147584?s=46&t=daqEl6IRuNEKGvbHj-4bCg

This was the flagrant foul, please ignore the broadcast.",asaber1003,2023-03-24 03:20:54
**THEY SHOWED THE WRONG REPLAY! THE FLAGRANT WAS ON THE FAU THREE POINTER**,hoosnotbassfishing,2023-03-24 03:21:19
"Uh, yeah, I'd say that's a flagrant. He's kinda lucky he wasn't ejected, actually.",PeteF3,2023-03-24 03:22:25
Remember when Brady Manek was ejected for much less than what that guy just did,cleenclaf,2023-03-24 03:24:00
"Tennessee coming back, looks like Gonzaga came back. Damn I can only watch one game at a time…",[deleted],2023-03-24 03:28:16
Kansas St vs Florida Atlantic for a spot in the Final Four is some simulation shit,longconsilver13,2023-03-24 03:34:47
Candace Parker representin on the desk! Let’s go VOLS!,Ok-Till-8905,2023-03-24 01:12:57
obligatory i love candace parker comment,[deleted],2023-03-24 01:29:12
That was a lot of steps lmao,chrt,2023-03-24 01:42:26
am I high or was that a blatant travel,DangerIsMyUsername,2023-03-24 01:42:30
Looked like a travel,Dhh05594,2023-03-24 01:42:58
Just came here for the travel call lmao that was insane,billthedancingpony,2023-03-24 01:43:20
Lmao that’s the same guy who missed the dunk against FDU,Gr8_M8_,2023-03-24 01:44:34
Did I just see Grant Williams behind the Tennessee bench?,SmellyJellyfish,2023-03-24 01:52:12
"It's basically impossible to overstate how good Vescovi has been in this game and the last game. Throwback point guard excellence, just completely refusing to let Tennessee get into the kind of frantic nonsense FAU wants to create.  Second game in a row he has personally dictated the terms of the game",CashMikey,2023-03-24 01:56:11
"Y’all way too confident in the Vols right now. There WILL be a scoring drought. The question is if FAU gets hot when we hit that drought. If so, they can easily take this.",TotesMcGotes13,2023-03-24 01:57:30
"Nah it’s cool. You guys can have it - FAU, probably",blenkows,2023-03-24 02:05:46
For a guy who “can shoot” key can’t shoot for shit,DoctorHolliday,2023-03-24 02:19:31
"If you don’t like this, you don’t like Tennessee basketball. Sickos",TotesMcGotes13,2023-03-24 02:25:56
he falls down a lot feels like a disrespectful call lmao,v-v-v-v-v-v-v,2023-03-24 03:02:05
I know UT is comfortable in these games but they are playing a dangerous game letting a team that can actually play offense hang around. All these offensive rebounds going to bite them.,DoctorHolliday,2023-03-24 03:02:24
the fact that we have had a gazillion opportunities to pull away and haven’t is just ridiculous,[deleted],2023-03-24 03:03:18
That timeout really needed to be called a couple of minutes ago,Boom_Confetti,2023-03-24 03:11:38
I want FAU but refs gotta keep from getting wrapped up in momentum,addicted2antacids,2023-03-24 03:12:00
"If you didn't see this coming from the comments all week, I got a beach front property to sell ya in North Dakota.",Nifos88,2023-03-24 03:12:29
That was definitely out on FAU. Refs blew that one.,grey_pilgrim_,2023-03-24 03:13:44
Why is FAU getting the calls lmao,UMeister,2023-03-24 03:17:04
0.1 seconds of basketball then commercials. Love it!,[deleted],2023-03-24 03:18:24
Pretty unfair for the Owls to get to play this game after sundown,Equal-Razzmatazz1806,2023-03-24 03:18:41
Wrong replay. He decked the guy on the three,elbenji,2023-03-24 03:19:22
Oh DAMN that was dirty. That’s nasty.,[deleted],2023-03-24 03:22:13
oh holy shit thats one hell of a flagrant,Gavangus,2023-03-24 03:22:27
okay now that’s a flagrant,trex_189,2023-03-24 03:22:33
Okay yeah that’s straight up flagrant lol,spncemusic,2023-03-24 03:22:47
Lmao yeah that was absolutely a flagrant. Dirty ass play,SmellyJellyfish,2023-03-24 03:22:56
8 points might as well be 20 for this team,yousmelllikebiscuits,2023-03-24 03:25:29
I'm just here for the fau celebration dunk,fancycheesus,2023-03-24 03:26:35
Too much time left. Idk if FAU can finish it out,Anus_Targaryen,2023-03-24 03:28:18
did you know: a group of owls is called a parliament??,greysfordays,2023-03-24 03:40:35
It’s happening. My God.,FriedFishFan,2023-03-24 03:40:55
"Tennessee trying to hit literally a single 3

![gif](giphy|DAQPViKDezujAL1FLF|downsized)",StarvedRock314,2023-03-24 03:41:24
FUCKING FAU IN THE ELITE 8!!!,noah3093,2023-03-24 03:41:28
"As a diehard FAU fan as of the last few hours, this is the best day of my life",loyalsons4evertrue,2023-03-24 03:42:07
DUSTY “WE SLEEP IN” MAY,FriedFishFan,2023-03-24 03:44:17
Tuning over to watch UCLA implode like UT,Hooper1054,2023-03-24 03:44:29
"Friendly reminder there is a difference between playing ""physical"" and playing ""dirty"".",charliebrown2417,2023-03-24 01:44:15
This game thread was fucking buried.,FrenchieBammer,2023-03-24 02:06:22
"that was 100% off of FAU, but okay",[deleted],2023-03-24 03:11:02
Tennessee can’t buy a call right now. FAU taking full advantage of the momentum.,MarbleBlasted,2023-03-24 03:13:25
"I love upsets, but that was not a flagrant.  Not even close.",Rysilk,2023-03-24 03:18:38
Plavsic should have been ejected. That’s the dirtiest play I’ve seen in a while.,crimsonblueku,2023-03-24 03:30:27
Fuck Tennessee is playing some really good d,YoungNissan,2023-03-24 02:14:09
Ted Lasso has become the official replacement for Harry Potter as a safe feel-good inoffensive pop-cultural national broadcast reference,[deleted],2023-03-24 02:34:34
"”Its a 7 point lead but it feels a lot closer than that.”

*looks at score*

Well, there's a reason for that, buddy.",MisterTito,2023-03-24 02:54:14
Key should not be in the game man,FeverOG,2023-03-24 03:01:45
Tennessee has a big size advantage and they're getting beat on the boards,thewill450,2023-03-24 03:03:21
"I mean this with no disrespect, but c’mon, let’s just … Can Vols fans give just a tiny peek behind the curtain and just… Plavsic is at least 36, right?",Mpm_277,2023-03-24 03:03:57
DONT LET THE OWLS GET HOT,jzsszmzj,2023-03-24 03:11:24
Why are they reviewing this lmao,belmontbreak,2023-03-24 03:16:24
".... There's nothing there....

Maybe a flop",strongscience62,2023-03-24 03:16:25
Should've been nothing man that's stupid,FutureRaifort,2023-03-24 03:16:30
What an awful fucking call.,neasroukkez,2023-03-24 03:18:00
They were reviewing the other play on the made 3 the announcers and production crew were reviewing the wrong play. Rewind it to the 3 and watch closely he tackled him,spawnofreddit,2023-03-24 03:19:10
Ok yeah that was a legit call lol,8686tjd,2023-03-24 03:22:19
Ohhhhhh yea that was the flagrant,a_banned_user,2023-03-24 03:22:34
Kick him out on that. Tf,FakeInternetDentity,2023-03-24 03:22:35
"Ok, *that* was an f-ing flagrant, no doubt",VinceValenceFL,2023-03-24 03:22:53
okay yea that's a flagrant lmao,Triscuitador,2023-03-24 03:23:00
Okay that is 100% an F1 hahaha now that we’ve seen the correct replay,Hammerhead34,2023-03-24 03:23:18
"Could have been a flagrant 2, that was dirty as hell",atticus_will,2023-03-24 03:23:59
KSU or MSU beats both these teams by 10+ tonight that game was just on a different level felt like a final four game.,JayMoney2424,2023-03-24 03:25:32
FAU definitely shouldn't have been a 9 seed lol,lulsszs,2023-03-24 03:26:16
If Tennessee wants to win they perhaps should have hit those free throws,dizZzy5,2023-03-24 03:27:50
"Regardless of outcome, Rick Barnes took a wrestling team to the Sweet 16. That's a coaching job",CtlEngr,2023-03-24 03:34:08
"Fuck it conference USA go win every tourney. First CBI, just need the NIT and NCAA.",Licit_x64,2023-03-24 03:34:42
"The committee put Penny Hardaway, Matt Painter, Shaka Smart, Rick Barnes, Tom Izzo, and John Callipari all in the same region knowing damn well the chaos that would ensue",bh6891,2023-03-24 03:36:10
"Can’t even get a goddamn rebound, fuck off",Sherpav,2023-03-24 03:36:43
"Refs didn't orchestrate a 18-2 run, what a whiff",symptomatc_adherence,2023-03-24 03:38:58
That was nice of the Vols to burn off the rest of the clock for FAU,Anus_Targaryen,2023-03-24 03:41:40
"Florida Atlantic vs Kansas State for a Final Four appearance.

![gif](giphy|2XskdWuNUyqElkKe4bm)",crappysandwich,2023-03-24 03:41:48
Friendly reminder that Rick Barnes couldn't get to the Sweet 16 with Kevin ducking Durant,CtlEngr,2023-03-24 03:43:09
all the faux outrage threads from sunday aging like MILK rn lmao,inshamblesx,2023-03-24 03:43:19
HOOT HOOT MOTHERFUCKERS,greysfordays,2023-03-24 03:44:14
FAU's coach got serious preacher vibes,bird-nado,2023-03-24 03:46:22
"Lmao what a fix, not even subtle

Edit: ah they showed the wrong play, makes sense",Shadrimoose,2023-03-24 03:17:52
bro how bad is this broadcast that they all missed the actual play where he straight checked that dude to the floor lol,ItzTheDad,2023-03-24 03:18:03
"Go FAU simply because the less “SOLE” shirts I see, the better",[deleted],2023-03-24 01:30:20
Can we talk about how they play SO much better defense in the NCAA than the NBA,blenkows,2023-03-24 01:46:59
[this game_irl](https://i2-prod.mirror.co.uk/incoming/article369156.ece/ALTERNATES/s615b/A12509CC-ACF8-7AF7-F2A6F368E6B587D4.jpg),aMiracleAtJordanHare,2023-03-24 01:48:27
"Boy, Tenn looks like an extremely frustrating team to play",Josh4R3d,2023-03-24 01:53:56
If Uros was just an average athlete he’d be an animal,orangewrld,2023-03-24 02:06:03
Tennessee is basketball terrorists. Games are so frustrating but respect where it’s due I guess,HectorReinTharja,2023-03-24 02:06:19
Boy we can't fucking make a shot,oddfuture671,2023-03-24 02:10:54
Neither team currently poses the ability to get the ball in the basket,Some_Pie_347,2023-03-24 02:12:40
Imagine having the absolute statue of Uros Plavsic on you as a guard and taking a 35 foot 3-pt shot,yousmelllikebiscuits,2023-03-24 02:19:50
Tennessee’s defense is playing great their dumpster fire offense is gonna let the Owls hang around.,BaltimoreBeefBadBoy,2023-03-24 02:21:32
"If you say the owl team's name like it's a word instead of an abbreviation, you sound like an incredulous southern basketball fan",[deleted],2023-03-24 02:48:42
He ripped and threw that right out of bounds. Right in front of the ref.,RVOSU50,2023-03-24 03:10:58
"This timeout was way overdue, Barnes",BasebornManjack,2023-03-24 03:12:14
FAU is back to being a friend of the sub,[deleted],2023-03-24 03:12:33
🦉🦉🦉🦉🦉🦉🦉🦉🦉🦉🦉🦉🦉🦉,Playbook420,2023-03-24 03:12:45
There's the Rick Barnes coached team choke we all knew was coming,locknload03,2023-03-24 03:13:07
༼ つ ◕_◕ ༽つ FAU take my energy ༼ つ ◕_◕ ༽つ,PhoneAcc23,2023-03-24 03:15:20
Can we review that out of bounds call while we are at it,Rickydada,2023-03-24 03:16:06
I think the refs are on some shit right now but without them this would still be like a 8-2 run.,RVOSU50,2023-03-24 03:16:14
these refs,trex_189,2023-03-24 03:16:27
I could care less about either team but what the actual fuck,FullCodeSoles,2023-03-24 03:16:33
"""Can't see the elbow from this angle"" no shit cause it didn't happen",OrangeCrushD,2023-03-24 03:16:40
Even Gene can’t spin that one,ilovecfb,2023-03-24 03:17:00
That's ridiculous,JEH-C,2023-03-24 03:17:14
I think they looked at the wrong play on the broadcast. I think the call was on the made three by FAU when Golden ended up on the floor.,mra101485,2023-03-24 03:17:18
"I’ll never feel sorry for Tennessee getting called for fouls with how physical they play, but no way that was a flagrant foul",timh123,2023-03-24 03:17:27
"What is that call? That's abhorrent to call, especially on a replay!!",Clynelish1,2023-03-24 03:17:35
"I am so confused. Over 10 seconds of game time later, and after UT used a timeout, you call the flagrant? Does UT get its timeout back?

Also, if their coach had called it two or three possessions ago like he should have, that doesn’t happen.",magikarp2122,2023-03-24 03:19:01
Broadcast has the wrong play.,NuggetSoup,2023-03-24 03:19:24
I blame Bill Lee for this,symptomatc_adherence,2023-03-24 03:20:45
I think the refs were looking at the high elbow at the other end of the floor and the broadcast was showing the wrong replays? If not then I have no idea how they view that as a flagrant,rwellsy09,2023-03-24 03:21:08
ohhhh wtf yeah that’s a flagrant,Boom_Confetti,2023-03-24 03:22:12
ok yeah that should've been a flagrant 2,HopscotchChampion69,2023-03-24 03:23:08
Lmao okay yeah that one is very much flagrant,cscowboy01,2023-03-24 03:23:15
"Plavsic is so ass lmao, gets played off the floor in every damn game",SwissArmyScythe,2023-03-24 03:23:19
I think I’m in love with the owls logo,greysfordays,2023-03-24 03:26:40
Tennessee really kept in two centers for the past 5 minutes while getting run off the floor.,[deleted],2023-03-24 03:33:45
"“I said it back in February. There was something special about this FAU team. I knew they would go at least elite eight in the tourney.” 

Lebron James",FireSalsa,2023-03-24 03:35:23
From Dunk City to Owl City hootie hooooooo,beav910,2023-03-24 03:35:28
I can’t fucking believe it,FriedFishFan,2023-03-24 03:36:37
[deleted],[deleted],2023-03-24 03:38:13
Honestly you can’t expect to win any game with how many missed tackles Tennessee had tonight,big_mustache_dad,2023-03-24 03:38:30
It’s a good day when Tennessee loses,BigballerBrett,2023-03-24 03:38:43
"Ahhh, you love to see a good 26 second possession there for Tennessee.",pghgamecock,2023-03-24 03:41:02
Seethe Tennessee fans…seethe,corndognugget,2023-03-24 03:41:41
"Everyone rooting for the FAU 360 dunk attempt is wrong, Barnes is about to bring Plavsic back in for the craziest 360 elbow anyone’s even thrown",byzantiums,2023-03-24 03:42:48
HOOT HOOT,surgebinder16,2023-03-24 03:44:38
Just saw the final and so hyped for the Owl bros.,texas2089,2023-03-24 03:47:20
Holy shit!,Fastbird33,2023-03-24 03:50:07
It was for this elbow https://twitter.com/jbirdb320/status/1639104153778790400?s=46&t=UfownUbsBFvlZKeagz30_w,OrlandoAndy,2023-03-24 03:19:21
Seeing how C-USA did in the NIT and the CBI makes FAU's resume even more impressive. Such a travesty that Memphis-FAU was an 8-9 game. Realistically they're both 6/7 seeds.,FutureRaifort,2023-03-24 03:24:56
That was clearly Tennessee ball lol,BreadKiller0688,2023-03-24 03:11:22
[deleted],[deleted],2023-03-24 03:11:41
"Everyone is like ""hey CBS showed the wrong replay for the flagrant"" but Tennessee fans would still rather find a way to cope with losing",Ok-Lack-5172,2023-03-24 03:22:31
Y'all gonna walk back your outrage a bit? Plavsic is a bitch.,PM_ME_YOUR_CHURROS,2023-03-24 03:22:41
he walked no?,chillmagic420,2023-03-24 01:42:34
I’m glad the vast majority of people no longer see FAU has villains (which was really weird in the first place),AFC-Wimbledon-Stan,2023-03-24 01:42:35
FAU is going to get blown out. Tennessee is too big and physical.,Wes___Mantooth,2023-03-24 01:54:01
Rick Barnes looks like he could be FAU's mascot,Wes___Mantooth,2023-03-24 02:01:25
"Honestly, I'm impressed with FAU at this point, all things considered.

I'm just more impressed with Tennessee's defense.

The offense... well, it looks better than ours. But man does that defense look delightful.",stoppedcaring0,2023-03-24 02:05:27
These turnovers are killing us! Oh and they need to make these open threes.,MinoKillz,2023-03-24 02:05:49
Plavsic getting some dirty looks from Rosado like Plavsic is the most annoying player he's ever played against.,yousmelllikebiscuits,2023-03-24 02:06:26
"If FAU could hit anything from the perimeter we might have a game, they’ve gotten good looks and just totally blown them so far

Tennessee’s defense is spectacular at just doing all the little things to throw you off though",rvadarocket,2023-03-24 02:06:44
"I hate the antonellis...they may actually be real and wonderful people, but u show me 5000 of ur commercial in a few days and I can't stand u",chrt,2023-03-24 02:06:48
"If Tennessee could shoot, they’d be unstoppable hahaha",[deleted],2023-03-24 02:10:25
Our offensive rebound numbers are gonna be fire tonight after all these misses,oddfuture671,2023-03-24 02:12:31
Talent difference is enormous... if only lay ups start rolling in,offtime_trader,2023-03-24 02:14:06
Damn tn shooting 37% from the field. Typical.,Ok-Till-8905,2023-03-24 02:15:44
FAU doing just enough to hang around. Gotta pray the 3-point shooting progresses to the mean.,run_nyg,2023-03-24 02:20:26
we’re so screwed when these FAU threes start falling,[deleted],2023-03-24 02:20:36
If FAU heats up it feels like we’re gonna be fucked. They’ve had open looks,white_crayon99,2023-03-24 02:22:24
REMINDER: Tennessee is 22-0 when their opponent scores less than 60 points.,yousmelllikebiscuits,2023-03-24 02:25:58
For Florida Atlantic be only down 5 despite having 9 turnovers and shooting poorly from the field I think Dusty May will take that.,spierce64006,2023-03-24 02:28:04
I feel like Rick Barnes is about to Rick Barnes this game...,Iamnofunatparties,2023-03-24 03:03:20
This is Lane Kiffin's fault,jodatoufin,2023-03-24 03:13:21
"No flairs with the spiciest takes, as per usual in March",bh6891,2023-03-24 03:16:18
Big dude in FAU is a grade A flopper,a_banned_user,2023-03-24 03:16:55
"I hate tennessee, but they are getting fucked worse then we did by fau refs",AlorsViola,2023-03-24 03:16:58
Embarrassing officiating.  Even ref shill Gene can’t defend it,newnewcharcoil23,2023-03-24 03:17:02
 Get fucked anyone who thinks that is correct.,HiFriend88,2023-03-24 03:17:02
Not remotely a flagrant. Golden has flopped all night,Mythic514,2023-03-24 03:17:04
Even Gene disagrees my God,HallandOates2,2023-03-24 03:17:07
Memphis gotta be kicking themselves rn,doyouevenIift,2023-03-24 03:18:53
So Tennessee can call a timeout with the ball and then just come back to two free throws for the other and they lose the ball. That seems fair.,rsspecht21,2023-03-24 03:19:13
FAU been giving off evil vibes,05_legend,2023-03-24 03:20:26
Shout-out the one dude in the comments that said that. Homie knew more than the tv crew smh,FutureRaifort,2023-03-24 03:22:10
Ok that's actually a flagrant lmao,mtmodi,2023-03-24 03:22:32
Finally they showed the actual replay jfc TBS,Kardinale,2023-03-24 03:22:47
oh ... that was a foul.,WildfireTommyBitch,2023-03-24 03:22:50
More so amazing that wasn’t even called a common foul in real time,a_breezy_12,2023-03-24 03:22:54
What the fuck is that? Get this dude out of here. No room for that shit.,Sad_Entertainment_54,2023-03-24 03:23:04
"lmao the broadcast had us all confused, that foul was definition of a flagrant",LindberghBar,2023-03-24 03:23:42
100% a flagrant,JB92103,2023-03-24 03:23:48
20-4 run is crazy,Chance_Adeptness_832,2023-03-24 03:23:49
