Comment,Author,Created UTC
Maybe they watched all of it except the end of the WCFs?,TheGeoninja,2023-03-16 01:36:42
as long as Chris Paul doesn’t get injured then then Nevada’s got a chance,ImmoralModerator,2023-03-16 01:36:47
*Hedake Smith has entered the chat.*,Cut-OutWitch,2023-03-16 01:39:00
Why does Warner bros do anything that that they do?,go_berds,2023-03-16 01:38:39
Passion,scoot87,2023-03-16 01:42:11
It’ truly is March when you hear it,melodyfelony,2023-03-16 01:45:08
Been there,NerdLord1837,2023-03-16 01:47:37
It’s an adventure,Thel3lues,2023-03-16 01:48:14
… probably,Thel3lues,2023-03-16 01:47:58
🤝,edgyusernameguy,2023-03-16 01:49:16
They also lost to San Francisco by 37 lol,boregon,2023-03-16 01:53:18
They also lost San Francisco by almost 40 points,mF-Jonezy,2023-03-16 01:53:46
"I always looked at Painter's hair and thought it was because he looked up to Alford as a kid.  But now it's flipped.  Alford clings to youth, Painter ages gracefully.  Alford's a piece of shit, Painter has never done anything wrong, and i understand",bfinleyui,2023-03-16 01:58:41
You can’t really judge the whole conference on a fucking stellar game by ASU so far and just below average performance by Nevada.,Duck_man_,2023-03-16 01:56:15
Firm for… firm for… firm for….  Not Herm…,[deleted],2023-03-16 01:59:03
![gif](giphy|3o7TKs2IW7F6w5hurS),Firmy4DaddyHermy,2023-03-16 02:01:26
"Not to say I had my finger on the pulse of this game cause I didn’t, but I can’t recall a single intelligent thing Stephen A Smith had ever said. Has to be on purpose cause it’s absurd how much of a blowhard he is.",[deleted],2023-03-16 02:00:18
Yikes…,Bcsmitty20,2023-03-16 01:59:33
Mizzou is going to be rough. Hold on MW bros,hoyeeah,2023-03-16 02:15:30
"Villanova shot 79% from the field in the ‘85 Championship game, gotta be one of those halfs",ddottay,2023-03-16 02:02:02
While somehow playing absolutely suffocating defense it’s wild,pp21,2023-03-16 02:01:55
Would have been amazing if NAU won the Big Sky. 4 AZ would have been in.,romanapplesauce,2023-03-16 02:07:39
otoh Sparky being nationally relevant in athletics is the first sign of the apocalypse,stoppedcaring0,2023-03-16 02:02:20
ASU can't sustain this offense for a deep tourney run. A nice dream though. Why is my flair faded?,romanapplesauce,2023-03-16 02:06:25
"They’re more big 10 than the big 10, they went 0-4 last year",Historical_Score5251,2023-03-16 02:04:13
Zags win 78-72,inshamblesx,2023-03-16 02:06:15
Hold my beer,guest1969,2023-03-16 03:02:30
Subscribe,[deleted],2023-03-16 02:08:05
Both those schools are very similar so it naturally makes sense,PNW_Jeff,2023-03-16 02:20:21
"Clemson lost to Morehead.  That was pretty fun. 

UCF blew out Florida.  That wasn't really fun, but it was funny.",Pollaski,2023-03-16 02:33:17
How did the Dominicans look,[deleted],2023-03-16 02:34:01
Bro wtf happened to Edwin Díaz?!,3EEBZ,2023-03-16 02:36:31
He's looking at the can like he's an alien seeing beer for the first time lmao,CaptainScuttlebottom,2023-03-16 02:37:59
Definitely a bud heavy kind of guy,Hokiestoned,2023-03-16 02:37:35
"Ever? He's been around a long time, so probably. I'd bet he doesn't drink alcohol at all anymore, probably for a while.",justaguyinthebackrow,2023-03-16 02:39:22
"He has and for every sip he says ""It's awesome baby!""",knivesout0,2023-03-16 02:53:28
It’s not our fault!,wooooooo1776,2023-03-16 02:38:34
Neither will have Kentucky if they don’t win this year,ImmoralModerator,2023-03-16 02:39:31
[deleted],[deleted],2023-03-16 02:38:34
That is a risky proposition. MW hasn't won a single tourney game since 2017...,ekimtk,2023-03-16 02:41:21
Thanks for believing in us lol,scoot87,2023-03-16 02:43:17
I genuinely think they were trying to help Nevada and then realized Nevada is so ass they can’t be helped and the refs didn’t want to blow their cover,ImmoralModerator,2023-03-16 02:42:06
I like to imagine Gene is just chilling on his couch in his underwear with a beer in hand and some wireless headset on waiting to be called on,Shamoofles,2023-03-16 02:46:03
Making up for all the Suns missed calls,IvankasFutureHusband,2023-03-16 02:50:22
Burger King wannabes,ImmoralModerator,2023-03-16 03:02:03
"With the transfer portal being as fluid as it is… I never get too excited about next year, but if it happens yeah it will be.",bobsaget824,2023-03-16 03:08:08
We got Braelon Green coming in next year too,theopression,2023-03-16 03:06:46
*sad howl*,1nf1niteCS,2023-03-16 03:13:02
Isn't Bobby already Robert Jr?,ALC_PG,2023-03-16 03:17:07
Lmaoo what’d you do,theopression,2023-03-16 01:17:53
Bill Walton approves this message,bgrad,2023-03-16 01:49:57
The PAC never gets its respect. Nothing new,GovernmentDoingStuff,2023-03-16 01:50:15
Dude ASU is playing a mid major that has lost their last 3 in a row to quad 3 opponents... Nothing has been proven yet lol.,ekimtk,2023-03-16 01:50:10
"No one will respect the Pac 12 until one of you win a title this century.

Even the B1G has won one this millennium.",stoppedcaring0,2023-03-16 01:51:26
He’s not even looking at him…,rockking16,2023-03-16 02:44:36
pretty sure NET gets tweaked every year.,Limp_Difference_5964,2023-03-16 02:03:39
"Ray is mad that Bobby has some success

Gotta quash that ASAP",[deleted],2023-03-16 00:37:51
Say what?,mrwhitaker3,2023-03-16 00:28:49
What,ddottay,2023-03-16 00:50:11
Lol was it revealed Ray didn’t like him in that shitty article that came out today?,theopression,2023-03-16 00:58:57
I think he fits better on college coverage honestly,theopression,2023-03-16 00:57:22
"Washed up alumnus here, FORKS UP 😈",cr0asu,2023-03-16 01:05:39
Hell yes Devils go get it!,marietta1200,2023-03-16 01:07:54
Nevada's wolf pack is 2words because you threatened to sue them if they didn't change it from one word. Also made Nevada change their Wolfie logo.,kneesmyon,2023-03-16 01:08:18
Here we go Firmy!,theopression,2023-03-16 01:15:32
SHOUTOUT TO /r/THE_PACK  AROOOOOOOOOOO,hussard_de_la_mort,2023-03-16 01:17:38
Dangerous game,JarodR747,2023-03-16 01:23:42
Firehouse is good,rattlerden,2023-03-16 01:22:01
"Fire House is the platonic ideal of... fine.

I have absolutely no idea how anyone could have strong feelings about it positively or negatively. You will receive adequate nutrition, you will have a pleasant but not mind-blowing taste experience.",stoppedcaring0,2023-03-16 01:24:13
"Did you get Cpt Sorenson sauce?

You'll regret not getting that with it",just-here-4-football,2023-03-16 01:21:43
"Nope. Unless it becomes soggy before you get it. 

The turkey bacon ranch slaps.",leakymemo,2023-03-16 01:22:30
"Vandy is a two seed in the NIT. They weren't next in line or anything, nor did they even have the most authoritative win by an NIT two seed.",elgenie,2023-03-16 01:25:02
"Hurts me to say this, but ASU isn’t a bad squad",TheBestKennedy96,2023-03-16 01:42:04
Alford,SwizzyDangles,2023-03-16 01:27:59
Because they took Rutgers spot,Almost_Punk_Enough,2023-03-16 01:27:08
Steve Alfraud don't play no D,Mh401k,2023-03-16 01:27:35
Doubt Bill Walton at your own risk,SirCromwell,2023-03-16 01:29:03
"Rutgers and Clemson fans, eh.",jabronius89,2023-03-16 01:36:48
Turns out having more turnovers than made baskets is bad.,elgenie,2023-03-16 01:37:58
It was with 8:37 to go in the 1st,cantpossiblywin,2023-03-16 01:45:41
with 10:49 left,inshamblesx,2023-03-16 01:39:20
Alford should never be allowed to live that down,Cut-OutWitch,2023-03-16 01:41:54
"Hey, respect Texas Southern

They beat us",[deleted],2023-03-16 01:41:11
"We're watching a team that lost to Texas Southern, though",elgenie,2023-03-16 01:41:27
You’re late.,3EEBZ,2023-03-16 01:41:02
You're in the right place!,GrouchyTrousers,2023-03-16 01:44:08
Thats hard,bfinleyui,2023-03-16 01:43:20
Usually we run through baker in the first half in the post but no idea what the fuck they're doing now,Zeppelin96,2023-03-16 01:44:21
"Somedays u hot, somedays u not",scoot87,2023-03-16 01:44:35
Also lost to USF by about 40,MarkFewsEyebrows,2023-03-16 01:47:47
"so you're saying athletics personnel employed by the University of Iowa acted unethically?

well I never",stoppedcaring0,2023-03-16 01:46:32
We need Bill for the First 4 games,Party_With_Porkins,2023-03-16 01:45:43
At least they have a sleek logo,scoot87,2023-03-16 01:47:18
Don't forget about Oregon. But yeah having 4 teams in the sweet 16 and 3 in the elite 8 was pretty sweet after the constant disrespect that year,jabronius89,2023-03-16 01:51:23
Yeah lol. Was waiting to see this comment,Shamoofles,2023-03-16 01:54:50
TCU plays defense. It won't be this easy against them.,mrwhitaker3,2023-03-16 01:54:16
110 points *this half*.,NotABot1235,2023-03-16 01:59:27
Avery Johnson.,warrenjt,2023-03-16 01:57:34
It’s Avery Johnson lol,tboots1,2023-03-16 01:57:57
"I thought Nevada was a fraud, this is confirmation",LackOfAnotherName,2023-03-16 01:58:32
This bodes terribly for you too lmao,RJD-ghost,2023-03-16 01:59:23
Hahaha fuck you Nevada. How did this team get in? They melted down the stretch!,Surfer5153,2023-03-16 02:10:08
Shhhh bad KARMA,hoyeeah,2023-03-16 02:16:50
"We split games with you this season, right?",Flycat777,2023-03-16 02:16:54
"We've been bad for awhile, sorry Aztec bros",hoyeeah,2023-03-16 02:03:39
Steve. Alford.,AndABananaCognac,2023-03-16 02:06:25
"It will be funny if the rest of the MWC wins after seeing this tho

Could be some real good cold takes exposed lmao",rvadarocket,2023-03-16 02:01:13
"Well yeah. Though we could say the same thing about the big ten if they flame out.

Any bit of common sense would have said it was ludicrous these MWC teams had higher metric ratings than the top ACC teams, and this is the beginning of history repeating itself potentially",dementedturnip26,2023-03-16 02:03:49
Because he’s a douche,SwizzyDangles,2023-03-16 02:01:27
https://www.crimsonquarry.com/2017/3/18/14966490/steve-alfords-pierre-pierce-iowa-sexual-assault,3EEBZ,2023-03-16 02:03:14
"Blindly and by default defended a player that was accused (and later convicted, I believe) of rape. EDIT: I was wrong on details; read the article linked in another comment here. 

Overall known to be an asshole, in a similar vain to Bob Knight. 

His fans in the IU community are the most pretentious people.",warrenjt,2023-03-16 02:03:30
"Unlike truck stop conferences they aren’t driving trucks between the cities, they’ll fly.",[deleted],2023-03-16 02:16:33
Looks like your pitching your tent,scoot87,2023-03-16 02:06:58
Invite UTEP,bh6891,2023-03-16 02:07:05
Typical Alfraud,guest1969,2023-03-16 02:10:10
Two of the first four out lost at home to mid majors in the NIT and a third opted out of the postseason. If people are going to judge these teams based on one game then none of the other bubble teams are making their case any stronger either,SaintArkweather,2023-03-16 02:20:22
67th place game,SaintArkweather,2023-03-16 02:12:03
https://www.crimsonquarry.com/2017/3/18/14966490/steve-alfords-pierre-pierce-iowa-sexual-assault,3EEBZ,2023-03-16 02:15:26
"Give me a second to add articles in an edit, but he was a rape apologist at Iowa, left UNM 10 days after signing a 10 year extension, and wasted so much talent at UCLA by playing daddy ball with Bryce (who would be a legit 7th man on top teams or starter at a mid major, but should never have started over Zach Lavine)",dinoian,2023-03-16 02:18:09
I think it's just people who hate Indiana.,Common-Community-550,2023-03-16 02:15:55
The bubble was hella weak this year.,1nf1niteCS,2023-03-16 02:16:11
"Per Chris Karpman: ASU only turned the ball over 1 time in the half and had 13 assists. 

ASU hasn't done better than 23 assists to 10 turnovers in a game this season.",bgrad,2023-03-16 02:24:18
Subscribe,SirDevilDude,2023-03-16 02:21:23
My dream is that NAU gets it’s shot together and AZ creates a Crossroads Classic 2.0,TooHotForDog,2023-03-16 02:25:41
You want em to go back out there?,Flycat777,2023-03-16 02:25:35
It debuted when Perry Ellis was a freshman,SaintArkweather,2023-03-16 02:27:04
"If InvescoQQQ and AT&T ads can keep updating each season, so can Marriott",melodyfelony,2023-03-16 02:27:26
Yeah reusing the same mascots makes it boring tbh. And just having like zero speaking lines for em either is worse. Worst part is UNC is staying at a Super 8 cause they couldn’t make the tournament,LoserUserBruiser,2023-03-16 02:26:16
It’s just like the Antonellis commercial that gets beat to death in NBA games lol,wcooper97,2023-03-16 02:35:49
"Kim Kardashian

Edit for the uneducated: https://m.youtube.com/watch?v=qQseDjVp10I",Shamoofles,2023-03-16 02:36:07
This will be it,doublething1,2023-03-16 02:36:18
Might be this one,thewhalehunters,2023-03-16 02:36:43
Largest one in the tournament was in the first four. Incidentally another really big one was done by Nevada in 2018.,SaintArkweather,2023-03-16 02:39:14
"Kentucky came back from 31 down in the second half to LSU in 1994, but it wasn't in the tournament.",justaguyinthebackrow,2023-03-16 02:41:23
"can stop as quickly as it started though, I imagine",ImmoralModerator,2023-03-16 02:36:33
"It's like they're only calling it on the perimeter like that, but I think that also helps Purdue.",bendovernillshowyou,2023-03-16 02:43:00
I am still pissed about the sheer number of fouls called on us during our game.,NotABot1235,2023-03-16 02:46:48
Hey I'm trying to get a similar IU/ASU flair but I keep just getting assigned the one despite trying to follow the instructions. How did you get two flairs?,MrP1anet,2023-03-16 02:53:13
Alford,1nf1niteCS,2023-03-16 02:49:18
Because March baby!,doublething1,2023-03-16 02:59:27
There's nothing else to watch. Life is meaningless.,Joelsaurus,2023-03-16 02:59:03
"""We realize this may be the last time you watch TruTV in 2023, but please hang on! Nevada's making a game of it!""",Cut-OutWitch,2023-03-16 03:00:58
![gif](giphy|3oriO5t2QB4IPKgxHi),ImmoralModerator,2023-03-16 03:03:14
That’s hurleys son lol,balakay_lodge,2023-03-16 03:03:55
"Genuine jackass

[When UCLA was about to fire him](https://twitter.com/latbbolch/status/1076608378535923718?s=46)",RyanIsHungryToo,2023-03-16 03:13:06
"Horrendous coach and bad man. You can read about his controversy at Iowa by googling his name + Pierre Pierce

Pulled in extremely talented classes but did nothing with them 

As mentioned below played his son at the expense of better players",SolarpunkJesus,2023-03-16 03:14:23
"On top of what everyone else has said: he had a player accused of some heinous crimes. Alford didn't just defend his player without evidence, he went so far as to accuse the young woman who came forward of lying for attention and making up the allegations. He did this in public, multiple times, without any actual proof. Which put a public target on her back. And what do you know, it turns out she was telling the truth. So Alford made this young woman's life much worse, dragging her name through the mud, during what was probably already one of the worst times of her life.

https://www.crimsonquarry.com/2017/3/18/14966490/steve-alfords-pierre-pierce-iowa-sexual-assault",BatManatee,2023-03-16 03:16:34
"Iowa fans hate him cause he covered up for a rapist on his team

New Mexico fans hate him because he left them in a slimy way and lied to them

We hate him because he never bought into the program’s history, acted like he was above it, and was arguably one of the worst coaches we had",listinglight778,2023-03-16 03:16:40
UCLA fans this is your moment,bobsaget824,2023-03-16 03:12:41
He helped try to cover up rape while a coach at Iowa.,ilkei,2023-03-16 03:15:15
Complete tool when he was stinking it up at UCLA.  Hence a lot of the hate coming from UCLA flairs,disposable-assassin,2023-03-16 03:13:01
read his wiki. Covered up sexual assault at Iowa is the crown jewel in the shit sandwich,cshenton,2023-03-16 03:13:12
It can’t help that he knew he had no business being near a program that storied and he used his position to give his son a spot on the team lol,ImmoralModerator,2023-03-16 03:14:21
"This was a team picked to finish 9th this year after losing their best three players.

Most of us in Reno are actually fairly happy with him. And the entire team can return.

I very much doubt it.",Freakydeaky9,2023-03-16 03:17:08
He has a 10 year contract lmfao,1nf1niteCS,2023-03-16 03:16:05
"Sometimes you just get smoked by a team that can't miss. 

I should know, happens to us enough",Muh_Nado,2023-03-16 03:18:23
Maybe if they go for a quick 2 here,LondonIsBoss,2023-03-16 03:18:24
YES!!!,Hybridkg87,2023-03-16 03:21:15
"Lampkin is out, right?",disposable-assassin,2023-03-16 03:26:11
"Wouldn’t fade SDSU tbh, but everyone else seems fair game",SirCromwell,2023-03-16 01:59:22
Definitely,[deleted],2023-03-16 02:03:26
"Nevada was on a bad 3 game skid. I’m not sure why they got in to begin with honestly, mid major or not",LongMaybe1010,2023-03-16 02:21:34
There is no chance you guys lose. But I hope BSU does obviously,fluffyglof,2023-03-16 02:43:42
The first 2 are realistic but I don't know about that last one,LondonIsBoss,2023-03-16 02:04:26
Nice,NeedOfBeingVersed,2023-03-16 01:51:39
I think Nevada is the 2nd best team in the country,thewhalehunters,2023-03-16 01:57:15
"January

February

Mountain Worst shitting the bed",KJones77,2023-03-16 01:58:17
But not ASU good,hoyeeah,2023-03-16 02:20:52
1-800 GAMBLER,Common-Community-550,2023-03-16 01:58:36
Put down the knife,AFC-Wimbledon-Stan,2023-03-16 01:58:48
[deleted],[deleted],2023-03-16 01:59:52
Please tell me you also have money on FDU and Memphis,carnagebot_55,2023-03-16 02:00:36
I'm one half they scored more than double what NCST once scored in an entire game,AL3XD,2023-03-16 02:22:50
Put your money where your mouth is and take Nevada on the h2 cover,Jhwelsh,2023-03-16 02:29:45
*SDSU got screwed in 2020*,klongbor,2023-03-16 02:39:43
if SDSU can't get it done this year then I'm not sure who will for them,inshamblesx,2023-03-16 02:40:15
"I, too hate Alfraud",[deleted],2023-03-16 03:51:31
Anything to make you feel better losing In the NIT,madmonstermax,2023-03-16 03:16:48
Streameast dot com and then give ‘em $7,brokentr0jan,2023-03-16 00:51:50
lmao,inshamblesx,2023-03-16 01:08:01
Does James Harden give good lap dances? Does his beard tickle?,GrouchyTrousers,2023-03-16 01:24:42
Dude flopped a lot. Hardly got called for it though,sfr18,2023-03-16 01:19:21
Use a vpn and when it expires shut off the vpn then restart it,[deleted],2023-03-16 01:21:04
Easy. ASU is insane. Not always in a good way.,marietta1200,2023-03-16 01:36:41
Impractical Jokers will be back on soon,marietta1200,2023-03-16 01:32:54
Phoenix was room temperature w/ rain today,530josh,2023-03-16 01:37:42
Won’t for long if they don’t change something,therealbigted,2023-03-16 01:37:12
No ASU fan thought Gaffney was making that,bgrad,2023-03-16 01:43:34
How we beat USC everything fell,IvankasFutureHusband,2023-03-16 01:44:03
Im down,scoot87,2023-03-16 01:47:32
UConn is losing to Iona lol,Jeremyw402,2023-03-16 01:49:24
Legend,balakay_lodge,2023-03-16 01:48:22
OSU would have gotten in not Rutgers. But I agree with your sentiment.,ekimtk,2023-03-16 01:51:07
"Yeah Nevada is just outmatched, goes to show metrics aren’t perfect",Historical_Score5251,2023-03-16 01:58:55
Both,rainbowremo,2023-03-16 01:58:29
Were not great but ASU with the sun shining on 'em should be pretty frightening,Flycat777,2023-03-16 01:59:26
"So transitively, is Buttgers > Alford?",bfinleyui,2023-03-16 02:00:49
I mean I don't think the conditions could be any better for it,LondonIsBoss,2023-03-16 02:00:29
Haha yeah that team is gonna be screwed. Haha...,Joelsaurus,2023-03-16 02:01:16
Remind me in three days,dementedturnip26,2023-03-16 02:04:19
"Now hold on, UNR could still cover!",ArkanoidbrokemyAnkle,2023-03-16 02:01:43
It's not. Top 2/3 of the PAC is all really good talent. Just a few bad eggs *cough* Cal *cough*,Colonel_Toast3,2023-03-16 02:12:38
I haven't eaten subway since before Jared was pimpin them,PercySnowsHandgun,2023-03-16 02:11:03
Nevada has been on a losing streak before this and have not looked great as of late,wooooooo1776,2023-03-16 02:13:24
"Your Boise State pick is based, don't change it",LondonIsBoss,2023-03-16 02:11:33
Change it.,thewhalehunters,2023-03-16 02:12:32
Do NOT pick Boise to beat UCLA. Just don't do it,Jhwelsh,2023-03-16 02:22:03
"If you invest in asu now, you can win it all alongside them",fancycheesus,2023-03-16 02:11:50
"This chart should help you 
https://www.barttorvik.com/cgi-bin/ncaat.cgi?type=conf&sort=1&yrlow=2000&yrhigh=2022
The MWC sucks ass, always",AL3XD,2023-03-16 02:26:30
"Nevada has been sliding late in the season and their result here is not necessarily indicative of the MWC in general. 3 straight losses prior to this 2 of them being quad 3, the other quad 2.",ilkei,2023-03-16 02:30:26
The state of Nevada needs to a marketing campaign to rid the world of nevahduh,TheRedWunder,2023-03-16 02:15:41
Abolish sports,slitheringsidew,2023-03-16 02:17:59
This scoring is not maintainable as much as I want to believe,LongMaybe1010,2023-03-16 02:18:49
Nevada playing so bad they scared you away from flairing up oof,DontTakeOurCampbell,2023-03-16 02:25:29
If it was uncensored I’d watch it,FakeInternetDentity,2023-03-16 02:28:11
Lotta game left,bgrad,2023-03-16 02:28:56
"“Nevada was clearly over-ranked, this win doesn’t prove that ASU is good”

-NET Rankings, probably",igonnawrecku_VGC,2023-03-16 02:34:08
https://preview.redd.it/wmx0pokf02oa1.jpeg?width=500&format=pjpg&auto=webp&s=2b9063360769043867759ebf7c7733cfd93d860e,SaintArkweather,2023-03-16 02:31:24
"WCC
MWC
WAC

WCC is the best simply because of Gonzaga and Saint Mary’s",igonnawrecku_VGC,2023-03-16 02:32:32
The monkey paw is you’ll get a B1G crew,3EEBZ,2023-03-16 02:33:24
Every conference officials suck,[deleted],2023-03-16 02:33:41
He’s 7 feet tall tbf,FostetlerLFC,2023-03-16 02:34:58
Sandman,[deleted],2023-03-16 02:35:17
All it took was Alex Caruso and Danuel House,quacainia,2023-03-16 02:39:45
"16 seeds are the worst auto bid winners 



11 seeds are the last at-larges",inshamblesx,2023-03-16 02:41:26
Because mid majors.,Joelsaurus,2023-03-16 02:41:41
"Bottom 4 auto-qualifiers get the 16s

Bottom 4 at-larges get placed according to their overall seed",530josh,2023-03-16 02:42:52
sometimes theyre 12s instead of 11s! not really anymore though,verdenvidia,2023-03-16 02:43:36
"After the offensive ineptitude of this season, wouldn't that be something.",Cut-OutWitch,2023-03-16 02:59:13
"Nvm, Gaffney is shooting from 3.",TheNSAAgent777,2023-03-16 02:58:46
:*( me too,Only499,2023-03-16 03:08:20
This is pac12 basketball..,skarkle_coney,2023-03-16 03:17:06
"Don't worry, we know UofA people can't read.",Hybridkg87,2023-03-16 02:58:13
Fuck the third best program named after Wildcats,listinglight778,2023-03-16 02:57:55
"Nah, we can take care of Pac12 teams just fine. I’m scared of those SEC and Big12 fellas though",[deleted],2023-03-16 02:02:36
"They lost in the first round of the NIT, they have no room to talk",cavahoos,2023-03-16 01:59:01
"And a terrible human, too",cory_bdp,2023-03-16 02:00:59
"Lol on the floor, in the natural direction he was heading?",blackfishfilet,2023-03-16 02:45:45
Probably not on his chest,Nacos2001,2023-03-16 02:45:28
Take your time to untangle instead of rushing into a situation where you might step on someone?,quacainia,2023-03-16 02:46:17
"the dude is over 6 feet tall, I'm sure he could've cleared the player laying on the ground lol",travshootsphotos,2023-03-16 02:46:39
Off the air duh,[deleted],2023-03-16 02:45:17
TSU beat ASU,Muffinnnnnnn,2023-03-16 01:34:45
Thanks Purdue. Very astute observation. I can’t wait to watch y’all get pressed for 40mins,-gold-stin,2023-03-16 01:42:49
Yes totally judge them on this one game where asu is making 71% of their shots. Just have to give credit to asu,sandy-eggo-padres,2023-03-16 01:54:15
"Northwestern and Boise are very similar teams, so it will be interesting to see if the B1G's prestige wins out.",bh6891,2023-03-16 02:23:04
The MW sucks. They haven’t won a tourney game since 2018. Awful conference that keeps getting love for some reason,[deleted],2023-03-16 02:26:08
Nevada has been dog water for several weeks now. Something broke and Alford isn’t good enough to fix it.,MarcTheCreator,2023-03-16 02:30:00
let the hate flow through you,Boom_Confetti,2023-03-16 02:23:17
">~~Nevada~~ Alford  really lost 3 straight MWC games and still made the dance

FTFY",throwaway4tankies,2023-03-16 02:23:31
[deleted],[deleted],2023-03-16 03:00:13
I’m still rolling w them to the Elite 8 lol,Advanced_Meringue_53,2023-03-16 03:00:15
"I get the sentiment but Utah State is probably the upset I'm most confident in, even considering this game",Muffinnnnnnn,2023-03-16 03:05:27
"CBB fans in general have a massive hardon for the MWC. I think either of UNT, UAB, or FAU wins the MWC by 2+ games this year






Gonzaga and Houston make runs to the Sweet 16 and beyond on a regular basis and still get labeled as choke artists, yet the MWC hasnt won a game since 2018 and still gets the benefit of the doubt for some reason",-PaulDaGOATPierce-,2023-03-16 03:19:39
Yo fuck Nevada I hope Nevada burns this summer.,slitheringsidew,2023-03-16 01:37:55
"It’s the WCC if Gonzaga didn’t exist, but they are held up as being comparable to the lower of the power 6s this season",No_Push4492,2023-03-16 02:27:56
:(,NegativePride1,2023-03-16 02:07:32
I mean they just lost at home to KenPom #234 so they should probably stay quiet for a bit.,SaintArkweather,2023-03-16 03:11:51
They lost. So did OSU and Rutgers. All of ball has moved on,hoyeeah,2023-03-16 03:09:41
