Comment,Author,Created UTC
Let's get Gene on to tell us how it was a perfect call,very_humble,2023-03-17 19:39:04
Fuck Joey Hauser!,millertime1419,2023-03-17 20:50:26
Here's to hoping this is the quietest game thread of the day,footer9,2023-03-17 18:24:47
Lmao that’s one of the worst calls I’ve ever seen.,Boilermaker24,2023-03-17 19:38:25
You’ve gotta be kidding me how is this a flagrant lol,big_mustache_dad,2023-03-17 20:21:13
This play happens 3 times every game and is never called a flagrant,Shot_Juggernaut2113,2023-03-17 20:21:26
"Marquette really tough as nails and it’s gonna take a really strong, complete 40 minute game from a team to take them out. 

- signed a fan of a team that lost to them 3 times",TheVirtual_Boy,2023-03-17 20:31:02
"Hi Marquette! I have you guys winning the whole thing! So please win!

Nothing personal UVM!

[Also all 5 BE tourney teams play today!](https://youtu.be/oBqqI6NMeaM)",huskyferretguy1,2023-03-17 19:05:57
The Kam Jones show in Columbus in the 2nd half. He has 18 of Marquette's last 21 point.,spierce64006,2023-03-17 20:32:43
Couldn’t they have showed that kid BEFORE they were down 20?,coilmeup,2023-03-17 20:41:00
Shout out GE3 let's go Pitt,SnakeMilker,2023-03-17 19:53:59
"Bro, I am straight up having a good time",TheyCallMeStone,2023-03-17 20:30:56
"From a strict rule fidelity standpoint, that is undoubtedly one of the worst calls I've ever seen",upstatewilly,2023-03-17 19:41:42
Hilarious you can tell at halftime that Kenny isn’t even watching this game.,Chucktownbadger,2023-03-17 19:46:18
Kam Jones would be better off taking his free throws from about 8 feet further back,_Hank_Marducas_,2023-03-17 20:17:57
They’re boxing out before he jumps,_Hank_Marducas_,2023-03-17 20:20:53
Kam gonna start chucking dumb 3s,SnakeMilker,2023-03-17 20:25:07
**Poll:**  Do I drive to Columbus tomorrow?,Dekalbian,2023-03-17 20:43:09
How in the world has it been 10 years since Marquette won a game in the tournament?,Intelligent_Shirt_50,2023-03-17 20:43:31
"Marquette is my pick to win it all

Vermont spoiled UMass Lowells chances of going to the dance (sister school of mine) 

Go Golden Eagles",Pesci_Avocado,2023-03-17 19:05:42
"Vermont is the ultimate spoiler team, every since the great Sorrentine from the parking lot",JalenBrunsonBurner,2023-03-17 19:27:43
That was brutal. Ref had a blow locked and loaded on that foul call,Stang1776,2023-03-17 19:38:44
That might have been the worst call of the tournament,Glass3QuartersFull,2023-03-17 19:38:44
what the hell was that call man,CoachKillerTrae,2023-03-17 19:39:00
He literally jumped while being blocked out and put himself in a vulnerable state. Steratore is such a hack,zachwilson23,2023-03-17 20:21:43
Bullshit. He was boxing out before he jumped,teamgreat455,2023-03-17 20:22:27
Jesus Kam is FEELING it.,ApprehensiveCorgi867,2023-03-17 20:25:18
"we had a chance with the flagrant and we blew it. that’s game for ya, good luck marquette i’ll be cheering for u guys against michigan st and prolly throughout the tourney, cool to see marquette back on top it’s pretty nostalgic at least even if my team is shit",CoachKillerTrae,2023-03-17 20:28:12
cause of death: kam jones,LocksTheFox,2023-03-17 20:29:42
Shaka gonna get the NCAA monkey off his back finally. Marquette got some dudes.,mrwhitaker3,2023-03-17 20:30:46
Gold coming for most improved player next season. Book it,SnakeMilker,2023-03-17 19:15:47
"Definitely feels like the refs are biased in favor of the higher seed a lot of years, last year against Arkansas it felt like bullshit, and this year it feels like bullshit",DrDilatory,2023-03-17 19:37:15
"I’m not someone who’s quick to cry refball, but that was bullshit",SeekerSpock32,2023-03-17 19:38:48
"Wow, that horrendous call is gonna be a big swing here",ieatplaydough,2023-03-17 19:38:57
"Thank god that only resulted in one point, that was a **terrible** call",Dekalbian,2023-03-17 19:41:17
"Hello, let me introduce you to Kameron Jones.",millertime1419,2023-03-17 20:13:48
I like how they put up Gene’s NCAAB ref credentials this time since people got so mad at his last appearance during the Xavier game,TheJURY15,2023-03-17 20:21:44
How tf is that a flagrant?!?,Any_Mud442,2023-03-17 20:21:46
"I hate that. He's boxing out before the guy jumps, wtf is he supposed to do?",SocksandSmocks,2023-03-17 20:22:09
Who needs a point guard when you have point Oso,_Hank_Marducas_,2023-03-17 20:23:57
WE ARE,gandaalf,2023-03-17 20:30:20
kam jones in the second half is the greatest college basketball player i have ever seen. dude is hotter than a pizza oven,kylepierce722,2023-03-17 20:30:52
Cooking with gas now,footer9,2023-03-17 20:30:53
Not looking good now. Good luck rest of the way Marquette!,Intelligent_Shirt_50,2023-03-17 20:34:00
Announcers acting like Vermont won’t go on an 18-0 scoring run to win the game,Wolf_of_Walmart,2023-03-17 20:43:02
"Uh, there aren’t any SEC teams in this game.",SeekerSpock32,2023-03-17 19:29:30
Dumb foul,WIN011,2023-03-17 19:31:53
That was a terrible call… sorry Vermont fans,millertime1419,2023-03-17 19:37:40
Man FUCK this game,DrDilatory,2023-03-17 19:38:00
Lmao that was one of the worst phantom fouls I’ve seen.,Boilermaker24,2023-03-17 19:38:49
KILLA KAM!,coilmeup,2023-03-17 20:13:39
Holy fuck make free throws,coilmeup,2023-03-17 20:18:05
 he lost his footing is this really something that needs relooked at?,cixzejy,2023-03-17 20:20:18
How is that a flagrant what,coilmeup,2023-03-17 20:21:32
"As much as a BS flagrant that is, we've gotten some good calls too.",CJL13,2023-03-17 20:21:47
"Shaka Smart has Marquette on a string defensively. 

Awesome rotations.",PhillyPhan95,2023-03-17 20:23:34
Kam,_Hank_Marducas_,2023-03-17 20:24:33
Kam Jones decided he wanted to play basketball lmao,Any_Mud442,2023-03-17 20:24:51
Kam Jones is a DUDE,KJones77,2023-03-17 20:24:52
"A truly great ""ball don't lie"" stretch right there",SocksandSmocks,2023-03-17 20:25:28
by my count 13 straight points for jones,jconley4297,2023-03-17 20:27:28
The Marquette Golden Jones',americanbaseball,2023-03-17 20:27:46
STEVIE GETTING SOME OF THAT SWEET SWEET 3 TOO,Dekalbian,2023-03-17 20:33:42
Marquette looks good. Always have loved their color scheme too.,GeneralTaos,2023-03-17 20:39:11
Nice to hear CBS Championship after an NCAA tourney game. Shout MU Pep Band!,Spectre1919,2023-03-17 20:53:00
"#DARRYL MORSELL DIFFERENCE, BABY 😤


#

#I GOT THE GOLDEN EAGLES WINNING IT ALL",PinkSaldo,2023-03-17 18:21:41
🤠🔫,footer9,2023-03-17 18:57:31
Worst call I have seen this year,Augustus13,2023-03-17 19:37:22
God I hate when the ref with the worse view of the play makes the call.,ddottay,2023-03-17 19:37:26
Bad call for sure,WIN011,2023-03-17 19:37:26
Horrible call lmao,JayMoney2424,2023-03-17 19:37:38
"God, the officiating is awful.",mrwhitaker3,2023-03-17 19:37:52
God awful call wow,framingXjake,2023-03-17 19:37:59
First the Kennesaw st game now this reffing is making these games unwatchable,No-Lab7758,2023-03-17 19:38:42
Absolute horseshit,ScubaSteveEL,2023-03-17 19:39:12
Who the fuck invited ACC refs to the party,framingXjake,2023-03-17 19:39:16
bro we can never be the sleeper upset team 🥲,CoachKillerTrae,2023-03-17 19:39:46
"Feet were moving side-to-side, good call.",Dekalbian,2023-03-17 20:09:58
Take stevie Mitchell out and give the ball to Oso every fucking possession. How hard is this game?,packersRus,2023-03-17 20:10:16
FINALLY KAM!!!,millertime1419,2023-03-17 20:13:05
Why was that ref cheeked up?,ChiTownFan4,2023-03-17 20:21:02
A lot of man fell on that play,LocksTheFox,2023-03-17 20:21:07
that’s a common foul all day,jconley4297,2023-03-17 20:21:35
Ridiculous,Augustus13,2023-03-17 20:21:55
Nothing in that.,spierce64006,2023-03-17 20:21:58
BALL DON’T LIE,FedGoat13,2023-03-17 20:22:42
Oh yeah well I had zero offers too.,Warhawk137,2023-03-17 20:23:03
"I always struggle on those calls.

I get the intention behind calling those and can see that it’s certainly a valid safety concern, but often times it seems like they expect players to have eyes in the back of their head in order to avoid such a call.",______W______,2023-03-17 20:24:04
Good things happen when Kam drives,WIN011,2023-03-17 20:24:43
KAM. JONES.,millertime1419,2023-03-17 20:25:00
That soft flagrant call gave us an opportunity and we threw it away. That's momentum for ya.,LocksTheFox,2023-03-17 20:25:44
"Kam Jones, good lord.",millertime1419,2023-03-17 20:29:18
OMFG IM CREAMING RN,coilmeup,2023-03-17 20:30:20
[Kam](https://streamable.com/d7f2xh),CaptainBecket,2023-03-17 20:33:03
K A M,MurDoct,2023-03-17 20:36:59
"HE HIT THAT ONE FROM THE PARKING LOT 

God, that was a great upset.  Vermont never should have been near a 13 that year.",Pollaski,2023-03-17 20:37:08
Oh come on we’re out of the tournament and still catching strays,dangermouse29,2023-03-17 20:37:19
Alright biggest fear averted now onto second biggest fear.,cixzejy,2023-03-17 20:43:31
This is amazing. Keep it up boys! Onto Sparty,gandaalf,2023-03-17 20:44:14
I had a feeling that this was gonna be the hardest game for Marquette but this was a blowout. LETS GO EAGLES 🦅,moella0407,2023-03-17 21:05:14
"Pro tip, just jump on the back of the guy boxing you out and get a flagrant.",millertime1419,2023-03-17 20:21:46
"So if you're being blocked out, you can just jump and fall so they'll call it a flagrant",zachwilson23,2023-03-17 20:23:14
ummm going to the locker room? we so fucked,ApprehensiveCorgi867,2023-03-17 18:58:34
Jesus Christ this would be terrible if Kolek is badly hurt. Thankfully seems like he just jammed it..,gandaalf,2023-03-17 18:58:46
Put a hand up Jop,WIN011,2023-03-17 19:07:22
They may not win the game but Vermont’s pep band washes Marquette’s,ddottay,2023-03-17 19:09:44
Bothers the shit outta me that the NCAA can make money by dancing on Jim Valvano’s grave.,confirmd_am_engineer,2023-03-17 19:10:05
JOPWAGON,coilmeup,2023-03-17 19:11:20
Guard the three maybe?,coilmeup,2023-03-17 19:12:49
"The dad in that Allstate commercial puts a tiny amount of extinguisher onto the house, then sees his home is still on fire and then tries to put out the tiny candles in the yard.

My man, your fucking home is on fire.",Common-Community-550,2023-03-17 19:18:17
I still think it’s ridiculous they interview coaches during the game. Grab something small at half otherwise leave them alone.,WIN011,2023-03-17 19:18:50
LET OSO COOK,coilmeup,2023-03-17 19:21:47
"Let's go boys, open this shit up",SnakeMilker,2023-03-17 19:24:13
Vermont gotta summon the spirits of coppenrath and sorrentine,brownblackmamba,2023-03-17 19:27:53
Veretto playing his heart out,scrapsbypap,2023-03-17 19:28:49
Come on Tyler…,millertime1419,2023-03-17 19:32:29
"Yo how is that a foul he just stood there…

Wow and even then he didn’t even hit him anyway",Kodyaufan2,2023-03-17 19:37:28
TERRIBLE CALL,humorousmoose,2023-03-17 19:37:40
Horrible call,Dekalbian,2023-03-17 19:37:52
Wow that is a terrible call,TheyCallMeStone,2023-03-17 19:37:55
Bad call wow,inevitablescape,2023-03-17 19:38:01
Absolute phantom call,VentureQuotes,2023-03-17 19:38:09
Wow terrible call,SnakeMilker,2023-03-17 19:38:39
Atrocious call,CXDXOXP,2023-03-17 19:38:44
Absolute horseshit,ScubaSteveEL,2023-03-17 19:38:49
"Seans gotta take a dribble there before making that pass, huge bailout there for us",P1kachu2_,2023-03-17 19:38:51
At least that BS only cost them 1 point,CageyTurtlez,2023-03-17 19:40:22
Between that Uberone commercial and this awful Taco Bell commercial it's enough to make me shut these games off.,thenewTeamDINGUS,2023-03-17 19:51:11
Kolek come the fuck on,coilmeup,2023-03-17 20:02:58
21-2 Pitt lead 🤯,inevitablescape,2023-03-17 20:07:13
"Don't do it....

Don't give me hope...",DrDilatory,2023-03-17 20:07:53
Finally Kam,WIN011,2023-03-17 20:12:47
THERE WE GO,coilmeup,2023-03-17 20:13:07
I love Shaka’s enthusiasm,The_Champ_Son,2023-03-17 20:13:48
WTF is wrong with Kolek?  He body language has been trash since the game started.  I know about the injury and everything.,Chucktownbadger,2023-03-17 20:16:54
Just guys falling over.,millertime1419,2023-03-17 20:20:32
This ref has a certified dump truck,TheyCallMeStone,2023-03-17 20:20:53
The ref is thicc,[deleted],2023-03-17 20:21:05
"They’re playing All Star pretty loudly in there, aren’t they?

![gif](giphy|PgJwMLahrGc3IcteOt|downsized)",Zloggt,2023-03-17 20:21:50
Oooooh I'm not sure I agreee with that,LocksTheFox,2023-03-17 20:22:11
Not a good call,inevitablescape,2023-03-17 20:22:41
The man can’t miss,Prison__er,2023-03-17 20:24:28
Kam Jones show.,mrwhitaker3,2023-03-17 20:25:00
Jones can't be stopped right now,TaliZorah14,2023-03-17 20:25:08
Vermont getting some trash calls,zachwilson23,2023-03-17 20:25:19
Kam jones is a cheat code,humorousmoose,2023-03-17 20:25:41
A seven point scoring spurt from Kam Jones and Marquette's lead is 14 just like that.,spierce64006,2023-03-17 20:26:24
Vermont had a legit chane to get the deficit down to 3 if they made both technicals and then hit a 3-pointer. Huge missed opportunity and Marquette pounced.,nysom1227,2023-03-17 20:27:01
wow kam jones is unstoppable right now,wwgd,2023-03-17 20:29:26
Killa cam destroys everything I love,[deleted],2023-03-17 20:29:57
Kam Jones legacy game,Any_Mud442,2023-03-17 20:30:07
Absolutely loving this.,MayIServeYouWell,2023-03-17 20:30:11
Sadly…Vermont cannot keep up with the Jones…,Zloggt,2023-03-17 20:30:23
Jones is now president of Vermont,gopher33j,2023-03-17 20:30:38
This is literally the Texas-Colgate game except not as close,coilmeup,2023-03-17 20:30:48
Big credit to Vermont for shutting Tyler Kolek down.,the_greasy_one,2023-03-17 20:32:21
"Just gotta ask.. how does one find themselves a fan of Vermont Basketball? That’s gonna be as niche as it gets.

One thing was for sure, I don’t care what my brackets say, I was a big fan of the CATAMOUNTS today.",PancherosFood,2023-03-17 20:33:53
PUT IN MICHAEL KENNEDY,packersRus,2023-03-17 20:36:15
Now I want a milkshake.,jaowerpower,2023-03-17 20:46:23
No finish line!!,skyllian-five,2023-03-17 20:51:02
Big East 🤝refs,John_E_Depth,2023-03-17 19:39:59
"Vermont has been a trendy upset pick the last 3 times they got in and lost each time.

Would be funny if they got their win when nobody is expecting it",sebsasour,2023-03-17 19:44:08
Floor slap= automatic bucket,cynicallyoptimistic1,2023-03-17 20:40:38
So I guess if you’re getting boxed out just jump and fall over. Profit,Bucks2020,2023-03-17 20:22:06
These motherfuckers are going to get like four points off of a foul that didn't happen,DrDilatory,2023-03-17 19:38:19
Nervous energy,irreleventnothing,2023-03-17 17:51:21
I DON'T EVEN KNOW WHERE MARQUETTE IS BUT FUCK WHEREVER THAT IS GO CATS!,DrDilatory,2023-03-17 18:14:51
Marquette isn't safe. 14 and 15 seed upsets are becoming a trend this year.,shawn131871,2023-03-17 18:24:20
"Seeing all these 13, 14, and 15 seeds doing well so far 👀",DrDilatory,2023-03-17 18:33:01
I really hope we aren’t asleep at tip-off,cixzejy,2023-03-17 18:38:22
Needs to be an Oso game,WIN011,2023-03-17 18:52:55
"Oso 7'1"" if you count his hair",SnakeMilker,2023-03-17 18:54:46
Fuck me,SnakeMilker,2023-03-17 18:56:57
Fuuuu,Spectre1919,2023-03-17 18:56:58
Kolek take my arms I don't need them,TheyCallMeStone,2023-03-17 18:57:19
CMON CATS,CoachKillerTrae,2023-03-17 19:01:37
"Well, at least if this one's over early it won't be like most other years where I think we might actually pull a huge upset before we get blown out in the last 5 minutes lol",DrDilatory,2023-03-17 19:02:41
Kol3k,footer9,2023-03-17 19:05:36
Come on boys,scrapsbypap,2023-03-17 19:06:15
Kolek is so good,Doctor_Phist,2023-03-17 19:07:03
"Come on Jop,  Close out",Chucktownbadger,2023-03-17 19:07:11
This court seems slick.,Chucktownbadger,2023-03-17 19:13:05
"I knew it was long, but legit a decade since our last tourney win. Goddamn. I was a junior in college",gandaalf,2023-03-17 19:15:05
If we play like this for the rest of the tourney we’re screwed,coilmeup,2023-03-17 19:21:37
"If Marquette knows that they can just keep all five guys at the three-point line, it's going to be impossible to get anyone open for a shot

Can we even attempt to play where we drive towards the rim and then pass it back out for a quick three?",DrDilatory,2023-03-17 19:22:17
"Can’t watch the Iowa State v Pitt game I wanted while I am overseas. Only feed that this bar has is a Serbian one that has this Vermont Marquette game. 

The beauty of the commercials though is they do a live wide cam of the whole arena. It’s low key awesome 

https://i.imgur.com/70VGQq8.jpg",ToxicSteve13,2023-03-17 19:24:36
CALL HIM,coilmeup,2023-03-17 19:26:22
Joplin is BALLIN,gandaalf,2023-03-17 19:26:43
Ugh,coilmeup,2023-03-17 19:32:19
Vermont is playing like they are allergic to the paint,Wolf_of_Walmart,2023-03-17 19:32:38
Kolek clearly bothered by that thumb or whatever. Think they can take this without his A game but he needs to wake up,gandaalf,2023-03-17 19:32:54
The yearly competitive Vermont tourney game only to lose by double digits is right on schedule so far,rvadarocket,2023-03-17 19:34:48
REFBALL,DrDilatory,2023-03-17 19:36:44
What a horrible call. Wasn’t even touched!,Wolf_of_Walmart,2023-03-17 19:37:11
One of the worst calls I’ve ever seen,thugmuffin22,2023-03-17 19:37:15
Holy moly WHAT,afantasticbastard,2023-03-17 19:37:48
"just, wow.",ilovefacebook,2023-03-17 19:38:01
"Ooof, bad call",Spectre1919,2023-03-17 19:38:09
FUCK YEAH STEVIE,coilmeup,2023-03-17 19:38:26
Just a disastrous end to the half for Vermont. John Becker is not happy on a terrible missed foul call that went against him.,spierce64006,2023-03-17 19:39:30
"“Tyler’s only made three field goals, is he okay?” Lmao",MookieSweats,2023-03-17 19:40:39
How come so many Michigan state fans have Vermont shirts on? Coaching ties or something?,theopression,2023-03-17 19:40:59
That would have been a huge 3,Stang1776,2023-03-17 20:05:43
I have Marquette in Final Four. Apologies to all their fans in advance.,FedGoat13,2023-03-17 20:06:27
why can't this team play a game that isn't FUCKING stressful,ApprehensiveCorgi867,2023-03-17 20:09:08
This Vermont team has some really good perimeter defense,No-Lab7758,2023-03-17 20:09:27
Such poor ball movement now,footer9,2023-03-17 20:09:38
Hesitating and passing up an open 3 leading to a Marquette mini-run. Not great!,LocksTheFox,2023-03-17 20:14:08
Vermont had their chance right there great look to cut it to 2,JayMoney2424,2023-03-17 20:14:21
I always have to look up if Marquette is private because I can never remember if it's one of those weird public schools like Purdue or Auburn that are public schools without a stately name,airbornetoxic,2023-03-17 20:16:38
Fuck that looked awful. Hope he’s alright,Jordanwolf98,2023-03-17 20:20:16
What in the world is this smash mouth remix🤮🤮,Waterpalolegend,2023-03-17 20:20:44
Kinda seems like he was just backing up... odd.,hiswayout,2023-03-17 20:21:44
Is adding the F1 to that the makeup call? We all even now?,Spectre1919,2023-03-17 20:22:53
We’re even for that call in the first half now.,millertime1419,2023-03-17 20:23:05
"He's lucky he landed on the guy who undercut him, otherwise that would have hurt a lot worse.",Pollaski,2023-03-17 20:23:17
KAMERON JONES,millertime1419,2023-03-17 20:23:39
the kam jones show,jconley4297,2023-03-17 20:24:06
Oh Kam…,Chucktownbadger,2023-03-17 20:29:05
dudes a BUCKET,jconley4297,2023-03-17 20:29:17
What a performance from Cam Jones!,jaowerpower,2023-03-17 20:29:28
Kam Jones really took over,[deleted],2023-03-17 20:29:35
THE KAM SHOW,Dekalbian,2023-03-17 20:29:37
Simply unstoppable Mr. Jones,sarcasmrules18,2023-03-17 20:29:47
"This game is over, Marquette (Jones) is just too good",LordStarkgaryen,2023-03-17 20:29:49
Kam Jones hates Vermont/St. Patricks Day,SeattleMatt123,2023-03-17 20:29:52
KAM CAM,kylepierce722,2023-03-17 20:30:14
Kam Jones has sauce,_Hank_Marducas_,2023-03-17 20:30:24
"Hi Dylan Schaefler, your team held its own today!",millertime1419,2023-03-17 20:41:29
Dylan Penn's hair is almost as impressive as Tyger Campbell's,the_greasy_one,2023-03-17 20:41:47
Robin Duncan deep banked in 3 lol. Still perfect from the field on 5/5 shooting. Marquette flexed their muscles in that 6-7 minute period and put the game away. Tough final game in a Catamounts jersey for America East POTY Finn Sullivan but he's been outstanding over his time and career in Burlington.,spierce64006,2023-03-17 20:45:44
gordon’s milkshakes are very good,hatnohat,2023-03-17 20:46:39
Certainly will bring all the boys to the hotel yard…,Zloggt,2023-03-17 20:53:19
I stopped working just to come here and say that was one of the worst calls I've seen in my 39 years on this planet.  Holy fuck.,Where0Meets15,2023-03-17 19:39:23
Another great day of college basketball officiating right here!,DetroitSparty,2023-03-17 19:39:41
I apologize for that call but will also take the point it gave us,irreleventnothing,2023-03-17 19:41:56
Gotta be one of the worst calls in the history of calls,Blitqz21l,2023-03-17 19:44:13
New Ben & Jerry's Flavor: No Upset For You Vanilla (with extra salt),Pollaski,2023-03-17 20:32:04
"Vermont looks like a 15 seed, but underwhelmed by Marquette so far",thugmuffin22,2023-03-17 19:21:53
That was the worst foul call I’ve ever witnessed in my life,buckyballboy,2023-03-17 19:39:39
"So dumb there is no way to remedy just an atrocious, garbage call",LunchboxDDS,2023-03-17 19:39:56
Block and a flop,SnakeMilker,2023-03-17 20:09:29
Good luck Shaka!,mbh223,2023-03-17 17:47:22
"Demonstrate that Jesuit superiority, Marquette.",AchtungKessel,2023-03-17 18:22:55
I want Joey,SnakeMilker,2023-03-17 18:47:45
LFG,coilmeup,2023-03-17 18:48:18
Yeah Oso!,coilmeup,2023-03-17 18:54:02
Oso please please please stay out of foul trouble,footer9,2023-03-17 18:54:39
Fuck,coilmeup,2023-03-17 18:56:22
"Kolek favoring that hand/wrist started before the 3, I didn't clock when it happened but it was early. Hopefully it's nothing serious.",skyllian-five,2023-03-17 18:56:41
FUCK ME,coilmeup,2023-03-17 18:57:04
"Good lord we look sloppy, rushing shots, holy fuck",DrDilatory,2023-03-17 18:57:28
What is it with high-seeded teams who haven't won before (or not in a long time) and their best player getting injured? It's like the injury gods hate parity.,karmew32,2023-03-17 19:00:26
Nobody makes Kolek bleed his own blood.,TheyCallMeStone,2023-03-17 19:02:00
"Kolek, my King, welcome back",Dekalbian,2023-03-17 19:02:08
Did that just sau 6th “Person” of the year?,coilmeup,2023-03-17 19:03:16
Vermont has a great program but seems this version isn't as strong as the past couple,[deleted],2023-03-17 19:03:53
GOOD BLOCK MATT,CoachKillerTrae,2023-03-17 19:04:24
"Well, TKO seems fine.",Chucktownbadger,2023-03-17 19:05:07
PENN 3,CoachKillerTrae,2023-03-17 19:07:40
"The not so secret, secret now is that March Madness commercials blow Super Bowl commercials outta the water",Jordanwolf98,2023-03-17 19:08:34
We need to get Kam and Oso cooking.,Chucktownbadger,2023-03-17 19:09:35
"Lets go Catamounts! How about Dylan Penn hitting a three ball early on. Matt Veretto who had a career high in the America East tournament final against UMass-Lowell also has hit from the outside early on. Finn Sullivan needs a huge game for Vermont to pull this off. 

Tyler Kolek looks good in the first 10 minutes here for Shaka Smart's charges.",spierce64006,2023-03-17 19:09:46
is Kolek hurt?,BigBoutros,2023-03-17 19:09:54
Jopppp,theerealobs,2023-03-17 19:11:00
"Welp...same as every year, maybe next year",DrDilatory,2023-03-17 19:11:50
stop losing your assignments on the perimeter pls :/,[deleted],2023-03-17 19:12:52
AD heating up from 3?,scrapsbypap,2023-03-17 19:13:34
Vermont is in big trouble if they keep up the fouling like this,gandaalf,2023-03-17 19:14:01
"It almost looks like Vermont is coached to not even try to go for offensive rebounds lmao

Either the ball goes in, or all five Marquette players are closer than any single UVM player on the rebound",DrDilatory,2023-03-17 19:15:35
Ben. Cmon,coilmeup,2023-03-17 19:15:40
john becker run a play for a shooter challenege,CoachKillerTrae,2023-03-17 19:16:39
Thats actually a pretty cool arena,coilmeup,2023-03-17 19:18:33
[deleted],[deleted],2023-03-17 19:18:34
"I like Vermont.

It has good beer, quiet life and Ben & Jerry's ice cream.",Pesci_Avocado,2023-03-17 19:19:24
It seems like Vermont has more that one turnover to me,coilmeup,2023-03-17 19:19:42
Offensive boards and fouls killing us,LocksTheFox,2023-03-17 19:21:39
By slip I think you mean push off announcer dude.,Chucktownbadger,2023-03-17 19:24:59
That was a strange foul call,ToeSuckingFiend,2023-03-17 19:25:15
LFG JOP!,Chucktownbadger,2023-03-17 19:27:06
"Who remembers when Darius ""Expecto Patronum"" Johnson-Odom played for Marquette?",itwasnewtome,2023-03-17 19:28:23
The threes in this game worry me if we can’t defense these 3’s how do we except to defend MSU’s 3’s,cixzejy,2023-03-17 19:28:40
Matt Veretto seems to be going for another career high. Picking up right where he left on in the America East final against UMass-Lowell. 3 triples in the opening half for him thus far.,spierce64006,2023-03-17 19:29:15
Would enjoy if Kam picked it up,SnakeMilker,2023-03-17 19:30:17
Vermont has some goooood looking jerseys,humorousmoose,2023-03-17 19:33:04
"I can’t imagine a more frightening sight for a top 3-4 seed than seeing your first round opponent is the American East champion.

It feels like every year the winner of this conference pulls off an upset or comes very close to doing it.

The American East, Big West, Ivy, and Missouri Valley. Every year",Kodyaufan2,2023-03-17 19:35:27
Watching this on the John at work. The future is now.,ITHETRUESTREPAIRMAN,2023-03-17 19:36:33
Horseshit,JerryGoDeep,2023-03-17 19:37:05
Wow that’s terrible.,andy-022,2023-03-17 19:37:32
What is that call lmao,coilmeup,2023-03-17 19:37:32
