Comment,Author,Created UTC
I love seeing former Murray State assistants do well in the tournament,thewill450,2023-03-24 03:41:40
YOOOI GO OWLS. WHINY VOLS. HOOT HOOT!,bsEEmsCE,2023-03-24 03:41:40
The committee desperately tried to sabotage FAU but it didn’t work!,[deleted],2023-03-24 03:41:43
Elite 🦉's,FriesWithThat,2023-03-24 03:42:02
The Cinderella story for FAU continues to the elite eight,NOTtigerking,2023-03-24 03:42:05
Tennessee gets one more chance to miss another 3,HerkulezRokkafeller,2023-03-24 03:42:08
man knocking it off your opponent but then it hitting your leg as it goes out of bounds is so tough,HopscotchChampion69,2023-03-24 03:42:13
Did Tennessee forget about their time outs? Call a timeout!,Altruistic_Virus8357,2023-03-24 03:42:19
Redemption dunk time,keymargot,2023-03-24 03:42:29
Did any bracket in the entire country have FAU over Tennessee? Lol,coltsmetsfan614,2023-03-24 03:42:32
TENNESSEE WAS JUST VISITED BY HOOTCIFER,StarvedRock314,2023-03-24 03:42:38
I have never seen a UT team out hustled and out worked before tonight. FAU was the better team tonight and certainly deserved to win against that piss poor effort,Hooper1054,2023-03-24 03:43:09
"Tennessee, these guys were public enemy number one and you couldn’t do it.",SeekerSpock32,2023-03-24 03:43:21
FLORIDA ATLANTIC WINS! HOOT HOOT!,yoshidawg93,2023-03-24 03:43:21
Lol. Lmao even,kaw027,2023-03-24 03:43:30
Who??? Who???,Lefty21,2023-03-24 03:43:30
Hoot hoot bitchesss,mtmodi,2023-03-24 03:43:32
SEC SPEED,fightin_blue_hens,2023-03-24 03:44:04
Congrats to the Owls,Ill_Ad_5308,2023-03-24 03:45:04
YOU BLEW IT,MediocreDot3,2023-03-24 04:04:40
FAU ball? This is an unreal game by the refs.,HerpaderpObes,2023-03-24 03:11:03
So is 50 on FAU always a bitch??,Ceruti_,2023-03-24 03:18:24
[deleted],[deleted],2023-03-24 03:24:38
Extremely obvious travel,SmellyJellyfish,2023-03-24 01:43:06
Vols about to win this by 25,Tigercat01,2023-03-24 01:56:00
FAU players out there thinking they are freakin full backs.,[deleted],2023-03-24 02:04:22
#LET HIM EAT,yousmelllikebiscuits,2023-03-24 02:04:42
"Idk man, hard to see how Kansas St beats Tennessee. The Vols’ size will suffocate Nowell",PhoneAcc23,2023-03-24 02:05:07
That should count for no reason,_Reporting,2023-03-24 02:25:10
Looked like Tennessee ball,purplehayze37,2023-03-24 03:10:57
"There had to be a foul on someone on that rebound, these refs are ass",[deleted],2023-03-24 03:12:41
What in God’s name is this flagrant foul?,PalsRocksMyWorld,2023-03-24 03:16:17
what the fuck was that call,Gavangus,2023-03-24 03:17:08
Refs had the FAU moneyline clearly,Skipper2399,2023-03-24 03:18:45
"I’m not at all attempting to blame the refs, we’re playing like hot ass but Plavsic does so much more shit that deserves a flagrant and for that to be the one to get called is almost comical.",Lstark5642,2023-03-24 03:19:02
Where are all the Tennessee fans? You gonna defend that?,[deleted],2023-03-24 03:22:40
"In the same Duke couldn’t complain about refs against Tennessee cause they deserved to lose anyway, FAU is outplaying Tennessee down the stretch here without ref interference. FAU is deserving to be ahead, refs or not",theiwc0303,2023-03-24 03:23:35
How can you have a 20-4 run against you and say anything about the refs lmao,swaggerific,2023-03-24 03:23:55
Yeah fau’s coach definitely taking over a major program. Dude has the *look* to him as well,304rising,2023-03-24 03:28:57
I have a feeling some people on the fence about rooting for FAU are going to change their mind when they see how Tennessee plays,bh6891,2023-03-24 01:33:38
What was the foul there???,Hooper1054,2023-03-24 03:01:52
"My favorite part of March Madness is all the fans who complain about the refs when their team starts losing, especially if/when it’s against a mid major.",StrivingProsperity,2023-03-24 03:12:56
What in the fuck???,dickles-pickles,2023-03-24 03:17:12
"Holy shit I'm relatively neutral here, but that's a fucking joke. Doesn't help that it's like the 4th straight bad call in FAU's favor.",md4024,2023-03-24 03:17:26
Refs only review things if it'll give them a chance to fuck us over,vnut08,2023-03-24 03:17:50
It has to be the one on the other end of the court. Plavsic put a pretty solid forearm shiver in to 50 as the three went in.,ArttVandelay,2023-03-24 03:18:03
Say what you want about rebounds but Tenn had the most near-KO’s of the entire tourney.,Mpm_277,2023-03-24 03:43:59
Tennessee committed the cardinal sin of beating Duke. They are now getting hosed by the refs.,BearForceDos,2023-03-24 03:11:17
Vols blaming the refs while the owls go on a 20-4 run lmaooooo,TuaTouchdownsallova,2023-03-24 03:24:55
Stop sucking cinderellas dick refs,HiFriend88,2023-03-24 03:10:42
Bullshit call refs. Golden is soft af.,grey_pilgrim_,2023-03-24 03:17:16
These fucking walnuts watched that in slow motion and still made that call. Fuck off,evanset6,2023-03-24 03:18:17
Let's go Owls.,Funky_Dingo,2023-03-24 01:46:54
Weak call,BigballerBrett,2023-03-24 02:03:51
This is legitimately a sickos game in the Sweet 16 rn,CheckItWhileIWreckIt,2023-03-24 02:23:12
Seems like an over the back,thisisfunnyright,2023-03-24 02:58:46
FAU was under seeded badly. Should have been at least a 4 or 5 seed.,PNW_Jeff,2023-03-24 03:12:48
"Not that it really makes a difference in this game, but any team that has 30+ wins headed into the tourney should not be a 9 seed",TsugaGrove,2023-03-24 03:13:25
Literally no elbow. These refs are fucking stupid,evanset6,2023-03-24 03:17:03
absolute bullshit call wtf,McPluckingtonJr,2023-03-24 03:17:06
What a monumental and unnecessary decision.,PersianVol,2023-03-24 03:17:20
Golden is a baby back bitch,CaesarDaApeman,2023-03-24 03:17:23
He did throw an elbow but that was 100% a flop by Goldin.,MinoKillz,2023-03-24 03:18:09
Performance worthy of the ballon d’or,ChonkyWumpus,2023-03-24 03:18:22
Came back from commercial for two flagrant shots just to go back to commercial,OttoRocket94,2023-03-24 03:18:32
This refereeing is a disgrace,100BlackDolphins,2023-03-24 03:19:37
Everyone in this thread complaining about the flagrant foul not looking too great right now.,EnwardGamerz,2023-03-24 03:22:27
Are people still on the FAU hate train? I’d hate to see a mid major make a great run like this and everyone hate them over a last second dunk,drewzy1846,2023-03-24 03:22:55
FAU coach is gone after this,long_dong,2023-03-24 03:24:39
FAU owns this goofy ass team 😭,Ok-Clock-5459,2023-03-24 03:24:47
Come on boys let’s do this.,zorofan8878,2023-03-24 03:25:22
[deleted],[deleted],2023-03-24 03:26:35
Memphis was seconds away from beating this team,BreadKiller0688,2023-03-24 03:27:57
Look at Rick Barnes face. He has no idea what to do. Losing tournament record. That’s hard to do.,[deleted],2023-03-24 03:34:38
"Just want to record that I have a bracket that's 99.9 percentile on ESPN before it gets fucked by the result of this game  
edit: mixed up brackets and this one actually has KState in the final 4, so I'm still totally alive LFG",D1N2Y,2023-03-24 03:39:20
HAHAHAHAHAHA. FUCKING RICK BARNES MAN. EASIEST TOURNAMENT HES EVER HAD!!!,[deleted],2023-03-24 03:41:31
Goldin is a giant flopper.,magikarp2122,2023-03-24 02:52:17
I really hate foul calls like that. He’s moving his feet. No hand contact.,RVOSU50,2023-03-24 03:02:00
Under 12 phantom whistle,PFGcallaway,2023-03-24 03:02:20
They’re really going to call a flagrant on Uros on that absolute flop,evanset6,2023-03-24 03:16:19
"Flopping has no downside and permanent upside

0 flops called in the tournamsnt and many dumbass fouls called via flops",ApplicationDifferent,2023-03-24 03:17:27
Tackle basketball did not work today,Kardinale,2023-03-24 03:36:21
"Another Vols-In-Tears classic

🏀Oregon St (2021)
🏀Michigan (2022)
🏀FAU (2023)
🏈Georgia (2022)
🏈South Carolina (2022)
⚾️CWS (2021)
⚾️ Notre Dame (2022)",BrettKernStanAccount,2023-03-24 03:40:57
[deleted],[deleted],2023-03-24 03:17:46
do i start drinking now or wait until we see how the first half goes?,[deleted],2023-03-24 00:10:10
Fuck,sickmemes48,2023-03-24 00:38:29
Did they give an updated start time?,Great_Smells,2023-03-24 01:15:43
Why so long a wait?,fgbh,2023-03-24 01:16:30
This is now an Alijah Martin fanclub thread,tacoguy1234,2023-03-24 01:20:08
This is the best region for neutrals in my opinion. K-State hasn’t gone to the Final Four since 1964 and Tennessee and FAU have both never gone.,Almost_Punk_Enough,2023-03-24 01:37:35
I’m gonna need atleast 2 more cigarettes before I can get into this game. And I don’t smoke,confused-koala,2023-03-24 01:40:27
I’m choosing to forget the dipshit dunk attempt at the end of last game,HerkulezRokkafeller,2023-03-24 01:42:15
Two slavs going at it down low,Dynastyfan22,2023-03-24 01:43:31
If it's covid,[deleted],2023-03-24 01:45:16
Better lace them gloves up OWLS....on a side note so far it doesn't look like they're scared of the Vols rn,DEPORT_PULISIC,2023-03-24 01:46:01
"Reminder:

USA America, # 1 America time!",moby323,2023-03-24 01:46:25
Why don’t they air ads for schools the way they do during the football season?,Mav_Rixx,2023-03-24 01:47:00
Wow that was deep,Ghost-of-Moravia,2023-03-24 01:49:10
I like the lineup for tn. V3,Ok-Till-8905,2023-03-24 01:49:23
LaForce may be a GOAT tier last name tbh,texas2089,2023-03-24 01:49:42
"This game should out ""classic"" the K-State MSU game and go for triple or quadruple overtime.",ednksu,2023-03-24 01:50:42
FAU getting some really good looks so far,asaber1003,2023-03-24 01:51:03
This is our lineup. Both key and vescovi in at the same time. One of them will be open,Ok-Till-8905,2023-03-24 01:52:10
33 victies,Immediate-Recipe-642,2023-03-24 01:54:27
I always know there's gunna be a lot of turnovers but it still always surprises me.,Greenredbull,2023-03-24 01:55:19
Barnes would kill it as an auctioneer,NikThaGreat9,2023-03-24 02:00:45
"Hard to root against Tennessee, because they took out Duke and did a service. So, I'll just remain neutral :-)",k614,2023-03-24 02:00:51
Here comes our infamous scoring drought,Ok-Till-8905,2023-03-24 02:01:23
"Plavsic is wider than a house, hard to go around him without dribbling",yousmelllikebiscuits,2023-03-24 02:02:23
Next logo shot attempter should be benched on the spot,[deleted],2023-03-24 02:02:48
9 turnovers ??,purplehayze37,2023-03-24 02:05:22
This will turn in to a UCONN-Hogs type of blowout in the 2nd Half,Mav_Rixx,2023-03-24 02:13:36
What’s with helping when you shouldn’t tonight. Cost us a million points just cost Tennessee 3. Just no reason to help there,DoctorHolliday,2023-03-24 02:14:09
[deleted],[deleted],2023-03-24 02:19:41
We gotta find some offense,zorofan8878,2023-03-24 02:19:58
Let’s try not jumping at every shot fake,PFGcallaway,2023-03-24 02:20:14
Geez we should’ve buried these guys by now but can’t shoot. We are what we are I suppose.,FeverOG,2023-03-24 02:20:19
We take so many mid range jumpers lol,HighYieldOrSTFU,2023-03-24 02:20:26
How did Plavsic air ball a layup?,wrassehole,2023-03-24 02:20:38
We are finding out the hard way that being able to shoot 3’s in C-USA doesn’t necessarily mean you’ll hit them in the NCAA tournament…,FriedFishFan,2023-03-24 02:23:22
Markquis Nowell is having to de-escalate fans in the stands now after the game lol,scd2103,2023-03-24 02:24:48
UROS WTAF,[deleted],2023-03-24 02:25:04
Missed opportunities for Florida Atlantic late in the 1st half. They could easily be winning this game if they could make more of those really good 3-point looks. All to play for though.,nysom1227,2023-03-24 02:25:50
"Neither team is shooting well, but FAU is getting some wide open looks from 3.",DroopyTheDrew,2023-03-24 02:26:07
Every FAU player looks shocked when they actually have an open shot. They seem more focused on getting rid of the ball than aiming,dickismalls,2023-03-24 02:27:33
"rebound and stop falling for fakes, that simple!",[deleted],2023-03-24 02:32:28
Victies,HiiipowerBass,2023-03-24 02:34:26
Didn’t think this would be a better game than Zags-UCLA,purplehayze37,2023-03-24 02:47:07
For every Nowell there is a Martin.,Sirrenderthe69th,2023-03-24 02:49:09
"This season, Hootie Hoo is 29-0 when they win the offensive rebounding battle or hold their opponents to under 46% from 2- their three losses have all come when they've gone 0fer on those.

Currently on track to hit both.",llamawhittlings,2023-03-24 02:50:43
Feels like both of these teams could easily be up by double digits,qbvee,2023-03-24 02:51:18
That’s at least 10 missed lay ups.,offtime_trader,2023-03-24 02:51:37
"All three of FAU's losses this season have come when they've had a free throw rate of less than 28%.

Currently sitting at only 8%.",llamawhittlings,2023-03-24 02:51:55
Why would you change your hairstyle before the Sweet 16?,colin_forreal,2023-03-24 02:54:22
I can’t believe how badly we’re getting out rebounded.,MamawRex,2023-03-24 02:56:00
FAU should get Michael Forrest involved.,run_nyg,2023-03-24 02:57:23
"The reason ads that try to be funny are so awful is because no genuinely funny person goes to college and thinks ""imma go into advertising""",Equal-Razzmatazz1806,2023-03-24 03:06:03
Key wasting possessions every time he touches the ball,ChaoticNeutral657,2023-03-24 03:06:16
"Barnes in March, we have the worst possible lineup out there right now",mattdingus2002,2023-03-24 03:07:21
Lmao **everyone** scared to shoot,HiiipowerBass,2023-03-24 03:07:37
oh my.,ilovefacebook,2023-03-24 03:07:46
Rick just refuses to take timeouts,FeverOG,2023-03-24 03:07:47
Every Tenn player scared to take the shot,senoricceman,2023-03-24 03:07:53
h y p e !,Zloggt,2023-03-24 03:07:58
Wow,MamawRex,2023-03-24 03:08:05
TAKE KEY OUT OF THE DAMN GAME,Hooper1054,2023-03-24 03:08:14
Forrest!,KJones77,2023-03-24 03:08:17
Owls getting the swing in momentum,noah3093,2023-03-24 03:08:19
MICHAEL FUCKING FORREST OUT OF WVERHONE OMG,jzsszmzj,2023-03-24 03:08:28
MIKE!!!!!,Playbook420,2023-03-24 03:08:40
Goldin spends more time on his back in one game than your girlfriend does in a year.,L0835,2023-03-24 03:09:28
They low down. They dirty. They some snitches.,Dewot423,2023-03-24 03:09:34
![gif](giphy|13Cmju3maIjStW),FriedFishFan,2023-03-24 03:09:46
Why does Rick Barnes look like he’s getting ready for principal photography on a Night of the Living Dead remake?,[deleted],2023-03-24 03:09:54
"*Rick Barnes cracks his knuckles*

It’s time",[deleted],2023-03-24 03:09:59
If I’m building a college basketball team I’d just get a few guards who can dribble or shoot. Seems like hanging your hat on great defense or bigs isn’t all it’s cracked up to be,ehs4290,2023-03-24 03:10:09
What a dumb foul when you already have 3. Why aggressively trap like that,SmellyJellyfish,2023-03-24 03:10:11
FAU FAU,dcunningham03,2023-03-24 03:10:37
LET’S GO OWLS!!!,Wings4514,2023-03-24 03:10:40
All I'm getting from this game is that FAU is better than Duke,mtmodi,2023-03-24 03:10:50
THE MIGHTY BURROWING OWLS,run_nyg,2023-03-24 03:11:33
#LFG,lijijil,2023-03-24 03:11:38
Love the energy from FAU!!,purplehayze37,2023-03-24 03:11:53
🦉,sjmahoney,2023-03-24 03:11:56
HOOT HOOT,Ok-Clock-5459,2023-03-24 03:11:56
OWLS SWOOPING DOWN ON THEIR PREY,noah3093,2023-03-24 03:12:00
oh boy vol's defense has broke.,[deleted],2023-03-24 03:12:01
FAU GOT THE REFS ON THE VILLAIN ARC NOW,CatataFishSticks,2023-03-24 03:12:19
HOO HOO,steliofuckingkontos,2023-03-24 03:12:19
Fau big is constantly falling over,BIgCon,2023-03-24 03:12:24
Hooty hoooo,Smidgens,2023-03-24 03:12:25
FAU feelin themselves.,[deleted],2023-03-24 03:12:26
EVERYONE GET IN HERE,Innowisecastout,2023-03-24 03:12:38
Rick Barnes in classic March form,UMeister,2023-03-24 03:12:38
HOOT HOOT,wjackson42,2023-03-24 03:13:02
So K State huh?,Kardinale,2023-03-24 03:13:15
This is the 36th time I’ve watched Tennessee this season and the only time i enjoyed it was last 10 seconds of the Alabama game,tclark8995,2023-03-24 03:14:05
Waffle house also has a steak and bacon grilled cheese and it's amazing,Immediate-Recipe-642,2023-03-24 03:14:12
"Well, I was going to watch The Suicide Squad, but I decided to flip to this game real quick and FAU ended clutching my nuts in a vice grip.",2PacTookMyLunchMoney,2023-03-24 03:14:40
Holy shit what a fuckin elbow by #33 after that made 3,the_dawn_of_red,2023-03-24 03:15:49
That doesn’t seem intentional,natigin,2023-03-24 03:16:30
I'm with Gene on this.  Should just be a common foul.,SithOverlord101,2023-03-24 03:16:41
what the actual fuck,rsspecht21,2023-03-24 03:16:43
Lol golden flopping all game,Inevitable_Badger995,2023-03-24 03:16:43
Wild how bad the broadcast can be on this. The foul was on the other end.,Buckeyes0916,2023-03-24 03:16:43
"If you’ve got Gene saying its wrong, its wrong",jlucaspope,2023-03-24 03:16:44
How is that a tech?,thewill450,2023-03-24 03:16:45
That’s a tech?!?!,a_breezy_12,2023-03-24 03:16:49
Yeah I'm not sure about that,Zelvahula,2023-03-24 03:16:49
Uh alright then haha,ugafan2148,2023-03-24 03:16:50
Don’t agree with that one,purplehayze37,2023-03-24 03:16:56
"Who knew that putting Matt Painter, Shaka Smart, and Rick Barnes in the same bracket as 3/4 top seeds would lead to this",[deleted],2023-03-24 03:17:05
"Coach K said, ""Get them out of here.""",HerpaderpObes,2023-03-24 03:17:08
Bring Grant Williams in,GuyFaulks77,2023-03-24 03:17:09
This cloddy motherfucker just hasn’t grown into his body. That’s all it is lol,dickismalls,2023-03-24 03:17:46
We just came back from a commercial break...,LastPhoton,2023-03-24 03:18:09
Another time out fuck off,[deleted],2023-03-24 03:18:52
People in this thread lol they had already scored a three after the replay they showed….,DroopyTheDrew,2023-03-24 03:19:10
"And to think, we were once worried about Russians taking over the world. Lulz this dude looks like the bad guy from Rocky 4 and yet is such a pansy ass.",RockyattheTop,2023-03-24 03:19:45
Rewind to the 3 pt that made it 48 for FAU and you'll see the flagrant,Br_Ba,2023-03-24 03:20:11
FAU #50 snatched that rebound with one hand. That was nuts.,Winbrick,2023-03-24 03:22:12
They some snitches,sjmahoney,2023-03-24 03:22:22
"That elbow was actually hilarious, but I didn’t think they could go back in time like that",dickismalls,2023-03-24 03:22:40
That's a dirty play.,run_nyg,2023-03-24 03:22:40
Yea that was a f1 sorry,Milflover69cbb,2023-03-24 03:22:44
Almost flagrant 2,Playbook420,2023-03-24 03:23:19
Okay but why didn’t they call it originally? It’s clearly at least a common foul. Then the ball is dead and they can review it.,rsspecht21,2023-03-24 03:23:25
33 is a damn goon,wutitdotho,2023-03-24 03:23:30
20-4 goodness Tennessee,lulsszs,2023-03-24 03:23:57
i *presumed* the Vols are going to score points again…but would anyone really have been all that surprised at this point if Tennessee only scored 2 points over the last 12:52 of the game?,Tfsz0719,2023-03-24 03:25:06
Tennessee what happened,conker1264,2023-03-24 03:25:47
The rare time where you *wouldn’t* want to be fouled…,Zloggt,2023-03-24 03:25:56
That's continuation in the NBA lol,rps215,2023-03-24 03:26:03
[deleted],[deleted],2023-03-24 03:27:12
BALL DONT LIE,TuaTouchdownsallova,2023-03-24 03:27:13
Of course we miss our free throws man 😭,zorofan8878,2023-03-24 03:27:29
FT specialist Grant Williams in attendance,Seastep,2023-03-24 03:27:40
Dude just slid like 3 feet with the ball. I'm not convinced these refs know what traveling even is.,AlaDouche,2023-03-24 03:28:50
The Vols death has been greatly exaggerated,Redline-7k,2023-03-24 03:29:14
"Rick ""I am the senate"" Barnes is fixing to bring in a reign of terror coach k could only dream of if he snaps the march curse",fancycheesus,2023-03-24 03:30:49
FAST.BREAK.OWLS,noah3093,2023-03-24 03:32:44
Wide open 3 to a run out layup. Killer.,8686tjd,2023-03-24 03:32:44
"Rick Barnes doing Rick Barnes type things

Even in a good year for them, you cannot escape the losing to lower seeds",cjackc11,2023-03-24 03:33:27
Damn Oliver tough game . Is what it is,Sirrenderthe69th,2023-03-24 03:34:21
poggers,ImmoralModerator,2023-03-24 03:34:26
Every mid major just needs to ctrl c ctrl v FAUs entire system lmao,ErickBachman,2023-03-24 03:34:44
Rick Barnes must've crossed Madam Zeroni. Dude is cursed in March,thewill450,2023-03-24 03:34:53
Tennessee’s shot enough bricks this half to build a hospital,Artlens2013,2023-03-24 03:34:54
I don’t get it. Why doesn’t the orange team just tackle the other one.,tfhdeathua,2023-03-24 03:34:56
GGs FAU,AtreusPeverell,2023-03-24 03:34:57
was a little travel there tbh,Solgiest,2023-03-24 03:35:06
FAU coach gonna be hired for the soon open position of Tennessee head coach,Ok-Lack-5172,2023-03-24 03:35:11
Tennessee is taking too much time.,americanbaseball,2023-03-24 03:35:14
This game is over. I can’t believe it,GuyFaulks77,2023-03-24 03:35:14
"Too late for this game to be played, owls on the hunt!",_HiWay,2023-03-24 03:35:45
My stepdad bet me after Kansas state beat MSU than Tennessee is gonna end their season anyway 😂😂😂 I can’t wait to talk all the shit,[deleted],2023-03-24 03:36:05
Dayum Tennessee #0 sent that ball back to the round of 32,MoistGrandpa,2023-03-24 03:36:08
Does Tennessee know they have the size advantage?,optimisticgatorfan,2023-03-24 03:36:48
FAU are really gonna take out both Tennessee teams lmao,IndycarFan64,2023-03-24 03:36:49
Tennessee quit doing the work on the glass tbh,AFC-Wimbledon-Stan,2023-03-24 03:36:53
How does the smallest player on the floor get that board?,strongscience62,2023-03-24 03:36:56
Hoot hoot,purplehayze37,2023-03-24 03:36:58
That offensive rebound was the dagger,inevitablescape,2023-03-24 03:37:05
Fucking rebounds. Unbelievable.,HerpaderpObes,2023-03-24 03:37:11
We are all witnesses today…,qbvee,2023-03-24 03:37:14
We need a 360 dunk attempt before this thing ends,Cbeauski23,2023-03-24 03:37:20
GOTTA FEED THE FAMILY,BigFoot423205,2023-03-24 03:37:21
Join us in losing to a CUSA team 😈,BrettKernStanAccount,2023-03-24 03:37:23
FLORIDA ELITE 8LANTIC,llamawhittlings,2023-03-24 03:37:32
"Lol that’s fitting. 

Looking at this box score is fucking brutal 

1-7

2-9

4-10

3-10

3-10

I mean Jesus wept",DoctorHolliday,2023-03-24 03:37:33
Rocky Top. Faded.,a_Tyde_Ad,2023-03-24 03:37:34
I’m just waiting for the disrespectful late dunk attempt. They just better hope Plavsic isn’t on the floor when it happens,MapleHeel,2023-03-24 03:37:41
Fuck yeah Owls,reggaetony88,2023-03-24 03:37:47
"Sorry I doubted you FAU. However, if my bracket shows anything - it's that I literally have no idea what I'm talking about.",newaccount721,2023-03-24 03:38:06
I don't miss a Rick Barnes team melting down in the tournament. -Texas fan,shiny69,2023-03-24 03:38:12
C-usa > SEC,NOTtigerking,2023-03-24 03:38:20
According to ESPN Tennessee had a 92% chance to win at one point,IAmNotStephen,2023-03-24 03:38:20
This Tennessee offense can no longer hurt me. God bless the owls,CtlEngr,2023-03-24 03:38:35
What are the betting odds if FAU fails another 360 dunk to end the game?,ilikemarblestoo,2023-03-24 03:38:37
"🎵Good ol' Rocky Top

I live there in a tree🎵

- an owl probably.",_HiWay,2023-03-24 03:38:45
Free throw contest coming up,phamousj,2023-03-24 03:38:45
Lol… big white dude got juked,stoolsample2,2023-03-24 03:38:52
"Way to go Tennessee, allow the only adidas team left into the Elite 8!!!",nikefreak23,2023-03-24 03:38:56
360 dunk on Plavsic please!!!,Sad_Entertainment_54,2023-03-24 03:39:01
Just glad I can hear Kenny “the jet” smith waffle all the way through this game,rotallytad,2023-03-24 03:39:51
Can't hit a three to save their lives lol,nikefreak23,2023-03-24 03:40:24
Oh no,Altruistic_Virus8357,2023-03-24 03:40:26
Please don’t replay this,natigin,2023-03-24 03:41:05
THEY DID IT!!!!! THE OWLS DID IT!!!!  LFG,loyalsons4evertrue,2023-03-24 03:41:05
Can this game wrap up quick so i can switch channels lol,FutureRaifort,2023-03-24 03:41:13
backcourt?,ilikemarblestoo,2023-03-24 03:41:15
CUSA CUSA CUSA!!!,loyalsons4evertrue,2023-03-24 03:41:19
THE MISSED DUNK WAS WORTH IT,loyalsons4evertrue,2023-03-24 03:41:29
Looks like Tennessee started to rebound a little too late,rwellsy09,2023-03-24 03:41:33
"""It's only gonna add to the drama"" while Tennessee is down 7 with 5 seconds left.",Im_DJayy,2023-03-24 03:41:41
"No need to review, game is ovah",rattlerden,2023-03-24 03:41:42
🦉🦉,natigin,2023-03-24 03:42:16
HOOT HOOT,thewill450,2023-03-24 03:42:19
ROCKY FLOP,loyalsons4evertrue,2023-03-24 03:42:26
Rick barnes lololol,TyroneSwoopes,2023-03-24 03:42:32
HOOT HOOT,Tough-Reaction9671,2023-03-24 03:42:32
just fucking end jesus christ,bug_man_,2023-03-24 03:42:40
Well at least Tennessee keeps their streak of not losing when holding an opponent to under 60 points,ironichaos,2023-03-24 03:42:43
I want another dunk attempt,420Rowlet,2023-03-24 03:42:47
FAU BELIEVE IT!!!,Meanteenbirder,2023-03-24 03:42:50
The game is over man there up 7 with 5 secs left lol,lulsszs,2023-03-24 03:42:55
Hoot Hoot!,floridorito,2023-03-24 03:43:15
really sad to see this defense get wasted away by one of the worst offenses that Rick Barnes has ever had. oh well. GBO🍊,[deleted],2023-03-24 03:43:34
"Temple, Rice, Kennesaw St., this is your team now",arbitrator06,2023-03-24 03:44:40
"The media has completely lost the angle on this game.

This is a story about an underdog. An underdog who has been denied again and again but is determined to show he deserves to win.

That underdog is Rick Barnes in march. If they cast it like that, tennessee could be a real media darling. Lots of people don't like tennessee but does anyone actively dislike Rick Barnes? Seems like a chill guy even if he does look like palpatine.",fancycheesus,2023-03-24 02:50:24
Extremely soft foul call on Key,HighYieldOrSTFU,2023-03-24 03:01:51
Media narrative did it's job,V_O_L_S,2023-03-24 03:17:15
