Comment,Author,Created UTC
"Maybe next year people will finally start respecting the Pac-12. Arizona State is looking amazing, and this defense is exactly what we have been seeing all season long.",seahawksjoe,2023-03-16 01:49:07
One of these days the committee will realize the Mountain West isn’t a 3+ bid league,libsoutherner,2023-03-16 01:59:38
This game is really making me consider moving off all mountain west teams,simba80328,2023-03-16 02:05:12
Uh thats obviously blatant lol,BlueHellion93,2023-03-16 02:42:51
Nevada and Rutgers should schedule a game next week to see if the committee was wrong,ScrewAnalytics,2023-03-16 01:22:08
So. I need to change my bracket and switch AZ as my National champion to ASU.,grrgrrtigergrr,2023-03-16 01:58:20
Mountain West moment,Impossible-Mud-597,2023-03-16 01:58:49
I REALLY hope if this turns into a patterN AGAIN this tournament we reevaluate NET. MWC got blasted last year and this is a bad start yet we keep inflating their metrics somehow,dementedturnip26,2023-03-16 02:02:01
The NET is crap,i_am_the_senate_,2023-03-16 02:02:56
Can we stop overseeding the mountain west? That league sucks.,JayMoney2424,2023-03-16 02:08:46
Nevada is a fucking joke. Mountain west sure was better than the acc,YoooCakess,2023-03-16 02:08:47
"ASU to the Final Four, baybayyy!",coltsmetsfan614,2023-03-16 02:11:29
Just give the title to ASU,cjheadley,2023-03-16 02:11:33
I hope Bill Walton gets to commentate the natty,idkausername76,2023-03-16 02:12:32
"If this wasn’t a first four game, that mouth open/hands on head dude would be this years meme",Fearghas,2023-03-16 02:16:11
That was obviously intentional. Commentators being boneheads thinking it was accidental.,laughoutloud102,2023-03-16 02:43:55
"Classy to not go for 100 here, respectable",ImmoralModerator,2023-03-16 03:20:16
The fact our AD doesn’t like Bobby Hurley is perhaps the greatest endorsement he could have. Not to mention he helped cover up a booster harassing Hurley’s wife.,Thel3lues,2023-03-16 00:18:48
at the game - place feels way more lit the second asu pulled up,brokentr0jan,2023-03-16 00:51:15
How the hell has Lefkoe weaseled his way onto both NBA and NCAA coverage,footer9,2023-03-16 00:51:53
hi friends,carter_00,2023-03-16 00:55:19
I’m so fucking excited and nervous at the same time. FORKS UP 🔱,theopression,2023-03-16 00:57:00
"When the studio camera is on just Candace and Jay, that's a lot of hotness in one frame.",deanopeez,2023-03-16 00:59:01
I've got NC State Wolfpack playing Nevada Wolfpack in the finals so really got a lot riding on this game.,mcgray,2023-03-16 01:02:10
IM NERVOUS,Firmy4DaddyHermy,2023-03-16 01:11:27
Best of luck to the MWC,Ill_Ad_5308,2023-03-16 01:13:51
Lets Get it! The strength of the Pack is the Wolf and the strength of the Wolf is the Pack!!!,1nf1niteCS,2023-03-16 01:16:19
"With their underwhelming resume, I'm really surprised they let Nevada into the Union",Orange_Kid,2023-03-16 01:17:35
"Game to play:

Drink every time Jarod Lucas flops/falls down. You’ll be dead by halftime.",AndABananaCognac,2023-03-16 01:19:20
Bro left his feet to get “thru” the screen,3EEBZ,2023-03-16 01:19:24
"Not even 60 seconds before a review. 

Buckle up lads.",fancycheesus,2023-03-16 01:19:41
Camera angle gonna make me sick jesus christ,1nf1niteCS,2023-03-16 01:20:28
"i just ordered fire house subs

am i gonna regret it",Pesci_Avocado,2023-03-16 01:20:33
LOL Nevada...,[deleted],2023-03-16 01:22:15
Nevada really looking like the 37th best team in the country…,i_am_the_senate_,2023-03-16 01:22:22
"But could Nevada have managed a loss at home to an NIT 8 seed?

(Yes, probably)",elgenie,2023-03-16 01:23:29
Rethinking my utah state to the elite 8 pick rn,Advanced_Meringue_53,2023-03-16 01:23:36
Vandy seething rn,fancycheesus,2023-03-16 01:23:47
What're the chances for either of these teams to upset TCU? Not really familiar with either team due to being an east coast bro,abrutalstrudel,2023-03-16 01:25:33
Not biased or anything lol why is Nevada so hated,DeadInsdWestCoastPrd,2023-03-16 01:26:41
Ugh c’mon Nevada.,Wings4514,2023-03-16 01:26:53
What's up with ASU just absolutely having their way inside the paint so far?,abrutalstrudel,2023-03-16 01:27:00
Now this is the Nevada team that lost 3 straight games against non tourney teams to finish. If this is the effort should have just put OK State in,mF-Jonezy,2023-03-16 01:27:37
Maybe Wazzu should have been in the tournament,EnwardGamerz,2023-03-16 01:28:21
What's going on with the flairs? Why are random teams faded if they're still in the tourney?,NotABot1235,2023-03-16 01:30:40
He just threw it up what a dumb shot,coilmeup,2023-03-16 01:32:24
Holy shit Shazam is gonna bomb lol,theopression,2023-03-16 01:33:04
Do we just take 3's now? Only shot that's going in,1nf1niteCS,2023-03-16 01:33:18
"...yeah, these Sun Devil boys came here to play",ivanezzz,2023-03-16 01:33:59
Damn we are on fire,LongMaybe1010,2023-03-16 01:34:14
Desmond Cambridge is fun to watch.,mrwhitaker3,2023-03-16 01:34:24
"Oklahoma State fans, you have my sympathy right now",KJones77,2023-03-16 01:34:31
Something bout this court getting everyone to shoot threes lol jk,sarcasmrules18,2023-03-16 01:35:17
Nevada isn't looking too good,[deleted],2023-03-16 01:36:25
Shooting 63% first 8 mins of play...down by 10.,scoot87,2023-03-16 01:37:05
"Once the tourney hits, I turn into Bill Walton and it's Pac-12 above all else. So even though it hurts to say.....Go Devils.",TheLadyMagician,2023-03-16 01:37:07
When will Nevada score their first 2pt FG? Place your bets below,cantpossiblywin,2023-03-16 01:38:41
Just search “Steve Alford Pierre Pierce”,TheDevolution27,2023-03-16 01:40:01
"""Fuck field goals, threes are all that matters""",DontTakeOurCampbell,2023-03-16 01:40:08
Nevada has looked bad defensively but at least we’re not watching Texas Southern anymore,therealbigted,2023-03-16 01:40:32
yeah this game is going over 133 total points lol,Pesci_Avocado,2023-03-16 01:40:47
"I'm here for the F Steve Alford party, is this the right address?",bfinleyui,2023-03-16 01:40:47
ASU currently on pace to score 124 points,therealbigted,2023-03-16 01:42:02
"Who knew the team that came in losing three straight, including back to back quad 3 losses would be exposed in the tournament?",ScotTheDuck,2023-03-16 01:42:10
Nevada is 6/8 on 3s and down 11 10 minutes into the 1st half. WTF.,[deleted],2023-03-16 01:42:35
Nevada is cooked already. What a stupid foul.,seahawksjoe,2023-03-16 01:42:41
Vinny Del Negro coaching Nevada,_kingfelix,2023-03-16 01:42:44
"You live by the 3 and you die by the 3…

unless you’re Nevada. Then you just die by the three and keep doing it again and again forever.",ImmoralModerator,2023-03-16 01:42:45
Is this how Nevada usually approaches the game? How did this team make the tournament?,edleranalytics,2023-03-16 01:42:47
"Oh good, nevada has even less of a real pg now lol",Zeppelin96,2023-03-16 01:43:20
How did this ASU team lose to the TSU team we just saw get boat raced by FDU?,bh6891,2023-03-16 01:43:49
Under bettors shaking,immaculatebacon,2023-03-16 01:43:50
If nevada does the opposite of what they are doing they could win,devil-lion-steeler,2023-03-16 01:44:17
"Steve Alford quit Iowa just ahead of getting fired, then tried to expense his leased car and Final Four passes back to the university.",TheDevolution27,2023-03-16 01:44:30
Bill Walton is pleased with this ASU pace,kirkismyhinrich,2023-03-16 01:45:03
Nevada looks comatose.,run_nyg,2023-03-16 01:45:04
POINTS IN THE PAINT,tboots1,2023-03-16 01:45:12
THE DEVILS ARE FLYING!!!,AFC-Wimbledon-Stan,2023-03-16 01:45:16
"Was Nevada's band chanting ""TurboTax""?",mcgray,2023-03-16 01:45:24
ASU is just too fast for Nevada. Running circles around them,tboots1,2023-03-16 01:45:57
Tra Holder and Shannon Evans died for this,_kingfelix,2023-03-16 01:46:05
Maybe neither Nevada or Rutgers should’ve made the tourney,idkausername76,2023-03-16 01:46:27
Nevada is hard to watch,coilmeup,2023-03-16 01:46:43
ASU BABY LETS FUCKING GOOOO,Goooldschmidt,2023-03-16 01:46:51
Last night we had one possession games. Tonight has been two absolute dog walkings,fancycheesus,2023-03-16 01:47:24
It looks like ASU feels disrespected having to play Nevada. A team that's lost their last 3 straight against Quad 3 opponents. Maybe OSU deserved it over Nevada. Nevada is getting boat raced atm.,ekimtk,2023-03-16 01:47:36
The PAC 12 is a GREAT basketball conference. Remember when USC and Oregon State and UCLA all ran the tournament like 2 years ago,brokentr0jan,2023-03-16 01:48:14
Taking Nevada +2 is shaping up to be the kind of decision that I laugh about for the next 10 years,go_berds,2023-03-16 01:50:14
Good shit Arizona St.,NickTheDick_,2023-03-16 01:50:16
"> Steve, are you going to Dublin to play the Nicklaus course tomorrow?",ScotTheDuck,2023-03-16 01:50:17
Alford looks like the dad in a 90s Disney movie,fancycheesus,2023-03-16 01:50:58
"Oo the last few shots have had good defense, they just make em anyways",1nf1niteCS,2023-03-16 01:51:02
Kinda hoping Nuñez is back for the next game so he can take Luther’s minutes,theopression,2023-03-16 01:51:55
Even the bad shots are falling 😂😭,33027439439,2023-03-16 01:51:57
"""Build your own luck""

What???",Joelsaurus,2023-03-16 01:52:18
I am not having fun,1nf1niteCS,2023-03-16 01:52:40
that was a clear foul that baseline ref is out of his mind lmao,v-v-v-v-v-v-v,2023-03-16 01:53:02
Me questioning picking TCU in my bracket...,scoot87,2023-03-16 01:53:37
"After that whole sequence, *that's* the foul they call?",quacainia,2023-03-16 01:53:42
"Even Gaffney is playing reasonably well

When that happens, you know you fucked up son",[deleted],2023-03-16 01:53:49
I can see why IU has never asked Alford to coach .,Forecydian,2023-03-16 01:55:18
[deleted],[deleted],2023-03-16 01:55:28
"I change my mind, I want to play Hofstra",1nf1niteCS,2023-03-16 01:55:59
This game is over,BlueEagle15,2023-03-16 01:56:25
ASU - “I’ll do it again”,[deleted],2023-03-16 01:56:30
Rejected! And rejected!,cantpossiblywin,2023-03-16 01:56:44
I'm witnessing a murder,DontTakeOurCampbell,2023-03-16 01:57:02
Leave some for TCU.. jeez.,Willsears94,2023-03-16 01:57:10
The voice of one these announcers is unbearable,Forecydian,2023-03-16 01:57:11
At least I don't need to stay up til 11:30 now..,Ender_Stark,2023-03-16 01:57:13
"""I just had my shit pushed in on a dunk attempt, it'd be a good idea to go straight back at the same dude""",notedgarfigaro,2023-03-16 01:57:14
when does the mercy rule kick in?,ImmoralModerator,2023-03-16 01:57:22
God this Nevada defense is bruuuutal,ThatsRich,2023-03-16 01:57:23
I do not mind this at all.,adam6294,2023-03-16 01:57:36
Nevada needs to go full grinell since they can’t make any two point shots.,Fearghas,2023-03-16 01:57:38
How many people are gong back into their brackets right now and taking ASU deep?,shoshin2727,2023-03-16 01:57:40
This is ridiculous,bh6891,2023-03-16 01:57:57
Can they miss a 3?,70277027,2023-03-16 01:58:05
"This does not look like a play in team, holy shit",beezer08,2023-03-16 01:58:11
Hahaha fuck you Nevada. How did this team get in? They melted down the stretch!,Surfer5153,2023-03-16 01:58:12
Arizona state might hit 100 points lol,Pesci_Avocado,2023-03-16 01:58:21
I have this sneaking suspicion that ASU will win this basketball game,ballgazer3,2023-03-16 01:58:46
"UNLV fans looking like Randy Marsh after he got attacked by a ""spooky ghost.""",run_nyg,2023-03-16 01:58:55
Sorry Rutgers. 🤷‍♂️,XXWWXXFF,2023-03-16 01:59:20
Yo wtf,dinkir19,2023-03-16 01:59:27
Nevada is a joke 🤮,zachwilson23,2023-03-16 01:59:46
Could literally call this at halftime and let ASU get a head start on travel,ThanksForTheF-Shack,2023-03-16 02:00:12
Wtf Nevada,spoonfedsam,2023-03-16 02:00:21
Here come all the middle of the road (if that) power conference fans saying they deserved to get in lmao.,Wings4514,2023-03-16 02:00:23
"Fuck this, going to watch Shark Tank reruns.",Pura112,2023-03-16 02:00:42
Quick question why do we hate Steve Alford,IAmNotStephen,2023-03-16 02:00:47
[deleted],[deleted],2023-03-16 02:04:00
This may move our Arizona State loss to Q1,steveoriley,2023-03-16 02:04:01
LFG Devils!,6pikmin,2023-03-16 02:04:21
How did Nevada even get in? I just looked at their schedule,asaber1003,2023-03-16 02:04:44
This game is bringing back some traumatic memories from November,Dugtoni,2023-03-16 02:05:10
I’m hard,[deleted],2023-03-16 02:05:49
"Only need 4 TD's, very winnable 

*INHALES INCREDIBLE IMMOUNT ON COPIUM*",1nf1niteCS,2023-03-16 02:05:52
Kick Nevada out of the conference!!!!,wooooooo1776,2023-03-16 02:06:17
Halftime Analysis: Nevada should’ve been in the NIT,Almost_Punk_Enough,2023-03-16 02:06:35
"Nevada I hope you know, this is embarrassing and is putting the whole Mountain West to shame!",Get_Pancaked,2023-03-16 02:06:42
"To be fair to the committee (ducks tomato) there will always be some blowouts in the first 4 and it’s super easy to second guess the inclusion of the losing team every time it happens.

Doesn’t help Nevada was the most questioned team though",therealbigted,2023-03-16 02:07:07
NEVADA PACK RIPBOZO 🤣🤣🤣,[deleted],2023-03-16 02:07:52
Where is the conference of champions account. I need a fat Bill post right now,Shamoofles,2023-03-16 02:10:59
Nevada and Texas Southern should have to play a consolation game.,FourWayFork,2023-03-16 02:11:15
Can someone clue me in as to why I should hate this Alford dude?,PM_ME_YOUR_CATS_PAWS,2023-03-16 02:14:25
"We wouldn't be having this controversy about Nevada if the bid thieves actually showed up this year. Nevada shouldn't have been in IMO, but none of the other teams contending for an at large were super appealing either. Only teams I feel sorry for are OSU and Rutgers because they lost crucial players to injury.",bh6891,2023-03-16 02:14:30
Just need 17 in the second half to hit our season average on PPG… needless to say this is our best offensive performance on the year.,bobsaget824,2023-03-16 02:19:13
BRB picking AZ State all the way to the E8,DontTakeOurCampbell,2023-03-16 02:20:20
I wanna play ASU sooooo bad. Why did they match us with the titan that is Gonzaga???,brokentr0jan,2023-03-16 02:20:51
Is it just me or is this halftime extra long,1nf1niteCS,2023-03-16 02:24:57
This Marriott commercial was old 3 years ago.,Joelsaurus,2023-03-16 02:25:23
[deleted],[deleted],2023-03-16 02:25:56
Damn they really got my girl Lily behind the desk😭😭,Hokiestoned,2023-03-16 02:27:05
Well that felt like a dagger.,Joelsaurus,2023-03-16 02:27:29
Watch out TCU,FakeInternetDentity,2023-03-16 02:27:48
Wtf how are they shooting so well,Duck_man_,2023-03-16 02:27:51
"Pack Baseball proceeded to beat Oregon State last night.

Oregon State took that personally today too. 

Not a good day in Wolf Pack land.",Freakydeaky9,2023-03-16 02:29:50
"Oh Mountain West please don’t disappoint me again

I love yall",Ghost-of-Moravia,2023-03-16 02:31:40
I need to finish my bracket instead of watching this game,Saw_a_4ftBeaver,2023-03-16 02:31:51
USU give us your energy.,slitheringsidew,2023-03-16 02:33:57
"I just want to see some good, clean refball this half",ImmoralModerator,2023-03-16 02:34:22
This zone is fucking killing us lol,wcooper97,2023-03-16 02:34:59
What’s the largest come back you’ve ever seen?,melodyfelony,2023-03-16 02:35:25
Can't believe it took that long for Alford to change the defense,1nf1niteCS,2023-03-16 02:35:56
"Nevada looks like they’ve got their feet under them now

Offensively they’re getting penetration and defensively they’re a step faster than the first half…

Need to keep the momentum going but good start",rvadarocket,2023-03-16 02:36:00
This ASU team has Hurley's personality. Lmao,[deleted],2023-03-16 02:37:53
Refs are not playing good refball with these ticky tack fouls,ImmoralModerator,2023-03-16 02:38:58
"These fouls on 3’s are killers.

Gotta be more disciplined",rvadarocket,2023-03-16 02:39:01
What the fuuuuuuck,doublething1,2023-03-16 02:39:38
"Frankie has to be smarter… backup PG out, need his ball handling.",bobsaget824,2023-03-16 02:40:20
"I am FASCINATED to see how this foul calling works out for Purdue. If they are gonna call all of these ticky tack fouls we very well may shoot 50 free throws a game. On the other hand, Edey could pick up 2 quick ones on the offensive end.",ekimtk,2023-03-16 02:40:35
"ASU, stop trying to play 100 miles an hour. It's the only way you can lose.",JerseyDvl,2023-03-16 02:40:52
WE WANT REFBALL,ImmoralModerator,2023-03-16 02:45:23
The cbs stream just cut out and I don’t care enough to reload the page,Saw_a_4ftBeaver,2023-03-16 02:47:29
This is going to be a fun March for me I can feel it,Vo1ture,2023-03-16 02:48:09
I have no idea where this offense is coming from.,romanapplesauce,2023-03-16 02:48:38
[deleted],[deleted],2023-03-16 02:48:49
Ball don't lie,BlueHellion93,2023-03-16 02:49:59
"Nevada just make it a game pls Hell you can win if you win, I've already busted",verdenvidia,2023-03-16 02:51:34
There’s no way Nevada comes back but it’s against my nature to give up on teams who aren’t down by twice as many points as there are minutes left in the game. They’re pushing it though.,ImmoralModerator,2023-03-16 02:52:41
Nevada has more points in the first 9 minutes here than in the entire first half,ItsSiegTime39,2023-03-16 02:54:04
Mountain West Chokers,spoonfedsam,2023-03-16 02:56:45
March madness is when you’re team doesn’t win so you stop watching and when someone asks about your bracket you stare at them confusing and question wtf is a bracket?,slitheringsidew,2023-03-16 02:57:23
Why am I still watching this?,ieatplaydough,2023-03-16 02:58:10
Wait Dev has his knee wrapped up what?? That’s not great to hear,theopression,2023-03-16 02:58:36
I wish I had the copium the announcers have,1nf1niteCS,2023-03-16 02:59:03
Still slightest of window of opportunity open for Nevada,casinobolton,2023-03-16 03:00:34
[deleted],[deleted],2023-03-16 03:02:05
"Finally some transition, it’s been awhile",wcooper97,2023-03-16 03:03:15
"Damn yall I'm on one, and been around for awhile. I feel like the drunkenUte in rCFB",IvankasFutureHusband,2023-03-16 03:09:03
"Little Bobby Hurley better make an appearance in this one. Not yet, but soon.",bobsaget824,2023-03-16 03:10:09
Fill me in on why Alford is so hated? Seems much more deep seated than just him being a bad coach,SaintArkweather,2023-03-16 03:10:50
"Look, members of the selection committee, if there are only 67 tournament quality teams, just have 3 Dayton games and spare us this.

(This is all I have to work with after last night)",ALC_PG,2023-03-16 03:12:49
"So…Alford on the hot seat next year, yes or no?",Zloggt,2023-03-16 03:15:42
IM CREAMIN,Firmy4DaddyHermy,2023-03-16 03:16:26
Going to hit fucking trippple digits..,skarkle_coney,2023-03-16 03:16:33
We gonna get free corn dogs???,3EEBZ,2023-03-16 03:17:05
Both tournament games today were so fucking good. This is what March Madness is about!!!,Asderfvc,2023-03-16 03:17:18
Does Nevada turn this one around?,ImmoralModerator,2023-03-16 03:17:21
"See you Friday night, Sun Devils.",Joelsaurus,2023-03-16 03:18:02
BOBBY JR,theopression,2023-03-16 03:18:31
#BOBBY JR SIGHTING,[deleted],2023-03-16 03:18:32
TCU vs ASU is gonna be one helluva first round game,bperu,2023-03-16 03:18:43
I want 100 so badly,wcooper97,2023-03-16 03:19:26
Bro hurley.. hahahhahhahah,skarkle_coney,2023-03-16 03:19:32
noo corn dogs!!!,Hybridkg87,2023-03-16 03:19:57
Nevada wtf lol,1990sandiegoalways,2023-03-16 05:06:38
I faded all Mountain West teams. All the teams have been awful in the Tourney the last few years.,RaidenTombs,2023-03-16 01:57:39
"So, ASU is gonna get blown out by 20 by TCU now right?",immaculatebacon,2023-03-16 02:02:13
"For those waiting for this massacre to continue, an update for the women's First Four game: In the 16v16 game, Southern started the game on a 14-4 run and since then Sacred Heart has gone on a 29-6 run lmao",Muffinnnnnnn,2023-03-16 02:09:40
Blackshear getting absolutely sonned by Frankie Collins in the first couple minutes probably changed this game tremendously.,Muh_Nado,2023-03-16 02:11:44
"I'm not sure if people are going to try to use this game as evidence that the at larges should only go to power conference schools, but if they do it would be a pretty silly arguement considering two of the first four out lost in their home gyms to mid majors",SaintArkweather,2023-03-16 02:18:24
Props to nevada for scheduling a good non-conference opponent,[deleted],2023-03-16 02:27:52
"Hey yall corny AF, but pimping ain't easy, unless you're a 37 yr old alum whooping up on Nevada by 30pts waiting to bitch slap your nephew and nieces who went to TCU.  Let the shit talking commence, until we blow this game we 3 minutes left",IvankasFutureHusband,2023-03-16 02:32:00
MW is ass. 0-4 incoming,volcanicon7,2023-03-16 02:43:03
"Congrats NCAA, you just wasted 5 minutes of everyone’s time",[deleted],2023-03-16 02:45:50
Paxlovid sounds like a frat kid getting banned from spring break trip due to infection being like “pshhh covid paxlovid im good”,ErickBachman,2023-03-16 01:24:51
"ASU to the Final 4

UofA to a loss to Princeton

I get an A on my thermo test

Cmon God I’m asking for a lot here",[deleted],2023-03-16 02:01:13
"I'm rooting for ASU so they can upset TCU, although I guess Nevada has some experience in the higher elevation games as well.",SentientPoster,2023-03-16 01:21:29
Paxlovid is the most inefficient use of syllables in the English language,[deleted],2023-03-16 01:27:04
"One might say that Nevada is having a


Devil of a time with ASU's defense",DontTakeOurCampbell,2023-03-16 01:48:15
The mountain west really sucks,Historical_Score5251,2023-03-16 01:51:40
"Is it me, or is Nevada just getting fouled multiple times every possession with no calls?",SandbergFan,2023-03-16 01:55:08
"The MAC deserves more bids than the Mountain West, I don’t care what Kenpom and the NET says",ddottay,2023-03-16 01:56:38
"Any of the first four out are better than Nevada, I don’t care who lost in the NIT",Historical_Score5251,2023-03-16 01:57:17
I put money on both Texas Southern and Nevada. AMA,melodyfelony,2023-03-16 01:57:52
Im changing my championship pick,quasithomas,2023-03-16 01:58:08
So will ASU live up to all the hype that is gonna be placed on them to be the annual First Four team who makes a run?,[deleted],2023-03-16 02:03:09
Mountain West win a tournament game challenge (impossible),[deleted],2023-03-16 02:13:10
"Fun Fact: In only one half, Arizona State score ~86.8% of all the points Texas Southern has scored in *an entire game*!",Zloggt,2023-03-16 02:18:32
This will get to a single digit lead I guarantee it,doublething1,2023-03-16 02:28:59
The MWC has lost 9 straight tournament games going back to 2018.,Bigdeacenergy,2023-03-16 02:38:52
Looks like Sparky strikes again.,romanapplesauce,2023-03-16 02:54:35
ASU was going to smoke any 11 seed. Glad it was Alfraud's,guest1969,2023-03-16 03:15:27
How the hell do you stream TruTv?,jpharber,2023-03-16 00:11:27
i would hate to be behind this coach ordering food at a Hardees rest stop,JiffKewneye-n,2023-03-16 00:53:00
Time for some better basketball,NYKnickerbocker2,2023-03-16 00:57:21
"Alright Devils, do it for the PAC!

Also, what's the O/U on Hurley getting a T?",GrouchyTrousers,2023-03-16 01:01:48
Apparently James Harden offered free lap dances to the entire ASU roster if they win.,NedFriarson49,2023-03-16 01:03:43
Go devils 😈,cr0asu,2023-03-16 01:04:52
Mans is in love with Candace Parker and he doesnt even realize it,SentientPoster,2023-03-16 01:06:28
Nevada has a lot of size in their starting lineup!,Additional_Effort12,2023-03-16 01:16:02
Bob Hurley looks like the kinda guy that would be a blast to rip an 8 ball with.,leakymemo,2023-03-16 01:16:19
[rooting for nevada for WCW reasons](https://youtu.be/IYwXUxgszF0),hussard_de_la_mort,2023-03-16 01:16:25
I hope both teams have fun and get completely exhausted and have no energy come Friday.,Joelsaurus,2023-03-16 01:16:40
That Will Baker 3 just gave me flashbacks!,Get_Pancaked,2023-03-16 01:17:26
[deleted],[deleted],2023-03-16 01:18:50
Lucas has been such a punk ever since he transferred from OSU.,seahawksjoe,2023-03-16 01:19:05
Giga bruh move Lucas,1nf1niteCS,2023-03-16 01:19:10
Bro think he walter white,D1N2Y,2023-03-16 01:19:19
LETS GO OVER,Pesci_Avocado,2023-03-16 01:20:03
Anyone k ow if using incognito mode will allow my 3 hour free trial to reset?,go_berds,2023-03-16 01:20:15
Well we got no defense,1nf1niteCS,2023-03-16 01:22:15
"Nevada needs a timeout.

Edit: they called one",lol_smart,2023-03-16 01:22:31
"After this game, no more Avery Johnson until Baylor vs UCSB on Friday",tboots1,2023-03-16 01:23:15
Did Nevada know who they were playing?,TheFinalKiwi,2023-03-16 01:23:25
"Lot of time, just gotta settle in here.",1nf1niteCS,2023-03-16 01:24:16
"Hooo, this might be a rout!",TheGeoninja,2023-03-16 01:24:50
This is not going how I would have preferred so far.,[deleted],2023-03-16 01:28:38
They know the chemistry of each other is the most awkward version of the cliche they have chemistry ever.,kstatepurrplecat,2023-03-16 01:28:38
Poor basketball such a broken little game. :(,slitheringsidew,2023-03-16 01:29:08
https://preview.redd.it/tkceadeep1oa1.jpeg?width=1242&format=pjpg&auto=webp&s=b58bfc95d4146891650efcb99a624b82aed6bb8e,go_berds,2023-03-16 01:29:36
I’m gonna have to mute games bc of Avery Johnson.,weinshe2,2023-03-16 01:29:54
>AZ St misses their first 2 pt field goal as the announcer remarks how they haven't missed one yet,DontTakeOurCampbell,2023-03-16 01:30:39
