Comment,Author,Created UTC
"If they do what they’ve been doing in good games, early second half is gonna be awesome.

Also of note is UVM isn’t great with offensive rebounds either, tho has improved through the season. Looks like this will be an old-school game.",Meanteenbirder,2023-03-17 18:23:49
God I'm still annoyed about that Arkansas game last year,DrDilatory,2023-03-17 18:28:16
Cats are a good defensive rebounding team.  Which is only good if they can get stops and Marquette cools off.,Captain_T,2023-03-17 19:08:13
You mean FTs?,Chucktownbadger,2023-03-17 19:15:44
Jop wagon*,millertime1419,2023-03-17 19:17:49
Hair follicles I think,SnakeMilker,2023-03-17 19:23:49
Well now 4,coilmeup,2023-03-17 19:24:17
You try guarding this offense…,millertime1419,2023-03-17 19:30:42
Why not Esperanto?,spierce64006,2023-03-17 19:30:02
I wish I had studied Latin.,brownlab319,2023-03-17 19:32:39
He's a star in my eyes,SnakeMilker,2023-03-17 20:07:13
Idk how this sub was when UMBC won but if a 13-16 seed had a double digit lead at any point the thread would be on fire 😂,inshamblesx,2023-03-17 18:46:15
"Always liked Greg, great teammate.",Dekalbian,2023-03-17 19:55:31
1 heat check everybody knows the rules,footer9,2023-03-17 20:26:12
Respectable opinion,Dekalbian,2023-03-17 20:45:23
"I’d assume early afternoon, the Sunday 2:30 EST slot?",Dekalbian,2023-03-17 20:48:34
Don’t forget the state of the program that Buzz left him. 7 scholarship players,Augustus13,2023-03-17 20:45:40
"Great recruiter, but arguably the worst in-game coach I've ever seen",gandaalf,2023-03-17 20:44:40
That's why he's not coming for it til next season lol,skyllian-five,2023-03-17 19:17:37
It shreds any momentum Vermont had. How are they supposed to play D if they get called for fouls where they don't even *touch* their guy? Like that's confusing as shit and hurts your ability to defend because you don't fucking know what's gonna get the whistle blown,framingXjake,2023-03-17 19:42:28
Strange that an SEC commercial plays for a game where there aren’t any SEC teams,SeekerSpock32,2023-03-17 19:37:24
Doesn’t change the fact that the last two possessions could’ve had an entirely different outcome if there hadn’t been utter bs calls on them,No-Lab7758,2023-03-17 19:42:40
Also I would argue the kennesaw state one was worse because it was on a much more crucial time of the game,No-Lab7758,2023-03-17 19:43:23
i was born in 2005 brotha i missed our relevancy 😿,CoachKillerTrae,2023-03-17 19:42:37
"Exactly.

There are plenty of clear cases where it’s a target or an danger box out, but there are a ton where it’s not really avoidable on the part of the defender (or person boxing out).",______W______,2023-03-17 20:31:21
Shaka isn’t going anywhere. Marquette has the bag to keep him for the long haul.,millertime1419,2023-03-17 20:48:31
"Not only is Shaka Smart the perfect fit for Marquette, it's his dream job.  I expect him to retire there.",the_greasy_one,2023-03-17 21:00:09
"That one's awful too.

Yeah there's some bad ones this year",thenewTeamDINGUS,2023-03-17 20:09:09
"I’ve been to Vermont multiple occasions to snowboard as I’m not far from them. I love it there, just a crazy combination of things. Vermont and basketball. Wild.",PancherosFood,2023-03-17 20:35:49
worcester vt right here smallest town fuckin ever,CoachKillerTrae,2023-03-17 20:47:27
dartmouth is just barely in NH my guy,CoachKillerTrae,2023-03-17 20:46:57
Fuckin Doug,PancherosFood,2023-03-17 20:37:19
"My brotha in Christ all over Vermont is rural essentially

Even Burlington is like a suburb",PancherosFood,2023-03-17 20:47:11
haha enemies for today alone!,irreleventnothing,2023-03-17 19:09:01
"And Marquette, Michigan has a DI national champion in ice hockey (Northern Michigan)",LocksTheFox,2023-03-17 19:00:32
Bruh you jinxed us,b_ollhoff,2023-03-17 18:59:52
Naming my first newborn Tyler and his middle name Fuck’Em,Dekalbian,2023-03-17 19:09:56
"Ahhhhh, that would make sense.",Chucktownbadger,2023-03-17 19:15:29
That’s the thing. I’m not in Serbia. But that’s the only feed that shows this lmaoo,ToxicSteve13,2023-03-17 19:27:29
"Last year we should have been higher than a 13 seed for sure, if they ranked us like 10 or 11 like we should have been I think we would have won a game or two

Arkansas was just really good last year, unfortunate first round match up and the game was still really close",DrDilatory,2023-03-17 19:41:57
We all got blackout drunk after and forgot,SnakeMilker,2023-03-17 20:16:02
"yeah i think this is why i get confused, it definitely has public school energy",airbornetoxic,2023-03-17 20:56:32
Oh shoot my bad lol,jaowerpower,2023-03-17 20:30:39
They should wear a shock collar to be punished for their misdeeds,queef-latina-69,2023-03-17 19:49:55
I’m glad we could have your unbiased take as well,WIN011,2023-03-17 20:10:52
Bros feet were moving for sure,SnakeMilker,2023-03-17 20:10:41
wrong green mid-major,Boom_Confetti,2023-03-17 19:07:50
I guess I would say so. I live like 10 minutes away from Stevens Point so thats cool,coilmeup,2023-03-17 19:20:39
"Im on my third beer already.  I hope i can make it to our game.  These Guinness are going down so damn smooth.  Ill move to Busch Light after this.  Can only donso many draughts before i get cotton mouth.

Might be a 15 beer night.",Stang1776,2023-03-17 20:12:54
Ayyyyyyyyyyy,millertime1419,2023-03-17 20:30:27
"Thing is Shaka’s in a situation Vermont has been in before. A meh school most years is excelling this season and the coach is getting a lot of respect, similar to Vermont last year.",Meanteenbirder,2023-03-17 18:26:20
"Username checks out, I think something is wrong with yours",DrDilatory,2023-03-17 19:39:05
"yup, but 11-6 involving two high majors is the boringest of upsets, lol",[deleted],2023-03-17 20:04:01
"Was a perfectly good call...

Was pretty much the same play as the time where your guy got three free throws on his three-point attempt",DrDilatory,2023-03-17 20:03:23
And if Marquette were playing peak ball it’d be a 20 point game. Goes both ways.,Dekalbian,2023-03-17 20:12:37
Yes it is but tournament runs are what make or break careers imo.,[deleted],2023-03-17 20:19:19
"Cuz fuck y'all after today, that's why?

Why would I want to see the fans dancing on our season's grave be even happier? The hypothetical of you guys winning the championship and us going ""well, we drew the national champion in the first round, of course it makes sense we lost, maybe if we drew a different team we would have won"" isn't worth anything. It's a pointless hypothetical that may or may not be true. What is true is that you guys are reveling in our loss, and I look forward to doing the same if you lose against Michigan next week lol",DrDilatory,2023-03-17 20:55:32
My man just learned about cheerleaders,CaptainBecket,2023-03-17 20:36:49
And yesterday with Arizona,SnakeMilker,2023-03-17 20:32:27
[deleted],[deleted],2023-03-17 20:33:05
Sorry was referring to UVM getting defensive rebounds though the verbiage was kind of confusing,Wolf_of_Walmart,2023-03-17 18:26:23
"ugh yes FTs, I very much mean FTs.",ApprehensiveCorgi867,2023-03-17 19:16:22
I’m partial to trains,CarrollPC,2023-03-17 19:18:20
[deleted],[deleted],2023-03-17 19:30:58
"I still want a Greg and JaJaun sitcom. They were hilarious together.

Edit: meant Jamal Cain, not JaJuan.",millertime1419,2023-03-17 19:58:45
I was hoping he'd transfer his 3 point shooting to Stevie,footer9,2023-03-17 19:59:07
Buzz fucked us HARD. Our best player was Juan Anderson who somehow stumbled into the NBA. He was awful at MU,gandaalf,2023-03-17 20:53:05
Let Markus do whatever he wants and make the Hauser's upset enough to leave,SnakeMilker,2023-03-17 20:46:14
"Bad team coach honestly, he put everything on Howard.",cixzejy,2023-03-17 20:46:13
Man couldn't make an adjustment to save his life,ApprehensiveCorgi867,2023-03-17 20:53:19
Let’s wait for the second half when the makeup calls start flying.  I just find it bullshit that refs can’t call an objective or even game.,Chucktownbadger,2023-03-17 19:43:08
"Sure, but it’s not a “big swing” anyway you put it",Dekalbian,2023-03-17 19:43:40
It really is!,brownlab319,2023-03-17 19:49:37
"Holy shit, my brain can't handle y'alls generation already being adults.",framingXjake,2023-03-17 19:50:21
"Jesus christ.

Here i am remembering IUs last championship",Stang1776,2023-03-17 19:46:18
"Yeah you'd expect us to be one of the better hockey teams in the country, surprised the basketball team is as good as it is, and we don't even have a football team",DrDilatory,2023-03-17 20:37:10
I legit spent two decades thinking Dartmouth was in Vermont.  LMFAO.,Pollaski,2023-03-17 20:52:02
ik lol i grew up in a town with less than 250 people close to montpelier. we got some good ass co-ops tho 🥵🥵,CoachKillerTrae,2023-03-17 20:48:50
Cheers!,scrapsbypap,2023-03-17 19:09:36
then that's...bizarre,butts6891,2023-03-17 19:28:17
Where are you?,chuncken,2023-03-17 19:28:53
All good lol just like to poke fun when people call him Cam,WIN011,2023-03-17 20:36:14
"I haven't officially signed off work yet, another 7 minutes and the Beanblossom hard cider from Oliver down in Bloomington comes out.",Where0Meets15,2023-03-17 20:25:07
Looks like he heard ya,Spectre1919,2023-03-17 20:32:39
"Sure thing homer 😂. If you can't see the forearms to the chest, you must have started St Patty's early.",owmyfreakingeyes,2023-03-17 19:40:46
Everyone knows you shoot your off hand completely to the right after you shoot,WIN011,2023-03-17 20:04:20
yeah no shit we playin like a middle school team from new hampshire with this playcalling rn,CoachKillerTrae,2023-03-17 20:15:04
"Maybe at some schools, but I think his got a long leash at a school like Marquette",somasomore,2023-03-17 20:31:42
Or maybe like getting the highest seed in school history,TheyCallMeStone,2023-03-17 20:24:39
We haven’t won a tourney game in 10 years. Y’all player well and it was a competitive game for a lot of it. We’re just very glad to have finally won one.,millertime1419,2023-03-17 20:59:16
We also haven't won a tournament game in a decade,SnakeMilker,2023-03-17 20:34:03
"Seems like maybe if UK came into their game with Marquette’s attitude, maybe they wouldn’t have gotten upset",Rockerblocker,2023-03-17 20:35:06
"Yeah. Vermont got one of their rim-protecting bugs back from injury a few weeks ago, so it definitely helps.",Meanteenbirder,2023-03-17 18:28:20
Trains have wagons. 🤷‍♂️,millertime1419,2023-03-17 19:19:41
"imagine studying a language at vermont hahaha haha 

*was an English major with a Russian minor..*",LocksTheFox,2023-03-17 19:33:01
The Jamal and Greg show,SnakeMilker,2023-03-17 19:59:39
Every time that Juan Anderson comes up I can’t explain how he made a NBA career for himself haha,Augustus13,2023-03-17 21:29:22
"By the end I actually disliked Howard. It was the Markus Howard show and then everyone else, and he was a turn over machine. Thank his that era is over.",thatsryan,2023-03-17 22:50:23
I'm an NC State fan and if we're famous for anything it's bitching about refs so I'm probably not the guy to discuss this with in all honesty 😅,framingXjake,2023-03-17 19:46:31
"Fair. He made, what, one FT?",framingXjake,2023-03-17 19:47:23
Hello fellow 40ish year old?,Stang1776,2023-03-17 20:04:43
You guys weasel into the mix every year. I love it.,PancherosFood,2023-03-17 20:40:26
"I didnt go to IU so im not to familiar.  I tried the IUPUI thing out then joined the service in 2001.

On the bright side i retire from it in a couple months!!!!  College wasnt my thing.",Stang1776,2023-03-17 21:17:30
Learning from Reggie Miller.  Also gotta kick the leg.,Stang1776,2023-03-17 20:07:24
"We have only won one tourney game ever, over 10 years ago lol

Did you actually expect anything resembling sympathy?

I mean I get it, of course you're happy, I hope you're not after your next game, all the best 👍",DrDilatory,2023-03-17 21:05:09
LOL called it,DrDilatory,2023-03-20 03:14:36
The Kolek Kaboose,CarrollPC,2023-03-17 19:21:13
Higher German would've been funnier or Gaeilge maybe.,spierce64006,2023-03-17 19:40:13
"Doh, Jamal* not JaJuan!",millertime1419,2023-03-17 20:00:34
"Yeah, and Vermont held out a defensive stop after they turned the ball over.

If Kolek made the 3 at the end, then I’d see the big swing there.",Dekalbian,2023-03-17 19:48:44
I'm only 25 but my brother was born in 2004 and I still think of his generation as being my 8 year old little sibling,framingXjake,2023-03-17 22:07:04
"I didn't either, but they sell the cider at the local Meijer and I like buying local when possible.

What branch, if you don't mind me asking?  Congrats on the military retirement!",Where0Meets15,2023-03-17 21:24:59
"Ohh fuck man.  This aint helping me.

I no shit have my first colonoscopy scheduled later on this month.  Well there is a lot of shit qbout it.  I hear that  pretest is a waterfall out the ass.",Stang1776,2023-03-17 22:44:57
"USCG.  Wasnt too shitty till these past 5 years (i think its because im just burnt out).  I was able to the wife through school....twice.

If youbhave any questions feel free to ask (shoot me a PM).  If interested go USCG or USAF in my humble opinion",Stang1776,2023-03-17 22:40:05
"I've had one to try and diagnose my stomach problems. Turns out I have pelvic floor dysfunction. And yeah, the colonoscopy prep is uhhhh pretty shitty iykwim. I highly recommend installing a bidet to save from rubbing yourself raw. Also when they say drink a whole 64oz bottle of Gatorade, break it into 4 16oz bottles, each a different flavor. I will never be able to drink yellow Gatorade ever again.",framingXjake,2023-03-17 23:12:00
"I'm well past joining up myself, but I've got two brothers-in-law that are Air National Guard, one former Navy, and one of the ANG in-laws is married to just-retired USAF.  I've also got an uncle that's a retired F-16 pilot.  So I'm probably generally more curious than the average person about people in one of the service branches.

Getting to retirement is pretty impressive, regardless of branch.  From what I know it's a lot more common to do one or two rounds and get out.  I applaud your service.  Enlisting in '01 puts you just a couple years older than me, given your year(s) at IUPUI.  It also puts you signing up either right before or right after a very significant event in US history, although CG probably didn't see quite the same bump as the other branches, I'm sure it, too, had a surge of enlistment.",Where0Meets15,2023-03-17 23:26:01
Thanks for the tips young man.  Never thought youd be talking about colonoscopy tips today on the CBB subreddit did ya?,Stang1776,2023-03-17 23:29:50
Yeah.  I went to IUPUI starting '99. Did 3 semesters.  Wasnt for me.  Worked at UPS. Starting January '01.  Figured i need to do something.  Went to basic november of '01,Stang1776,2023-03-17 23:33:43
"After how my team played today, I think colonoscopy talk is probably the least of my worries rn lmao",framingXjake,2023-03-17 23:33:58
"Yeah.  Talking with a guy at work and my mother in law it sounds like they are no big deal.  Sounds like a colonoscopy would be a decent tradeoff for a W in the tourney.

Mine is also to try and diagnose my stomach issues.  Hopefully its just IBS or even Chrones.  I fear for the worst though.",Stang1776,2023-03-17 23:39:35
