Comment,Author,Created UTC
"My wife is an ASU alum.

 I said “your alma mater is winning big in the NCAA Tournament right now.”

She responded “is that basketball?”

Exciting times in our house. All in on the Sun Devils, one might say.",OverMyDadBody,2023-03-16 01:49:46
Nevada already performing to MW postseason standards I see,rattlerden,2023-03-16 01:21:09
"I wouldn’t be surprised at all if the Pac-12 was severely underrated again this season, like we were two years ago.",seahawksjoe,2023-03-16 01:21:38
ASU proving Walton correct that the conference of champions doesn't get the respect it deserves,NegativePride1,2023-03-16 02:03:06
"With all the shade Rutgers people were throwing at Nevada, I'd like to see them win to make them grapes even more sour.",The_Fishbowl,2023-03-16 00:14:16
I’m just here for the ASU cheerleaders,Jets2022Champs,2023-03-16 01:11:20
"They just chose this matchup (and possibly put Nevada in) because two ASU guys transferred from Nevada, didn't they?",elgenie,2023-03-16 01:21:41
"I’ve seen enough

ASU to the Final 4",[deleted],2023-03-16 01:47:29
"Well...this game is likely staying out of hand. So why not make some light of some fun facts about these universities?

* [](#f/nevada) Nevada - Due to a large number of Basques (an ethnic group native to Spain and France known for speaking a language predating modern Indo-European languages) that emigrated to Northern Nevada, the University of Nevada has open a center dedicated to Basque studies - and of the *Euskara* language as well!

* [](#f/arizonastate) Arizona State - The famous mascot, Sparky the Sun Devil, was designed by former Disney animator Berk Anthony - and although never *confirmed*, there are many rumors that the design (especially the earlier styles) had...taken some features from Mr. Anthony's old boss Walt...

* **BONUS**: Although Arizona State has made the Tournament relatively constantly during recent times - the last they *didn't* have to first play in Dayton? **2014**. This means that, for three straight appearances, Arizona State has had the bubble work out in their favor - albeit with them still stuck in the First Four!",Zloggt,2023-03-16 03:08:35
"Conference of champions what can I say. More smooth than butter lettuce. Flying high in Dayton Ohio the home of the flyers. Birthplace or Orville and Wilbur, and not that silly Wilbur down in tuscon I'm talking about the godfather of aviation Wilbur Orville.  This ASU team spurned by hurley playing with the heart of the pac 12, conference of champions, such tenacity they are going further than the Wright brothers ever dreamed of.

- Bill Walton or something.",IvankasFutureHusband,2023-03-16 01:51:38
"My gf just looked at me and said she’s an ASU fan

Don’t know what to do",brokentr0jan,2023-03-16 01:48:43
Forks up! Screw you Alford,guest1969,2023-03-16 02:08:55
How are you 60% from 3 and down by 20,530josh,2023-03-16 02:53:13
Arizona State is currently on a 51-19 run. Unreal.,TheFinalKiwi,2023-03-16 01:58:27
"Before the game James Harden told ASU players they'd be getting lap dances all night at the club of their choice. 

No wonder they're up 30.",NedFriarson49,2023-03-16 01:59:50
"/quickly changes my SDSU, Boise State, and Utah State picks",everyvillainizlemonz,2023-03-16 02:04:30
"Fellas…Arizona State and Grand Canyon could technically meet in the second round.

…who *doesnt* want an All-Phoenix matchup?",Zloggt,2023-03-16 02:16:53
"""Here's a move an old college teammate of mine taught me"" -Bobby Hurley, to his players",ddottay,2023-03-16 02:43:19
"Alright, a dude hits the Larry Bird from behind the backboard, you just hang ‘em up and go back home. ASU wins.",warrenjt,2023-03-16 02:47:18
Does ASU have the best cheerleaders in the tournament?,cavahoos,2023-03-16 03:21:09
Steve Alford is a bum,SolarpunkJesus,2023-03-16 01:27:43
Committee really got to look like geniuses for a day just for this to happen,carnagebot_55,2023-03-16 02:02:20
Asu walk ons gonna get to play in the national tournament tonight. Good stuff,fancycheesus,2023-03-16 02:03:34
"okay but ASU somehow losing this game would be *peak* Arizona State.

Actually - scratch that. Peak ASU is winning this game by 35, getting their fans excited the team has momentum, and then laying an unmemorable egg once the team has expectations in a game that actually matters.",stoppedcaring0,2023-03-16 02:04:55
Bill Walton lighting a blunt right now,AFC-Wimbledon-Stan,2023-03-16 02:11:27
"Can’t believe ASU is going to the Final 4 and UofA is going to lose to Princeton

A dream come true",[deleted],2023-03-16 01:49:20
"This is the first play-in game I haven't bet on and I'm really enjoying watching and shooting the shit in the gamethread without actually caring what happens.

Is gambling....bad?????",Orange_Kid,2023-03-16 01:31:59
A reminder that 3 of the 4 career Sweet 16s Steve Alford has made came at UCLA with players he did not recruit himself.,ddottay,2023-03-16 01:48:47
"https://preview.redd.it/g12wr79ju1oa1.jpeg?width=640&format=pjpg&auto=webp&s=f1817a12e7b45a0d5e46ccf299f5df192c78ab7f

Steve Alford watching his team get 50+ dropped on them and go down 30 in one half",Boom_Confetti,2023-03-16 01:58:39
ASU is going to the Sweet 16 aren't they,LondonIsBoss,2023-03-16 01:58:42
so I just tuned in... umm ASU what the fuck?,Jhwelsh,2023-03-16 02:03:20
"TCU right now:

![gif](giphy|55itGuoAJiZEEen9gg)",Ryan1006,2023-03-16 02:06:13
"Still glad Nevada got here.

But good god this isn’t the same team as a month ago. I don’t know what changed with them. Maybe the short bench got to them.

Kenan going out immediately didn’t help either.",Freakydeaky9,2023-03-16 02:18:14
"Going to bed

I’ll dream of ASU winning by 50, and Hurley kicking Alford square in the ballsack during handshakes",cory_bdp,2023-03-16 02:44:33
Cambridge with the Kobe shot,listinglight778,2023-03-16 02:46:44
"Give me 100 points or an UoA loss to Princeton. 

Your choice, basketball gods.



E: okay, I'll take it.",Willsears94,2023-03-16 03:20:19
"Conference of Champions.

Walton was right, Wazzu was robbed.",JerseyDvl,2023-03-16 01:48:03
"https://preview.redd.it/n10wuhwfu1oa1.jpeg?width=638&format=pjpg&auto=webp&s=af813a0f1a27efbdda873f9d19f80a82dfb95822

ARIZONA STATE",AFC-Wimbledon-Stan,2023-03-16 01:57:53
Get fucked Alford,notanamateur,2023-03-16 01:58:00
This is the game I’ll point to the next time I need to remind IU fans why we don’t want Steve Alford as our coach.,warrenjt,2023-03-16 01:58:35
How fast can we get that kid as a meme?,[deleted],2023-03-16 02:00:58
"If Arizona State plays like this against TCU it's going to be a trackmeet, both teams will be in the 90's.",Im_DJayy,2023-03-16 02:03:40
Washington State deserved this spot over Nevada. This game would be closer.,Shamoofles,2023-03-16 02:04:48
ASU… thank you for allowing me to go to bed at a sensible time tonight.,grrgrrtigergrr,2023-03-16 02:13:48
"I’m sure it’s been mentioned, but Steve Alford is a piece of shit and it’s awesome watching him anguish on the bench.",tenacious-g,2023-03-16 02:55:09
[deleted],[deleted],2023-03-16 03:19:27
Nothing says first four more than having both games yesterday be around 1 to 2 possessions the entire time and both games today be 20+ point blowouts.,americanbaseball,2023-03-16 03:19:28
Time to take on the Truck Stop Conferences!,romanapplesauce,2023-03-16 03:22:55
"Good on you ASU! People slept on you because we’re PAC schools, but this was no upset. This was expected",listinglight778,2023-03-16 03:23:27
About to undo every MWC pick now...,Seastep,2023-03-16 03:25:14
They’re getting too cute with the camera angles this game,theopression,2023-03-16 01:20:50
ASU woke up and chose violence.,leakymemo,2023-03-16 01:21:04
pizza hut is the last place i'd get a calzone,Pesci_Avocado,2023-03-16 01:24:32
Do people watch TruTv outside march madness?,mruab,2023-03-16 01:26:10
Lmao I’m high with my ASU buddies rn. Can’t help but have a good time with them so far,StephenBrocker,2023-03-16 01:27:39
Can we pretty please stop using the 2k view,therealbigted,2023-03-16 01:34:54
Imagine its the national championship game. Someone hits a three for the win but we have to watch it in that 2k camera view,coilmeup,2023-03-16 01:35:59
Oklahoma State would have been a better opponent than Nevada lol,DontTakeOurCampbell,2023-03-16 01:46:29
"This is what ASU can do when it hits 3s…

...

...It’s just that ASU sucks at hitting 3s.",Cut-OutWitch,2023-03-16 01:48:22
"We are a sad, strange little conference",GovernmentDoingStuff,2023-03-16 01:49:49
UCLA made it to the final four after being in the first four. ASU going to do the same thing?,boregon,2023-03-16 01:52:36
Reminder that nevada hired Alford to a 10 year contract just 4 years ago,Zeppelin96,2023-03-16 02:00:35
No one say shit,d-lo_tha_boss,2023-03-16 02:00:36
How does the Mountain west keep getting so many teams in? They've more than proven in recent years they aren't actually good. Need more power conference teams,zachwilson23,2023-03-16 02:01:32
I'm getting 2021 UCLA flashbacks,LondonIsBoss,2023-03-16 02:09:48
The commentators are talking about this game in the past tense. The post game round up is coming at half time.,Saw_a_4ftBeaver,2023-03-16 02:12:16
"TCU fans right now

![gif](giphy|UI1qLkl9hekmoJWduz|downsized)",Shamoofles,2023-03-16 02:16:45
Not that it matters but Nevada is getting absolutely hosed by the refs lol,Hammerhead34,2023-03-16 02:42:25
"Sick shot, my goodness.",kGibbs,2023-03-16 02:46:57
What do you even do there? 1 foot fade over the backboard???,1nf1niteCS,2023-03-16 02:47:16
Team USA just took a 1-0 lead over Colombia,3EEBZ,2023-03-16 03:00:35
Regret not going to the WBC USA v Columbia game to watch this. (Side note the WBC is awesome and if you have not seen it in person you should).,1nf1niteCS,2023-03-16 03:05:05
absolute fucking rest in piss alfraud,RyanIsHungryToo,2023-03-16 03:08:48
"Holy shit ASU is shooting 64% from the field hahahahahahahaha

Steve Alford you fucking bumpkin",listinglight778,2023-03-16 03:13:57
"Bobby Hurley saw the floor in March yet again 

Natty confirmed",[deleted],2023-03-16 03:20:53
"my brain: i want a sub

doordash: that will be $30",Pesci_Avocado,2023-03-16 01:31:38
People blaming the Mountain West as if Arizona State hasn't been erratic as hell all year,TheRealHenryG,2023-03-16 02:07:27
"The closest truck stop to UNR: [4.5 miles from campus](https://www.google.com/maps/dir/TA+Travel+Center,+North+McCarran+Boulevard,+Sparks,+NV/University+of+Nevada,+Reno,+1664+N+Virginia+St,+Reno,+NV+89557/@39.5355505,-119.81044,13z/data=!3m1!4b1!4m13!4m12!1m5!1m1!1s0x80993edbe61e5eb1:0x290c9564ba69cb78!2m2!1d-119.7363237!2d39.534669!1m5!1m1!1s0x809946d7874bd11f:0xe385628992fed618!2m2!1d-119.8141582!2d39.5437205)

The closest truck stop to ASU: [3.7 miles away from campus](https://www.google.com/maps/dir/Arizona+State+University,+Tempe,+AZ/Pilot,+3444+S+40th+St,+Phoenix,+AZ+85040/@33.4169316,-111.9971258,13z/data=!3m1!4b1!4m13!4m12!1m5!1m1!1s0x872b08db3b33540f:0x666e717f473c3033!2m2!1d-111.9280527!2d33.4242399!1m5!1m1!1s0x872b0f01c3ea5e65:0x209760352476df2b!2m2!1d-111.9959432!2d33.4149481)

CONCLUSION: the truck stop team tonight is in fact the PAC 12 team",stoppedcaring0,2023-03-16 01:22:02
Nothing makes me happier then seeing that greasy snake oil of a Coach get embarrassed on TruTV.,Anels0505,2023-03-16 01:24:10
"The good ASU team showed up today

The one with S16 potential

So on Friday the one that lost to Texas Southern will show up, provided that one doesn’t show up in the 2nd half",[deleted],2023-03-16 01:34:47
we should have never intercepted the Zimmerman telegram.,slitheringsidew,2023-03-16 01:46:23
Quickly changing my bracket to have Arizona State beating TCU,IAmNotStephen,2023-03-16 01:52:28
"Avery: ""You can't make any excuses""
Alford: ""Oh fuck""",bfinleyui,2023-03-16 01:52:38
Holy fucking shit this is an absolute demolition,boregon,2023-03-16 01:56:48
Sheesh ASU take them out to dinner first,andSLIPPERY,2023-03-16 01:58:06
Arizona State could smoke weed in the locker room for the whole second half and still win,ImmoralModerator,2023-03-16 01:58:09
"Babe wake up, new mountain west disaster class just dropped",PandaOfCh5os,2023-03-16 01:59:00
This is what you get when Steve Alford is your teams coach in the tournament,casinobolton,2023-03-16 01:59:09
I miss Steve Alford at UCLA,rkz99,2023-03-16 02:05:29
I’m starting to think the NET might not be a very good metric.,skipca,2023-03-16 02:06:39
"Jon Rothstein saying ""have a nice rest of the half"" at the end of the halftime interview is exactly what I would expect from a guy who hasn't slept in the past 15 days.",SpartansATTACK,2023-03-16 02:06:39
"Interviewer: “Coach, what do you have to say regarding your team’s execution tonight?”

Alford: “I’d be in favor.”",530josh,2023-03-16 02:07:26
"We're getting rolled but come on, ASU is hitting some insane shots",1nf1niteCS,2023-03-16 02:09:16
Bro did the mods already fade the Nevada flair? Lmao,TyroneSwoopes,2023-03-16 02:13:38
"https://preview.redd.it/quzehysp02oa1.png?width=3023&format=png&auto=webp&s=15c99778b94223bfc558a3010281a0b50179df32

Anyone care to rate my March madness setup? Anything I should change before the action starts tomorrow?

Also go easy on the mess in the kitchen, I’m a single guy that doesn’t care if there’s stuff on the counter for periods of time.

Edit: I have the ability to add up to 3 more TVs which I might actually try to do for Friday so I can watch both women’s and men’s games.",Anels0505,2023-03-16 02:35:12
"Absolutely bailed out with that foul, such a bad shot lmao",wcooper97,2023-03-16 02:41:24
Ahhhh the classic Laetner chest step.,ekimtk,2023-03-16 02:43:11
"Fun Fact: Teeth are naturally a little yellow, not completely white.",Joelsaurus,2023-03-16 02:52:47
The NET rankings are a joke if they keep making Mountain West squads qualify for at-large bids.,Routine_Face6630,2023-03-16 03:02:42
"The devils born from the sun. Valley of the vast. Flying in the state of flyers. Reborn like the Phoenix from the city they hail. Will they crash and burn like Icarus, scorched by the sun, made from the paper wings of the Wright Brothers in the city of flight.  One things for sure. This, this devils team, represents all of us. The conference of champions. 

- bill Walton or something",IvankasFutureHusband,2023-03-16 03:03:36
"Axe commercials now are all Fortnite and videogames, back in my day they would just strongly imply that hordes of women would want to have sex with you if you smelled like ""Phoenix"" or ""Chocolate Temptation"" or whatever. And we liked it, goddamnit!!",CaptainScuttlebottom,2023-03-16 03:06:48
"We're going to state, folks",[deleted],2023-03-16 03:13:11
Rothstein needs to stop playing and hit ‘em with the BOBBY ******* HURLEY on live TV,bobsaget824,2023-03-16 03:16:52
"Arizona State has to be careful here. Maybe the scoreboard can only hold two digits and scoring again will cause a rollover error, leading to a 70-1 Nevada victory",SaintArkweather,2023-03-16 03:19:03
"Nevada is kill

F",Zloggt,2023-03-16 03:21:43
I hope we win and GCU wins so we can clown them for stealing our logo.,Joelsaurus,2023-03-16 03:21:58
God I love cheering against Alford.,3EEBZ,2023-03-16 01:15:22
"Horne made his first 3

That’s a good sign, his first couple of shots usually dictate what kind of night he has",[deleted],2023-03-16 01:18:05
"3 offensive fouls already by Nevada

Yikes",[deleted],2023-03-16 01:26:53
"All time favorite Bob Hurley highlight, [getting back to back technicals, ejected, and walking out like a rock star in less than 30 seconds.](https://youtu.be/KjoZN-XMkRw)",leakymemo,2023-03-16 01:27:36
Avery Johnson's announcing skills are playin-game quality.,elgenie,2023-03-16 01:29:54
Zona State going for a hundo,coilmeup,2023-03-16 01:34:16
"ASU has the worst FT shooting percentage in the Pac 12 with 69% 

Nice",Goooldschmidt,2023-03-16 01:44:41
"That dunk might’ve honestly been the dagger, this game is over",ImmoralModerator,2023-03-16 01:45:21
Brb changing my Utah St pick,FostetlerLFC,2023-03-16 01:45:31
Like our D isn't good but ASU is also hitting some stupid difficult shots,1nf1niteCS,2023-03-16 01:47:01
[deleted],[deleted],2023-03-16 01:47:14
ASU is kinda scary ngl,Neither_Mix1658,2023-03-16 01:47:20
Bill Walton is peaking on two hits of acid and just came in his pants. “That’s the conference of champions I know and love”,L0835,2023-03-16 01:48:48
"it is 2006. A Steve Alford coached team plays well below its talent level on its way to a cringeworthy loss in the NCAA tournament.

it is 2013. A Steve Alford coached team plays well below its talent level on its way to a cringeworthy loss in the NCAA tournament.

it is 2023...",stoppedcaring0,2023-03-16 01:50:44
Bobby’s antics crack me up. Most entertaining coach to watch in the conference,Celery-Man,2023-03-16 01:52:42
Hey gang just a reminder that Steve Alford is a piece of shit human,cory_bdp,2023-03-16 01:54:05
Stop ASU they’re already dead,-sorry-,2023-03-16 01:57:03
It's sweet justice that it's a PAC team to stomp on Alford's throat,jabronius89,2023-03-16 01:57:49
Oh god yes fire Alford into the fucking sun ASU,cory_bdp,2023-03-16 01:57:53
The Pac-12 tournament run begins …,wordsonascreen,2023-03-16 01:58:07
"I’m just dropping in quickly to say Fuck Steve Alford! 

Hope everyone except Steve’s night is going well",BatManatee,2023-03-16 01:58:21
There has to be some sort of law against this right?,1nf1niteCS,2023-03-16 01:58:35
"There's something to be said about the Sun Devils playing 5 of their last six games against UCLA, Arizona and USC. They are obviously not the least bit concerned with Nevada.",mrwhitaker3,2023-03-16 01:59:18
"Serious question, is there any particular reason the MW does so well with respect to metrics? Do they really kill it in the noncon or what?",Historical_Score5251,2023-03-16 02:02:25
"They were up 15, I looked down, I looked back up and they were up 29.",JerseyDvl,2023-03-16 02:02:58
Suddenly ASU is the Golden State Warriors.,romanapplesauce,2023-03-16 02:03:15
Remember that Alford is one of those people where it’s OK to kick them while they’re down,cory_bdp,2023-03-16 02:05:47
Not up by 30.. unacceptable.,Willsears94,2023-03-16 02:06:09
Shooting 68% from the field.. Sheeesh,Goooldschmidt,2023-03-16 02:07:27
I’m going to watch the Saint Peters first round upset on YouTube instead of this nonsense,nuahs,2023-03-16 02:08:42
Rutgers died for this,brokentr0jan,2023-03-16 02:23:00
"""What if Nevada goes on a 10-2 or 10-0 run?""

*goes on 11-2 run*",justaguyinthebackrow,2023-03-16 02:37:23
WHY WOULD YOU FOUL AGAIN ON A 3 ATTEMPT,Joelsaurus,2023-03-16 02:41:07
I’m gonna give this to Stax as a correct prediction LOL https://www.reddit.com/r/CollegeBasketball/comments/11pt5ng/drop_your_boldest_march_madness_predictions/jbzmupg/?utm_source=share&utm_medium=ios_app&utm_name=iossmf&context=3,crownebeach,2023-03-16 02:43:27
Giving them the 3 free throws on a shot that should’ve never been put up in the first place lmao wow,bonelegs442,2023-03-16 02:44:06
I feel like a mountain west team loses in the first four every year,asaber1003,2023-03-16 02:45:51
"NEVADA IS BACK, THEY'RE ONLY DOWN BY ^(20)",Muffinnnnnnn,2023-03-16 02:46:39
Are we really only 7 minutes into the second? Feels like a lot longer than that,Fearghas,2023-03-16 02:47:14
As a neutral fan Nevada is getting royaly fucked by these fouls,qu2qu2,2023-03-16 02:50:56
"We have lost 1 game where we have scored 69+ points

The critical nice boundary",[deleted],2023-03-16 02:51:51
"I’m here for any team that has a player that slaps the hardwood when they’re playing Alford 

You go Muhammad",listinglight778,2023-03-16 02:57:03
Fuck these new sonic commercials. Bring back the two guys in the car,CaptainScuttlebottom,2023-03-16 03:01:00
Off to Colorado we go,Hybridkg87,2023-03-16 03:08:18
"Iowa, New Mexico fans, get in here guys!",listinglight778,2023-03-16 03:18:04
"Proud of the boys, forks up 🔱",cr0asu,2023-03-16 03:19:31
"Well gg ASU, gl vs TCU",1nf1niteCS,2023-03-16 03:19:55
"&#x200B;

https://preview.redd.it/3ce5syi0v1oa1.png?width=972&format=png&auto=webp&s=34d515add8f73895afb33013c7a1fd6ba6498084",SaintArkweather,2023-03-16 02:01:36
"Shit like this is why I'm never picking a Mountain West team until they can prove they can win games in the tourney again.  After this game, they'll be 8-29 in the tourney in the last 12 years",chhhyeahtone,2023-03-16 02:09:04
"I'm not nervous, you're nervous. Go Pack!",1nf1niteCS,2023-03-16 00:12:55
Me searching for truTV on my provider every March,mruab,2023-03-16 01:04:07
Still crazy to think ASU hitting that half court shot against Arizona is what got them in the tournament,ddottay,2023-03-16 01:15:55
All refs should die change my mind,slitheringsidew,2023-03-16 01:20:06
Having watched Nevada's last game I've gotta say this game is going pretty much exactly how I would have expected.,JerseyDvl,2023-03-16 01:23:00
Are we heading for another nightmare tourney for the Mountain West? We'll know by Saturday morning.,mrwhitaker3,2023-03-16 01:23:02
"Mountain West always underperforms in the tournament. I don't why, but they just do.",PNW_Jeff,2023-03-16 01:23:45
FRICK TURBO TAX,Pesci_Avocado,2023-03-16 01:24:13
"Mmmmm yes, a 13 - 0 run to start the game off. Exactly what I was hoping for.",Steve____Stifler,2023-03-16 01:26:07
That Nevada player came so close to getting a T,StevvieV,2023-03-16 01:27:05
"Texas Southern and Arizona St playing in the First Four, a tradition unlike any other",KJones77,2023-03-16 01:27:24
Just throwing out there that Arizona State lost to Texas Southern,Muffinnnnnnn,2023-03-16 01:29:14
"Avery pronounces the day of the week as ""Mung-di""",elgenie,2023-03-16 01:31:38
Start 4/6 from 3 and trail by 13. Not ideal!,natethe247,2023-03-16 01:33:50
Normally would be feeling good with 5 3's in 8 minutes,1nf1niteCS,2023-03-16 01:34:29
Can Nevada do ANYTHING on offense other than chuck threes??,Jdenney71,2023-03-16 01:34:40
Crazy that two asu players played for Nevada last year lol.  Committee is big pimpin it,PercySnowsHandgun,2023-03-16 01:44:25
I love this team,theopression,2023-03-16 01:44:54
##**NEVADA HAS MADE A TWO POINT FIELD GOAL**,DontTakeOurCampbell,2023-03-16 01:45:37
Looks like Missouri is going to be the one beating Princeton on Saturday,[deleted],2023-03-16 01:46:42
"Yeah, this is why I hate drawing a play-in winner. ASU building a ton of momentum right now.",Joelsaurus,2023-03-16 01:48:32
This game got me putting Charleston over SDSU,cavahoos,2023-03-16 01:48:57
Asu in my final four. Why not?,fancycheesus,2023-03-16 01:51:45
Ok this is kinda getting funny now lol,theopression,2023-03-16 01:52:51
Reevaluating my Utah State Sweet 16 pick,530josh,2023-03-16 01:53:32
ASU looks amazing and a first four team always goes far which means Pitt will be in the sweet sixteen,lilgers,2023-03-16 01:54:32
Feel bad for the Nevada kids but not the Nevada coach.,CarrollPC,2023-03-16 01:56:02
https://preview.redd.it/zmogg2s8u1oa1.jpeg?width=622&format=pjpg&auto=webp&s=4bc331cc135400186816b6d97ed1459b33f51363,AFC-Wimbledon-Stan,2023-03-16 01:56:44
WHAT THE FUCK IS THIS!!! ASU TO THE SWEET SIXTEEN IDGAF,Goooldschmidt,2023-03-16 01:57:05
Number 11 on Nevada gotta walk home,Ahambone,2023-03-16 01:57:06
Lmao,Celery-Man,2023-03-16 01:57:22
"I feel bad for the Nevada fans and players, but man do I fucking love seeing Steve Alford get fucking walloped.",halldaylong,2023-03-16 01:57:38
This is genocide,SirCromwell,2023-03-16 01:58:06
Texas Southern beat Arizona State earlier this season.,elgenie,2023-03-16 01:58:15
"Alonzo Gaffney is a Westbrook/Ben Simmons-level meme among our fans.

This is UNREAL",530josh,2023-03-16 01:58:27
"They’re already dead.

*they’re already dead!*",Fearghas,2023-03-16 01:58:50
ASU is going to get to the sweet sixteen this year,SolarpunkJesus,2023-03-16 01:58:52
ASU is just throat punching Nevada over and over and over. This is like one of those UFC fights that should've been stopped 2 rounds ago.,[deleted],2023-03-16 01:58:55
EVERYONE GET IN HERE!!! LFGGGGGGGG!,TheBrettitor,2023-03-16 01:59:15
"Iowa, UCLA, and New Mexico St. fans are right now greatly enjoying how much this piss poor excuse of a head coach is getting embarrassed right now. I think I’m gonna go get a burrito to celebrate.",Anels0505,2023-03-16 02:00:06
I don't want to overreact but I'm blowing up my bracket.  ASU champions.,humblerodent,2023-03-16 02:00:27
If only there was a top 5 defense team that would be able to compete,huttts999,2023-03-16 02:00:35
Just a reminder that ASU IS 321ST IN 3-POINT PERCENTAGE. Averages 31.4%.,Duck_man_,2023-03-16 02:01:22
#GET INNOVATED ON,CVBrownie,2023-03-16 02:01:44
Steve Alford getting boat-raced on national TV: couldn’t happen to a more deserving guy.,TheDevolution27,2023-03-16 02:01:45
Do we really have to keep pretending the MWC is any good? I thought last year proved how fraudulent they are as a collective,JunyaisOffTheGrid,2023-03-16 02:02:19
I ain’t seen this kinda can of whup-ass since we lost to USC 2 years ago.,brkfstfd,2023-03-16 02:03:44
I hope more banks crash.,slitheringsidew,2023-03-16 02:04:28
"https://preview.redd.it/aozgwcmvv1oa1.jpeg?width=2052&format=pjpg&auto=webp&s=063c9a01c6e4c6370e9a7ec436b8cc648c201bef

Leslie Hurley respectfully",AFC-Wimbledon-Stan,2023-03-16 02:06:02
Bill Walton was talking 4D chess all along,ehs4290,2023-03-16 02:06:36
Not gonna lie. I might need to change my bracket after seeing this,[deleted],2023-03-16 02:06:46
"Steve Alford may be an odious human being, but at least he makes up for it by losing hilariously in the NCAA tournament",elgenie,2023-03-16 02:15:23
