Comment,Author,Created UTC
Go Vols!,Ryry77,2023-03-24 03:01:13
Foul???,[deleted],2023-03-24 03:02:44
"Called it in the UT sub, FAU is outmatched size and skill wise and they’d start flopping in this half.",RockyattheTop,2023-03-24 03:09:38
I am the world's biggest FAU fan rn,thewill450,2023-03-24 03:12:08
Plavsic is such a fake tough guy lmfao,SaltyPickle1495,2023-03-24 03:15:35
[deleted],[deleted],2023-03-24 03:19:14
[deleted],[deleted],2023-03-24 03:45:30
Refs fueling the fire. Go figure,offtime_trader,2023-03-24 03:13:03
"They're letting FAU do literally whatever they want. UT isn't doing themselves any favors, but this officiating is embarrassing.",AlaDouche,2023-03-24 03:15:32
refs selling,subcrazy12,2023-03-24 03:08:35
The refs have decided the narrative. This is goofy.,VolsPE,2023-03-24 03:12:09
i,NoPersonKnowsWhoIAm,2023-03-24 01:09:37
Holy hell,loyalsons4evertrue,2023-03-24 01:44:32
Fire every ref that called a foul in tennessees favor. They all are paid,ApplicationDifferent,2023-03-24 03:35:54
Honestly the missed three was more valuable due to the offensive rebound and being able to run off more clock.,BtownBrelooms,2023-03-24 03:36:52
This rebounding by FAU is insane!,noah3093,2023-03-24 03:36:52
I think we all know why Rick Barnes won’t be fired lol,[deleted],2023-03-24 03:37:56
Idk what vol player it was but dude looked completely lost on defense. Probably worst defender I've seen,05_legend,2023-03-24 03:38:43
Lol Vols complaining about the refs in here when they could've been called for 2x the fouls in this game. Glad it finally caught up to them after this whole year. Their style of play ain't it.,[deleted],2023-03-24 03:14:09
I don’t really care for Vescovi that much,keymargot,2023-03-24 01:44:05
"I know it's popular to hate FAU but Tennessee players are on the verge of playing dirty. Saw several shoves, a couple of them HARD ones, in the past few possessions. Fortunately it hasn't got them any points but the refs really need to start calling that shit.",shamwowslapchop,2023-03-24 03:13:50
"The Owls big is fucking bitch made, have some dignity man.",HiFriend88,2023-03-24 03:15:48
Refs threw this game,pmayankees,2023-03-24 03:34:16
This is such a fucking joke,ClassicCarPhenatic,2023-03-24 03:20:14
Refwalked to the elite 8,AlorsViola,2023-03-24 03:37:05
That interview was cringe. No excitement from May and Davis is well…I don’t even know what to say.,vvvvvwaves,2023-03-24 03:51:15
Tennessee fans complaining about another team flopping lol,mad_cart,2023-03-24 03:16:19
Lmfao at TN fans who can’t take their medicine and seriously think Vegas is rigging for an… FAU vs K-State matchup?,84brown4carr,2023-03-24 03:19:55
Alijah Martin… people would be pumped if you could nail those kind of dunks in game when it matters. Instead you tried to show boat the 16 seed after barely beating them. Ball don’t lie and both dunks have been all rim so far,Bronco4life21,2023-03-24 01:46:44
That was a weak one. C'mon.,HerpaderpObes,2023-03-24 02:49:38
Bruh I don't even watch enough basketball to know a foul but even I know some of these calls are shit,vnut08,2023-03-24 03:09:32
Vegas took a beating with the K St ML so they’ve decided FAU must win here. Refs have begun to influence this game,GeauxSaints90,2023-03-24 03:13:46
Uh oh. How will Tennessee's wrestling team respond,CtlEngr,2023-03-24 03:13:53
Wow that's a horrific call but I am rooting for FAU so yay,BreadKiller0688,2023-03-24 03:16:59
Tennessee try not to foul on every possession challenge (impossible),Lord_of_Oof,2023-03-24 03:17:07
"I’ve been to seiverville tenn and I’m from Chicago. They hated me, but Tennessee getting royally fucked this game",rotallytad,2023-03-24 03:20:30
Can we stop complaining for once and just enjoy the game,IndividualCamera8034,2023-03-24 03:21:41
[deleted],[deleted],2023-03-24 03:29:28
Do we still hate FAU?,[deleted],2023-03-24 01:43:24
TENNESSEE BETTER,[deleted],2023-03-24 01:52:07
Abolish charges,DonaldDust,2023-03-24 02:06:00
"""too small"" gesture... Weight room? Lmao",Immediate-Recipe-642,2023-03-24 03:01:25
FAU's offense is deadly when they are clicking,thewill450,2023-03-24 03:08:57
refs with a phantom offensive foul,inshamblesx,2023-03-24 03:09:21
Amazing what happens when TN isn't allowed to just maul the other team anymore,JamJiggy,2023-03-24 03:09:52
Lol all these cameras you can’t get away with anything 😭😭😭,[deleted],2023-03-24 03:16:15
Weak but that kid been throwing bows all tournament,a_Tyde_Ad,2023-03-24 03:17:22
Dusty May should be national coach of the year,PhoneAcc23,2023-03-24 03:18:13
Ain’t nobody getting a booster,_Reporting,2023-03-24 03:20:07
Lol remember when Tennessee fans kept saying they weren't a dirty team all week? 😂🤣,wladue613,2023-03-24 03:23:30
Call 1 flop on that man,PFGcallaway,2023-03-24 03:33:07
"Tennesse's shooting this 2nd half lmao.

See ya later Vols fans.",spierce64006,2023-03-24 03:42:10
Refs have FAU ML I’ve seen enough,Sad-Outside2229,2023-03-24 03:14:14
"refs sold

was an okay season wish it was friday so i could drink",TheVolmannBrothers,2023-03-24 03:12:53
"Please win Tennessee, the last two times K-State went to the Elite 8 we lost to really good mid-majors",leverich1991,2023-03-24 01:12:30
Go Vols,[deleted],2023-03-24 01:41:36
Go Owls!!,loyalsons4evertrue,2023-03-24 01:42:17
I feel blessed we dont have a team like Tenn. in our quadrant. Nightmare matchup,acat20,2023-03-24 01:43:19
Allie LaForce is bad,Ghost-of-Moravia,2023-03-24 01:48:06
FDU would have turned this into a road game for Tennessee,EnwardGamerz,2023-03-24 01:57:13
Tennesse being way to aggressive in the opening 10 minutes. Already 5 team fouls.,spierce64006,2023-03-24 01:57:21
UROSSSS,zorofan8878,2023-03-24 02:03:07
God I hope that counts lol,zorofan8878,2023-03-24 02:24:52
🎶You'll always be🎶,MakesYourMise,2023-03-24 02:25:45
LMFAO that was not even close to being tipped in time by Plavsic despite his ridiculous reaction.,spierce64006,2023-03-24 02:26:06
Vescovi needs to go full Ginobli mode this half,[deleted],2023-03-24 02:47:40
Oh my god bro,zorofan8878,2023-03-24 02:56:05
Greenlee for 3! Owls starting to knock down shots.,spierce64006,2023-03-24 02:56:26
FORREST!!,run_nyg,2023-03-24 03:06:16
Lololilol,PFGcallaway,2023-03-24 03:08:01
Tennesse is missing Ziegler,[deleted],2023-03-24 03:09:00
Guess we got a new set of officials at halftime. Jeez.,TotesMcGotes13,2023-03-24 03:09:16
Fucking March.,the_cajun88,2023-03-24 03:10:02
Way to completely forget how to play defense after contesting everything in the first half...,GoRangers5,2023-03-24 03:11:52
Does 33 for Tennessee do ANYTHING but run into people?,ddottay,2023-03-24 03:12:02
Holy shit what a comeback,RangersFan243,2023-03-24 03:12:04
FAU is hitting shots and Goldin is still falling. Somebody get this man a right foot or take a couple inches off one of his legs,dickismalls,2023-03-24 03:13:31
FAUUUUU,[deleted],2023-03-24 03:14:27
Certified Vol moment,Shootit_Rockets,2023-03-24 03:14:38
Is this worth reviewing?,[deleted],2023-03-24 03:15:32
Cathartic. After watching Tennessee wrestle their way through the SEC,CtlEngr,2023-03-24 03:16:39
Ball don't lie,lijijil,2023-03-24 03:16:46
Plavsic has been consistently dirty in games I’ve watched but that wasn’t anything lol,[deleted],2023-03-24 03:17:32
33 gave him a big hit a few plays earlier. But that one was nothing.,BIgCon,2023-03-24 03:17:39
Tennesse can't score for shit,[deleted],2023-03-24 03:18:23
Rocky Top you’ll always be 1 defensive rebound away from meeeee,[deleted],2023-03-24 03:22:07
More like Down Tennessee amirite,llamawhittlings,2023-03-24 03:22:10
just think how badly Merrimack would blow out Tennessee..,indreams159,2023-03-24 03:29:34
Dusty May will be coming to an NBA sideline very soon. His actions are excellent.,EfficientPlane,2023-03-24 03:29:37
Never in my life have I seen so many commercials in one game,El_Mike,2023-03-24 03:31:31
FAU >>>>. GO OWLS!,Virtual-Suspect1733,2023-03-24 03:34:25
it’s… it’s happening :),XAfricaSaltX,2023-03-24 03:34:58
I love march,framingXjake,2023-03-24 03:35:03
Refs are doing too much rn,FutureRaifort,2023-03-24 03:36:02
This is the same team that beat Memphis bc Memphis got hosed that's wild,Kardinale,2023-03-24 03:37:44
Hoot hoot mothafuckas 🦉,the615Butcher,2023-03-24 03:38:01
Reddit in shambles.,Teh_cliff,2023-03-24 03:38:17
This would be a gutting collapse,crimsonblueku,2023-03-24 03:40:27
Congrats FAU!  Fantastic game!,stoolsample2,2023-03-24 03:41:20
Vandy woulda had that.,CreampieChef69,2023-03-24 03:43:35
[deleted],[deleted],2023-03-24 03:45:35
LMAO traveling is just not a thing apparently,chrt,2023-03-24 01:50:04
[deleted],[deleted],2023-03-24 01:56:38
Fuck these refs.,zorofan8878,2023-03-24 03:08:01
TN is about to be punished by the refs for playing physical,adumb99,2023-03-24 01:45:32
c’mon let’s go on a quick run,Playbook420,2023-03-24 02:51:24
Another missed dunk by 15 what a dumbass,MightyEighth,2023-03-24 01:44:58
Ironic that UT fans complaining about refs 💀,a_Tyde_Ad,2023-03-24 03:13:47
Refs <3 Tenn,the_greasy_one,2023-03-24 02:05:32
"Damn it, tennessee, I wanted yall to win after that failed dunk shit that FAU did",Mcstabler,2023-03-24 03:46:35
Martin is a joke,thomashutchins,2023-03-24 01:47:04
Uros legacy game lol,Sirrenderthe69th,2023-03-24 02:03:23
Tennessee is so shit,Keeping_Secrets,2023-03-24 03:06:55
Classic Rick Barnes,mdrico21,2023-03-24 03:13:42
[deleted],[deleted],2023-03-24 03:13:59
Bought time they called that flopping mfer,grey_pilgrim_,2023-03-24 03:34:08
"Dont worry tennesse is the only team thart can travel


Refs give tau their 3rd win

Imagine if every team didnt have to dribble.

Sounds like a different game?",ApplicationDifferent,2023-03-24 03:40:33
FAU shouldn't even be in this game,Mike_Honcho_3,2023-03-24 03:12:49
Did the ref just stop play because a defender lost his shoe? Get out of here.,ddottay,2023-03-24 03:25:16
James harden academy of selling that shit. Fuck this game.,HiFriend88,2023-03-24 03:25:45
Why do I feel like FAU should have a lot more travels called against them than there have been,PersianVol,2023-03-24 03:29:33
Not a foul. Davis jumped into him.,BearForceDos,2023-03-24 03:34:18
Refs were on twitter apparently. Saw the complaints from duke and now they’re gonna blow it completely out of proportion,[deleted],2023-03-24 01:43:58
Awwww. Tennessee hates a taste of their own medicine. So sad.,[deleted],2023-03-24 03:16:52
Joe Milton for heisman and Tennessee for the CFP title next season.,[deleted],2023-03-24 01:42:03
Tennessee will demolish FAU go Vols,[deleted],2023-03-24 01:42:16
wtf is going on,DangerIsMyUsername,2023-03-24 01:43:51
[deleted],[deleted],2023-03-24 01:45:13
"So conflicted. As someone in the SEC, I don't want another SEC team to succeed. But FAU are the disney villains who killed FDU in cold blood.",BurnPhoenix,2023-03-24 01:51:17
Finally called an FAU travel,akulkarnii,2023-03-24 02:02:08
Alijah Martin from downtown to make it a 7 point lead for the Owls. Timeout Rick Barnes.,spierce64006,2023-03-24 03:12:54
"What's the opposite of tenacity?

Tennesseety",TheStandardSuspects,2023-03-24 03:17:46
"Tennessee in the post-season and shit officiating 

name a more iconic duo",[deleted],2023-03-24 03:20:11
every fau screen is moving,Gavangus,2023-03-24 03:24:27
Feels like 98 (missed free throws),llamawhittlings,2023-03-24 03:27:43
"FAU is gonna do it, wow. Doesn’t matter to me, I had Memphis going to the next round LOL",AeroStatikk,2023-03-24 03:28:51
"Tennessee needs to watch Houston’s defense, that’s how you play physically. Tennessee takes it too far and it hurts them more than it helps them sometimes",theiwc0303,2023-03-24 03:33:09
"I was rooting for FAU both as the underdog (despite having 33 wins to Tennessee’s 25) and for my bracket.

But I feel very bad that they only lost by 7 with a couple of huge momentum crushers by the refs. I feel depressed on their behalf for that. But congrats, FAU!",[deleted],2023-03-24 03:44:11
"Rick Barnes, CTE merchant",hejendo76,2023-03-24 03:45:17
Don’t see these punks doing any chirping like they did against that #16 seed. Ya luv to see it tbh,[deleted],2023-03-24 01:51:09
Offensive foul on Plavsic finally!,spierce64006,2023-03-24 02:50:09
TENNESSEE WINNING THE CFP NEXT YEAR,[deleted],2023-03-24 01:51:59
Aidoo being too aggressive and finally the referees are starting to call these obvious fouls.,spierce64006,2023-03-24 03:10:00
FAU has the refs but they're also completely outplaying Tenn..,PaddlingDuck,2023-03-24 03:22:58
"Refs biased, foul called against fau",ApplicationDifferent,2023-03-24 03:27:23
[removed],[deleted],2023-03-24 01:54:37
It appears Tennessee's weakness is... fair officiating?,CtlEngr,2023-03-24 03:09:23
Plavsic is a dirty player. I don’t care. Downvote me.,Mpm_277,2023-03-24 03:16:39
Tennessee fans acting like they didn’t profit off highly questionable reffing to get here. Funny.,mvpharo,2023-03-24 03:20:18
FAU reaching and grabbing but no calls.,grey_pilgrim_,2023-03-24 03:26:02
Tennessee always gets fucking refs that let them bang on dudes down low when they’re on defense but then with get all the ticky tack touch fouls on offense. I don’t fucking get it,corndognugget,2023-03-24 02:16:17
[deleted],[deleted],2023-03-24 02:49:30
Imagine if Memphis won,RangersFan243,2023-03-24 03:11:47
HOOTY HOOT MOTHERFUCKERS,thewill450,2023-03-24 03:13:33
"I hope FAU dunks again at the end of this game 
, regardless of the score.",Teh_cliff,2023-03-24 03:17:03
Ah so the refs can call fouls on Tennessee!,unearthlysquire,2023-03-24 01:43:51
"Personally, after the failed dunk at the end of the FDU game, FAU has felt like a villain, not an underdog.",CFB_Mods_Eat_Poop,2023-03-24 03:26:55
[deleted],[deleted],2023-03-24 01:09:01
#FUCK KENTUCKY,DangerIsMyUsername,2023-03-24 01:41:03
Feed my boy Plavy,yousmelllikebiscuits,2023-03-24 02:00:58
"And 1, boys.

BEAT AND BANG",yousmelllikebiscuits,2023-03-24 02:03:08
Tennessee can’t buy a bucket right now,akulkarnii,2023-03-24 02:04:00
What is an ETF?,Immediate-Recipe-642,2023-03-24 02:04:22
How is FAU keeping this close?,[deleted],2023-03-24 02:43:54
Knew that was coming.....,yousmelllikebiscuits,2023-03-24 02:50:20
SANTI!,yousmelllikebiscuits,2023-03-24 02:51:43
"Uros with the ""too small""

killin me",yousmelllikebiscuits,2023-03-24 02:59:14
GIMME THAT SHIT,run_nyg,2023-03-24 03:10:13
Oh sheeeet,ChonkyWumpus,2023-03-24 03:11:54
Who was that former Tennessee player behind the bench scratching his chin?,DoobieRudy23,2023-03-24 03:12:07
"Best shade of red vs terrible shade of Orange. 


Correct result.",[deleted],2023-03-24 03:12:23
Let’s goooooo,OttoRocket94,2023-03-24 03:13:31
Shut up gene,Cool_cid_club,2023-03-24 03:16:56
Alijah Martin will not be denied his classless last second dunk,tacoguy1234,2023-03-24 03:19:33
It was 8-2 foulsise?  Come on,fragger404,2023-03-24 03:22:45
Johnell Davis drawing the foul there and getting to the line.,spierce64006,2023-03-24 03:26:32
Ball don’t lie,purplehayze37,2023-03-24 03:27:28
How do you beat Duke but are losing to #9 FAU?????,nikefreak23,2023-03-24 03:32:38
This game is over.......,nikefreak23,2023-03-24 03:33:18
I feel like Vescovi and Uros are 31 years old,AFC-Wimbledon-Stan,2023-03-24 03:34:19
Owl yeah!,mad_cart,2023-03-24 03:34:39
Stupid foul fau,snuffleupagus86,2023-03-24 03:35:33
"Great game to both teams, congrats to the owls!",purplehayze37,2023-03-24 03:36:49
ELITE OWLS,llamawhittlings,2023-03-24 03:36:53
"I’m not hating. Or talking trash. Tennessee is a good team. But does anyone else think they’ve had a pretty damn easy tournament this year? I know Duke can be difficult but their matchups have been pretty easy in my opinion. 

I’m not taking anything away from them. They are good. Just wanting a civil discussion. I could be wrong.",[deleted],2023-03-24 02:07:31
Not shocked these losers from Tennessee offense went cold and they lose.,42dylan,2023-03-24 03:25:32
God Plavsic is a goon,84brown4carr,2023-03-24 03:17:29
Another travel not called,offtime_trader,2023-03-24 03:21:49
[deleted],[deleted],2023-03-24 02:17:53
Can we bring back K State and M State? Can both of those teams just advance?,MysteriousFact5363,2023-03-24 02:14:03
Didn't know that Plavsic or Tennessee could be called for fouls. They could seemingly deck whoever they wanted last week.,Life_Act_6887,2023-03-24 02:51:18
"This fau team isnt good idc what anyone says. Idk how to explain it combination of luck, refs, and other team throwing. Regardless whoever wins this is getting smacked by k state",Ok_Nefariousness5479,2023-03-24 03:10:26
Finally lmao. Been doing that all game,[deleted],2023-03-24 02:02:13
Fantastic defending by Godin. FAU Ball.,spierce64006,2023-03-24 03:11:21
Listening without sound and am so confused how that was a flag,Porter2455,2023-03-24 03:19:07
Everyone just jealous they don't live in Florida tbh,gohuskies15,2023-03-24 03:20:26
Soft call,Galaxies59,2023-03-24 03:23:53
"Whoever plays them next, get ready to deal with travels.  Theyve won their 3rd game due to refs letting them sprint with the ball in their hand.  We would have been playing fdu if refs knew what a travel was.

Edit: haha, i challenge you dumbasses to watch any of thier games after watching some videos on what a travel is.  We would have been playing fdu if refs read the rules


Edit2: See dumbasses who didnt make r32 below, see dumbasses who have yet to read traveling rule below(its ez btw).",ApplicationDifferent,2023-03-24 03:43:54
Oh so now we can just scour game tape and find fouls to call later?,evanset6,2023-03-24 03:21:57
Worst elite 8 team in the history of March madness,Ok_Nefariousness5479,2023-03-24 03:37:33
Let’s go Vols! All my homies hate trashy ass FAU,Life_Act_6887,2023-03-24 01:40:59
Those orange and white striped clown pants. Were solid orange pants with solid white tops (or vice versa) not available?,lafcrna,2023-03-24 01:51:18
[deleted],[deleted],2023-03-24 01:05:44
[deleted],[deleted],2023-03-24 03:22:12
The talent on these two teams compared to the previous two games...the difference is palpable,ididntwin,2023-03-24 01:49:26
[deleted],[deleted],2023-03-24 03:16:28
Hate both of these teams so much,Lamar_ScrOdom_,2023-03-24 03:42:57
Congrats to all you whiny bitches about TN playing dirty. That’s not the case at all. Now we have refs dictating the outcome of games again. It’s an issue in the NFL but not NCAA basketball when you simply don’t like a team?,Mowers_01,2023-03-24 03:33:12
I can’t believe Tennessee gave this game away,[deleted],2023-03-24 03:28:19
GB🍊,sickmemes48,2023-03-24 00:31:48
So who we all rooting for?,Amayetli,2023-03-24 00:34:18
Looks like I get a chance to watch the start of the Minnesota v Canisius college hockey tournament game with this starting at leas 15-20 minutes later.,spierce64006,2023-03-24 00:47:22
Tennessee ruined my Labor Day weekend in 2017,[deleted],2023-03-24 01:37:58
Is that FAU or Ole Miss in disguise?,Longvols,2023-03-24 01:38:47
That’s a lot of guards,zorofan8878,2023-03-24 01:38:52
Can’t wait to see Tennessee’s girth on display,rad1ram,2023-03-24 01:38:53
Let's go Vols!,JJ2461,2023-03-24 01:39:25
I know nothing about either team. Who do we match up well against for the elite 8?,circa285,2023-03-24 01:40:15
LFG VOLS !!!,[deleted],2023-03-24 01:40:22
Is the game delayed,rodpod17,2023-03-24 01:40:28
Why are there so many empty seats?,PhoneAcc23,2023-03-24 01:40:55
Yes sir!  Strong d to offence,Ok-Till-8905,2023-03-24 01:40:57
"Love that Johnell Davis is from the beautiful city of Gary, Indiana",Ryry24lol,2023-03-24 01:41:10
"So I’ve picked Tennessee to make it to the E8 my last 3 brackets 

I’ve finally decided to dump Rick Barnes, if this is the year he does it I’m flipping a table",[deleted],2023-03-24 01:42:50
Weak response from a head coach,[deleted],2023-03-24 01:48:01
How many of these dudes are coming back for UT next year?,[deleted],2023-03-24 01:50:35
Both teams missing lots of wide open shots,RocketsGuy,2023-03-24 01:50:57
Good stuff K3Y!!,zorofan8878,2023-03-24 01:51:44
Any free link?? It's not on TV on my country,Swish46,2023-03-24 01:52:04
Why did 2 not foul him on the fast break?,coolycooly,2023-03-24 01:55:03
That CollegeHumor Nic Cage agent sketch from back in the day was spot on,Ghost-of-Moravia,2023-03-24 01:57:23
"That’s a weird looking Buick, like a Cherokee/Kona love child",_RocketGrunt_,2023-03-24 01:57:36
I’m gonna need FAU to shake things up in this tournament. Tomorrow has chalk written all over it,dickismalls,2023-03-24 02:00:04
Rick Barnes unhappy about his team winning - gotta love it.,yousmelllikebiscuits,2023-03-24 02:00:13
We’re getting dominated on the boards,[deleted],2023-03-24 02:00:19
I hate this UT lineup. Why?,Hooper1054,2023-03-24 02:00:36
"Cake walk for TN, of course. I have to wait for UCLA game.",[deleted],2023-03-24 02:00:49
Wonder what the difference in viewrship numbers is gonna be between this game and the Gonzaga - UCLA game,Ghost-of-Moravia,2023-03-24 02:01:20
Gonna need Vescovi to play all minutes. We look lost without him.,TotesMcGotes13,2023-03-24 02:01:54
The patented scoring drought,offtime_trader,2023-03-24 02:02:13
What is an ETF?,Immediate-Recipe-642,2023-03-24 02:02:48
"Plavsic is the only UT player who can hit a layup
Tonight",Hooper1054,2023-03-24 02:03:21
BigDaws gettin jiggy with it,Robinsoncrusoe69,2023-03-24 02:04:12
Bob Knight's Basketball coaching crew media equivalent of Hayden Fry's Football coaching crew.,HypedRobot772,2023-03-24 02:09:29
Gators should have kept Dusty May.,GuyFaulks77,2023-03-24 02:09:59
#AND ONE,Ok-Till-8905,2023-03-24 02:10:39
Box out pls,belmontbreak,2023-03-24 02:12:04
Can we draw up some plays or we just chucking bricks all day?,28Vikings,2023-03-24 02:19:55
Bigdaws has the clamps too,Robinsoncrusoe69,2023-03-24 02:20:03
We might make it to the half with neither team in bonus,Ok-Till-8905,2023-03-24 02:24:04
fuckkkk it’s not,[deleted],2023-03-24 02:25:10
Why does Rick Barnes have so many foreign players?,fancycheesus,2023-03-24 02:25:59
I had the shitty flute version of the Mission Impossible theme song playing in my head for the last 2:44 of the half,AnchorsAweigh89,2023-03-24 02:35:08
Does FAU turn it around or does Tennessee keep them at bay?,chrobbin,2023-03-24 02:45:59
FAU are 10-1 in games decided by 5 points or less.,spierce64006,2023-03-24 02:47:10
Lots of fun passes but you need more than that,natigin,2023-03-24 02:48:46
 Barge,toaster_inthe_lake,2023-03-24 02:48:49
Alr I’m back,[deleted],2023-03-24 02:51:10
Who is the injured player for Tennessee they kept showing earlier?,Great_Smells,2023-03-24 02:52:20
Wasn't expecting this game to be the close one,Kardinale,2023-03-24 02:52:24
Bill Burr knows what's up about cruises,Equal-Razzmatazz1806,2023-03-24 02:56:06
Doug Dimmabuckets,Equal-Razzmatazz1806,2023-03-24 02:56:21
Maybe they should make behind both benches the late teams fans,colin_forreal,2023-03-24 02:57:19
Just got BIGGED,yousmelllikebiscuits,2023-03-24 02:58:38
Meeces?,Bchillman1,2023-03-24 02:58:44
Key bro what are you doing ?,Sirrenderthe69th,2023-03-24 03:05:36
"love key and all, but he has nothing right now my goodness",[deleted],2023-03-24 03:06:03
Bro…what does key bring to this team lol,DoctorHolliday,2023-03-24 03:06:11
"Even if we lose, it's a win by out rebounding and defending a much bigger Tennessee.",Knightmare25,2023-03-24 03:06:36
MR. FAU,FriedFishFan,2023-03-24 03:06:41
FAU is playing Tennessee’s game rn and it’s working,AFC-Wimbledon-Stan,2023-03-24 03:07:02
"I really thought Tennessee was going to run away with this. Feels like this is going to be a really good finish, now.",Tigercat01,2023-03-24 03:07:04
Unfortunately we just have no consistent shooter,sickmemes48,2023-03-24 03:07:07
Golden cannot stay on his feet lol,Cool_cid_club,2023-03-24 03:07:08
We are really about to lose because we can’t hit a fucking shot,zorofan8878,2023-03-24 03:07:16
Dudes passing on wide open looks is never good lol,DoctorHolliday,2023-03-24 03:07:18
Gowls!,dontbelievejustwatch,2023-03-24 03:07:26
"Mommmmm, I don’t feel so good.",murder-farts,2023-03-24 03:07:28
Key is literally there for every negative play. Fouling late rotations and garbage shot selection,Icy_Increase3376,2023-03-24 03:07:33
[deleted],[deleted],2023-03-24 03:07:34
Oh my!,smgregory,2023-03-24 03:07:35
FAU 👀👀👀👀,inevitablescape,2023-03-24 03:07:42
Rick Barnes would never,DrZoidbergJesus,2023-03-24 03:08:09
Forrest through the trees!,thisisfunnyright,2023-03-24 03:09:00
I SMELL BLOOD BOYS! BLOOD IN THE WATER!,[deleted],2023-03-24 03:09:03
"Damn that Forrest kid is on fire, mad respect",framingXjake,2023-03-24 03:09:06
"Shoot, Forrest, shoot!",CurbedDogma,2023-03-24 03:09:07
Putting FAU in the bonus this early…,skyman501,2023-03-24 03:09:24
Go Owls!!,loyalsons4evertrue,2023-03-24 03:09:32
"Tennessee is like Auburn but good this season, both experts at throwing leads",Kardinale,2023-03-24 03:09:54
This crowd is lit,IAmNotStephen,2023-03-24 03:10:43
It's kind of weird that they named the Atlantic Ocean after the Capitol of Georgia.,TheStandardSuspects,2023-03-24 03:10:46
THATS MY BRACKET WINNER!! HOO DAT,Pseudoneum,2023-03-24 03:10:50
UH OH,Chance_Adeptness_832,2023-03-24 03:11:46
Woohoo!,MysteriousFact5363,2023-03-24 03:11:46
Golden looked like shit against fdu but damn he’s filling the role nicely now,milk-drinker-69,2023-03-24 03:11:48
Wowie,smgregory,2023-03-24 03:11:59
El oh el,MamawRex,2023-03-24 03:12:03
"What a run, with the refs lol",sarcasmrules18,2023-03-24 03:12:06
Wowzers,Redline-7k,2023-03-24 03:12:09
Fucking Ice!!!,Ill_Ad_5308,2023-03-24 03:12:18
Are not gonna take a TO lmao,BurmecianSoldierDan,2023-03-24 03:12:30
FFAU!,mad_cart,2023-03-24 03:13:01
Oh yay!,mad_cart,2023-03-24 03:14:07
Florida best state,gohuskies15,2023-03-24 03:16:40
WHAT,fluffyglof,2023-03-24 03:16:55
