Comment,Author,Created UTC
Well they're both in Orlando so good enough for the CBS research department  I guess lol.,spierce64006,2023-03-16 17:20:48
Dunn was ready to banish that ball to the shadow realm if Whitt tried to lay it in.,feed_me_muffins,2023-03-16 17:20:01
"Right?

That shit was terrifying",PuckNorthern,2023-03-16 17:19:36
tHe SoUndTRaCk oF cHiPoTLe?,deanopeez,2023-03-16 17:22:41
Not in years.,mrwhitaker3,2023-03-16 17:24:36
I figured if you got a perfect bracket the money would find you,ImmoralModerator,2023-03-16 17:25:21
"He's 1-5 in the field, so its not just from the line",AnEmptyKarst,2023-03-16 17:30:02
Virginia's play style make's games close. Cardiac Cavs.,mountainoyster,2023-03-16 17:30:08
He's fine. Just got some quick fouls.,the-real-macs,2023-03-16 17:31:56
"Has two fouls- once you hit 2 in the first half, Tony sits you until halftime",Shenanigangster,2023-03-16 17:34:08
"Foul trouble, invisible even when he’s been in the game",smellslikebadussy,2023-03-16 17:40:41
"If we get hot in the second half, we win by double digits",tomtomtumnus,2023-03-16 17:31:07
"They also hit a few really tough, contested shots, so it kinda balances",ppm4fy,2023-03-16 17:33:26
Oh my god an NYU flair. Go violets!,20mcfadenr,2023-03-16 17:30:31
You haven’t watched us this season then. We have at least one scoring drought of our own every game and let teams back into it all the time.,Duck_man_,2023-03-16 17:32:34
First time.meme,AnAngryBartender,2023-03-16 17:35:05
"yeah i said this earlier in the thread, but winning any games in the tourney is just gravy. I'm just happy being here and want our dudes to enjoy the moment. If we win I'm gonna go nuts though",Dervoo,2023-03-16 17:32:21
40% from 3 point is the secret sauce,tomtomtumnus,2023-03-16 17:32:27
UVA bumbled away at least 10 points around the basket.,weigojmi,2023-03-16 17:39:17
I think they got Thanos'd,the-real-macs,2023-03-16 17:46:30
For some reason ESPN just deletes them after one year. Wanted to look back at brackets I did in prior years and there's zero way to check them past 2022.,bicyclebread,2023-03-16 17:49:14
Alabama didn't make the CFP in 2019.,feed_me_muffins,2023-03-16 17:46:24
The brick heard round the world,djfunknukl,2023-03-16 17:55:40
Is the fast break channel good?,[deleted],2023-03-16 18:00:29
He looks awful today,PorterSchrader,2023-03-16 18:04:49
That’s like our thing,tomtomtumnus,2023-03-16 18:14:51
Gardner should be the guy here,ipartytoomuch,2023-03-16 18:18:38
They're well-coached. Have definitely improved during the season.,VAGentleman05,2023-03-16 18:19:31
This is not going according to plan.,Seastep,2023-03-16 18:26:23
He did that in the conference final too,tomtomtumnus,2023-03-16 18:27:30
Add it to the list,BlueLondon1905,2023-03-16 18:29:39
first time?,flyinhyphy,2023-03-16 18:30:08
Never depend on UVA.,VAGentleman05,2023-03-16 18:30:50
Team apparently has never practiced offense against a zone,bigbadape,2023-03-16 18:31:35
Shut up we root for chaos here,canadianbroncos,2023-03-16 18:34:24
Oddly enough I think Shedrick is one of our best free throw shooters,MarcusAurelius121,2023-03-16 18:35:49
"He famously called Scott Brooks an idiot. 

Dude is unhinged.",Common-Community-550,2023-03-16 18:38:50
Big game from the young man,djfunknukl,2023-03-16 18:42:25
Dude is an elite FT shooter at least,bigbadape,2023-03-16 18:43:58
Leading scorer having fouled out probably played a role there,VinceValenceFL,2023-03-16 18:45:09
Have you considered taking a quick two instead?,Bumst3r,2023-03-16 18:47:38
They would’ve been ok if they fouled faster instead of letting it run to 4 seconds,[deleted],2023-03-16 18:47:47
I have no idea why they stopped at the Zone it was killing us,obxtalldude,2023-03-16 18:48:40
Damn bro why are you so butthurt,maxtcwahoo,2023-03-16 18:49:20
"Thanks, I hate it",AnAngryBartender,2023-03-16 18:48:54
I assume he was running out of time in his own backcourt,ImmoralModerator,2023-03-16 18:50:14
Caleb hasn’t done something like that before tho 😬,Licit_x64,2023-03-16 18:50:13
"Me too, but I have both teams losing in the next round, so meh",booger_dick,2023-03-16 18:50:40
The Natty softens the blow….we don’t even have that.,Pnflkc3,2023-03-16 18:51:34
That game took so long dear lord,spartans2299,2023-03-16 18:51:44
I'm 2 for 2 :),hfhrhjdjhhhjhguy,2023-03-16 18:55:44
Onions… those things are grapefruits,bengalboiler,2023-03-16 18:54:35
"It wasn't the loss to the 16 seed?

Maybe this means they win it all next year.",EpOxY81,2023-03-16 18:53:06
I was in the middle of saying “what are they doing” and then that pass happened,That_One_Pancake,2023-03-16 18:52:14
He has the best and worse pass in tournament history,burnt_pubes,2023-03-16 18:52:49
FUR PEOPLE UNITE,[deleted],2023-03-16 18:52:34
Honestly it was a good trade,homie_mcgnomie,2023-03-16 18:56:17
[deleted],[deleted],2023-03-16 18:01:28
"virginia just won a natty, you're not gonna be finding a lot of sympathy",CastleRock_,2023-03-16 18:02:13
It’s all the dorks that bet on the game.  They want their $$.,AnAngryBartender,2023-03-16 18:01:34
"People want to see upsets, you just won a title a few years ago, and you're boring to watch.  Not exactly rocket science.",Franky_FourFingers,2023-03-16 18:04:47
I mean he got hit in the face hard enough to cause a bloody nose....,feed_me_muffins,2023-03-16 18:34:51
"Elbow to the nose, it’s bleeding. Hard to see on replay I guess.",sleepy_heartburn,2023-03-16 18:35:25
Cuz he missed the ball completely and smacked him in the nose. Idk if it was a flagrant but there’s an argument for it,Wilper971,2023-03-16 18:35:15
Cause you cannot elbow someone in the nose while not even going for the ball.,AdEfficient442,2023-03-16 18:35:17
Of course. Always will be because of UMBC,Mattya929,2023-03-16 16:49:52
"Yeah, that take on Shedrick was just bizarre.",VAGentleman05,2023-03-16 18:01:17
why? call the timeout and its all avoided it was the dumbest thing he could of done and he did it,Beatdooown,2023-03-16 18:55:54
I feel for the rest of the team. Kihei lost them the game,UnCSeth12,2023-03-16 18:58:00
That was definitely a foul lol. And tbh it was kind of reckless too. He had stopped going for the ball and started moving into the Furman player to block his path to the ball.,_hell_is_empty_,2023-03-16 17:59:48
I was wondering that. He was chasing the ball and was basically ahead of the Furman player.,ppm4fy,2023-03-16 18:01:14
Dude was all over his back too. Wtf,sleepy_heartburn,2023-03-16 18:01:30
"To be fair, Kihei was awful in the ACC championship game",Bumst3r,2023-03-16 17:32:54
Named after a mediocre Hawai’i town. I get the hate.,FostetlerLFC,2023-03-16 17:32:30
Chaos? More like the crowd LOL,Zorua3,2023-03-16 17:12:06
"Right here.  I'll always appreciate what he's done for the program, but I'm ready for Reece to be the main man.",Wahooz,2023-03-16 18:01:19
Here 🙋‍♂️,bigbadape,2023-03-16 18:00:46
Silent.,cavahoos,2023-03-16 18:01:05
That one wasn't,morelibertarianvotes,2023-03-16 18:23:25
The Furman zone has given Virginia problems in the last few minutes.,spierce64006,2023-03-16 18:25:24
Worse experience in that game than UMBC,ipartytoomuch,2023-03-16 18:26:31
fuck me,cameronxzz,2023-03-16 18:27:02
"You can catch the arm, but you can’t smack him square across the face. Intentionally or not, it’s F1",UncleMalcolm,2023-03-16 18:33:42
not like it won a national championship or anything,SpiceNoodles,2023-03-16 18:34:10
We won a natty with slow paced games.,Bumst3r,2023-03-16 18:34:45
Cardiac Cavs,OOrochi,2023-03-16 18:46:31
I didn’t,AnAngryBartender,2023-03-16 18:53:44
"Kihei: ""You thought wrong!!"" YEEEEEET!",Burnout189,2023-03-16 18:54:10
#BROGDON,RoboticPanda77,2023-03-16 18:38:17
"Honestly I think this is probably the best draw out of any of the 13 seeds for UVA. They're the worst defensive 13 and their offense isn't hyper efficient at shooting over a packed in defense.

Though Iona may have been a better draw solely because Tony Bennett absolutely owns Rick Pitino.",feed_me_muffins,2023-03-16 16:16:05
I made sure to prepare last night.,finalfourcuse,2023-03-16 16:43:17
the app sucks. I lag out when I try to do multigame,fancycheesus,2023-03-16 16:44:39
Assume it was in the restricted zone as that was a charge.,weigojmi,2023-03-16 16:49:21
It’s okay. I picked against Kentucky,Bumst3r,2023-03-16 16:49:32
Bro we need you to get gas prices down not watch basketball,[deleted],2023-03-16 16:57:53
"Well when you have people ranging from 5’7 to 7 foot on the floor, pass heights can probably get confusing",cavahoos,2023-03-16 17:01:28
"And the 1 was a wide open look off a broken play. 

Contesting the 3 matters",Shenanigangster,2023-03-16 17:02:03
"Yeah, Virginia isn't really a 3pt team, right?",mlk960,2023-03-16 17:07:17
Happiness,cavahoos,2023-03-16 17:04:07
"Lavender and soap, but like a smooth cleanliness, not a harsh chemical citrus",Twitter_WasA_Mistake,2023-03-16 17:06:16
Just in time for the 3-point barrage lol,booger_dick,2023-03-16 17:11:34
im trying to watch both. madness stops for no one,kylepierce722,2023-03-16 17:12:02
We in Wichita have our eyes on Richey.,bh6891,2023-03-16 17:13:50
😭😭😭,Wings4514,2023-03-16 17:16:33
Did you just tune in. They've hit 4 threes so far.,spierce64006,2023-03-16 17:19:52
Have you watched a UVA game before? It’s kind of our game plan to keep it close until the end.,ExtiWonderTrader,2023-03-16 17:19:56
Yeah now I definitely am not leaving this game for hopes of chaos and my bracket staying alive,arrowflash01,2023-03-16 17:25:01
2 threes is all it takes to turn this game on its head,djfunknukl,2023-03-16 17:25:40
"Not fouls, clock problems",daswassup13,2023-03-16 17:53:12
Shot clock apparently,Bumst3r,2023-03-16 17:54:08
"The online options are really horrible if you want to see the entire tournament.

There's really no excuse if these games are paid for by all the advertisements?",obxtalldude,2023-03-16 18:04:57
WV has to have the longest average game time in the country,mF-Jonezy,2023-03-16 18:02:44
"High, their game is a foul fest",cavahoos,2023-03-16 18:02:57
"I think that if we maintain the lead and WVU/Maryland stays close, this game will finish first, bc that game will get stopped by fouls a lot in the last minutes.",Zorua3,2023-03-16 18:03:47
Bothwell might need to come back in in the next few minutes even with 4 fouls. No later than under 8 mark anyway.,spierce64006,2023-03-16 18:14:06
Nah these guys nervous as hell,lolothescrub,2023-03-16 18:08:22
God I would love it if Howard wrecked my brackets,Bumst3r,2023-03-16 18:10:16
"It’s three minutes into the game, chill.",Affectionate-Cup9340,2023-03-16 18:09:34
Perfect time imo,AnAngryBartender,2023-03-16 18:15:58
"UVA has another drought in em too, don't worry",MarcusAurelius121,2023-03-16 18:13:23
Hey that’s our signature move too!,bigbadape,2023-03-16 18:14:20
Haha nice call - went 1-3-1 right after timeout,AD50,2023-03-16 18:17:25
"Low 30s as of late, so not really",bigbadape,2023-03-16 18:14:04
Typically yes,Duck_man_,2023-03-16 18:14:23
"No. Mckneely can, but essentially no one else.",AnAngryBartender,2023-03-16 18:14:50
You commentating for people who can’t see the game?,Duck_man_,2023-03-16 18:14:13
Slippery Rock avatar! One of the few schools in NCAA that doesn't have a mascot name.,spierce64006,2023-03-16 18:15:26
"Nah, we on paper are the classic 13 over 4 upset team",tomtomtumnus,2023-03-16 18:16:44
NOT OUT YET BABY,tomtomtumnus,2023-03-16 18:17:34
First time watching us huh?,AnAngryBartender,2023-03-16 18:18:17
instead we'll just turn it over,SpiceNoodles,2023-03-16 18:18:12
3s,the_pantsmith,2023-03-16 18:23:15
This is on brand,djfunknukl,2023-03-16 18:23:00
Don’t put this evil on me,bigbadape,2023-03-16 18:25:07
Lol,AardvarkBarber,2023-03-16 19:11:02
Madness,-STO,2023-03-16 18:28:30
condolences,inshamblesx,2023-03-16 18:29:46
Did they say that lol,i_w8_4_no1,2023-03-16 18:30:32
He’s amazing,tomtomtumnus,2023-03-16 18:30:19
"Go back and watch the title run, he wasn't exactly putting on a coaching clinic that year either. I respect the result, but the narrative that has risen out of it washes away the very uneven play that (barely) got them there.",filthysven,2023-03-16 18:32:36
When was the last time Izzo won a title?,mountainoyster,2023-03-16 18:32:43
It's his place of play imo.   It doesn't take advantage of the talent gap they should have because of fewer plays which allows lesser teams to hang with them if they can score.,The12thman94,2023-03-16 18:33:08
But why,Duck_man_,2023-03-16 18:33:47
bruh why,greenfiend97,2023-03-16 18:34:22
Nah this is just us. I mean we almost lost to y’all lol.,AnAngryBartender,2023-03-16 18:39:11
"For sure.  Zero confidence in our outside shooting, so why not.",hdoublephoto,2023-03-16 18:40:07
Race to 69™️,deanopeez,2023-03-16 18:39:57
THANKS SOCON BRO,tomtomtumnus,2023-03-16 18:40:57
Yeah that's terrible basketball. Up with 2 minutes left you gotta milk some clock!,Srirachafarian,2023-03-16 18:42:22
Double double Shedrick,ipartytoomuch,2023-03-16 18:44:37
My doctor is not thrilled rn,bigbadape,2023-03-16 18:44:15
Part of what makes March Madness so fucking awesome.,chamtrain1,2023-03-16 18:45:26
[The Virginia program in a nutshell](https://reddit.com/r/CollegeBasketball/comments/11jg7c0/hang_the_banner/jb2i1la),TheBlueRajasSpork,2023-03-16 18:53:23
NO BRACKET ONLY CHAOS,CoofBone,2023-03-16 18:50:54
A lot of people picked Furman... it's moments like these remind me why I don't do brackets.,the_greasy_one,2023-03-16 18:53:28
NK,LordLiefje,2023-03-16 18:51:26
MAJOR 🧅🧅,69-o,2023-03-16 18:52:27
You didn’t call it yet then lol,tmt22459,2023-03-16 18:53:39
Mixture of both I think,SporkFanClub,2023-03-16 18:52:44
Fucking terrible execution. GG Furman.  You earned the hell out of that,hutchscouter,2023-03-16 18:53:52
It’s all on TB.,AnAngryBartender,2023-03-16 18:55:02
same lol,2222lil,2023-03-16 18:53:04
"Nah they got lucky as fuck against us in the e8, no sympathy.",a_banned_user,2023-03-16 18:53:45
Me too,Duck_man_,2023-03-16 17:10:35
Same email. Ridiculous,fightin_blue_hens,2023-03-16 17:19:53
WHAT THE FUCK,PhoneAcc23,2023-03-16 17:19:57
"""Inflation""",Outta_hearr,2023-03-16 17:21:04
i remember when they increased from $50 to $65. that was the last straw for me. sorry bud,SpiceNoodles,2023-03-16 17:21:23
Nope. Complete phantom call,Schned6,2023-03-16 17:29:30
Yes.  Picked up his pivot foot.,hdoublephoto,2023-03-16 17:29:56
The national media who doesn't watch UVA,the_pantsmith,2023-03-16 18:03:15
Their offense (bomb 3s) is Virginias weakness but the shots aren’t falling,djfunknukl,2023-03-16 18:03:11
Virginia can be good too.,Common-Community-550,2023-03-16 18:03:52
Where the fuck is that Kenpom guy,mlk960,2023-03-16 18:02:58
You don't win 27 games without being good regardless of today's result. A couple more made 3's from them and this could be a tie game right now.,spierce64006,2023-03-16 18:07:43
why does Jay Bilas have a Carolina flair,SpiceNoodles,2023-03-16 17:04:56
People say this but UVA blows these types of leads in 3 minutes all the time,ddottay,2023-03-16 17:06:07
there's never a moment I'm not worried,SpiceNoodles,2023-03-16 17:07:01
"That's our secret, we're always worried",daswassup13,2023-03-16 17:06:48
We're always worried.,obxtalldude,2023-03-16 17:06:56
"Not really, we’re used to this lol",cavahoos,2023-03-16 17:06:53
9 is a huge lead for us this year,ncs1123,2023-03-16 17:06:56
I’m always a little worried. That’s why I usually drink during Virginia games.,Bumst3r,2023-03-16 17:07:29
Something something being down by 9 against us is like being down by 18 (of course I’m nervous),HooGoesThere,2023-03-16 17:07:27
im more cautious. yea were up but i literally just saw Maryland make a run so lets keep the foot on the gas if we can find  it,kylepierce722,2023-03-16 17:08:17
This looks just like the Clemson game so far,MarcusAurelius121,2023-03-16 17:07:05
That’s what I was thinking. Clearly a lot of nerves and this game is too close,[deleted],2023-03-16 17:07:00
Leave Kihei Fuckin' Clark out of this,the-real-macs,2023-03-16 17:49:34
It was the most likely upset prediction,djfunknukl,2023-03-16 17:58:10
We're not underdogs here.,VAGentleman05,2023-03-16 17:58:42
Hells yeah,PorterSchrader,2023-03-16 18:14:20
Hope you aren’t watching the Maryland wvu game then lol,makualla,2023-03-16 18:31:38
I’m going to fucking connollys if we win this,maxd98,2023-03-16 18:33:24
Same,AnAngryBartender,2023-03-16 18:35:41
We used to say that about Villanova,General_PoopyPants,2023-03-16 18:36:49
The pass was a way better option,Duck_man_,2023-03-16 18:46:10
What lol? He had to shoot that there was no other reasonable option.,tmt22459,2023-03-16 18:51:10
Please tell me he has at least one more year,Hokiestoned,2023-03-16 18:55:33
"Pick a ton of upsets, you'll get some right",Agitated-Basil-9289,2023-03-16 19:12:07
Pretty sure he was inside the arc but haven’t seen a replay,Shenanigangster,2023-03-16 16:50:11
Rule of cool I guess but yeah he was planted and in position,daswassup13,2023-03-16 16:50:27
Cuz it was a cool dunk.,SteffeEric,2023-03-16 16:50:36
Was he inside the restricted area? I didn’t get a great view,Bumst3r,2023-03-16 16:50:40
He was absolutely set,TheNewDiogenes,2023-03-16 16:50:17
"Because it wasn’t even close to a charge? He was in the restricted area, he slid over after the guy had started his upward motions, and he got scared and put his arm out against the offensive player instead of actually taking the contact",byzantiums,2023-03-16 16:51:46
That would be a mess,cavahoos,2023-03-16 16:51:02
That was be absolute chaos,AFC-Wimbledon-Stan,2023-03-16 16:51:07
nah bc in some comments no one will know which game they referring to,hejendo76,2023-03-16 16:50:42
You're winning?,Common-Community-550,2023-03-16 17:18:27
"You don’t need to be set to take a charge, you can also be in legal guarding position. It baffles me how many people think that when it’s just so incorrect.",Affectionate-Cup9340,2023-03-16 17:27:54
"Usually they go with intent unless it’s particularly egregious, he was going for the ball so common foul",[deleted],2023-03-16 18:33:58
Always does. But he's so small he doesn't get called for it,asiankid2463,2023-03-16 18:45:03
No chance for me lol,The_Letter_Purple,2023-03-16 19:04:43
Friggin' why? Tony is a great guy and UVA hasn't had players like Grayson Allen.,Best_Duck9118,2023-03-17 05:31:03
This is just not true (im a NCSU fan),Squat1998,2023-03-16 22:53:43
"They’d be down anyway, but yeah some very soft calls on defense for them",byzantiums,2023-03-16 16:48:57
"He went to block and missed, it’s a normal foul. Flagrant 1 rule is soft as fuck",Rhodysurf,2023-03-16 18:33:28
"Hey, you’re playing. I have to pull against you but love the attitude!",carringtonsworld,2023-03-16 15:57:29
Go make the SOCON some money!!!!!,IONTOP,2023-03-16 16:02:38
Playing with house money is the best advantage,Seastep,2023-03-16 16:07:57
Not a chance,morelibertarianvotes,2023-03-16 16:46:43
All of a sudden he's turned into Jontel Evans,MarcusAurelius121,2023-03-16 16:57:01
We literally are incapable of burying a team all year. Furman is solid so I’d be surprised if they let us do it to them. Think this will be a very close game down the wire.,addicted2antacids,2023-03-16 17:06:35
We don’t do that,ncs1123,2023-03-16 17:07:13
"They basically haven’t put their foot on any team’s neck in the four years since the title team, they’re incapable of burying anyone outside of once or twice a season anymore",byzantiums,2023-03-16 17:08:23
We regret not putting the foot into everyone’s neck early. Playing down to the competition is a tradition. Being bitten by it is too.,Bumst3r,2023-03-16 17:06:32
"Oh look, another no flair talking shit about college basketball.",Common-Community-550,2023-03-16 17:15:35
Very sloppy on both sides,Moonti314,2023-03-16 17:15:25
He didn’t touch it,Bumst3r,2023-03-16 17:55:50
It’s fucking nuts. And he drives in and no one is there to help.,FostetlerLFC,2023-03-16 18:00:07
He’s much better at 3 this season. Was up near 40% the first half of the season,Duck_man_,2023-03-16 18:01:17
Because he’s extremely quick and can dish it to anyone,cavahoos,2023-03-16 18:02:14
why not be both,cameronxzz,2023-03-16 18:25:33
"It’s me, I hate the slow play.  Props to TB for getting us a national championship though.",AnAngryBartender,2023-03-16 18:27:11
Most of us are both actually. We love the slow play style but we’re also weary of being disappointed,Bumst3r,2023-03-16 18:26:37
I hope so.,BratVerstappen,2023-03-16 18:37:48
Why would one affect the other?,Common-Community-550,2023-03-16 18:38:24
Or how about both thirteens lose,Bumst3r,2023-03-16 18:44:58
Have to give credit to Virginia's defense too.,spierce64006,2023-03-16 18:46:51
Perfect bracket is shot but I’ve had $20 on both underdogs so far,ImmoralModerator,2023-03-16 18:52:10
"Greenville, South Carolina",spierce64006,2023-03-16 17:12:30
It should definitely be on everyone’s bucket list of places to see!!,Jdenney71,2023-03-16 17:12:55
![gif](giphy|3ohhwH6yMO7ED5xc7S|downsized),Bumst3r,2023-03-16 17:14:31
TruTV fans eating,mhoq,2023-03-16 18:23:46
Virginia fans are sickos,Bigdeacenergy,2023-03-16 18:28:51
ME TOO,better-days385,2023-03-16 18:52:30
"In that case, we’ll take him",Primary_Psychology95,2023-03-16 18:53:11
Tf we do to you,mmmcheez-its,2023-03-16 17:12:20
That’s gonna continue the whole game. It’s who we are,UncleMalcolm,2023-03-16 18:07:18
That’s literally what we do every game. First time?,AnAngryBartender,2023-03-16 18:07:17
Hell no,UpTheChelsea-,2023-03-16 18:31:22
UNC and missing the tourney,FuckTheHokies,2023-03-16 18:54:02
This is not Rocket League lol,VelocityRD,2023-03-16 18:55:53
"No, it's not Rocket League rules.

Once the clock hit zero, as soon as the ball hits a player or the floor, it's over.",chogram,2023-03-16 18:55:40
Once the buzzer goes that’s it. So that original shot was the only one that could have counted.,dubblechzburger,2023-03-16 18:55:52
"No. No one can shoot the ball after the clock hits 0, no matter if their feet are touching the ground or not.",MyNameIsGoran14,2023-03-16 18:56:36
…,rindor1990,2023-03-16 18:54:37
"Nah, time expires it's done",RichardStuck757,2023-03-16 18:54:51
Buzzer sounds that it’s it. The ball is dead once the clock reads 0:00,NemesisBates,2023-03-16 18:55:05
"no, yeah once the buzzer sounds that's it",NewHavenJeff,2023-03-16 18:55:08
"No, original shot needs to hit",Death_by_carfire,2023-03-16 18:55:12
Ball has to leave their hands before the 00 mark. After that it’s a dead ball.,ash-jager-main,2023-03-16 18:55:13
A shot only counts if it was last touched before the buzzer goes off,eddiedeli,2023-03-16 18:55:17
If anybody touches the ball after the buzzer it’s game over,COLU_BUS,2023-03-16 18:55:18
"No, once time is up that is it.",bornalion,2023-03-16 18:55:18
As soon as the clock hits zero it’s over.,Inevitable_Escape689,2023-03-16 18:55:25
Once time runs out no touch touch,punkmaster2,2023-03-16 18:55:30
No game actions after :00,AlorsViola,2023-03-16 18:55:31
"Once the buzzer goes off the play is dead upon contact with a player or the floor, so the two Virginia guys wouldn’t be able to tip it in",BigDucketts,2023-03-16 18:55:39
no they cannot,Brsijraz,2023-03-16 18:55:43
"No. It doesn't matter if you're not touching the ground, if you touch the ball after time expires its not gonna count",Wienerr,2023-03-16 18:55:44
Anyone touching the ball after it hits zero doesn’t count,CalebH428,2023-03-16 18:56:11
"? They've been getting decent looks, just been shitting the bed. Now their shots are finally falling.",StrivingProsperity,2023-03-16 17:09:42
"This is a great matchup for Furman, a team that hangs it's hat on defense but primarily clogs the lane and slows the game down to a crawl keeping everyone within arms reach",soflahokie,2023-03-16 17:10:30
I had Virginia losing and Maryland winning I’ll just take my perfect bracket check now lol,StasRutt,2023-03-16 18:54:43
"I've got Furman to the Sweet 16, 2 for 2 so far!",derrickd95,2023-03-16 18:54:29
I'm 2/2 so far,RayCashhhh,2023-03-16 18:56:53
This was a pretty trendy upset pick.,SweetPennies,2023-03-16 18:56:12
I had Furman winning. But I also had West Virginia winning. So that sucks,[deleted],2023-03-16 18:56:23
2 for 2 here,hfhrhjdjhhhjhguy,2023-03-16 19:01:33
?,Affectionate-Cup9340,2023-03-16 18:34:01
Try making the tournament,djfunknukl,2023-03-16 17:16:00
You're a clown.,VAGentleman05,2023-03-16 18:22:33
We live rent free in your head I see,culp,2023-03-16 18:23:39
TB doesn't have any DUIs so that's nice,the_pantsmith,2023-03-16 18:24:42
Not exactly a hot take.,VAGentleman05,2023-03-16 17:36:50
Cool story,hdoublephoto,2023-03-16 17:50:46
Damn,Affectionate-Cup9340,2023-03-16 19:14:01
How is unc doin?,djfunknukl,2023-03-16 17:23:26
Lol what? We're all fine. This is about like every game this year. It's everyone else.,MarcusAurelius121,2023-03-16 17:26:36
Welcome to the show,bigbadape,2023-03-16 18:17:19
Who the fuck are you,Duck_man_,2023-03-16 18:17:42
Sometimes it feels like Gonzaga fans are the meanest to us :(,mmmcheez-its,2023-03-16 18:18:03
[deleted],[deleted],2023-03-16 18:18:16
to Kansas? yes please,SpiceNoodles,2023-03-16 17:10:36
If it gets us another championship I'll take it,the_pantsmith,2023-03-16 17:11:07
Texas A&M-CC moving on I agree,inshamblesx,2023-03-16 17:11:07
Flex call bro!,PopDukesBruh,2023-03-16 18:56:15
You rooting for a Bama/Furman Sweet 16?,JGraham1839,2023-03-16 16:16:36
I feel the opposite. I picked Furman and to me they just don't look that good. I'd be surprised if they pull off the upset.,[deleted],2023-03-16 17:22:13
Nope,lolothescrub,2023-03-16 17:24:20
