Comment,Author,Created UTC
Side note: it’s weird seeing 800 comments in a Furman game thread.,tomtomtumnus,2023-03-16 17:38:25
[deleted],[deleted],2023-03-16 18:56:59
"FU 1 TIME
FU 2 TIMES
FU 3 TIMES
FU ALL THE TIME!!!!",TheLivingBubba,2023-03-16 15:45:47
"Last 5 years:

> first round loss

> national championship

> tournament cancelled

> first round loss

> missed tournament

Considering the tournament wasn't cancelled, if we win this game we're winning the natty

Thanks for coming to my TED talk",5p4mr1,2023-03-16 16:37:24
"congrats virginia fans, now you get to see that on every march madness buzzer beater montage from now on",sportsnstuff,2023-03-16 18:52:14
wtf are these referees calling. Virginia jumps straight up and gets called for a foul and Furman is getting run over and theyre calling blocking fouls,Beatdooown,2023-03-16 17:26:39
Just got a notification from my Apple Watch telling me my heart rate is unusually high,cavahoos,2023-03-16 18:41:42
"this was during class and I heard multiple people go ""ughh"" and shut their lids at the end of that...",BelieveWhatJoeSays,2023-03-16 18:53:23
"At the arena for my first ever in-person March Madness. Really impressed by the amount of Furman fans, they easily outnumber every other school right now.",Citruspilled,2023-03-16 16:14:24
">”Don’t be cavalier with the ball”

So the TruTV guy thinks he’s funny huh",530josh,2023-03-16 16:47:48
"My brother went to Furman. I went to UVA. I do not want to be reminded of this game every day of my life. 

I desperately need UVA to win.",jippylee,2023-03-16 16:53:53
Having your school's initials be FU feels like cheating for making signs. So many possibilities,Citruspilled,2023-03-16 17:11:51
"https://preview.redd.it/95pcmekcg6oa1.jpeg?width=745&format=pjpg&auto=webp&s=ca051d655481407066b804e1fb166290bc10228f

Poca Dots mascot (and Walmart Andy Reid)",SaintArkweather,2023-03-16 17:27:44
It’s honestly hard to complain about the refs because it’s not like they’re actually favoring one side. I think they just suck.,Bumst3r,2023-03-16 17:34:28
"“Winners make big shots and I call myself a winner”

You love to see that",ImmoralModerator,2023-03-16 18:53:40
Wow. That’s an all time boneheaded play to lose a game.,crimsonblueku,2023-03-16 19:04:34
When I watched Furman they shot lights out. Now they can’t hit anything.,[deleted],2023-03-16 16:58:20
"Fuck it teammate down there somewhere (he was not, in fact, down there somewhere)",TheFrigz,2023-03-16 18:53:43
My dad passed away a year ago and I’ve been watching this team since I was a kid this win would mean so much to him FU ALL THE DAMN TIME,DaRealJuanCena420,2023-03-16 18:52:48
"One thing about this team is that they are completely incapable of stepping on decent teams’ throats. It’s like clockwork: double digit lead, other team takes a timeout, other team goes on a run.",UncleMalcolm,2023-03-16 18:05:42
Fuck this bald ref. Dude is trash and making shit calls for both teams.,SugarFreeBrowny,2023-03-16 17:27:53
Up 5 having not made a single 3. Feeling okay about this one. Just gotta get some more open looks and continue defending the way we have,cavahoos,2023-03-16 17:34:31
The thing about Virginia is they can absolutely dominate you and still only be up a couple of scores,ImmoralModerator,2023-03-16 17:07:12
![gif](giphy|ggHmCDJXx4om4hNWbM|downsized),Bumst3r,2023-03-16 17:09:53
virginia almost pulled the upset,PrinceWhoPromes,2023-03-16 18:52:10
UVA and choking against a double digit seed nobody school in the first round. Name a more iconic duo.,Ok-Anywhere8986,2023-03-16 18:53:36
Maybe Virginia should try being a double digit seed to avoid losing to one for as long as possible?,RazzleDazzle3469,2023-03-16 18:55:13
"Great ending, bracket busts incoming",Yourboydub,2023-03-16 19:58:18
Virginia’s style just doesn’t let them step on a team’s throat. Furman was nervous early but they’re settling in.,JayMoney2424,2023-03-16 17:10:57
Neither one of those were fouls lol,UncleMalcolm,2023-03-16 18:28:50
Ahhh yess the ol UVA'aroo,cahill48,2023-03-16 18:54:00
"For being juiced with adrenaline, that final interview with JP was super wholesome. Hoping Furman can keep it going.",Elexeh,2023-03-16 18:54:15
Okay that was the ONE 4-13 upset allowed in the round of 64….,BeanMachine5555,2023-03-16 19:26:24
On one hand that was definitely an offensive foul on Gardner. On the other hand Slawson literally just got 2 FTs from a clean block.,feed_me_muffins,2023-03-16 17:18:08
Atrocious call,MRC1986,2023-03-16 17:25:31
It’s still go ACC I don’t care that it’s our rival,IndividualCamera8034,2023-03-16 17:44:20
"JFC, how do we *always* have these scoring droughts?",OOrochi,2023-03-16 18:21:37
Would be a ridiculous soft flagrant if called,MoneyManeVick,2023-03-16 18:31:19
We are all Furman fans on this blessed day,waowie,2023-03-16 18:54:52
I came,Qwertyasdert69,2023-03-16 18:57:55
First tournament points scored by Furman since Carter was president,SaintArkweather,2023-03-16 16:44:41
This team just forgets how to do anything once they go up 9.  I swear they are deathly allergic to double digit leads,akg4y23,2023-03-16 17:10:20
UVA is taking a lot of contact on drives,ClippersStrippers,2023-03-16 17:17:32
How does Gardner get a foul for jumping straight up while his opponent attempts a karate kick,smellslikebadussy,2023-03-16 17:27:59
Am I crazy or was that not a jump ball at all?,addicted2antacids,2023-03-16 18:04:58
UVA hoops are only boring if you're not a basketball fan. Fun fact,the_pantsmith,2023-03-16 18:14:28
![gif](giphy|fA1OFzprOfRjteYADG),Bumst3r,2023-03-16 18:25:08
How is that a foul????,Duck_man_,2023-03-16 18:27:02
Comments moving so fast no one will know I'm a furry,mtmodi,2023-03-16 18:50:00
"AS A LIFELONG FURMAN FAN AS OF 45 SECONDS AGO. 

&#x200B;

# LETS FUCKING GO FURMAN",RollOverBeethoven,2023-03-16 18:51:06
I hate seeing the upset players though 😭😭,BeGneiss,2023-03-16 18:52:51
If not for 2019 would Virginia be one of the worst performing schools in March?,Ghost-of-Moravia,2023-03-16 18:53:49
at UVA right now. The chicken/waffle food truck line has doubled/tripled from normal in anticipation of this game...,BelieveWhatJoeSays,2023-03-16 16:32:56
Omg they are so nervous right now man can’t even make a layup,Due_Ruin_2809,2023-03-16 16:59:18
I am entirely unfamiliar with basketball rules. Why am I watching this?,Mad-Lad-of-RVA,2023-03-16 17:05:45
He just stiff armed dude on Furman. Like come on bro. Call that shit.,[deleted],2023-03-16 17:17:47
Everyone is watching this game on different timelines lol,TheOldManInTheSea,2023-03-16 17:59:04
Tru TV try to show a UVA highlight when they’re up by 10 challenge [IMPOSSIBLE],Wilper971,2023-03-16 18:04:07
WHY DO WE HATE HOLDING LEADS,Duck_man_,2023-03-16 18:22:53
Everything is a foul.,AbusiveTubesock,2023-03-16 18:28:17
Some of the softest fouls I’ve ever seen getting called vs uva now,TheDangerZoone,2023-03-16 18:28:38
"They called a phantom foul on Shedrick for an and one earlier, go ahead and call this one a flagrant refs",cavahoos,2023-03-16 18:31:44
We make two three pointers then decide that's all we are going to try from that point on,akg4y23,2023-03-16 18:33:34
These fouls are soft. On both ends,morelibertarianvotes,2023-03-16 18:39:01
I don’t like the first weekend,InstaNormie0,2023-03-16 18:39:02
"Kihei with the greatest play in UVA history, Kihei with the worst play in UVA history. I am so mad",daswassup13,2023-03-16 18:49:42
How are you a acc point guard for like six years and still throw that shit pass in that situation,BrutalOptimism,2023-03-16 18:49:54
"![gif](giphy|26AHMBTzc1qJgFfDW)

I LOVE THE LEAN COLORED TEAM!!!",Zloggt,2023-03-16 18:51:36
Honestly the boneheaded move is one thing but what a fuckin shot to finish it. Furman earned that as much as Virginia gave it away.,filthysven,2023-03-16 18:51:45
Virginia loves nothing more than getting knocked out early,mcdc4ever,2023-03-16 18:52:07
Kihei came in the year after they lost as a 1 so he just wanted his chance to feel like shit.,OsStrohsNattyBohsHon,2023-03-16 18:52:10
I love March Madness for making me happily root for schools I've legit never heard of,StarvedRock314,2023-03-16 18:52:54
Virgina with an all time dumbass pass out of that,browndude10,2023-03-16 18:53:07
Virginia is the biggest team of choke artists on the planet,CFBCommentor,2023-03-16 18:53:20
"First two games and already 2 great finishes! 

How can you not love March Madness!? (losing teams fans not included)",barryitsmeitshank,2023-03-16 18:54:34
"wait what just happened I looked away from the thread because work and it seemed like it was over and then I got the notification that Furman won

shame on me for doubting March",DaMantis,2023-03-16 18:56:07
I feel for Furman not hitting any shots whatsoever right now. UVA fans know that feeling all too well.,jippylee,2023-03-16 17:01:21
wheres the foul on that,Beatdooown,2023-03-16 17:15:45
"Grant Hill has given the suite to Blue Devil five years in a row, why does he expect the mascots will ever accept it? And why do the other mascots even show up? They should know he will never change his ways",SaintArkweather,2023-03-16 17:20:05
[deleted],[deleted],2023-03-16 17:31:39
Auburn just excommunicated Chuck lol,Shenanigangster,2023-03-16 17:41:55
Yo if you're at the arena do NOT use the bathrooms during halftime. These lines are wild,Citruspilled,2023-03-16 17:45:13
Cmon all defense no offense bros i got you guys in all 5 of my brackets,[deleted],2023-03-16 18:09:09
McKneely please stay all 4 years,ipartytoomuch,2023-03-16 18:09:35
We ran that flare screen corner three to Kyle Guy a zillion times,addicted2antacids,2023-03-16 18:10:44
McKneely is gonna be so fucking good,the_pantsmith,2023-03-16 18:11:03
Being a 13 seed that can’t make layups is a tough recipe for an upset,byzantiums,2023-03-16 18:12:05
"I’ve commented it 800,000 times but our inability to maintain our build a lead needs to be studied by scientists",addicted2antacids,2023-03-16 18:23:12
Where’s the foul there?,cavahoos,2023-03-16 18:27:01
This would definitely be the biggest upset in Virginia history. Nothing else comes to mind. Nope.,mrsunshine1,2023-03-16 18:31:45
Fire first 2 games,canadianbroncos,2023-03-16 18:38:49
It is entirely possible that that was the worst pass I’ve ever seen,Baron_DeCharlus,2023-03-16 18:49:01
"That was close, but man, UVA really threw that one away.",realbigexplosion,2023-03-16 18:51:38
Bro I am 0-2 already in my bracket 😂😂,roonscapepls,2023-03-16 18:51:48
"LOL.  Not a bad look at the end for Virginia, but holy shit what a total fucking bonehead play after being trapped.",MRC1986,2023-03-16 18:52:15
Never doubted furman ever. If anyone says I did it’s fake.,14475553,2023-03-16 18:52:16
"""Fuck it"" and chuck it is not what you want to do in those situations.",Half_Baked22,2023-03-16 18:52:22
"Virginia just loves being upset, I think they have a problem.",Marino4K,2023-03-16 18:52:37
Man if it weren’t for 2019 UVA would really have a choke artist reputation at this point,That_One_Pancake,2023-03-16 18:52:52
"CONGRATS, FURMAN AND FURWOMEN!",EWVGL,2023-03-16 18:52:52
the second game and my bracket is toast looool,royalbluuuu,2023-03-16 18:52:58
WINNERS MAKE BIG SHOTS HE SAID,deanopeez,2023-03-16 18:53:30
Well he seems like a real swell kid. Hope he doesn't get TOO drunk tonight.,Crazyhawk28,2023-03-16 18:53:58
This is what im here for,damnedfish,2023-03-16 18:54:05
I thought I survive the Maryland pick only for this nonsense to happen. Thanks UVA,aten10x,2023-03-16 18:56:54
Multiple people picked Virginia in my survivor pool. Didn't take long for people to be out there.,DrKoooolAid,2023-03-16 18:58:17
"Wow, congratulations Furman.",ktbyers,2023-03-16 18:58:45
JALEN SLAWSON,rvadarocket,2023-03-16 16:48:31
Hey everyone coming from halftime of WV/Maryland,arrowflash01,2023-03-16 17:09:59
I hate it when we don’t even attempt 3’s.  We have one try so far and it was from Dunn.  That makes zero sense,CasperFatone,2023-03-16 17:11:01
Is it weird that I have UVA winning this in my bracket but I want Furman to win because chaos?,Haysie95,2023-03-16 17:18:07
"Gardner's built for this sort of matchup, where the three inches of height he's missing for the game he has don't matter.",elgenie,2023-03-16 17:18:40
[Poca Dots](https://pbs.twimg.com/profile_images/1558711385/Dot_400x400.jpg),loyalsons4evertrue,2023-03-16 17:23:30
"Furman has played a C+/B- game so far, its best player is in serious foul trouble, and it's only down 5.",run_nyg,2023-03-16 17:28:41
"I swear I’ve never seen a team so consistently build a 9-10 point lead and then immediately let the other team right back. It’s uncanny. Fundamentally allergic to maintaining a comfortable lead, let alone extending it.",addicted2antacids,2023-03-16 17:29:01
Refs have been quite bad (both ways). Maybe a third of the fouls if not more have been totally phantom.,addicted2antacids,2023-03-16 17:30:14
"With how aggressively Furman is guarding the perimeter, it’s mind boggling that Reece (and Jayden, to an extent?) are the only ones attacking the basket. 

Armaan should feast in that capacity this game but he’s been invisible.",addicted2antacids,2023-03-16 17:32:44
Lol at chuck yelling roll tide.  Traitor,upghr5187,2023-03-16 17:41:21
Damn it... Barkley and I have the same exact Midwest bracket...,Krankthat,2023-03-16 17:42:09
In what universe is that a jump ball,the_pantsmith,2023-03-16 18:04:30
Those McNeely threes are back breakers.,mrwhitaker3,2023-03-16 18:11:05
Mr Stark i don’t feel so good,ConsciousBlackberry,2023-03-16 18:21:01
Cardiac Cavs indeed,daswassup13,2023-03-16 18:21:12
Virginia needs to run a play. Move the ball and your bodies.,-STO,2023-03-16 18:22:03
WHY NOT HAVE IT CLOSE AM I RIGHT?!/!?/!,flyinhyphy,2023-03-16 18:22:40
Major respect to Furman. They're not quitting at all,the_pantsmith,2023-03-16 18:22:58
God we just cannot put teams away,umbchoos,2023-03-16 18:23:08
"You wouldn’t think the team that sees a zone a minimum of once a year in conference would have this much trouble with one, but it is 2023 UVA with a second half lead so 🤷🏼‍♂️",UncleMalcolm,2023-03-16 18:23:13
Bothwell fouls out after playing the dumbest game of his carwwr,tomtomtumnus,2023-03-16 18:23:23
Not that I want this to be a close game but so far the first 3 games are all close. March is here baby,cavahoos,2023-03-16 18:25:12
"Lol, Shedrick literally backed away, how is that a foul?",MarcusAurelius121,2023-03-16 18:26:50
lmao absolutely no one touched him??,AbusiveTubesock,2023-03-16 18:26:53
19-4 run. I want to die.,MeLlamoBenjamin,2023-03-16 18:30:11
bro i am straight up not having a good time right now,kylepierce722,2023-03-16 18:31:11
Virginia is always highly ranked but terrible to watch,built_internet_tough,2023-03-16 18:32:30
Right call,arrowflash01,2023-03-16 18:34:30
Furman did their homework on Virginia. This is an extremely impressive display of coaching,huttts999,2023-03-16 18:37:23
Holy shit,BigBat92,2023-03-16 18:48:59
LMAOOO WHY DID HE YEET THAT,Number333,2023-03-16 18:49:03
What in the actual hell was that pass lmao,yukoncowbear47,2023-03-16 18:49:03
What a dumb play from like a seventh year senior,[deleted],2023-03-16 18:49:17
" HOW DO YOU LIKE THOSE APPLES VIRGINIA 

&#x200B;

DON'T LIKE A STUPID INBOUNDS TURNOVER LEADING TO A CLUTCH 3 DOES IT",aaronman4772,2023-03-16 18:49:51
"When that 3 went up, the world knew it was going in",jmcstar,2023-03-16 18:49:59
Clark’s been at UVA for 17 years and really just did that lmao,GuyFaulks77,2023-03-16 18:50:22
Nobody is ever picking Virginia again lmao,Great_Smells,2023-03-16 18:50:34
Broooo. Kiehei Clark is a 23 year-old senior who's been here before. Crazy mental lapse,soxandpatriots1,2023-03-16 18:50:38
Clark had one of the most iconic passes in tournament history as a freshman. Now he's gonna finish his UVA career with one of the worst.,ddrector,2023-03-16 18:50:58
My bracket is destroyed and I couldn’t care less,jeffmatch,2023-03-16 18:51:04
Bruh. How does the guy who threw one of the most impressive passes in tournament history as a freshman do that……,Boilermaker24,2023-03-16 18:51:12
Does any team fail like UVA in March?,[deleted],2023-03-16 18:51:12
Literally threw the game away.,Nodarg,2023-03-16 18:51:46
That praying girl had me dying from laughter.,ShlomoShogun,2023-03-16 18:51:52
Lol Virginia either goes far or loses embarrassingly,RazzleDazzle3469,2023-03-16 18:51:58
"I don't even care that I picked Virginia to make the Elite 8, that was awesome",galacticdude7,2023-03-16 18:52:10
Paladins decided to use SMITE,[deleted],2023-03-16 18:52:26
Boneheaded play there when they had a timeout,Wazoongaa,2023-03-16 18:52:27
UVA next years champs confirmed,ErickBachman,2023-03-16 18:52:27
"Holy shit that was awesome, what a way to win for Furman",CumAssault,2023-03-16 18:52:37
"That poor kid man, holy shit",RollTides,2023-03-16 18:52:42
Another Tony Bennett master class of tournament coaching,JayMoney2424,2023-03-16 18:52:51
UVA is something else.,Solgiest,2023-03-16 18:52:59
Gonna be a good tourny,Crazyhawk28,2023-03-16 18:53:01
"B1G 1-0

SoCon 1-0

Big 12 0-1

ACC 0-1

Just like we planned it",huggles7,2023-03-16 18:53:14
"""and I call myself a winner""

Stone cold.",llamawhittlings,2023-03-16 18:53:18
Lets go two perfect brackets left lmao,Ghost-of-Moravia,2023-03-16 18:53:19
Moments like that are why I take PTO for the first two days of the tournament.,ChonkyWumpus,2023-03-16 18:56:04
Virginia on its quest to lose in the first round as every seed,The_Cows_Are_Home,2023-03-16 18:52:30
Right now on the ACC network they are showing “Unbelievable” the journey of UVAs improbable championship…. Like literally right now it’s on,PopDukesBruh,2023-03-16 19:36:12
Cautiously optimistic,cavahoos,2023-03-16 15:44:56
He just took that man's soul!,BtownBrelooms,2023-03-16 16:47:54
Sweet Christ,RhodeIslandisFake,2023-03-16 16:48:50
"Using our superior athleticism to drive to the rim and get fouls instead of passing to an open man for a mid range jumper, who woulda thunk that would work?",cavahoos,2023-03-16 16:55:46
Gotta keep scoring. Furman won’t stay cold forever and despite what commentators may tell you - a 10 point UVA lead is still just 10 points,mmmcheez-its,2023-03-16 17:02:19
I was very wrong about Furman. They can't buy a bucket.,sportsfan510,2023-03-16 17:02:30
"I could see this game get closer.

Furman has some good players and Virginia is not exactly crisp with their ball handling today.",obxtalldude,2023-03-16 17:05:09
Furmans looks haven't been that bad. I think eventually they'll heat up more,ehs4290,2023-03-16 17:05:10
Lily posting season is upon us,Twitter_WasA_Mistake,2023-03-16 17:10:42
The offense has completely stopped functioning,daswassup13,2023-03-16 17:14:15
Furman being only down 5 is a minor miracle because offensively they’ve looked really inept at times,AFC-Wimbledon-Stan,2023-03-16 17:21:05
"This game is being called extremely inconsistently, like a game with 3 referees who don't work together much",MarcusAurelius121,2023-03-16 17:21:43
Poca grad here. There's also a Poca Middle if you want a PMS Dot shirt.,Rangertexas9,2023-03-16 17:24:34
That’s terrible,Affectionate-Cup9340,2023-03-16 17:25:41
That was awful,KitchenBest4478,2023-03-16 17:26:12
"Shouldn't be this close, but Franklin will be back and scoring in 2H and we shouldn't have so many bunny misses/turnovers in the paint",AbusiveTubesock,2023-03-16 17:29:01
Gotta feel good if you're Furman right now. To only be down two possessions after that horrible start is good.,Dhh05594,2023-03-16 17:29:21
This team refuses to capitalize on or even maintain a solid lead. All season.,Duck_man_,2023-03-16 17:31:21
Furman gotta make this a game.,etsuandpurdue3,2023-03-16 17:36:52
"This has been about as classic a Virginia game as you can get so far, as long as the offense keeps finding ways to score and can get us to over 60ish then I think we’ll hold on",cov2445,2023-03-16 17:42:34
"Right after this game tipped, I took Furman + 6.5. I totally forgot that earlier this morning I took Virginia -5.5 in a parlay.

If Virginia wins by exactly 6 points, I'm buying a lottery ticket.",mrwboilers,2023-03-16 17:56:41
Furman is just missing wide open 3s am I missing something? All the announcers keep talking about uvas defense but these are wide open,asaber1003,2023-03-16 17:58:33
Man Shedrick has just been a punching bag this season,Gingerbread2296,2023-03-16 17:58:40
"Virginia looks much more poised facing a chaotic team like this than in the past.  Lessons learned I guess.  Or Furman is just missing shots.  A little of both

This aged very poorly",jalsy543210,2023-03-16 17:59:00
"This is an absolute brick show from Furman, my god",Franky_FourFingers,2023-03-16 17:59:32
most of furman's looks from 3 have been good they just aren't falling,wwgd,2023-03-16 17:59:37
THERE IT IS KIHEI that’s the efficient guard I’ve been waiting for these past 6-7 games. Using the body very well to shield on the layup.,Duck_man_,2023-03-16 18:00:20
Furman is not HIM this game which is a shame,AFC-Wimbledon-Stan,2023-03-16 18:00:25
"Yep, we figured it out. Furman cannot guard the paint and the guys are taking advantage of that by just driving in for layups over and over again. Even if their offense heats up, it's gonna be a tough sell to make back 12 points against our defense while also patching up their defensive weakness. 

Can't get overconfident but I'm optimistic.",Zorua3,2023-03-16 18:00:48
Y’all saying this game was over: it’s definitely NOT over,Duck_man_,2023-03-16 18:04:24
I kinda wanna see us win this one without a single made 3 just for the memes,cavahoos,2023-03-16 18:04:35
Nothing scarier in Virginia sports than the phrase “ten point lead”,Bumst3r,2023-03-16 18:06:50
Whoa.  We made a 3?,AnAngryBartender,2023-03-16 18:09:56
iMac on one end and Dunn on the other. I love our young guys so much,Bumst3r,2023-03-16 18:10:52
Kyle guy 2.0,PorterSchrader,2023-03-16 18:11:09
MCKN33LY,Duck_man_,2023-03-16 18:11:16
Mckneely the GOAT tbh.,AnAngryBartender,2023-03-16 18:11:19
Thank god for Beekman,OOrochi,2023-03-16 18:11:51
Another clean block called a foul,smellslikebadussy,2023-03-16 18:12:59
"12 point lead, timeout, give up a run

Like clockwork",UncleMalcolm,2023-03-16 18:17:13
Playing twister with Shedrick then complaining it’s not a foul 😂,Bumst3r,2023-03-16 18:20:22
"Kinda weird to see this team go out of sorts when presented with a zone, we used to carve those up",cavahoos,2023-03-16 18:23:38
Internal monologue: *a four point Virginia lead is like a 38 point lead for* ***any other team***,MeLlamoBenjamin,2023-03-16 18:24:57
 *a tie game for Virginia is like a 54 point lead for* ***any other team***,MeLlamoBenjamin,2023-03-16 18:27:51
The mood inside the Applebee's on Pantops is...subdued.,throwmeawaypoopy,2023-03-16 18:28:23
"Everyone with Furman watching Slawson right now:

https://preview.redd.it/vtwipb7fr6oa1.jpeg?width=645&format=pjpg&auto=webp&s=94acff21ecac33b74ca353df685eff5fcec116b7",jklaz,2023-03-16 18:30:04
So if you play a slow paced game and take terrible shots it's gonna be a bad time,edleranalytics,2023-03-16 18:31:15
Ain't no way this is flagrant,spiderpigface,2023-03-16 18:31:41
Pretty obvious foul. The elbow to the face is a dead giveaway,General_PoopyPants,2023-03-16 18:32:36
Watching UVA basketball is a choice between being beyond frustrated and laughing your ass off,Baron_DeCharlus,2023-03-16 18:33:06
"Virginia fans be like ""hey, look at Kansas over there!""",MRC1986,2023-03-16 18:36:38
"Virginia's pace is always going to keep games close. They are likely one of the teams that you want to see if you are an underdog, but also not one of the teams you want to see if you are favored.

Gotta be nerve-wracking for fans, but hard to doubt a process that has allowed a team to be this good for this long...and win a championship.",mkl122788,2023-03-16 18:36:50
The socon is such an underrated conference every year. So many good socon players and coaches are now at high major programs.,Bigdeacenergy,2023-03-16 18:38:30
Why the fuck did they switch back to man?,WhizBangNeato,2023-03-16 18:44:12
They just decided to not win at the end lol ofc,sycamotree,2023-03-16 18:44:27
Thankfully Maryland vs West Virginia finally ended so I can see this ending,BtownBrelooms,2023-03-16 18:46:16
Man they really played hero ball down the stretch,itsamemarkus,2023-03-16 18:47:28
That was certainly a shot choice,lees395,2023-03-16 18:47:29
He was fouled on that 3 point attempt,Himynameisart,2023-03-16 18:47:49
Virginia had a timeout what the FUCK,stripes361,2023-03-16 18:49:03
Wow. That really happened,Celticskevin2020,2023-03-16 18:49:04
Well at least my bracket survived the first game,newtownmail,2023-03-16 18:49:52
WTH Was the play???,Eelmaster11,2023-03-16 18:50:10
My head just exploded twice,MysteriousFact5363,2023-03-16 18:50:10
Goddamn I love March,repentforthousins,2023-03-16 18:50:11
OH MY GOD MARCH IS HERE,JaffinatorDOTTE,2023-03-16 18:50:15
Clark has the best pass in UVA history and now the worst as well,juice0722,2023-03-16 18:50:24
Bracket just went kaboom but I don’t even care that was EPIC,humorousmoose,2023-03-16 18:50:40
RANK FURMAN YOU COWARDS,King_Kung,2023-03-16 18:51:04
"6 year vet makes a bone head decision with 5 seconds left 

unreal",hi-Im-gosu,2023-03-16 18:51:12
If this is how Clark’s college career ends it is going to haunt him for the rest of his life. I honestly feel bad for him,Affectionate-Cup9340,2023-03-16 18:51:12
Well... At least it's not a 16?,PinkSaldo,2023-03-16 18:51:12
And my TV went to an emergency broadcast test as the last shot went up,DrZoidbergJesus,2023-03-16 18:51:15
Why do I ever pick Virginia to get out of the first round lmao,IAmTheWaller67,2023-03-16 18:51:17
